Move History,Number of Plies,Outcome,Result,Player Scores,ACPL White,ACPL Black
Pe2e4- Pc7c6- Pd2d4- Pe7e6- Ng1f3- Pd7d5- Nb1d2- Ng8f6- Bf1d3- Bf8e7- Ke1g1- Ke8g8- Pc2c3- Pb7b6- Pe4e5- Nf6d7- Rf1e1- Pc6c5- Nd2e4- Pc5d4x Pc3d4x Bc8a6- Ne4g5- Ba6d3x Qd1d3x Be7g5x Nf3g5x Qd8g5x Bc1g5x Nb8c6- Pf2f3- Nc6b4- Qd3d2- Ra8c8- Qd2b4x Rc8c2- Qb4a4- Rf8c8- Qa4d7x Ph7h6- Bg5e7- Rc8c7- Qd7e8+ Kg8h7- Qe8f7x Rc2b2x Kg1h1- Rb2d2- Qf7e6x Rc7e7x Qe6e7x Rd2f2- Ra1c1- Rf2a2x Rc1c7- Pa7a5- Qe7g7$ ,58,checkmate,1-0,"[31, 46, 35, 79, 71, 72, 70, 71, 82, 94, 101, 95, 97, 130, 145, 146, 169, 187, 174, 198, 224, 210, 214, 219, 220, 318, 346, 558, 545, 548, 530, 553, 562, 614, 609, 636, 637, 638, 637, 637, 642, 691, 721, 720, 746, 764, 785, 800, 826, 1059, 99993, 99994, 99995, 99996, 99997, 99999, 100000]",0.84,9.791666666666666
Pe2e4- Pb7b5- Bf1b5x Pc7c6- Bb5a4- Pd7d6- Pc2c4- Bc8d7- Pd2d4- Qd8c8- Ng1f3- Qc8b7- Ke1g1- Pa7a5- Nb1c3- Ng8f6- Pe4e5- Pd6e5x Pd4e5x Nf6g4- Rf1e1- Pe7e6- Ph2h3- Ph7h5- Ph3g4x Ph5g4x Nf3g5- Pg4g3- Qd1f3- Qb7c8- Qf3f7$ Ke8d8- Ng5e6$ Bd7e6x Bc1g5+ Bf8e7- Qf7e7$ ,38,checkmate,1-0,"[34, 155, 172, 179, 181, 210, 198, 249, 243, 254, 258, 320, 325, 357, 363, 424, 422, 422, 418, 414, 422, 462, 470, 498, 476, 496, 504, 563, 564, 99996, 99997, 99997, 99998, 99998, 99999, 99999, 100000]",0.2857142857142857,4.214285714285714
Pe2e4- Pd7d6- Pd2d4- Pf7f5- Nb1c3- Pf5e4x Nc3e4x Ng8f6- Bf1d3- Nf6e4x Bd3e4x Pc7c6- Qd1h5+ Pg7g6- Be4g6$ Ke8d7- Ng1f3- Qd8a5+ Qh5a5x Pb7b6- Qa5h5- Pb6b5- Bg6e4- Pb5b4- Bc1f4- Pd6d5- Nf3e5+ Kd7e6- Qh5f5+ Ke6d6- Ne5f7+ ,32,checkmate,1-0,"[28, 48, 57, 135, 107, 130, 138, 127, 98, 104, 119, 258, 241, 279, 282, 284, 279, 641, 657, 714, 723, 752, 744, 771, 788, 99990, 99992, 99998, 99999, 99999, 100000]",0.9166666666666666,6.416666666666667
Pe2e4- Pa7a6- Pd2d4- Pe7e6- Bf1d3- Pd7d5- Pe4e5- Pc7c5- Pc2c3- Nb8c6- Ng1f3- Pc5d4x Pc3d4x Bf8b4+ Nb1c3- Bb4c3$ Pb2c3x Ph7h6- Bc1a3- Ng8e7- Ra1b1- Ke8g8- Bd3c2- Pb7b5- Qd1d3- Ne7f5- Pg2g4- Nf5e7- Qd3h7+ ,30,checkmate,1-0,"[31, 73, 69, 88, 73, 63, 51, 59, 56, 62, 50, 82, 102, 119, 119, 168, 144, 160, 149, 149, 148, 205, 212, 255, 250, 424, 400, 99999, 100000]",0.7692307692307693,2.076923076923077
Pe2e4- Pe7e6- Pd2d4- Ng8f6- Pe4e5- Nf6d5- Pc2c4- Nd5b6- Nb1c3- Pd7d5- Pe5d6x Bf8d6x Pc4c5- Bd6e7- Pc5b6x Pc7b6x Ng1f3- Ke8g8- Bf1c4- Nb8c6- Ke1g1- Nc6a5- Bc4d3- Bc8d7- Qd1e2- Pf7f6- Bc1d2- Qd8e8- Ra1d1- Pe6e5- Pd4e5x Pf6e5x Nf3e5x Be7f6- Ne5d7x Qe8d7x Nc3e4- Ra8e8- Bd2a5x Pb6a5x Bd3c4+ Qd7f7- Bc4f7$ Rf8f7x Ne4f6$ Rf7f6x Qe2e8$ Rf6f8- Qe8e7- Rf8f7- Rd1d8+ Rf7f8- Qe7f8$ ,54,checkmate,1-0,"[26, 31, 47, 111, 116, 115, 114, 127, 125, 105, 104, 391, 416, 420, 433, 468, 457, 459, 476, 460, 464, 487, 480, 467, 465, 512, 497, 514, 496, 540, 519, 548, 524, 609, 578, 598, 582, 629, 621, 723, 745, 834, 896, 99991, 99993, 99995, 99996, 99996, 99997, 99998, 99999, 99999, 100000]",2.380952380952381,7.809523809523809
Pe2e4- Pe7e6- Pd2d4- Pf7f5- Pe4f5x Pe6f5x Ng1f3- Pd7d6- Bf1c4- Ng8f6- Ke1g1- Bf8e7- Rf1e1- Ke8f8- Pa2a4- Pa7a6- Bc4b3- Nb8c6- Bc1f4- Nc6a5- Bb3a2- Pc7c6- Pb2b4- Na5c4- Ba2c4x Pd6d5- Bc4b3- Be7b4x Bf4d2- Bb4d2x Nb1d2x Bc8d7- Qd1c1- Kf8f7- Nf3e5+ Kf7e8- Ne5c6$ Ke8f7- Nc6d8$ Ra8d8x Nd2f3- Rh8e8- Nf3e5+ Kf7f8- Pc2c4- Nf6e4- Qc1a3+ Re8e7- Pf2f3- Pg7g6- Pf3e4x Pd5e4x Qa3d6- Rd8e8- Ne5d7$ Kf8g7- Qd6f6+ Kg7h6- Re1e3- Re7f7- Re3h3+ ,62,checkmate,1-0,"[36, 33, 44, 162, 162, 162, 165, 212, 214, 199, 216, 204, 205, 259, 272, 295, 223, 252, 259, 267, 271, 458, 457, 519, 498, 526, 510, 549, 507, 503, 489, 550, 542, 566, 575, 671, 611, 630, 626, 628, 629, 628, 627, 639, 650, 706, 711, 713, 742, 799, 843, 882, 1046, 99986, 99991, 99996, 99997, 99997, 99998, 99999, 100000]",1.3461538461538463,12.346153846153847
Pe2e4- Pc7c6- Pd2d4- Qd8a5+ Bc1d2- Qa5b6- Ng1f3- Qb6b2x Nb1c3- Pe7e6- Ra1b1- Qb2a3- Bf1d3- Qa3e7- Bd2g5- Ph7h6- Bg5e7x Bf8e7x Pe4e5- Nb8a6- Ke1g1- Be7b4- Nc3e4- Bb4e7- Kg1h1- Pc6c5- Bd3a6x Pb7a6x Pd4d5- Pe6d5x Qd1d5x Bc8b7- Rb1b7x Be7d8- Qd5d7$ Ke8f8- Qd7f7$ ,38,checkmate,1-0,"[28, 37, 31, 109, 105, 125, 119, 144, 140, 175, 159, 150, 178, 174, 172, 616, 610, 609, 593, 608, 590, 639, 629, 643, 624, 682, 664, 665, 667, 814, 805, 793, 797, 99998, 99999, 99999, 100000]",1.625,2.125
Pe2e4- Pb7b5- Bf1b5x Pa7a6- Bb5a4- Bc8b7- Pd2d3- Pe7e6- Ng1f3- Pc7c5- Ke1g1- Nb8c6- Bc1f4- Ng8f6- Nb1d2- Bf8e7- Pc2c3- Ke8g8- Ra1c1- Pd7d5- Ph2h3- Pd5e4x Pd3e4x Nf6h5- Bf4h2- Be7d6- Pe4e5- Bd6c7- Nd2c4- Pf7f6- Nc4d6- Bc7d6x Pe5d6x Nh5f4- Bh2f4x Pe6e5- Bf4h2- Pe5e4- Qd1d5+ Kg8h8- Ba4c6x Bb7c6x Qd5c6x Ra8c8- Qc6e4x Rc8c6- Qe4c6x Qd8d6x Qc6d6x Rf8d8- Qd6d8$ ,52,checkmate,1-0,"[31, 158, 159, 184, 187, 181, 189, 185, 188, 176, 182, 198, 197, 212, 206, 197, 197, 185, 190, 185, 185, 232, 246, 236, 264, 242, 285, 308, 300, 355, 387, 372, 384, 558, 553, 572, 541, 625, 614, 633, 637, 629, 642, 737, 736, 864, 897, 980, 99991, 99999, 100000]",4.291666666666667,8.91304347826087
Pe2e4- Pc7c5- Pc2c3- Pd7d6- Pd2d4- Pc5d4x Pc3d4x Ng8f6- Nb1c3- Pe7e6- Bf1d3- Bf8e7- Ng1f3- Nb8c6- Ke1g1- Ke8g8- Ph2h3- Pa7a6- Qd1e2- Pb7b5- Pe4e5- Pd6e5x Pd4e5x Nc6e5x Nf3e5x Qd8c7- Bc1f4- Qc7c5- Nc3e4- Qc5d5- Ne4f6$ Pg7f6x Qe2g4+ Kg8h8- Bf4h6- Rf8g8- Ne5f7$ ,38,checkmate,1-0,"[36, 26, 19, 46, 50, 77, 77, 75, 86, 76, 100, 95, 101, 99, 99, 90, 87, 86, 92, 132, 141, 144, 139, 357, 363, 398, 411, 506, 496, 574, 583, 99996, 99997, 99997, 99998, 99999, 100000]",2.6,5.866666666666666
Pe2e4- Pf7f6- Nb1c3- Pc7c6- Pd2d4- Pd7d6- Bc1e3- Pe7e5- Bf1c4- Pg7g5- Qd1h5+ Ke8d7- Ph2h4- Ng8e7- Ph4g5x Pf6g5x Pd4e5x Pd6e5x Ke1c1+ Kd7c7- Rd1d8x Kc7d8x Ng1f3- Pg5g4- Nf3e5x Pg4g3- Ne5f7+ Kd8c7- Qh5e5+ Kc7d7- Qe5d6+ Kd7e8- Qd6d8+ ,34,checkmate,1-0,"[33, 139, 122, 169, 176, 184, 184, 193, 189, 299, 286, 282, 291, 396, 390, 491, 534, 672, 698, 716, 707, 707, 695, 824, 848, 99994, 99995, 99997, 99998, 99998, 99999, 99999, 100000]",0.3333333333333333,9.083333333333334
Pe2e4- Pg7g6- Pd2d4- Pd7d6- Nb1c3- Bf8g7- Pf2f4- Ng8f6- Bf1d3- Ke8g8- Ng1f3- Nb8c6- Ph2h3- Pe7e5- Pd4e5x Pd6e5x Pf4e5x Nc6e5x Nf3e5x Qd8d4- Ne5f3- Qd4b6- Qd1d2- Bc8e6- Qd2f2- Be6c4- Qf2b6x Bc4d3x Qb6f6x Bg7f6x Pc2d3x Bf6c3$ Pb2c3x Ra8d8- Ke1e2- Rd8d7- Bc1e3- Pc7c6- Rh1b1- Pb7b6- Nf3e5- Rd7b7- Pg2g4- Pc6c5- Be3c5x Pb6c5x Rb1b7x Kg8g7- Ra1f1- Rf8d8- Rf1f7$ Kg7h6- Rf7h7$ Kh6g5- Rb7f7- Rd8d3x Ph3h4+ ,58,checkmate,1-0,"[33, 68, 67, 72, 79, 70, 53, 58, 45, 70, 58, 55, 60, 68, 41, 33, 38, 296, 321, 342, 345, 355, 351, 389, 410, 514, 518, 607, 610, 584, 587, 615, 620, 617, 620, 613, 628, 636, 636, 634, 613, 629, 632, 646, 669, 667, 691, 697, 753, 99994, 99995, 99997, 99998, 99998, 99999, 99999, 100000]",2.5,8.541666666666666
Pe2e4- Pe7e6- Nb1c3- Pe6e5- Pd2d4- Pe5d4x Qd1d4x Ng8f6- Bc1d2- Pd7d6- Ke1c1- Bf8e7- Pf2f3- Bc8e6- Pg2g4- Nb8c6- Qd4f2- Nc6e5- Pg4g5- Ne5g4- Pf3g4x Nf6g4x Qf2g3- Ng4e5- Ph2h4- Qd8d7- Kc1b1- Pa7a6- Bd2c1- Be6g4- Ng1e2- Bg4e2x Bf1e2x Pb7b5- Bc1f4- Pb5b4- Bf4e5x Pb4c3x Be5g7x Rh8g8- Bg7c3x Ke8c8- Be2g4- Qd7g4x Qg3g4$ Kc8b8- Kb1a1- Pa6a5- Qg4e2- Pa5a4- Qe2b5+ Kb8c8- Rd1d4- Pa4a3- Rd4a4- Pa3b2$ Bc3b2x Be7f6- Ra4a8+ ,60,checkmate,1-0,"[36, 39, 33, 94, 90, 90, 92, 97, 100, 123, 120, 141, 150, 191, 167, 165, 171, 278, 269, 397, 403, 376, 376, 454, 458, 462, 454, 483, 470, 483, 454, 553, 539, 589, 558, 586, 618, 649, 657, 668, 648, 705, 733, 727, 721, 724, 723, 771, 770, 99993, 99994, 99994, 99995, 99996, 99997, 99997, 99998, 99999, 100000]",1.4583333333333333,4.083333333333333
Pe2e4- Pe7e6- Pd2d4- Pd7d5- Nb1d2- Pd5e4x Nd2e4x Ng8f6- Ne4f6$ Qd8f6x Ng1f3- Bf8d6- Bc1g5- Qf6g6- Bf1d3- Pf7f5- Bg5d2- Ke8g8- Qd1e2- Nb8c6- Ke1c1- Nc6e7- Rh1g1- Pb7b6- Pg2g4- Bc8b7- Nf3g5- Rf8f6- Ph2h4- Ph7h6- Ng5h3- Pf5f4- Bd3g6x Rf6g6x Bd2f4x Bd6f4$ Nh3f4x Rg6f6- Pg4g5- Ph6g5x Rg1g5x Rf6f4x Qe2e6$ Kg8h7- Rg5h5+ ,46,checkmate,1-0,"[31, 35, 32, 31, 32, 57, 55, 88, 74, 48, 73, 115, 127, 125, 120, 116, 108, 140, 134, 130, 137, 191, 189, 220, 242, 257, 268, 285, 287, 265, 300, 519, 530, 548, 552, 579, 581, 609, 614, 629, 653, 840, 99982, 99999, 100000]",2.8095238095238093,8.05
Pe2e4- Pa7a6- Pd2d4- Pf7f6- Pa2a3- Pd7d6- Ng1f3- Pe7e5- Bf1c4- Bc8g4- Ph2h3- Bg4f3x Qd1f3x Ng8e7- Pd4e5x Pd6e5x Qf3b3- Nb8c6- Bc4f7+ Ke8d7- Qb3e6+ ,22,checkmate,1-0,"[31, 65, 67, 166, 153, 156, 164, 164, 175, 191, 191, 191, 166, 270, 264, 306, 318, 99998, 99999, 99999, 100000]",0.0,4.125
Pe2e4- Pe7e5- Ng1f3- Bf8c5- Nf3e5x Qd8f6- Pd2d4- Bc5b6- Pc2c3- Pc7c5- Bf1c4- Pc5d4x Pc3d4x Nb8c6- Ne5f7x Qf6f7x Bc4f7$ Ke8f7x Nb1c3- Nc6d4x Bc1e3- Nd4e6- Ke1g1- Pd7d5- Qd1h5+ Pg7g6- Qh5f3+ Kf7g7- Nc3d5x Bb6d8- Be3d2- Bd8f6- Bd2c3- Ng8e7- Qf3f6$ Kg7g8- Nd5e7$ ,38,checkmate,1-0,"[36, 44, 27, 150, 171, 248, 267, 268, 262, 327, 333, 330, 365, 364, 358, 537, 487, 486, 499, 557, 546, 552, 564, 581, 563, 603, 601, 604, 592, 585, 572, 626, 628, 99998, 99999, 99999, 100000]",0.75,6.75
Pe2e4- Nb8c6- Pd2d4- Pf7f5- Pe4f5x Ng8f6- Pd4d5- Nc6e5- Nb1c3- Pd7d6- Pf2f4- Bc8f5x Pf4e5x Pd6e5x Bf1b5+ Pc7c6- Pd5c6x Pb7c6x Bb5c6$ Nf6d7- Bc1e3- Pe7e6- Ng1e2- Bf8b4- Ke1g1- Ke8g8- Bc6a8x Qd8a8x Qd1d7x Bb4c3x Ne2c3x Pe5e4- Qd7a7x Rf8d8- Qa7a8x Rd8a8x Rf1f2- Pg7g6- Kg1f1- Bf5g4- Pa2a4- Kg8g7- Pa4a5- Ph7h6- Pa5a6- Ra8b8- Pa6a7- Rb8a8- Nc3e4x Bg4f5- Ne4d6- Bf5c2x Rf2c2x Ra8a7x Nd6e8+ Kg7f8- Ra1a7x Ph6h5- Rc2c8- Pg6g5- Ne8f6+ ,62,checkmate,1-0,"[31, 37, 55, 191, 207, 227, 221, 223, 233, 274, 262, 426, 435, 423, 412, 413, 411, 472, 510, 500, 488, 502, 517, 522, 527, 571, 569, 619, 622, 619, 623, 632, 639, 666, 675, 674, 688, 697, 697, 715, 725, 723, 751, 772, 760, 790, 789, 783, 788, 788, 788, 874, 1027, 99996, 99997, 99997, 99998, 99998, 99999, 99999, 100000]",1.3076923076923077,13.23076923076923
Pe2e4- Pa7a6- Pd2d4- Pe7e6- Bf1d3- Pd7d5- Pe4e5- Pc7c5- Pc2c3- Nb8c6- Ng1f3- Ng8e7- Ke1g1- Ne7f5- Pd4c5x Bf8c5x Nb1d2- Ke8g8- Rf1e1- Pb7b5- Nd2b3- Bc5b6- Bc1g5- Bc8b7- Bg5d8x Rf8d8x Bd3f5x Pe6f5x Nb3d4- Nc6e5x Nf3e5x Bb6d4x Pc3d4x Rd8c8- Ph2h3- Rc8c2- Qd1c2x Pf5f4- Qc2c7- Ra8c8- Qc7f7$ Kg8h8- Ne5d7- Rc8g8- Re1e8- Bb7c6- Qf7g8$ ,48,checkmate,1-0,"[34, 64, 66, 63, 61, 64, 66, 62, 66, 71, 61, 51, 43, 71, 64, 71, 70, 66, 66, 113, 107, 110, 121, 567, 558, 553, 562, 557, 562, 606, 613, 610, 608, 619, 620, 821, 861, 904, 970, 99995, 99996, 99996, 99997, 99998, 99999, 99999, 100000]",1.7894736842105263,7.7368421052631575
Pe2e4- Pc7c6- Pd2d4- Pb7b5- Ng1f3- Bc8b7- Bf1d3- Pe7e6- Pa2a4- Pb5b4- Pa4a5- Pa7a6- Nb1d2- Pd7d5- Pc2c4- Pd5c4x Nd2c4x Ng8f6- Pe4e5- Nf6d5- Nf3g5- Ph7h6- Ng5e4- Nb8d7- Ne4d6+ Bf8d6x Nc4d6$ Ke8f8- Qd1f3- Nd7e5x Pd4e5x Qd8c7- Bc1e3- Ra8d8- Be3b6- Qc7b8- Qf3f7$ ,38,checkmate,1-0,"[36, 42, 31, 150, 146, 166, 148, 147, 131, 141, 143, 159, 148, 196, 209, 280, 283, 333, 335, 323, 356, 394, 372, 517, 529, 531, 513, 523, 523, 553, 543, 550, 552, 536, 594, 99999, 100000]",1.7058823529411764,7.352941176470588
Pe2e4- Pc7c6- Pd2d4- Pb7b5- Bf1d3- Pe7e6- Ng1f3- Pd7d5- Pe4d5x Pc6d5x Bd3b5$ Bc8d7- Bb5d3- Bf8b4+ Nb1d2- Ng8e7- Ke1g1- Ke8g8- Bd3h7$ Kg8h7x Nf3g5+ Kh7g8- Qd1h5- Ne7g6- Qh5h7+ ,26,checkmate,1-0,"[33, 39, 36, 137, 149, 135, 139, 159, 172, 173, 185, 182, 178, 196, 184, 209, 195, 303, 317, 317, 331, 547, 574, 99999, 100000]",1.5454545454545454,8.727272727272727
Pe2e4- Pg7g5- Nb1c3- Pg5g4- Ph2h3- Pg4h3x Ng1h3x Pd7d6- Pd2d4- Ph7h5- Nh3g5- Pe7e5- Bf1c4- Pe5d4x Bc4f7$ Ke8e7- Nc3d5+ Ke7d7- Qd1d4x Ng8e7- Bf7e6+ Kd7c6- Qd4c4+ ,24,checkmate,1-0,"[32, 180, 191, 246, 225, 226, 233, 223, 225, 262, 281, 392, 438, 557, 609, 696, 706, 750, 733, 99998, 99999, 99999, 100000]",1.1111111111111112,16.333333333333332
Pe2e4- Pe7e6- Pd2d4- Pd7d6- Ng1f3- Bf8e7- Nb1c3- Ph7h6- Bf1d3- Be7f8- Qd1e2- Pa7a6- Bc1f4- Pg7g5- Bf4e3- Bf8g7- Ke1c1- Ng8e7- Ph2h4- Pg5g4- Nf3h2- Ph6h5- Pf2f3- Pg4g3- Nh2f1- Pb7b5- Pe4e5- Pb5b4- Nc3e4- Pd6d5- Ne4c5- Pc7c6- Nf1g3x Nb8d7- Pf3f4- Bc8b7- Nc5b7x Qd8b6- Nb7d6+ Ke8f8- Pf4f5- Nd7e5x Pd4e5x Bg7e5x Be3b6x Be5g3x Nd6f7x Bg3h4x Nf7h8x Kf8g7- Rh1h4x Ra8h8x Qe2e6x Ne7f5x Qe6f5x Rh8f8- Qf5g6+ Kg7h8- Rh4h5$ ,60,checkmate,1-0,"[31, 42, 30, 79, 78, 79, 78, 99, 98, 160, 151, 149, 150, 187, 184, 187, 176, 212, 218, 214, 204, 211, 202, 209, 212, 251, 267, 307, 321, 350, 342, 332, 364, 369, 362, 575, 580, 617, 645, 639, 656, 675, 662, 766, 846, 889, 914, 99990, 99993, 99993, 99995, 99995, 99996, 99996, 99997, 99998, 99999, 99999, 100000]",0.9565217391304348,9.869565217391305
Pe2e4- Pf7f5- Pe4f5x Pg7g5- Qd1h5+ ,6,checkmate,1-0,"[36, 165, 163, 99999, 100000]",0.0,0.0
Pe2e4- Pe7e5- Ng1f3- Pd7d6- Pd2d4- Ng8f6- Nb1c3- Nb8c6- Pd4d5- Nc6e7- Bc1g5- Ne7g6- Ph2h4- Bf8e7- Ph4h5- Ng6f8- Ph5h6- Pg7h6x Bg5h6x Nf8g6- Pg2g3- Bc8g4- Bf1b5+ Pc7c6- Pd5c6x Pb7c6x Bb5c6$ Nf6d7- Bc6a8x Qd8a8x Qd1d3- Qa8c8- Nf3d2- Be7g5- Bh6g5x Ng6f4- Pg3f4x Pe5f4x Bg5f4x Rh8g8- Pf2f3- Bg4e6- Bf4d6x Nd7c5- Qd3b5+ Be6d7- Qb5b4- Ke8d8- Bd6c5x Rg8e8- Ke1c1- Pf7f5- Nd2c4- Pf5e4x Rh1h7x Pe4e3- Rh7d7$ Qc8d7x Qb4b8+ ,60,checkmate,1-0,"[33, 35, 34, 72, 63, 58, 55, 64, 62, 67, 55, 95, 84, 75, 85, 91, 81, 124, 146, 131, 142, 179, 184, 328, 312, 317, 326, 325, 330, 318, 318, 382, 393, 582, 562, 678, 703, 734, 746, 764, 751, 759, 760, 761, 773, 773, 779, 900, 915, 936, 964, 1038, 1423, 99995, 99996, 99998, 99999, 99999, 100000]",1.6153846153846154,21.423076923076923
Pe2e4- Pg7g6- Pd2d4- Pd7d6- Nb1c3- Bf8g7- Bc1e3- Ng8f6- Qd1d2- Ke8g8- Ke1c1- Pa7a6- Ph2h4- Nb8c6- Ph4h5- Pb7b5- Pf2f3- Pb5b4- Nc3e2- Pa6a5- Ph5g6x Pf7g6x Ne2f4- Pa5a4- Ng1h3- Bc8b7- Bf1c4+ Kg8h8- Nf4g6$ Ph7g6x Nh3f4+ Nf6h7- Nf4g6$ ,34,checkmate,1-0,"[32, 66, 67, 55, 63, 62, 68, 62, 77, 82, 86, 134, 131, 134, 149, 159, 182, 192, 206, 194, 207, 196, 198, 214, 231, 344, 374, 817, 837, 901, 99981, 99999, 100000]",2.8,12.0
Pe2e4- Pd7d5- Pe4d5x Pc7c5- Nb1c3- Ng8f6- Bf1b5+ Bc8d7- Bb5c4- Pe7e6- Pd5e6x Bd7e6x Bc4e6x Pf7e6x Ng1f3- Bf8e7- Qd1e2- Ke8g8- Qe2e6$ Kg8h8- Nf3e5- Be7d6- Ne5f7+ Rf8f7x Qe6f7x Nf6d5- Nc3d5x Nb8c6- Nd5e3- Nc6d4- Pc2c3- Nd4c2+ Ne3c2x Ra8c8- Pd2d3- Qd8f8- Qf7f8$ Rc8f8x Bc1e3- Pc5c4- Pd3c4x Pb7b5- Pc4b5x Bd6c7- Be3a7x Ph7h6- Ke1e2- Pg7g5- Ba7d4+ Kh8h7- Ke2d3- Rf8d8- Nc2b4- Ph6h5- Kd3c4- Pg5g4- Nb4c6- Rd8e8- Ra1e1- Re8f8- Re1e7+ Kh7h6- Re7c7x Rf8f4- Pb5b6- Rf4f8- Bd4g7+ Kh6g5- Bg7f8x Ph5h4- Pb6b7- Ph4h3- Qb7b8- Ph3g2x Rc7g7+ Kg5h5- Qb8e5+ Kh5h4- Rg7h7+ ,80,checkmate,1-0,"[36, 65, 64, 155, 137, 136, 137, 164, 173, 176, 175, 177, 180, 171, 169, 201, 214, 208, 227, 225, 232, 225, 270, 271, 272, 453, 471, 485, 482, 477, 497, 576, 592, 629, 655, 697, 693, 696, 690, 737, 737, 758, 757, 763, 774, 774, 792, 804, 814, 803, 837, 836, 840, 846, 858, 873, 871, 910, 940, 1071, 1159, 1178, 1191, 1188, 1294, 99993, 99994, 99994, 99995, 99995, 99996, 99996, 99997, 99997, 99998, 99998, 99999, 99999, 100000]",1.40625,15.75
Pe2e4- Pg7g5- Nb1c3- Ph7h5- Pd2d4- Pg5g4- Ph2h3- Pd7d5- Nc3d5x Pc7c6- Nd5e3- Bf8g7- Ng1e2- Nb8d7- Ph3g4x Ph5g4x Rh1h8x Nd7f8- Rh8g8x Bg7h8- Rg8h8x Pe7e6- Ne3c4- Pb7b5- Bc1h6- Pb5c4x Rh8f8$ Ke8d7- Rf8f7$ Qd8e7- Rf7e7$ Kd7e7x Qd1d2- Ke7f7- Qd2f4+ Kf7e7- Qf4f8+ Ke7d7- Qf8f7+ Kd7d8- Bh6g5+ ,42,checkmate,1-0,"[31, 192, 187, 209, 214, 230, 219, 289, 292, 278, 278, 275, 272, 362, 307, 317, 323, 691, 704, 773, 771, 842, 880, 900, 906, 960, 1014, 1009, 1064, 99985, 99990, 99991, 99992, 99996, 99997, 99997, 99998, 99998, 99999, 99999, 100000]",1.5714285714285714,12.857142857142858
Pe2e4- Pc7c6- Pd2d4- Pe7e6- Ng1f3- Pd7d5- Nb1d2- Bf8e7- Bf1d3- Ng8f6- Ke1g1- Ke8g8- Pe4e5- Nf6d7- Ph2h4- Pf7f6- Pc2c4- Pf6e5x Pd4e5x Pd5c4x Nd2c4x Nd7c5- Bd3c2- Qd8d1x Rf1d1x Nc5d7- Bc1g5- Be7g5x Nf3g5x Nd7e5x Bc2h7$ Kg8h8- Nc4e5x Pg7g6- Ne5g6$ Kh8g7- Ng6f8x Kg7f8x Rd1d8+ Kf8g7- Ra1d1- Bc8d7- Rd8g8+ Kg7h6- Bh7g6- Pb7b5- Ng5f7+ ,48,checkmate,1-0,"[33, 51, 42, 74, 76, 78, 91, 97, 99, 97, 93, 111, 85, 90, 99, 127, 130, 112, 135, 206, 224, 213, 207, 219, 192, 230, 252, 425, 426, 730, 760, 768, 767, 780, 787, 787, 788, 801, 798, 99990, 99992, 99993, 99994, 99996, 99997, 99999, 100000]",1.631578947368421,6.894736842105263
Pe2e4- Pc7c5- Ng1f3- Pg7g6- Pc2c3- Bf8g7- Pd2d4- Pc5d4x Pc3d4x Nb8c6- Nb1c3- Pd7d6- Pd4d5- Nc6e5- Nf3d4- Ng8f6- Bf1b5+ Bc8d7- Pf2f4- Bd7b5x Pf4e5x Pd6e5x Nd4b5x Qd8a5- Pd5d6- Pe7d6x Qd1d6x Nf6e4x Nb5c7+ ,30,invalid_move,*,"[31, 33, 30, 55, 42, 62, 70, 73, 71, 104, 94, 89, 60, 63, 85, 89, 95, 139, 145, 282, 282, 292, 287, 348, 376, 501, 524, 529, 538]",0.35714285714285715,7.285714285714286
Pe2e4- Pd7d5- Pe4d5x Ph7h5- Pd2d4- Bc8g4- Bf1b5+ Nb8c6- Pd5c6x Pb7c6x Bb5c6$ Bg4d7- Bc6d7$ Qd8d7x Ng1f3- Pg7g5- Nf3e5- Qd7e6- Ke1g1- Bf8g7- Rf1e1- Bg7e5x Re1e5x Qe6g6- Nb1c3- Pf7f6- Re5c5- Pc7c6- Qd1f3- Pg5g4- Qf3c6$ Ke8f7- Qc6a8x Ph5h4- Bc1f4- Pg4g3- Pf2g3x Ph4g3x Bf4g3x Pe7e6- Rc5c7+ Ng8e7- Qa8h8x Qg6e4- Nc3e4x Kf7g6- Qh8f6$ Kg6h5- Qf6g5+ ,50,checkmate,1-0,"[31, 77, 71, 157, 137, 153, 147, 537, 539, 604, 596, 575, 575, 576, 575, 576, 566, 570, 550, 552, 567, 575, 576, 584, 572, 608, 534, 603, 569, 650, 661, 661, 678, 683, 662, 718, 725, 740, 756, 99983, 99988, 99991, 99992, 99996, 99997, 99997, 99998, 99999, 100000]",1.105263157894737,3.6315789473684212
Pe2e4- Pb7b6- Pd2d4- Pe7e6- Ng1f3- Bc8b7- Bf1d3- Ng8f6- Pe4e5- Nf6e4- Ke1g1- Pd7d5- Rf1e1- Pc7c5- Pc2c4- Pc5d4x Pc4d5x Pe6d5x Nb1d2- Bf8c5- Nd2e4x Pd5e4x Re1e4x Ke8g8- Bc1g5- Pf7f6- Pe5f6x Pg7f6x Bg5h6- Rf8f7- Pb2b4- Bc5f8- Re4d4x Qd8c8- Bd3c4- Nb8c6- Bc4f7$ Kg8f7x Rd4d7+ Kf7e8- Rd7h7x Qc8d8- Qd1b3- Qd8d6- Qb3f7+ Ke8d8- Bh6f8x Ra8c8- Bf8d6x Rc8b8- Rh7h8+ ,52,checkmate,1-0,"[36, 91, 93, 85, 76, 82, 84, 110, 114, 103, 84, 138, 141, 130, 113, 189, 210, 176, 198, 245, 227, 242, 260, 294, 368, 384, 378, 403, 412, 396, 444, 442, 457, 493, 526, 559, 584, 607, 615, 628, 626, 695, 842, 99992, 99993, 99993, 99994, 99998, 99999, 99999, 100000]",3.9047619047619047,20.523809523809526
Pe2e4- Ph7h5- Pd2d4- Pg7g6- Ng1f3- Bf8g7- Bf1c4- Pe7e6- Nb1c3- Ng8e7- Ke1g1- Pd7d5- Bc4d3- Pd5e4x Nc3e4x Ke8g8- Bc1g5- Pf7f5- Ne4c5- Pb7b6- Nc5e6x Qd8d5- Ne6g7x Kg8g7x Bg5e7x Pc7c5- Be7f8$ Kg7f8x Pd4c5x Pb6c5x Qd1d2- Qd5c6- Ra1e1- Bc8b7- Qd2h6+ Kf8g8- Bd3c4+ Qc6d5- Re1e8+ Kg8f7- Qh6f8+ ,42,checkmate,1-0,"[33, 128, 121, 136, 134, 133, 137, 146, 141, 143, 149, 157, 151, 155, 143, 156, 151, 275, 262, 262, 250, 607, 592, 624, 625, 656, 687, 660, 658, 703, 719, 821, 883, 99996, 99997, 99997, 99998, 99998, 99999, 99999, 100000]",1.75,7.5
Pe2e4- Ph7h6- Pd2d4- Pc7c6- Bf1d3- Pd7d6- Pf2f4- Nb8d7- Pf4f5- Pg7g5- Pf5g6x Pf7g6x Pe4e5- Nd7e5x Pd4e5x Pd6d5- Bd3g6$ Ke8d7- Ng1e2- Ng8f6- Pe5f6x Pe7f6x Nb1c3- Bf8d6- Bc1f4- Rh8e8- Bf4d6x Re8g8- Bd6g3- Rg8g7- Qd1d3- Rg7g6x Qd3g6x Qd8e7- Rh1f1- Kd7d8- Rf1f6x Qe7e3- Rf6f8+ Kd8d7- Qg6d6+ ,42,checkmate,1-0,"[34, 82, 85, 91, 95, 96, 101, 152, 122, 261, 283, 296, 277, 332, 330, 535, 525, 537, 507, 545, 568, 582, 609, 607, 593, 679, 660, 678, 677, 787, 811, 866, 926, 951, 991, 983, 1029, 99998, 99999, 99999, 100000]",0.5555555555555556,14.11111111111111
Pe2e4- Pc7c6- Pd2d4- Pf7f6- Nb1c3- Ke8f7- Pd4d5- Kf7e8- Bc1e3- Pc6d5x Pe4d5x Pd7d6- Ng1e2- Pe7e5- Pd5e6x Bc8e6x Ne2d4- Be6f7- Qd1f3- Nb8c6- Nd4c6x Pb7c6x Qf3c6$ Qd8d7- Qc6a8$ Ke8e7- Bf1b5- Qd7b5x Nc3b5x Bf7e8- Qa8b7+ Be8d7- Ke1c1- Ke7e6- Qb7d5+ Ke6e7- Qd5d6$ Ke7f7- Qd6d7$ Bf8e7- Nb5d6+ Kf7f8- Qd7e8+ ,44,checkmate,1-0,"[33, 39, 39, 166, 171, 228, 230, 225, 231, 274, 264, 270, 276, 340, 372, 371, 389, 391, 402, 657, 665, 753, 771, 857, 864, 856, 881, 906, 924, 1100, 99992, 99992, 99993, 99994, 99995, 99995, 99996, 99996, 99997, 99998, 99999, 99999, 100000]",0.9333333333333333,11.142857142857142
Pe2e4- Pe7e6- Pd2d4- Pd7d5- Nb1d2- Pd5e4x Nd2e4x Pc7c5- Ne4c5x Bf8c5x Pd4c5x Qd8d1$ Ke1d1x Ng8f6- Ng1f3- Nb8c6- Bc1f4- Ke8g8- Kd1c1- Pe6e5- Nf3e5x Nc6e5x Bf4e5x Rf8e8- Pf2f4- Nf6d5- Bf1b5- Re8e5x Pf4e5x Bc8e6- Pc5c6- Pb7c6x Bb5c6x Ra8c8- Bc6b7- Rc8c2$ Kc1c2x Nd5e3+ Kc2c3- Ne3d5+ Bb7d5x Be6d5x Ra1d1- Bd5e6- Rd1d8+ ,46,checkmate,1-0,"[31, 42, 29, 27, 27, 50, 50, 109, 105, 102, 108, 128, 127, 116, 114, 152, 171, 169, 177, 231, 243, 228, 227, 231, 248, 318, 328, 401, 420, 439, 423, 423, 409, 432, 417, 575, 581, 594, 621, 749, 757, 772, 780, 99999, 100000]",1.5714285714285714,6.666666666666667
Pe2e4- Pe7e6- Pd2d4- Pc7c5- Pd4d5- Pe6d5x Pe4d5x Pd7d6- Ng1f3- Ng8f6- Ph2h3- Pg7g6- Bf1b5+ Bc8d7- Bb5d7$ Nb8d7x Ke1g1- Bf8g7- Rf1e1+ Ke8f8- Pc2c4- Pa7a6- Nb1c3- Ra8b8- Bc1f4- Pb7b5- Bf4d6$ Kf8g8- Bd6b8x Qd8b8x Pd5d6- Pb5b4- Nc3d5- Nf6d5x Qd1d5x Qb8d8- Re1e7- Bg7b2x Qd5f7$ ,40,checkmate,1-0,"[36, 33, 26, 55, 60, 78, 99, 99, 82, 103, 94, 168, 170, 168, 174, 174, 140, 174, 158, 164, 157, 181, 172, 185, 187, 444, 428, 439, 447, 442, 443, 455, 470, 505, 525, 726, 738, 99999, 100000]",0.5555555555555556,5.111111111111111
Pe2e4- Pc7c6- Pd2d4- Pa7a5- Nb1c3- Pb7b5- Ng1f3- Pb5b4- Nc3a4- Bc8a6- Bf1a6x Nb8a6x Ke1g1- Pe7e6- Pc2c4- Ng8f6- Rf1e1- Bf8e7- Pe4e5- Nf6g8- Pd4d5- Pe6d5x Pc4d5x Qd8b6- Na4b6x Na6c5- Nb6a8x Nc5e4- Pd5c6x Ng8h6- Qd1d7$ Ke8f8- Qd7c8+ Be7d8- Qc8d8$ ,36,checkmate,1-0,"[31, 42, 27, 84, 87, 132, 124, 150, 122, 200, 195, 188, 191, 187, 187, 208, 235, 277, 283, 298, 274, 306, 317, 785, 802, 857, 882, 983, 988, 99997, 99998, 99998, 99999, 99999, 100000]",0.7857142857142857,6.928571428571429
Pe2e4- Pb7b5- Bf1b5x Pc7c6- Bb5a4- Ng8f6- Nb1c3- Pd7d5- Pe4d5x Nf6d5x Qd1f3- Nd5c3x Pd2c3x Bc8e6- Ng1e2- Be6d7- Bc1f4- Pg7g6- Ba4b3- Bf8g7- Bf4c7- Qd8c8- Qf3f7$ ,24,checkmate,1-0,"[31, 164, 156, 181, 174, 184, 183, 202, 179, 167, 179, 254, 238, 237, 230, 333, 342, 399, 413, 563, 573, 99999, 100000]",1.3,4.5
Pe2e4- Pc7c6- Pd2d4- Pb7b6- Ng1f3- Pd7d6- Nb1c3- Pe7e6- Bf1d3- Bf8e7- Qd1e2- Nb8d7- Bc1f4- Bc8b7- Ph2h4- Qd8c7- Pe4e5- Pd6d5- Nc3d1- Pc6c5- Pc2c3- Pc5d4x Pc3d4x Ng8h6- Ra1c1- Nh6f5- Rc1c7x Nf5d4x Nf3d4x Be7b4+ Bf4d2- Ke8g8- Rc7d7x Ra8c8- Bd2b4x Bb7a6- Bd3a6x Rc8c1- Bb4f8x Rc1d1$ Qe2d1x Pg7g6- Bf8h6- Kg8h8- Rd7d8+ ,46,checkmate,1-0,"[33, 51, 21, 117, 125, 115, 110, 139, 115, 134, 144, 134, 142, 160, 169, 204, 216, 183, 203, 202, 209, 242, 226, 302, 294, 713, 711, 759, 773, 757, 771, 849, 839, 1046, 1085, 1133, 1162, 99994, 99995, 99996, 99997, 99997, 99998, 99999, 100000]",3.888888888888889,9.444444444444445
Pe2e4- Pb7b6- Pd2d4- Bc8b7- Bf1d3- Pe7e6- Nb1c3- Pg7g6- Ng1f3- Bf8g7- Bc1f4- Ng8e7- Ph2h4- Pd7d6- Qd1e2- Nb8d7- Ph4h5- Pa7a6- Ph5h6- Bg7f8- Bf4g5- Bf8g7- Ph6g7x Rh8g8- Rh1h7x Ne7c6- Rh7h8- Rg8h8x Qg7h8$ Nd7f8- Bg5d8x Ra8d8x Pd4d5- Nc6e7- Nf3g5- Pe6e5- Qe2f3- Ke8d7- Ng5f7x Rd8e8- Qf3h3+ ,42,invalid_move,*,"[33, 93, 85, 84, 87, 84, 90, 114, 112, 119, 124, 107, 98, 125, 131, 129, 132, 188, 192, 209, 195, 661, 632, 630, 621, 717, 740, 991, 1003, 1026, 1037, 1036, 1055, 1072, 1096, 1156, 1208, 1274, 1248, 1318, 99985]",1.3,8.842105263157896
Pe2e4- Pd7d6- Pd2d4- Pd6d5- Pe4d5x Pg7g6- Bf1b5+ Pc7c6- Pd5c6x Pb7c6x Bb5a4- Bf8g7- Ng1f3- Ng8f6- Ke1g1- Ke8g8- Pc2c4- Bc8g4- Nb1d2- Nb8d7- Rf1e1- Pa7a5- Ba4c6x Ra8c8- Bc6b5- Rf8e8- Ph2h3- Bg4f3x Nd2f3x Nf6e4- Re1e4x Nd7f6- Re4e1- Qd8d6- Bb5e8x Rc8e8x Bc1e3- Nf6h5- Pc4c5- Qd6f6- Qd1d2- Nh5f4- Be3f4x Qf6f4x Qd2f4x Bg7f6- Pc5c6- Pe7e6- Qf4f6x Ph7h5- Nf3g5- Re8f8- Pc6c7- Pe6e5- Qc7c8- Pe5d4x Qf6f7$ Kg8h8- Qf7f8$ ,60,checkmate,1-0,"[31, 57, 61, 129, 136, 174, 166, 167, 152, 150, 176, 172, 179, 175, 174, 174, 165, 166, 179, 217, 214, 328, 356, 351, 344, 347, 334, 432, 415, 576, 549, 635, 634, 639, 649, 641, 642, 632, 655, 656, 654, 746, 766, 854, 858, 850, 866, 1095, 1216, 99995, 99996, 99996, 99997, 99997, 99998, 99998, 99999, 99999, 100000]",1.7083333333333333,11.666666666666666
Pe2e4- Pb7b5- Bf1b5x Nb8c6- Ng1f3- Nc6b8- Pd2d4- Bc8b7- Nb1c3- Pc7c6- Bb5d3- Pd7d5- Bc1g5- Pd5e4x Nc3e4x Pc6c5- Ne4c5x Bb7f3x Qd1f3x Pf7f6- Qf3h5+ Pg7g6- Bd3g6$ Ph7g6x Qh5g6$ ,26,checkmate,1-0,"[36, 156, 176, 247, 255, 283, 280, 286, 275, 293, 286, 307, 312, 312, 300, 462, 456, 653, 672, 99997, 99998, 99998, 99999, 99999, 100000]",0.0,5.777777777777778
Pe2e4- Pe7e5- Ng1f3- Ng8f6- Pd2d4- Nf6e4x Bf1d3- Pd7d5- Nf3e5x Bf8d6- Nb1c3- Bd6e5x Pd4e5x Qd8g5- Bc1g5x Ne4g5x Pf2f4- Ng5e6- Pf4f5- Ne6c5- Nc3d5x Nb8c6- Nd5c7$ Ke8d8- Nc7a8x Bc8f5x Bd3f5$ Nc5d7- Qd1d7$ ,30,checkmate,1-0,"[31, 33, 22, 29, 28, 32, 29, 28, 31, 49, 30, 44, 48, 596, 609, 588, 592, 582, 605, 603, 609, 694, 695, 769, 793, 99994, 99995, 99999, 100000]",2.8333333333333335,6.5
Pe2e4- Pg7g6- Pd2d4- Ng8f6- Pe4e5- Nf6g8- Nb1c3- Pd7d6- Qd1e2- Pd6e5x Pd4e5x Nb8c6- Bc1e3- Bc8f5- Pg2g4- Bf5e6- Bf1g2- Qd8c8- Ph2h3- Ng8h6- Ke1c1- Nh6g8- Qe2b5- Pa7a6- Bg2c6$ Pb7c6x Qb5c6$ Be6d7- Rd1d7x Pf7f6- Pe5e6- Pg6g5- Rd7d1+ Qc8d7- Qc6d7$ ,36,checkmate,1-0,"[26, 58, 63, 121, 133, 130, 144, 139, 141, 176, 179, 173, 178, 233, 248, 235, 255, 253, 269, 287, 306, 407, 414, 646, 654, 659, 637, 658, 680, 872, 958, 99998, 99999, 99999, 100000]",1.9333333333333333,15.6
Pe2e4- Pg7g6- Pd2d4- Pe7e6- Nb1c3- Bf8g7- Ph2h4- Ng8e7- Ph4h5- Ke8g8- Qd1g4- Pc7c5- Pd4c5x Qd8a5- Qg4h3- Nb8c6- Ph5g6x Pf7g6x Qh3h7$ Kg8f7- Bc1h6- Qa5c5x Qh7g7$ Kf7e8- Qg7f8$ ,26,checkmate,1-0,"[34, 77, 63, 108, 109, 114, 116, 176, 177, 229, 257, 281, 285, 305, 293, 461, 443, 542, 510, 515, 524, 99998, 99999, 99999, 100000]",0.0,4.5
Pe2e4- Ph7h6- Pd2d4- Pg7g5- Ph2h4- Pg5g4- Nb1c3- Pa7a6- Qd1g4x Bf8g7- Qg4g7x Rh8h7- Qg7g8$ ,14,checkmate,1-0,"[31, 79, 88, 192, 188, 213, 210, 240, 232, 726, 723, 99999, 100000]",0.0,1.8
Pe2e4- Nb8c6- Pd2d4- Pf7f6- Ng1f3- Pd7d6- Pd4d5- Nc6e5- Nf3d4- Ne5f7- Pa2a4- Pc7c6- Nb1c3- Pc6c5- Nd4e6- Bc8e6x Pd5e6x Nf7e5- Qd1h5+ Ne5f7- Qh5f7$ ,22,checkmate,1-0,"[36, 62, 53, 154, 158, 233, 246, 255, 260, 250, 257, 294, 300, 481, 541, 569, 558, 576, 597, 99999, 100000]",1.1111111111111112,12.88888888888889
Pe2e4- Pa7a5- Pd2d4- Ph7h5- Nb1c3- Pb7b6- Bc1g5- Bc8b7- Ng1f3- Nb8a6- Pa2a3- Pe7e6- Bg5d8x Ke8d8x Bf1b5- Pf7f6- Ph2h4- Pc7c6- Bb5d3- Pb6b5- Nc3e2- Pb5b4- Ne2f4- Pg7g5- Ph4g5x Pf6g5x Nf4g6- Rh8h6- Ng6f8x Kd8c7- Nf8d7x Kc7d7x Nf3e5+ Kd7e7- Qd1d2- Pg5g4- Qd2g5+ Ke7d6- Qg5g7- Na6c7- Ne5c4+ ,42,checkmate,1-0,"[31, 84, 79, 158, 149, 196, 200, 212, 210, 237, 225, 589, 578, 596, 601, 606, 585, 599, 576, 586, 596, 619, 603, 659, 661, 661, 669, 686, 689, 714, 728, 730, 707, 754, 755, 861, 872, 871, 893, 99999, 100000]",0.05263157894736842,4.2105263157894735
Pe2e4- Pg7g6- Pd2d4- Pf7f5- Pe4f5x Pg6f5x Qd1h5+ ,8,checkmate,1-0,"[36, 57, 60, 227, 210, 99999, 100000]",0.0,1.5
Pe2e4- Ph7h5- Pd2d4- Pe7e6- Nb1c3- Pc7c5- Pd4d5- Pe6e5- Pd5d6- Ng8f6- Ng1f3- Pa7a6- Nf3g5- Pc5c4- Bf1c4x Bf8d6x Qd1d6x Nb8c6- Bc4f7$ ,20,checkmate,1-0,"[33, 132, 126, 125, 107, 160, 174, 299, 289, 349, 347, 368, 374, 589, 585, 671, 673, 99999, 100000]",0.125,2.75
