Move History,Number of Plies,Outcome,Result,Player Scores,ACPL White,ACPL Black
Pe2e4- Pe7e5- Pd2d3- Pd7d6- Ph2h3- Ng8f6- Pg2g4- Ph7h6- Bf1g2- Bf8e7- Ng1e2- Ke8g8- Nb1c3- Nb8c6- Pa2a3- Pa7a6- Pb2b4- Pb7b5- Bc1b2- Bc8b7- Qd1d2- Nc6d4- Ne2d4x Pe5d4x Nc3e2- Pc7c5- Pb4c5x Pd6c5x Ke1g1- Pc5c4- Pd3c4x Pb5c4x Bb2d4x Bb7e4x Bg2e4x Nf6e4x Qd2e3- Be7f6- Bd4f6x Qd8f6x Ra1b1- Ra8b8- Rb1b8x Rf8b8x Ne2d4- Qf6h4- Qe3e4x Rb8b2- Qe4e8+ Kg8h7- Qe8e4+ Pg7g6- ,53,invalid_move,*,"[29, 33, -18, 13, -7, 17, -15, 0, 0, 26, -7, 31, 32, 37, 25, 17, -10, 2, -47, 0, -23, 34, 46, 50, 43, 42, -20, -18, -39, 135, 0, 80, -10, -5, -87, -74, -87, 361, 6, 357, -269, 455, 464, 466, -34, 495, 412, 518, 512, 521, 482, 502]",0.34615384615384615,0.88
Pe2e4- Pe7e6- Pd2d3- Pd7d6- Ph2h3- Ph7h6- Pa2a3- Pa7a6- Nb1c3- Pb7b6- Ng1f3- Bc8b7- Bc1e3- Nb8d7- Bf1e2- Qd8e7- Ke1g1- Ke8c8- Pb2b4- Pg7g5- Pb4b5- Pa6a5- Pa3a4- Pf7f6- Pd3d4- Pe6e5- Pd4d5- Ph6h5- Nf3h2- Pg5g4- Ph3g4x Ph5g4x Be2g4x Qe7h7- Bg4d7$ Rd8d7x Qd1g4- Qh7h2$ ,39,checkmate,0-1,"[30, 48, 1, 30, 13, 40, -2, 32, -19, 47, 6, 50, -18, 21, -23, 30, 34, 209, 98, 123, 98, 118, -144, 157, -112, 18, -123, -136, -192, -171, -172, -172, -166, -166, -406, -409, -99999, -100000]",0.8888888888888888,0.5882352941176471
Pe2e4- Pe7e5- Pd2d3- Pc7c5- Pc2c4- Nb8c6- Nb1c3- Ng8f6- Ng1f3- Pd7d6- Bf1e2- Bf8e7- Ke1g1- Ke8g8- Pa2a3- Pa7a6- Pb2b4- Pb7b6- Pb4c5x Pb6c5x Bc1b2- Bc8g4- Ph2h3- Bg4h5- Nc3d5- Nf6d5x Pc4d5x Nc6d4- Nf3d4x Pc5d4x Bb2c1- Bh5e2x Qd1e2x Be7f6- Pf2f4- Pe5f4x Rf1f4x Bf6e5- Rf4g4- Pg7g6- Bc1h6- Rf8e8- Ra1f1- Qd8e7- Bh6g5- Qe7d7- Rg4h4- Pf7f6- Bg5h6- Re8e7- Rh4g4- Ra8e8- Qe2f3- Pf6f5- Pe4f5x ,56,invalid_move,*,"[29, 31, -12, 25, 4, 12, 11, 27, 11, 11, 8, 16, 12, 18, 19, 19, -17, 14, 17, 8, -32, -3, -20, 47, 11, 31, 15, 434, 380, 380, 18, 16, 20, 41, 27, 42, 10, 12, -115, 21, 38, 46, 53, 51, 25, 115, -13, 151, -9, -4, -1, 0, -1, 174, 156]",0.48148148148148145,1.2962962962962963
Pe2e4- Pe7e6- Pd2d3- Pd7d5- Pc2c3- Pd5e4x Pd3e4x Qd8d1$ Ke1d1x Nb8c6- Bf1d3- Ng8f6- Ng1f3- Bf8c5- Ph2h3- Pe6e5- Bc1g5- Bc8e6- Nb1d2- Ke8c8- Kd1c2- Ph7h6- Bg5f6x Pg7f6x Ra1d1- Rd8d7- Nd2c4- Be6c4x Bd3c4x Rh8d8- Rd1d7x Rd8d7x Rh1d1- Rd7d1x Kc2d1x Kc8d7- Kd1c2- Kd7d6- Bc4f7x Nc6e7- Bf7b3- Pb7b6- Nf3h4- Pc7c6- Nh4f5+ Ne7f5x Pe4f5x Kd6e7- Kc2d3- Ke7d6- Kd3e4- ,52,invalid_move,*,"[39, 41, 1, 4, 0, -7, -5, -3, -4, 0, -23, -5, -14, -19, -57, 2, -151, -23, -142, -80, -69, 3, 7, 9, -124, -19, -124, 12, 9, 157, 161, 137, 50, 112, 116, 145, 37, 97, 65, 155, 25, 94, -8, 36, -5, 0, 0, 16, 3, 77, 0]",1.44,1.0
Pe2e4- Pe7e5- Pd2d3- Pd7d6- Pg2g3- Ng8f6- Bf1g2- Bf8e7- Ng1e2- Ke8g8- Ke1g1- Nb8c6- Pf2f4- Pe5f4x Ne2f4x Nc6e5- Nb1c3- Pc7c6- Pd3d4- Ne5g6- Nf4g6x Pf7g6x Pe4e5- Pd6e5x Pd4e5x Nf6d7- Bc1f4- Nd7e5x Bf4e5x Be7f6- Be5f6x Qd8f6x Rf1f6x Rf8f6x Qd1d8+ Rf6f8- Qd8e7- Bc8f5- Ra1f1- Bf5c2x Rf1f8$ Ra8f8x Qe7f8$ Kg8f8x Nc3e4- Bc2e4x Bg2e4x Kf8e7- Kg1f2- Ke7d6- Kf2e3- Kd6e5- Pb2b3- Pb7b5- Pa2a3- Pa7a5- Pb3b4- Pa5b4x Pa3b4x Ke5d6- Be4d3- Pc6c5- Pb4c5$ Kd6c5x Bd3b5x Kc5b5x Ke3d4- Kb5c6- Kd4e5- Kc6d7- Ke5d5- Kd7e7- Kd5e5- Ke7f7- Ke5f4- Kf7f6- Kf4g4- Ph7h6- Kg4h4- Pg6g5+ Kh4h5- Kf6f5- Ph2h4- Pg5h4x Pg3h4x Kf5f4- ,87,invalid_move,*,"[36, 37, -12, 14, 10, 24, 23, 30, 29, 30, 25, 45, 39, 55, 56, 56, 35, 32, 36, 44, -3, 27, -133, -169, -137, -10, -97, 330, 343, 442, 424, 499, 508, 507, 480, 493, 503, 516, 565, 546, 539, 549, 353, 357, 349, 357, 371, 363, 370, 370, 372, 374, 354, 480, 380, 494, 448, 441, 461, 496, 249, 268, 246, 265, -1, 0, 0, 0, 0, 0, 0, 0, 0, 0, -2, 0, -296, 0, -436, -396, -481, -481, -577, -597, -547, -538]",2.186046511627907,5.023809523809524
Pe2e4- Pe7e5- Pd2d3- Pf7f5- Ph2h3- Pf5e4x Pd3e4x Ng8f6- Nb1c3- Bf8b4- Bc1d2- Ke8g8- Ng1f3- Pd7d6- Bf1c4+ Kg8h8- Ke1g1- Nb8c6- Pa2a3- Bb4a5- Pb2b4- Ba5b6- Pb4b5- Nc6d4- Nf3d4x Pe5d4x Nc3d5- Nf6d5x Bc4d5x Pc7c6- Pb5c6x Pb7c6x Bd5c6x Ra8b8- Bc6d5- Bc8a6- Rf1e1- Qd8f6- Bd2g5- Qf6g6- Qd1f3- Ba6c8- Ra1b1- Bc8h3x Pg2g3- Bh3g4- Qf3g2- Bg4h3- Qg2h2- Bh3g4- Bg5f4- Bb6d8- Bf4d6x Bd8f6- Bd6f8x Bf6d8- Bf8d6- Bd8f6- Bd6b8x Bg4f3- ,61,invalid_move,*,"[29, 28, -14, 99, 31, 261, 68, 47, 11, 8, -8, -10, -43, -41, -62, -61, -145, -32, -160, -24, -39, -49, -81, -64, -62, -47, -58, 18, 13, 85, 98, 121, 119, 123, 0, -20, -46, 73, -450, 76, -492, 99999, -475, 8, -588, 188, -455, -77, -326, -40, -133, 498, -434, 427, 316, 692, 327, 99996, 661, 733]",105.03448275862068,147.85714285714286
Pe2e4- Pe7e5- Pf2f3- Pd7d6- Pg2g4- Ng8f6- Ph2h3- Ph7h6- Pd2d3- Nb8c6- Pc2c3- Bc8e6- Pb2b4- Pa7a6- Pa2a4- Pb7b5- Pa4b5x Pa6b5x Ra1a8x Qd8a8x Pd3d4- Pe5d4x Pc3d4x Nc6d4x Bc1e3- Nd4c6- Be3d4- Nc6d4x Qd1d4x Pd6d5- Pe4d5x Be6d5x Qd4e5+ Bf8e7- Qe5c7x Qa8a1- Qc7b8+ Be7d8- Qb8b5$ Nf6d7- Qb5d5x Qa1b1$ Ke1f2- Qb1c2+ Bf1e2- Qc2c7- Qd5e4+ Bd8e7- Qe4a8+ Be7d8- Qa8e4+ Bd8e7- Qe4a8+ Be7d8- Qa8e4+ Bd8e7- Qe4a8+ Be7d8- Qa8e4+ Bd8e7- Qe4a8+ Be7d8- Qa8e4+ ,64,fivefold_repetition,1/2-1/2,"[29, 32, -78, 15, -239, -60, -147, -85, -136, -136, -129, -122, -205, -158, -271, -53, -26, -38, -44, -27, -27, -28, -133, 203, -119, -133, -316, -316, -306, -304, -283, -277, -411, -430, -453, 99995, -258, -293, -308, -321, -424, -227, -241, -10, -65, 5, 0, 0, 0, 3, 4, 3, 0, 0, 0, 3, 0, 0, 0, 3, 0, 0, 0]",7.967741935483871,19.066666666666666
Pe2e4- Pe7e6- Pd2d3- Pc7c5- Pc2c3- Nb8c6- Ph2h3- Pd7d5- Pe4d5x Pe6d5x Ng1f3- Ng8f6- Bf1e2- Bf8d6- Ke1g1- Ke8g8- Bc1g5- Ph7h6- Bg5h4- Rf8e8- Nb1d2- Qd8c7- Nd2b3- Pb7b6- Pd3d4- Pc5c4- Nb3d2- Bc8f5- Nf3h2- Re8e7- Be2f3- Ra8e8- Rf1e1- Re7e1$ Qd1e1x Re8e1$ Ra1e1x Bd6h2$ ,39,invalid_move,*,"[29, 34, -1, 7, -2, 3, -26, -32, -34, -39, -32, -27, -22, -31, -40, -35, -84, -87, -134, -110, -123, 33, -191, 17, -173, 11, -113, 102, -442, -23, -467, -129, -577, -588, -594, -600, -581, -580]",2.1052631578947367,1.7222222222222223
Pe2e4- Pe7e5- Pc2c3- Pb7b6- Pd2d3- Bc8b7- Ng1f3- Ng8f6- Bf1e2- Pd7d6- Ke1g1- Bf8e7- Bc1g5- Ke8g8- Bg5f6x Be7f6x Nb1d2- Nb8d7- Nd2c4- Pc7c5- Pa2a4- Pa7a5- Pb2b3- Ph7h6- Ph2h3- Pg7g5- Nf3h2- Kg8h7- Be2g4- Rf8g8- Bg4d7x Qd8d7x Nh2g4- Bf6g7- Qd1f3- Pf7f5- Pe4f5x Qd7f5x Qf3f5$ Kh7h8- Qf5f7- Ra8f8- Qf7b7x Rf8f7- Qb7b6x Rf7b7- Qb6d6x Rb7b3x Ra1b1- Rb3c3x Rb1b8- Rc3d3x Qd6e5x Rd3d2- Qe5e8- Rd2a2- Qe8g6- Rg8f8- Rb8f8$ Bg7f8x Qg6h6$ Kh8g8- Qh6g5$ Kg8f7- Qg5f5+ Kf7e7- Rf1e1+ Ke7d8- Qf5f8$ Kd8c7- Qf8c5$ Kc7d7- Qc5a5x Ra2a4x Qa5a4$ ,76,invalid_move,*,"[29, 28, -25, 98, 42, 28, 23, 89, 3, 1, 0, 15, -1, 3, -36, -33, -34, -28, -61, 117, -19, 153, 0, 137, -2, 289, 157, 301, 262, 344, 338, 348, 224, 325, 131, 120, -500, 679, 703, 700, 647, 697, 710, 871, 741, 878, 789, 847, 850, 970, 842, 99995, 562, 99991, 737, 99999, 761, 99998, 99998, 99998, 536, 99997, 99995, 99995, 99996, 99996, 99996, 99997, 99998, 99998, 99997, 99998, 99996, 99997, 99998]",11.518518518518519,7.962962962962963
Pe2e4- Pe7e6- Pd2d3- Pb7b6- Pc2c3- Bc8b7- Ph2h3- Pd7d5- Pe4d5x Bb7d5x Ng1f3- Bd5f3x Qd1f3x Nb8c6- Bf1e2- Ng8f6- Ke1g1- Bf8d6- Bc1g5- Ke8g8- Bg5f6x Qd8f6x Qf3f6x Pg7f6x Be2f3- Nc6e5- Bf3a8x Rf8a8x Pd3d4- Ne5g6- Nb1d2- Pc7c5- Nd2f3- Pc5d4x Pc3d4x Bd6f4- Ra1d1- Ra8d8- Pd4d5- Pe6d5x Rd1d5x Rd8d5x Rf1d1- Rd5d1$ ,45,invalid_move,*,"[30, 48, 8, 21, 5, 5, -16, -18, -19, -7, -11, 82, 82, 632, 93, 564, 79, 541, 28, 471, 243, 239, 253, 241, 239, 241, 260, 252, 222, 244, 239, 327, 305, 313, 282, 334, 257, 294, 347, 307, -456, -461, -99998, -99999]",3.380952380952381,4.3
Pe2e4- Pe7e6- Pd2d3- Pc7c5- Pg2g3- Nb8c6- Bf1g2- Pd7d5- Ng1e2- Pd5e4x Pd3e4x Qd8d1$ Ke1d1x Ng8f6- Pf2f3- Bf8e7- Kd1e1- Ke8g8- Ke1f2- Pb7b6- Rh1d1- Bc8b7- Nb1c3- Ra8d8- Bc1g5- Nc6d4- Ne2d4x Pc5d4x Nc3e2- Pe6e5- Pf3f4- Pe5f4x Ne2f4x Be7c5- Pc2c3- Pd4c3$ Kf2f3- Pc3b2x Ra1b1- Bb7e4$ Kf3e2- Be4b1x Rd1b1x Rd8d2+ Ke2f3- Rf8d8- Bg5f6x Pg7f6x Nf4h5- Rd2d3+ Kf3g4- Rd3d4+ Kg4f5- Rd4d5+ Kf5f6x Rd5h5x Bg2f3- Rh5h6+ Kf6g5- Rd8d4- Bf3g4- Rd4g4$ Kg5g4x Rh6g6+ Kg4f3- Rg6f6+ Kf3g4- Rf6g6+ Kg4f3- Rg6f6+ Kf3g4- Rf6g6+ Kg4h5- Rg6h6+ Kh5g4- Rh6g6+ Kg4h5- Rg6g5+ Kh5h4- Rg5g6- Rb1f1- Rg6h6+ Kh4g4- Rh6g6+ Kg4h5- Rg6h6+ Kh5g4- Rh6g6+ Kg4h5- Rg6g5+ Kh5h4- Rg5g6- Rf1f4- Rg6h6+ Kh4g4- Rh6g6+ Kg4h5- Rg6h6+ Kh5g4- Rh6g6+ Kg4h5- Rg6h6+ Kh5g4- Rh6g6+ Kg4f5- Rg6f6+ Kf5g4- Rf6g6+ Kg4h5- Rg6g5+ Kh5h4- Rg5g6- Rf4g4- Rg6g4$ Kh4g4x ,116,invalid_move,*,"[39, 52, 3, -3, 3, 5, 0, 0, -11, -11, -29, -42, -44, -19, -42, -60, -66, -38, -35, -29, -39, -34, -53, -26, -106, -3, -71, -69, -85, -81, -455, -132, -533, -17, -514, -507, -560, -567, -657, -576, -546, -605, -626, 137, -99999, -550, -558, -559, -654, -504, -535, -516, -560, -502, -99998, -99997, -99998, -694, -692, -479, -731, -585, -601, -581, -577, -576, -625, -610, -612, -576, -612, 0, -614, -202, -618, 0, -625, -169, -579, 0, -620, -628, -632, -620, -642, -658, -658, -620, -643, -477, -620, 0, -99993, -99994, -99994, -99992, -99995, -713, -99994, -99992, -99995, 0, -99994, 0, -99995, -701, -99990, 0, -99993, -687, -739, 0, -99992, -99993, -99993]",39.270833333333336,20.70212765957447
Pe2e4- Pe7e6- Pd2d3- Pd7d5- Ph2h3- Pd5e4x Pd3e4x Qd8d1$ Ke1d1x Nb8c6- Ng1f3- Bf8c5- Bf1b5- Bc8d7- Bb5c6x Bd7c6x Nb1c3- Ng8f6- Bc1g5- Ke8c8+ Kd1e2- Bc6e4x Nc3e4x Nf6e4x Bg5d8x Rh8d8x Rh1d1- Rd8d1x Ra1d1x Pf7f5- Pc2c3- Pg7g5- Nf3e5- Ph7h5- Pg2g3- Ph5h4- Pg3g4- Pf5g4x Ph3g4x Ph4h3- Rd1h1- Ph3h2- Rh1h2x Bc5f2x Rh2f2x Ne4f2x Ke2f2x Pb7b6- Kf2f3- Kc8b7- Kf3e4- Pa7a5- Ke4d4- Pc7c5+ Kd4c4- ,56,invalid_move,*,"[36, 31, 2, 11, -18, -5, -8, -12, -5, -3, -3, -6, -83, -15, -160, -184, -185, -169, -280, -73, -90, 64, 45, 34, 49, 61, 26, 23, 30, 219, 14, 244, 228, 217, 80, 272, -2, 315, 153, 318, 279, 441, 444, 99999, 498, 540, 557, 580, 570, 588, 573, 571, 543, 554, 553]",4.2592592592592595,4.846153846153846
Pe2e4- Pe7e5- Pd2d3- Pd7d6- Pg2g3- Ng8f6- Bf1g2- Bf8e7- Ng1e2- Ke8g8- Ke1g1- Nb8c6- Pf2f4- Pe5f4x Ne2f4x Nc6e5- Nf4d5- Nf6d5x Pe4d5x Be7g5- Bc1g5x Qd8g5x Pc2c4- Bc8g4- Qd1b3- Pb7b6- Nb1c3- Ra8e8- Nc3e4- Qg5e3+ Kg1h1- Bg4f3- Rf1f3x Ne5f3x Bg2f3x Qe3f3$ Kh1g1- Re8e4x Pd3e4x Qf3e4x Ra1f1- Qe4d4+ Kg1g2- Qd4d2+ Kg2h3- Qd2h6+ Kh3g2- Qh6d2+ Kg2h3- Qd2h6+ Kh3g2- Qh6d2+ Kg2h3- Qd2h6+ Kh3g2- Qh6d2+ Kg2h3- Qd2h6+ Kh3g2- Qh6d2+ ,61,fivefold_repetition,1/2-1/2,"[39, 32, -21, 12, 13, 25, 29, 23, 27, 33, 20, 47, 17, 37, 48, 59, -42, -43, -46, -29, -32, -30, -265, -196, -379, -95, -283, -184, -305, -307, -394, -235, -417, -451, -478, -485, -505, -268, -268, -256, -256, -262, -263, -141, -309, -237, -243, -138, -317, -243, -252, 0, -317, 0, -248, 0, -329, 0, -247, 0]",2.1,0.6896551724137931
Pe2e4- Pe7e5- Pd2d3- Pc7c5- Pb2b3- Nb8c6- Bc1b2- Pd7d6- Nb1d2- Ng8f6- Ng1f3- Bf8e7- Bf1e2- Ke8g8- Ke1g1- Bc8g4- Ph2h3- Bg4h5- Pg2g4- Bh5g6- Nf3h4- Bg6e4x Nd2e4x Nf6e4x Pd3e4x Be7h4x Pf2f3- Qd8g5- Kg1g2- Nc6d4- Bb2d4x Pc5d4x Qd1d3- Pf7f5- Pe4f5x Rf8f5x Rf1h1- Ra8f8- Ra1f1- Ph7h5- ,41,invalid_move,*,"[29, 28, -19, 8, -18, 3, -21, -44, -37, -19, -12, -4, -19, -28, -30, -8, -23, 41, -28, -32, -33, 298, -104, -85, -97, -107, -170, -129, -285, -114, -168, -165, -384, -63, -206, 371, -263, -269, -299, -130]",2.65,0.7368421052631579
Pe2e4- Pe7e6- Pd2d3- Pc7c5- Pc2c4- Nb8c6- Nb1c3- Ng8f6- Ng1f3- Bf8e7- Bf1e2- Ke8g8- Ke1g1- Pd7d5- Pc4d5x Pe6d5x Pe4d5x Nf6d5x Nc3d5x Qd8d5x Bc1e3- Bc8g4- Ph2h3- Bg4h5- Pg2g4- Bh5g6- Nf3h4- Be7h4x Pf2f4- Bh4g3- Be2f3- Qd5d6- Pf4f5- Bg6h5- Pg4h5x Pg7g6- Pf5g6x Pf7g6x Bf3d5+ Kg8g7- Qd1g4- Rf8f1$ Ra1f1x Ra8f8- Rf1f8x Kg7f8x Be3h6+ Kf8e7- Qg4g5+ Ke7d7- ,51,invalid_move,*,"[29, 34, -3, 7, -23, 3, -3, -5, -39, -12, -35, -19, -23, -26, -30, -39, -37, -25, -116, -106, -110, -3, -3, -1, -38, -39, -471, -467, -510, -351, -414, -275, -261, -116, -116, 46, 31, 35, -360, 63, -100, 31, 20, 701, 375, 401, 29, 105, 9, 11]",0.6,0.6666666666666666
Pe2e4- Pe7e5- Pd2d3- Pd7d6- Ph2h3- Ng8f6- Pg2g4- Ph7h6- Bf1g2- Bf8e7- Ng1e2- Ke8g8- Ke1g1- Nb8c6- Pf2f4- Pe5f4x Ne2f4x Nc6e5- Nf4d5- Nf6d5x Pe4d5x Be7g5- Bc1g5x Qd8g5x Nb1c3- Ne5g6- Nc3e4- Qg5e3+ Kg1h1- Ng6f4- Rf1f4x Qe3f4x Qd1f3- Qf4e5- Ra1f1- Bc8d7- Ne4f6+ Qe5f6x Qf3f6x Pg7f6x Rf1f6x Bd7b5- Rf6h6x Bb5d3x Pc2d3x Rf8e8- Bg2e4- Re8e4x Pd3e4x Ra8e8- Kh1g2- Re8e4x Kg2f3- Re4d4- Rh6h8+ Kg8g7- Rh8a8- Rd4d5x Ra8a7x Rd5d2- Ra7b7x Rd2b2x Rb7c7x Rb2a2x Rc7c6- Ra2a3+ Kf3e4- Ra3h3x Rc6d6x Rh3h4- Ke4e5- Rh4g4x Rd6d4- Rg4d4x Ke5d4x Pf7f5- Kd4e3- Kg7g6- Ke3f4- ,80,invalid_move,*,"[29, 33, -7, 18, -7, 19, -19, 3, -14, 17, 15, 24, 8, 24, 23, 24, 33, 23, -146, -156, -192, -60, -52, -56, -183, -39, -71, -42, -76, 175, -318, -405, -382, -308, -346, -342, -483, -482, -479, -478, -476, -441, -464, -181, -205, -121, -109, -7, -5, -6, -63, -33, -100, -27, -545, 12, 7, 7, 7, 106, 96, 528, 2, 5, 0, 0, 0, 0, 0, 0, 0, 0, -573, -547, -547, 0, 0, 0, 0]",2.871794871794872,1.5128205128205128
Pe2e4- Pe7e6- Pd2d3- Pd7d6- Ph2h3- Ph7h6- Pg2g4- Pa7a6- Bf1g2- Nb8d7- Ng1e2- Nd7b6- Nb1c3- Bc8d7- Pa2a3- Qd8e7- Pb2b4- Ke8c8- Bc1b2- Pf7f6- Pa3a4- Pg7g5- Pa4a5- Nb6a8- Nc3a4- Pb7b6- Pa5b6x Pc7b6x Bb2d4- Pe6e5- Bd4e3- Ph6h5- Pg4h5x Rh8h5x Ne2g3- Rh5h8- Ng3f5- Bd7f5x Pe4f5x Qe7h7- Bg2a8x Kc8c7- Ba8g2- Ng8e7- Qd1f3- Ne7f5x Qf3b7+ ,48,checkmate,1-0,"[29, 51, 3, 44, 9, 47, -6, 24, 21, 27, 22, 94, 77, 110, 64, 132, 74, 163, 0, 131, 145, 233, 245, 234, 164, 348, 360, 345, 330, 442, 321, 448, 337, 413, 392, 395, 326, 305, 314, 533, 546, 544, 535, 534, 531, 99999, 100000]",2.272727272727273,2.727272727272727
Pe2e4- Pe7e6- Pd2d3- Pc7c5- Ph2h3- Pd7d5- Pe4d5x Pe6d5x Ng1f3- Ng8f6- Bf1e2- Bf8d6- Ke1g1- Ke8g8- Nb1c3- Nb8c6- Bc1g5- Pd5d4- Nc3e4- Nf6e4x Bg5d8x Ne4f2x Rf1f2x Rf8d8x Nf3g5- Ph7h6- Ng5f7x Rd8f8- Nf7d6x Rf8f2x Kg1f2x Bc8e6- Be2g4- Be6g4x Qd1g4x Ra8f8+ Kf2g1- Nc6e5- Qg4e6+ Ne5f7- Nd6f7x Rf8f7x Qe6e8+ Kg8h7- Qe8f7x Pb7b5- Ra1f1- Pc5c4- Rf1f5- Pc4d3x Qf7g6+ Kh7g8- Rf5f8+ Kg8f8x Qg6f7+ Kf8f7x Pc2d3x Pa7a5- Kg1f2- Pb5b4- Kf2e2- Pa5a4- Ke2d2- Pb4b3- Pa2b3x Pa4b3x Kd2c1- ,68,invalid_move,*,"[29, 34, -5, 12, -25, -22, -29, -13, -14, -15, -29, -30, -35, -22, -26, -28, -77, 27, 17, 440, 411, 416, 415, 437, 447, 537, 525, 558, 576, 579, 588, 593, 592, 635, 642, 671, 675, 742, 791, 99986, 99994, 99996, 665, 99995, 99996, 99997, 99997, 99997, 99996, 99996, 492, 99998, 692, 713, 3, 0, 0, 4, 0, 382, 1, 364, 0, 0, 0, 0, 0]",56.75,32.111111111111114
Pe2e4- Pe7e5- Pd2d3- Pc7c5- Ph2h3- Nb8c6- Pa2a3- Pd7d6- Ng1f3- Ng8f6- Bf1e2- Bf8e7- Ke1g1- Ke8g8- Nb1c3- Pa7a6- Nc3d5- Nf6d5x Pe4d5x Nc6d4- Nf3d4x Pc5d4x Be2f3- Pb7b5- Pc2c3- Bc8b7- Pc3d4x Pe5d4x Bc1d2- Be7f6- Ra1c1- Ra8c8- Rc1c8x Qd8c8x Bd2b4- Rf8e8- Qd1d2- Qc8d7- Rf1c1- Re8c8- Rc1c8$ Qd7c8x Qd2e2- Qc8c1+ Kg1h2- Qc1f4+ Pg2g3- Qf4h6- Bb4d6x Bf6g5- Bd6e5- Pf7f6- Be5d4x Bg5f4- Pg3f4x Qh6f4$ Kh2g2- Qf4d4x Qe2e8+ ,60,checkmate,1-0,"[30, 32, -8, 13, -12, -8, -26, -3, -5, -9, -20, -8, -19, -9, -25, -4, -7, -9, -8, -15, -14, 2, -21, -23, -37, 50, 53, 53, 44, 58, 38, 46, 39, 56, 30, 29, 3, 22, 17, 169, 185, 228, 15, 17, 12, 39, 59, 99999, 677, 99999, 367, 514, 548, 99999, 501, 492, 484, 99999, 100000]",2.6296296296296298,2.8846153846153846
Pe2e4- Pe7e5- Pd2d3- Pb7b6- Ph2h3- Bc8b7- Ng1f3- Nb8c6- Bf1e2- Pd7d6- Ke1g1- Qd8d7- Nf3h2- Ke8c8- Be2g4- Pf7f5- Pe4f5x Qd7f5x Bg4f5$ Kc8b8- Bf5g4- Ng8f6- Bg4f3- Ph7h5- Bf3c6x Bb7c6x Nb1c3- Pg7g5- Nc3e4- Nf6e4x Pd3e4x Pg5g4- Ph3g4x Ph5g4x Nh2g4x Rh8h4- Ng4e3- Bf8e7- Pf2f3- Be7g5- Ne3f5- Rh4h8- Nf5g3- Rh8g8- Ng3f5- Bg5c1x Ra1c1x Rg8h8- Pb2b3- Rd8g8- Pc2c4- Rg8g2$ ,53,invalid_move,*,"[29, 33, -7, 58, 0, -7, -8, -3, -6, 44, 31, 66, -40, 474, 442, 441, -132, 583, 588, 599, 556, 553, 549, 596, 582, 577, 570, 559, 539, 496, 492, 542, 486, 499, 447, 637, 481, 497, 479, 560, 557, 694, 502, 539, 506, 575, 591, 599, 542, 608, 564, 739]",2.6923076923076925,0.84
Pe2e4- Pe7e6- Pd2d3- Pd7d5- Pf2f3- Pd5e4x Pf3e4x Ng8f6- Ng1f3- Bf8e7- Bf1e2- Ke8g8- Ke1g1- Pc7c5- Pc2c3- Nb8c6- Pd3d4- Pc5d4x Pc3d4x Pb7b6- Pe4e5- Nf6d5- Bc1e3- Bc8b7- Nb1c3- Ra8c8- Nc3d5x Pe6d5x Ra1c1- Nc6a5- Rc1c8x Qd8c8x Qd1d2- Na5c4- Be2c4x Pd5c4x Rf1c1- Qc8e6- Qd2c3- Rf8c8- Qc3d2- Bb7f3x Pg2f3x Qe6h3- Qd2g2- Qh3e6- Rc1f1- Pb6b5- Pf3f4- Pa7a5- Pa2a3- Pb5b4- Pa3b4x Pa5b4x Qg2a8- Rc8a8x Rf1a1- Ra8a1$ Be3c1- Ra1c1$ Kg1f2- Qe6g4- Kf2e3- Qg4f4$ Ke3e2- Qf4e4+ Ke2d2- Rc1c2+ Kd2d1- Qe4e2+ ,71,checkmate,0-1,"[29, 34, 3, 3, -58, 10, 6, 23, 14, 19, 14, 21, 12, 6, 8, 5, -164, -78, -152, 33, -41, -45, -404, -95, -464, -63, -60, 128, 73, 112, 75, 72, 37, 24, -28, 24, -110, -79, -182, -155, -195, -45, -42, 26, 31, 28, -41, -41, -55, 151, -56, 43, 24, 33, -620, -648, -99996, -99996, -99996, -99997, -99997, -99998, -99998, -658, -99998, -99999, -99999, -99999, -99999, -100000]",2.142857142857143,0.4642857142857143
Pe2e4- Pe7e5- Pg2g3- Pd7d5- Ph2h4- Pd5e4x Bf1g2- Ng8f6- Nb1c3- Bf8b4- Nc3e4x Nf6e4x Bg2e4x Ke8g8- Pc2c3- Bb4c5- Pd2d4- Pe5d4x Pc3d4x Bc5b4+ Bc1d2- Bb4d2$ Qd1d2x Nb8c6- Ke1c1- Bc8g4- Pf2f3- Bg4e6- Pd4d5- Be6d5x Be4d5x Qd8d5x Qd2d5x Ra8d8- Qd5d8x Rf8d8x Rd1d8$ Nc6d8x Ng1e2- Nd8e6- Rh1d1- Pc7c5- Ne2c3- Pb7b6- Nc3d5- Pg7g6- Nd5f6+ Kg8g7- Nf6e8+ Kg7h6- Rd1d7- Ne6d4- Rd7f7x Nd4e2+ Kc1c2- Ne2g3x Rf7h7$ ,58,invalid_move,*,"[29, 33, -69, -54, -207, -199, -259, -262, -280, -73, -68, -87, -86, -66, -85, -92, -149, -146, -252, -41, -388, -408, -389, -4, -21, 83, 85, 332, 339, 412, 358, 480, 476, 501, 473, 489, 489, 492, 494, 497, 498, 494, 487, 484, 476, 485, 468, 478, 476, 505, 513, 510, 518, 514, 510, 518, -6]",2.25,1.8928571428571428
Pe2e4- Pe7e6- Pd2d3- Pd7d5- Pg2g3- Pd5e4x Pd3e4x Qd8d1$ Ke1d1x Nb8c6- Bf1g2- Ng8f6- Nb1c3- Bf8b4- Bc1d2- Bb4c3x Bd2c3x Nf6e4x Bg2e4x Ke8g8- Ng1f3- Pf7f5- Be4c6x Pb7c6x Kd1e2- Bc8a6+ Ke2e1- Ra8d8- Ra1d1- Rd8d1$ Ke1d1x Rf8d8+ Kd1c1- Ba6e2- Rh1e1- Be2f3x Re1e6x Bf3d5- Re6e5- Bd5a2x Re5f5x Rd8d1+ Kc1d1x Ba2e6- Rf5a5- Pa7a6- Ra5a6x Be6g4+ Kd1c1- Bg4f3- Ra6c6x Bf3c6x Pb2b4- Kg8f7- Pb4b5- Bc6b5x Pf2f4- Kf7e6- Pf4f5+ Ke6f5x Ph2h4- Ph7h5- Kc1b2- Kf5g4- Kb2b3- Kg4g3x Kb3b4- Kg3h4x Kb4b5x Kh4g4- Kb5c6- Kg4f5- Kc6c7x Kf5e6- Kc7d8- Ke6d6- Kd8e8- Kd6e6- Ke8f8- Ke6d6- Kf8g7x Kd6e6- Kg7g6- Ke6e7- Kg6h5x Ke7f7- Kh5g5- ,88,invalid_move,*,"[30, 46, 1, -2, -23, -18, -20, -26, -21, -28, -92, -91, -114, -51, -65, 21, 18, 411, 426, 446, 448, 508, 501, 497, 453, 480, 413, 439, 459, 473, 467, 482, 486, 526, 82, 80, -99999, 312, 247, 436, 108, 575, 588, 591, 588, 589, 582, 602, 607, 606, 396, 392, 198, 329, 9, 10, 5, 44, 0, 1, -4, 2, 0, -3, -21, -21, -8, 14, 9, 392, -7, 396, 288, 337, -38, -35, -59, -62, -82, -58, -53, 623, -42, 747, 798, 896, 860]",66.3953488372093,85.30952380952381
Pe2e4- Pe7e6- Pd2d3- Pg7g6- Pf2f4- Bf8g7- Ng1f3- Ng8e7- Bf1e2- Ke8g8- Ke1g1- Pd7d5- Pe4e5- Pc7c5- Pc2c3- Nb8c6- Pd3d4- Pc5d4x Pc3d4x Pb7b6- Bc1e3- Bc8b7- Nb1c3- Ra8c8- Ra1c1- Ne7f5- Be3f2- Nf5e7- Pa2a3- Ne7f5- Pg2g4- Nf5e7- Ph2h4- Pf7f6- Pe5f6x Bg7f6x Pg4g5- Bf6g7- Nf3e5- Nc6e5x Pf4e5x Ne7f5- Be2g4- Qd8e7- Bg4f5x Pe6f5x Qd1f3- Rc8e8- Rc1e1- Re8c8- Re1e2- Rc8c4- Rf1e1- Rf8c8- Re2e3- Rc4d4x ,57,invalid_move,*,"[29, 34, -5, 58, 4, 42, 13, 43, 0, -3, -6, 42, 52, 57, 46, 76, 72, 58, 63, 112, 105, 116, 127, 166, 127, 147, 121, 184, 126, 184, 203, 182, 161, 159, 74, 122, -57, -59, -152, 40, 39, 76, -19, 45, 19, 82, 98, 200, 104, 136, 42, 111, 79, 159, -305, -301]",1.5,2.259259259259259
Pe2e4- Pe7e5- Pd2d3- Pg7g6- Ph2h4- Bf8g7- Ph4h5- Pg6h5x Rh1h5x Ng8f6- Rh5h1- Pd7d6- Bc1g5- Bc8g4- Pf2f3- Bg4e6- Nb1c3- Nb8c6- Qd1d2- Qd8d7- Ke1c1- Ke8c8- Bg5f6x Bg7f6x Nc3d5- Be6d5x Pe4d5x Nc6d4- Pc2c3- Nd4f5- Pg2g4- Nf5g3- Rh1h2- Ng3f1x Qd2c2- Nf1h2x Ng1e2- Nh2f3x Rd1h1- Nf3g5- Rh1h5- Ng5f3- Ne2g3- Nf3g5- Ng3f5- Qd7f5x Pg4f5x Ng5f3- Qc2f2- Nf3g5- Rh5g5x Bf6g5$ Qf2e3- Bg5e3$ Kc1c2- Be3f4- Pb2b4- Rh8g8- Pa2a4- Rg8g2+ Kc2b3- Rd8g8- Pa4a5- Rg2b2+ Kb3c4- Rb2c2- Pb4b5- Rc2c3$ Kc4b4- Rc3d3x Pb5b6- Pa7b6x Pa5b6x Pc7b6x Kb4b5- Rd3d5$ Kb5b6x Rg8d8- Kb6a7- Rd5b5- Ka7a8- Rd8d7- Ka8a7- Rb5a5+ ,85,invalid_move,*,"[29, 36, -14, 57, 0, 31, 41, 88, 55, 173, 17, 59, 57, 408, 88, 91, 62, 81, 62, 53, 25, 50, -27, -32, -91, -68, -56, 29, 5, 6, -27, -39, -41, -9, -562, -512, -610, -617, -641, -565, -662, -596, -649, -568, -577, -403, -368, -269, -264, -107, -425, -462, -737, -737, -761, -734, -745, -742, -757, -767, -780, -735, -799, -657, -99996, -742, -791, -668, -99996, -99997, -99997, -99996, -99996, -99996, -99996, -99996, -99999, -99998, -99998, -99998, -99999, -99998, -99998, -99997]",3.909090909090909,5.606060606060606
Pe2e4- Pe7e6- Pd2d3- Pc7c5- Pc2c4- Nb8c6- Nb1c3- Pa7a6- Ng1f3- Pb7b6- Bf1e2- Bc8b7- Ke1g1- Ng8f6- Ph2h3- Bf8e7- Bc1e3- Ke8g8- Pa2a3- Pd7d5- Pc4d5x Pe6d5x Pe4d5x Nf6d5x Nc3d5x Qd8d5x Ra1c1- Ra8d8- Qd1c2- Nc6d4- Nf3d4x Pc5d4x Be3d2- Be7f6- Be2f3- Qd5d6- Bd2f4- Qd6d7- Bf3b7x Qd7b7x Rf1e1- Rf8e8- Re1e8$ Rd8e8x Rc1e1- Re8e1$ ,47,invalid_move,*,"[30, 49, 3, 12, -23, -6, -19, 23, 24, 37, 17, 28, 22, 25, 1, 28, 19, 33, -37, -26, -26, -32, -101, -101, -94, -91, -94, -61, -96, -22, -99999, -74, -99999, 86, 97, 521, 61, 130, 140, 142, 37, 133, 92, 96, -475, -480]",0.5,1.380952380952381
Pe2e4- Pe7e5- Pd2d3- Pc7c5- Ph2h3- Pd7d6- Pg2g4- Nb8c6- Bf1g2- Ng8f6- Ng1e2- Bf8e7- Nb1c3- Ke8g8- Pf2f4- Pe5f4x Ne2f4x Nc6d4- Nf4d5- Nf6d5x Nc3d5x Be7h4+ Ke1f1- Bc8e6- Pc2c3- Nd4c6- Pb2b4- Pc5b4x Pc3b4x Pa7a5- Pb4b5- Nc6e5- Bc1b2- Pb7b6- Pa2a4- Ra8c8- Bb2e5x Pd6e5x Qd1e2- Qd8d6- Ra1c1- Rc8c1$ ,43,invalid_move,*,"[29, 28, -19, 8, -19, -10, -33, -42, -53, 17, 13, 25, 26, 35, 12, 16, -6, 29, -208, -209, -220, -228, -225, -236, -235, -130, -369, -367, -492, -335, -405, -293, -457, -249, -369, -300, -335, -359, -363, -353, -1046, -99991]",2.7,0.25
Pe2e4- Pe7e5- Pd2d3- Pc7c5- Ph2h3- Nb8c6- Pa2a3- Pd7d6- Ng1f3- Ng8f6- Bf1e2- Bf8e7- Ke1g1- Ke8g8- Nb1c3- Pa7a6- Bc1g5- Pb7b5- Bg5f6x Be7f6x Nc3d5- Bc8e6- Nd5f6$ Qd8f6x Pc2c3- Pb5b4- Pa3b4x Nc6b4x Pc3b4x Pc5b4x Ra1a4- Pa6a5- Qd1b3- Be6b3x Ra4a5x Ra8a5x Rf1c1- Rf8c8- Rc1c8$ ,40,invalid_move,*,"[29, 33, -12, 12, 2, -5, -26, -2, -5, 0, -17, -7, -15, -5, -23, -8, -29, -24, -19, -21, -25, -23, -24, -25, -23, 91, 63, 393, 380, 366, 335, 332, -580, -558, -624, -621, -656, 99998, 99999]",1.5,0.3888888888888889
Pe2e4- Pe7e6- Pd2d4- Pc7c5- Pc2c3- Pc5d4x Pc3d4x Nb8c6- Ng1f3- Pd7d5- Pe4e5- Bf8b4+ Bc1d2- Bb4d2$ Nb1d2x Ng8e7- Bf1d3- Ne7f5- Ke1g1- Ke8g8- Ph2h3- Ph7h6- Pg2g4- Nf5e7- Ph3h4- Ne7g6- Ph4h5- Ng6e7- Nf3h4- Ne7f5- Nh4f5x Pe6f5x Pg4f5x Bc8f5x Bd3f5x Qd8g5+ Bf5g4- Nc6d4x Nd2f3- Nd4f3$ ,41,invalid_move,*,"[29, 43, 53, 66, 32, 44, 32, 50, 39, 43, 49, 104, 49, 42, 5, 8, 8, 72, 95, 90, -71, 76, -117, 41, -80, -69, -199, 55, -135, -136, -193, -214, -296, 106, 142, 187, 192, 235, -671, 328]",1.7,4.2105263157894735
Pe2e4- Pe7e6- Pd2d4- Ph7h6- Pc2c4- Pa7a6- Nb1c3- Pb7b6- Ng1f3- Bc8b7- Bf1d3- Ng8f6- Ke1g1- Bf8e7- Pe4e5- Nf6h7- Bc1f4- Pg7g5- Bf4g3- Pg5g4- Nf3d2- Ph6h5- Pf2f3- Pg4f3x Nd2f3x Nh7g5- Nf3g5x Be7g5x Qd1f3- Bg5h6- Qf3f7$ ,32,checkmate,1-0,"[29, 43, 42, 68, 35, 121, 121, 152, 123, 127, 133, 223, 150, 221, 237, 234, 198, 283, 249, 299, 301, 289, 204, 283, 306, 371, 333, 363, -330, 99999, 100000]",1.0714285714285714,3.357142857142857
Pe2e4- Pe7e6- Pd2d3- Pd7d5- Pf2f3- Pd5e4x Pf3e4x Ng8f6- Ng1f3- Bf8e7- Bf1e2- Ke8g8- Ke1g1- Pc7c5- Pc2c3- Nb8c6- Pd3d4- Pc5d4x Pc3d4x Pe6e5- Pd4d5- Nc6d4- Nf3d4x Pe5d4x Be2d3- Bc8g4- Qd1c2- Bg4h5- Bc1g5- Ph7h6- Bg5f6x Be7f6x Nb1d2- Bf6e5- Nd2f3- Bh5f3x Rf1f3x Qd8h4- Ra1f1- Pf7f6- Pg2g3- Qh4g4- Rf3f5- Ra8c8- Qc2b3- Rc8c1- Rf5e5x Pf6e5x Qb3b7x Rc1f1$ Bd3f1x Qg4d1- Qb7a7x Qd1f1$ ,55,checkmate,0-1,"[30, 37, 2, 9, -59, 5, 2, 15, 17, 15, 7, 7, 11, 8, 0, -5, -171, -90, -163, 17, 17, 15, 24, 85, -39, -25, -114, -105, -186, 0, -10, -13, -19, 257, -51, -69, -65, -21, -99997, 0, -19, -25, -62, -24, -42, 399, -350, 438, -99991, -483, -550, -391, -99999, -100000]",71.08,54.458333333333336
Pe2e4- Pe7e6- Pd2d3- Pd7d5- Pg2g3- Pd5e4x Pd3e4x Qd8d1$ Ke1d1x Nb8c6- Bf1g2- Ng8f6- Nb1c3- Bf8b4- Bc1d2- Bb4c3x Bd2c3x Nf6e4x Bg2e4x Ke8g8- Ng1f3- Pf7f5- Be4c6x Pb7c6x Kd1e2- Bc8a6+ Ke2e1- Ra8d8- Nf3e5- Rd8d5- Ne5c6x Rd5d6- Nc6a7x Rf8a8- Na7b5- Rd6d5- Nb5c7x Ra8c8- Nc7d5x Pe6d5x Bc3d4- Rc8c2x Ra1d1- Rc2b2x Bd4b2x Ba6c4- Rd1d4- Bc4a2x Rd4a4- Ba2c4- Ra4c4x Pd5c4x Rh1g1- Pc4c3- Bb2c3x Pg7g6- Pf2f4- Kg8f7- Ph2h4- Kf7e6- Pg3g4- Pf5g4x Rg1g4x Ke6f5- Rg4g5+ Kf5f4x Rg5a5- Kf4g4- Ra5a4+ Kg4h3- Ra4a3- Kh3h4x Ra3a4+ Kh4h3- Ra4a3- Kh3h2- Ra3a2+ Kh2h3- Ra2a3- Kh3h4- Ra3a4+ Kh4h3- Ra4a3- Kh3h2- Ra3a2+ Kh2h3- Ra2a3- Kh3h4- Ra3a4+ Kh4h3- Ra4a3- ,92,fivefold_repetition,1/2-1/2,"[29, 43, 2, 3, -30, -21, -23, -24, -21, -19, -80, -73, -121, -57, -63, 20, 15, 428, 426, 444, 448, 511, 501, 484, 463, 494, 434, 431, 436, 482, 440, 448, 218, 222, 127, 571, 569, 594, 580, 593, 521, 524, 359, 675, 680, 684, 659, 716, 727, 728, 587, 587, 575, 591, 618, 621, 568, 601, 606, 652, 558, 564, 581, 719, 805, 99973, 530, 99967, 698, 99995, 441, 460, 455, 99992, 472, 99995, 485, 532, 533, 535, 526, 99992, 0, 99995, 493, 99989, 0, 537, 0, 99992, 0]",13.829268292682928,10.4
Pe2e4- Pe7e6- Pd2d3- Pc7c5- Pc2c3- Nb8c6- Ph2h3- Pd7d5- Pe4d5x Pe6d5x Ng1f3- Ng8f6- Bf1e2- Bf8d6- Ke1g1- Ke8g8- Bc1g5- Ph7h6- Bg5h4- Rf8e8- Nb1d2- Qd8c7- Rf1e1- Bc8f5- Bh4g3- Bd6g3x Pf2g3x Qc7g3x Nd2f1- Qg3c7- Nf1h2- Re8e7- Nh2g4- Ra8e8- Ng4f6$ Pg7f6x Qd1d2- Kg8h7- Re1f1- Re7e2x Qd2h6$ Kh7g8- Qh6f6x Re2g2$ Kg1h1- Rg2g7- Rf1g1- Re8e2- Rg1g7$ Kg8f8- Rg7g8+ Kf8g8x Qf6g5+ Kg8f8- Ra1g1- Re2h2+ ,57,invalid_move,*,"[35, 46, 5, -2, -5, 6, -20, -27, -39, -35, -39, -34, -46, -36, -47, -48, -71, -72, -136, -119, -111, 55, -186, 17, -273, -266, -271, -263, -255, -253, -278, -249, -435, -147, -176, -176, -186, -111, -486, -525, -634, -337, -451, 80, -469, -5, -378, 99999, 587, 605, -9, 0, -444, -38, -431, 350]",55.77777777777778,45.55555555555556
Pe2e4- Pe7e5- Pd2d3- Pd7d6- Pg2g3- Ng8f6- Bf1g2- Bf8e7- Ng1e2- Ke8g8- Ke1g1- Pc7c6- Pf2f4- Pe5f4x Ne2f4x Pd6d5- Pe4e5- Nf6d7- Pd3d4- Pf7f6- Pe5e6- Nd7b6- Pc2c3- Bc8e6x Nf4e6x Qd8d6- Ne6f8x Be7f8x Bc1f4- Qd6d7- Nb1d2- Bf8d6- Bf4d6x Qd7d6x Nd2f3- Nb8d7- Qd1d2- Ra8e8- Ra1e1- Nb6c4- Qd2c1- Nc4b6- Nf3h4- Pg7g5- Nh4f5- Qd6c7- Nf5h6+ Kg8g7- Nh6f5+ Kg7g6- Nf5e7+ Re8e7x Re1e7x ,54,invalid_move,*,"[29, 28, -7, 19, 14, 24, 28, 25, 20, 30, 22, 25, 5, 44, 15, 31, 18, 74, 63, 260, 150, 141, 43, 539, 531, 544, 537, 548, 515, 522, 498, 566, 561, 543, 510, 512, 482, 501, 510, 645, 493, 706, 525, 731, 577, 827, 639, 628, 577, 806, 575, 852, 1054]",1.6153846153846154,8.26923076923077
