Move History,Number of Plies,Outcome,Result,Player Scores,ACPL White,ACPL Black
Pe2e3- Pe7e6- Ng1e2- Pd7d6- Pd2d3- Pc7c6- Nb1d2- Pa7a6- Pg2g3- Pb7b5- Bf1g2- Bc8b7- Pb2b3- Ng8f6- Bc1b2- Pd6d5- Pa2a3- Bf8e7- Ke1g1- Ke8g8- Pc2c4- Nb8d7- Pc4d5x Pc6d5x Pb3b4- Ra8c8- Nd2b3- Nd7b6- Nb3c5- Be7c5x Pb4c5x Nb6d7- Pd3d4- Nf6e4- Bg2e4x Pd5e4x Ne2c3- Nd7f6- Qd1e2- Bb7d5- Nc3d5x Nf6d5x Ra1c1- Pf7f5- Ph2h4- Qd8f6- Rc1d1- Nd5e7- Ph4h5- Ne7d5- Ph5h6- Pg7g6- Bb2c1- Qf6f7- Bc1d2- Pa6a5- Bd2e1- Pa5a4- Be1d2- Rc8b8- Rd1b1- Rf8c8- Rb1b2- Rb8a8- Rf1b1- Rc8c7- Rb2a2- Ra8b8- Qe2d1- Rb8c8- Qd1e2- Rc7c6- Qe2e1- Rc6a6- Ra2b2- Rc8c6- Rb2a2- Qf7f6- Rb1b2- Ra6b6- Rb2b4- Qf6e7- Ra2b2- Qe7f6- Rb4a4x Rb6a6- Ra4b4- Ra6a7- Rb4b5x Ra7a3x Bd2b4- Rc6a6- Rb5b6- Ra3a1- Rb2b1- Ra6b6x Rb1a1x Rb6b4x Ra1b1- Rb4b2- Rb1b2x Qf6e7- Rb2b1- Qe7a7- Qe1b4- Qa7a6- Rb1f1- Qa6a7- Qb4b5- Qa7a3- Qb5e8+ ,112,checkmate,1-0,"[19, 17, -23, 27, -13, 9, -8, 35, 28, 37, 28, 26, 11, 31, 31, 64, 26, 17, 11, 14, 8, 26, 4, 32, 25, 28, 30, 62, -14, -11, -9, 99, 83, 134, -55, -68, -96, -76, -105, -3, -13, -3, -40, -33, -92, -53, -94, 168, -130, -153, -281, -151, -142, -80, -101, 67, -70, 7, -70, 39, 27, 177, 117, 160, 118, 212, 108, 169, 29, 138, 102, 122, -10, 98, 114, 264, 91, 165, 51, 350, -3, 353, 13, 441, 103, 230, 51, 246, 241, 359, 144, 468, 301, 301, 354, 336, 94, 107, -221, 440, 432, 494, 441, 512, -240, 640, -381, 480, 471, 99999, 100000]",1.2407407407407407,1.5185185185185186
Pe2e4- Pe7e6- Pd2d3- Qd8f6- Pc2c3- Nb8c6- Ph2h3- Pb7b6- Nb1d2- Bc8b7- Ng1f3- Ph7h6- Qd1e2- Ke8c8- Pg2g4- Ng8e7- Bf1g2- Pg7g6- Nd2f1- Bf8g7- Nf1g3- Ph6h5- Pg4h5x Pg6h5x Ph3h4- Pd7d5- Bc1g5- Qf6g6- Nf3e5- Qg6h7- Bg5e7x Nc6e7x Pe4d5x Ne7d5x Bg2d5x Rd8d5x Ne5f7x Rh8f8- Nf7g5- Qh7g6- Ng5f3- Pe6e5- Pc3c4- Rd5d3x Nf3e5x Qg6f6- Ne5d3x Qf6e6- Nd3f4- Qe6c6- Nf4h5x Qc6h1$ Qe2f1- Qh1f1$ Ke1f1x Bg7b2x Ra1b1- Bb2e5- Ng3e4- Bb7e4x Rb1e1- Be4c6- Nh5f6- Be5f6x Re1e6- Bc6d7- Re6f6x Bd7c6- Rf6f8$ Kc8b7- Rf8f6- Bc6e8- Rf6h6- Be8g6- Rh6g6x Pa7a5- Rg6g5- Pb6b5- Rg5b5$ Kb7a6- Rb5b8- Ka6a7- Rb8b5- Ka7a6- Rb5a5$ Ka6a5x Ph4h5- Ka5b4- Ph5h6- Kb4c4x Ph6h7- Kc4d5- Qh7h8- Kd5e4- Qh8c3- Ke4d5- Pf2f4- Kd5e4- Pf4f5- Ke4f4- Pf5f6- Kf4e4- Pf6f7- Ke4d5- Qf7f8- Kd5e4- Qf8f5+ ,108,invalid_move,*,"[29, 61, 12, 93, 82, 72, 46, 52, 41, 60, 77, 71, 1, 8, -60, -47, -88, -4, -41, 314, -24, 377, -43, -42, -48, 24, 11, 4, -435, 209, -165, -191, -189, -205, -386, -272, -286, -101, -112, -48, -400, -174, -498, -499, -608, 60, 37, 692, 332, 374, -226, 534, -154, -169, -191, -203, -177, -141, -488, -482, -483, 30, -536, -547, -572, -574, -596, 531, 542, 571, 518, 516, 450, 658, 796, 869, 838, 918, 869, 99992, 99992, 99992, 99992, 99992, 690, 723, 745, 759, 761, 768, 964, 99975, 99979, 99989, 99989, 99991, 99987, 99992, 99991, 99995, 99996, 99996, 99997, 99997, 99998, 99999, 99991]",136.83333333333334,156.30232558139534
Pe2e4- Pe7e5- Qd1f3- Pd7d6- Pc2c3- Ng8f6- Ph2h3- Pg7g6- Pd2d3- Bf8g7- Qf3g3- Ke8g8- Bf1e2- Pc7c6- Nb1d2- Bc8e6- Nd2f3- Nb8d7- Bc1g5- Ph7h6- Bg5f6x Nd7f6x Nf3h4- Qd8d7- Nh4f3- Ra8d8- Pa2a4- Pd6d5- Pe4d5x Pc6d5x Pa4a5- Pb7b6- Pa5b6x Pa7b6x Nf3e5x Qd7c7- Ne5f3- Qc7g3x Pf2g3x Nf6d7- Ke1c1- Nd7c5- Kc1c2- Rd8a8- Pd3d4- Nc5e4- Nf3e5- Pf7f6- Ne5g6x Rf8e8- Ng6f4- Be6f7- Be2d3- Ne4f2- Ng1f3- Nf2h1x Rd1h1x Re8e3- Rh1e1- Ra8e8- Re1e3x Re8e3x Nf4d5x Bf7d5x Bd3b5- Bd5f3x Pg2f3x Re3f3x Pd4d5- Rf3g3x Pd5d6- Bg7f8- Pd6d7- Rg3h3x Bb5c6- Rh3h2+ Kc2b3- Rh2d2- Kb3c4- Rd2d7x Bc6d7x Kg8f7- Bd7c6- Kf7e7- Kc4b5- Ke7d6- Pb2b4- Ph6h5- Kb5b6x Ph5h4- Pb4b5- Ph4h3- Pc3c4- Ph3h2- Pc4c5+ Kd6e7- Kb6b7- Qh2h1- Pb5b6- Qh1c6$ Kb7c6x Ke7d8- Kc6b5- Kd8d7- Pc5c6+ Kd7d6- Pb6b7- Kd6c7- Kb5a6- Kc7b8- Pc6c7+ Kb8c7x Ka6a7- Kc7c6- Ka7a6- Kc6c5- Ka6a7- Kc5c4- Ka7a6- Kc4d4- Ka6a7- Kd4c4- Ka7a6- Kc4c5- Ka6a7- Kc5c4- Ka7a6- ,128,invalid_move,*,"[29, 33, -44, 1, -36, -26, -48, -31, -55, -60, -101, -101, -99, -48, -98, -26, -80, -65, -269, -212, -271, -283, -363, -191, -278, -207, -337, -239, -294, -88, -420, -181, -335, -184, -200, 10, -28, -26, -25, 39, -123, -103, -197, -92, -251, -134, -184, 77, 98, 82, 94, 154, 35, 58, 58, 144, 116, 223, 25, 217, 238, 220, -360, -364, -400, -359, -414, -399, -410, -402, -429, -423, -422, 664, -442, -417, -453, -416, -440, -9, -11, -7, -22, 3, 11, 57, -4, 18, 12, 14, -35, -15, 0, 460, 520, 536, 31, 664, -99986, 488, 517, 544, 0, 0, 0, 364, -481, -571, -612, 400, 407, 438, 446, 475, -599, 509, -586, 457, -557, 518, -557, 504, -557, 489, -739, 493, -755]",81.43548387096774,85.33333333333333
Pc2c4- Pe7e6- Pg2g3- Pd7d5- Pe2e3- Pd5c4x Bf1c4x Ng8f6- Nb1c3- Bf8b4- Qd1b3- Bb4c3x Qb3c3x Ke8g8- Ng1f3- Nb8c6- Pa2a3- Pa7a6- Pb2b4- Pb7b5- Bc4e2- Bc8b7- Bc1b2- Ra8c8- Ph2h4- Nf6e4- Qc3c2- Ne4f6- Pg3g4- Nc6e7- Pg4g5- Nf6d5- Ke1c1- Pa6a5- Pb4a5x Pc7c5- Ph4h5- Pb5b4- Pa3b4x Pc5b4x Ph5h6- Pg7g6- Pe3e4- Nd5f4- Pe4e5- Nf4e2$ Kc1b1- Ne2f4- Pd2d4- Nf4d5- Nf3h4- Rc8c2x Kb1c2x Qd8a5x Kc2b3- Qa5b5- Rd1a1- Rf8c8- Rh1c1- Bb7c6- Rc1c4- Ne7f5- Nh4f5x Pe6f5x Pe5e6- Pf7e6x Ra1a6- Qb5c4$ Kb3c4x Bc6b5+ Kc4b3- Bb5a6x Kb3a4- Ba6d3- Ka4b3- Bd3e4- Kb3a4- Rc8c4- Bb2c1- Rc4c1x Ka4b3- Rc1c2- Kb3a4- Rc2f2x Ka4a5- Rf2f3- Ka5a4- Rf3e3- Ka4a5- Re3d3- Ka5a4- Rd3d4x Ka4b3- Rd4c4- Kb3b2- Rc4c3- Kb2a2- Rc3e3- Ka2b2- Re3d3- Kb2a2- Rd3c3- Ka2b2- Rc3d3- Kb2a2- Rd3c3- Ka2b2- Rc3c4- Kb2a2- Rc4c3- Ka2b2- Rc3c4- Kb2a2- Rc4c3- Ka2b2- Rc3a3- ,117,invalid_move,*,"[13, 22, 31, 28, -12, -12, -13, -10, -32, -23, -61, -27, -30, -22, -30, -6, -60, 0, -26, 39, 37, 29, 33, 94, 57, 99999, 62, 133, 133, 129, 30, 226, -81, -26, -87, -83, -268, 42, -253, -267, -468, -240, -502, -328, -701, -754, -782, -589, -723, -564, -651, -639, -674, -687, -1050, -749, -99996, -99995, -99995, -776, -821, -641, -745, -917, -860, -1270, -99994, -748, -806, -503, -864, -99986, -99998, -99995, -99995, -99987, -99996, -99988, -99995, -99996, -99996, -99996, -99997, -99995, -99997, -99995, -99997, -99995, -99997, -99995, -99997, -99994, -99995, -99991, -99996, -99997, -99997, -99996, -99996, -99995, -99996, -99997, -99997, -99995, -99996, -99997, -99997, -99996, -99996, 0, -99997, -99996, -99996, 0, -99997, -99995]",14.06060606060606,13.470588235294118
Pe2e4- Pg7g6- Pf2f4- Pd7d6- Pd2d4- Bf8g7- Ng1f3- Ng8f6- Pc2c4- Ke8g8- Nb1c3- Nb8d7- Bc1e3- Pc7c6- Bf1d3- Pe7e5- Pf4e5x Pd6e5x Pd4d5- Pc6d5x Pc4d5x Nd7c5- Qd1e2- Nc5d3$ Qe2d3x Pa7a6- Ra1c1- Bc8g4- Ke1g1- Qd8b6- Kg1h1- Ra8c8- Ph2h3- Bg4f3x Rf1f3x Qb6b2x Rc1c2- Qb2a3- Rc2d2- Rc8c3x Rd2f2- Rf8c8- Qd3d2- Qa3c5- Be3c5x Rc3c5x Rf3f6x Bg7f6x Qd2h6- Rc5c3- Qh6h7$ Kg8f8- Qh7h8+ Kf8e7- Qh8f6$ Ke7d7- Qf6e5x Rc3d3- Qe5b2- Rc8c4- Qb2e5- Rd3d5x Pe4d5x Rc4c5- Qe5d4- Pb7b5- Qd4c5x Pa6a5- Qc5b5$ Kd7d6- Qb5a5x Pf7f5- Qa5b6+ Kd6d5x Qb6g6x Pf5f4- Qg6f5+ Kd5c4- Qf5f4$ Kc4d5- Qf4f5+ Kd5c4- Rf2f4+ Kc4c3- Qf5e4- Kc3b2- Rf4f2+ Kb2c3- Qe4e3+ Kc3c4- Ph3h4- Kc4d5- Ph4h5- Kd5d6- Ph5h6- Kd6d5- Ph6h7- Kd5d6- Qh7h8- Kd6d5- Qh8h5+ Kd5d6- Qh5h6+ Kd6d5- Qh6g6- Kd5c4- Qe3d4+ Kc4b5- Qg6b6+ ,110,checkmate,1-0,"[29, 69, -7, 57, 64, 71, 41, 67, -96, 31, 19, 87, 4, 24, -18, -16, -28, -27, -27, 21, -14, 371, -17, 0, -20, 55, 39, 83, 86, 614, 163, 592, 288, 509, -90, -107, -121, -85, -498, -485, -693, -504, -545, 358, 379, 440, 436, 450, 66, 411, -500, 99984, -581, 741, 761, 804, 617, 99998, 623, 99992, 615, 99995, 781, 99998, 791, 99996, 99997, 99998, 99996, 99997, 1048, 99996, 99996, 99997, 99994, 99995, 99996, 99996, 99995, 99996, 99996, 99996, 99996, 99996, 99997, 99997, 99997, 99999, 99997, 99998, 99997, 99997, 99996, 99996, 99996, 99997, 99996, 99997, 99997, 99998, 99998, 99998, 99998, 99999, 99998, 99998, 99995, 99999, 100000]",9.766666666666667,60.833333333333336
Pe2e3- Pg7g6- Bf1e2- Pe7e6- Pd2d4- Pd7d5- Ng1f3- Pc7c5- Pc2c3- Pc5d4x Pc3d4x Nb8c6- Nb1c3- Bf8g7- Ke1g1- Ng8e7- Pb2b3- Ke8g8- Bc1b2- Pa7a6- Ra1c1- Pb7b5- Rf1e1- Bc8b7- Pe3e4- Pd5e4x Nc3e4x Ne7f5- Ne4g3- Nf5d4x Nf3d4x Nc6d4x Bb2d4x Bg7d4x Qd1d4x Qd8d4x Rc1d1- Qd4b2- Rd1d2- Qb2a2x Re1d1- Qa2b3x Ng3e4- Bb7e4x Be2f3- Be4f3x Pg2f3x Ra8c8- Rd2d7- Rc8d8- Rd7d8x Rf8d8x Rd1d8$ Kg8g7- Rd8d7- Pa6a5- Kg1g2- Pb5b4- Kg2g3- Pa5a4- Ph2h4- Pa4a3- Kg3g4- Pa3a2- Rd7a7- Qb3b1- Pf3f4- Qb1f5+ Kg4f3- Qa2a1- Kf3g3- Qa1c3+ Kg3g2- Qc3c2- Ra7a1- Qc2b2- Ra1f1- Qb2b3- Kg2g1- Qb3b1- Kg1g2- Qb1f1$ Kg2f1x Pb4b3- Kf1e2- Pb3b2- Ke2d2- Qb2b1- Kd2e3- Qb1c2- Ke3d4- Qc2f2$ ,93,invalid_move,*,"[19, 19, 8, 28, 28, 32, 36, 55, 19, 46, 21, 16, 18, 28, 35, 34, 32, 44, 18, 51, 46, 42, 29, 31, -148, -105, -107, -7, -167, -171, -180, -173, -169, -166, -496, -509, -531, -521, -676, 225, -550, -549, -638, -639, -726, -740, -742, -705, -791, -621, -630, -647, -652, -664, -684, -677, -675, -650, -668, -681, -721, -747, -811, -1038, -1136, -746, -924, -1023, -1569, -668, -99998, -99996, -99998, -99996, -99997, -99996, -99997, -99994, -99998, -99991, -99997, -99993, -99994, -99995, -99995, -99996, -99998, -99999, -99999, -99999, -99999, -99998]",88.0,77.77142857142857
Pe2e4- Pe7e6- Pd2d3- Pd7d6- Pc2c4- Pf7f6- Nb1c3- Pg7g6- Bf1e2- Bf8g7- Ng1f3- Ng8e7- Ke1g1- Ke8g8- Bc1e3- Pe6e5- Pd3d4- Pe5d4x Nf3d4x Nb8c6- Nd4c6x Ne7c6x Pf2f4- Bc8e6- Qd1c2- Nc6b4- Qc2b3- Pa7a5- Pa2a3- Nb4c6- Pf4f5- Pg6f5x Pe4f5x Be6f7- Be2d3- Nc6e5- Bd3c2- Ne5g4- Be3d2- Ng4e5- Ra1d1- Qd8d7- Nc3d5- Ne5c6- Bd2c3- Nc6e5- Bc3e5x Pd6e5x Nd5f6$ Bg7f6x Rd1d7x Bf7h5- Rf1e1- Ra8d8- Rd7d8x Rf8d8x Re1e5x Rd8d2- Qb3g3+ Kg8f7- Ph2h3- Bf6e5x Qg3e5x Rd2c2x Qe5d5+ Kf7f6- Qd5b7x Rc2b2x Qb7c7x Rb2g2$ Kg1g2x Bh5d1- Qc7a5x Bd1b3- Qa5c3+ Kf6g5- Qc3b3x Ph7h5- Pc4c5- Ph5h4- Pc5c6- Kg5h5- Pc6c7- Kh5g5- Qc7c8- Kg5f4- Qc8e6- Kf4g5- Qb3c4- Kg5h5- Qe6e5- Kh5h6- Qc4e6+ Kh6h5- Qe5f4- ,96,stalemate,1/2-1/2,"[29, 25, 1, 30, 0, 123, 99, 123, 97, 108, 95, 107, 87, 82, 16, 92, 85, 116, 127, 125, 110, 100, 50, 105, 3, 104, 146, 130, 140, 148, 96, 150, 164, 152, 24, 10, -238, 40, 9, -62, -273, 95, 107, 224, 136, 237, 155, 529, 528, 531, 539, 570, 524, 553, 563, 557, 383, 538, 533, 620, 507, 588, 601, 609, 558, 601, 495, 665, 554, 684, 713, 808, 749, 99978, 99972, 99988, 99989, 99992, 99994, 99996, 99995, 99998, 99996, 99996, 99997, 99997, 99998, 99998, 99999, 99999, 99998, 99999, 99999, 99999, 0]",52.30555555555556,70.10810810810811
Pe2e4- Pe7e6- Pd2d3- Pd7d5- Pf2f4- Pd5e4x Pd3e4x Qd8d1$ Ke1d1x Nb8c6- Pc2c3- Ng8f6- Ng1f3- Nf6e4x Bf1d3- Ne4f6- Rh1e1- Bf8c5- Pg2g4- Nf6g4x Ph2h3- Ng4f2+ Kd1e2- Nf2d3x Ke2d3x Ke8g8- Nf3e5- Nc6e5$ Pf4e5x Pc7c6- Bc1e3- Bc5b6- Nb1d2- Bb6c7- Nd2f3- Pb7b6- Ra1d1- Bc8b7- Kd3c2- Pc6c5- Pb2b4- Bb7f3x Kc2b3- Bf3d1$ Re1d1x Ra8d8- Rd1d8x Rf8d8x Be3f4- Rd8d3- Pb4c5x Pb6c5x Bf4e3- Bc7b6- Be3c5x Bb6c5x Kb3c4- Rd3c3$ Kc4b5- Rc3h3x Kb5c6- Rh3a3- Kc6c5x Ra3a2x Kc5d4- Ra2a3- Kd4e4- Ra3c3- Ke4d4- Rc3c8- Kd4e4- Pa7a5- Ke4d4- Pa5a4- Kd4e4- Pa4a3- Ke4d3- Pa3a2- Kd3d2- Qa2a1- Kd2d3- Qa1e5x Kd3d2- Rc8d8+ Kd2c2- Qe5c7+ Kc2b3- Rd8b8+ Kb3a2- Qc7a7+ ,91,checkmate,0-1,"[29, 48, 2, 6, -16, -14, -8, -3, -5, 0, -28, -23, -153, -147, -338, -124, -127, -104, -279, -274, -393, -387, -395, -389, -386, -388, -405, -388, -385, -309, -310, -237, -286, -282, -300, -286, -335, -339, -387, -369, -531, -522, -617, -620, -618, -571, -583, -578, -616, -627, -618, -622, -752, -622, -678, -683, -703, -546, -986, -921, -99980, -99986, -99987, -99989, -99989, -99989, -99990, -99990, -99990, -99991, -99991, -99992, -99992, -99993, -99993, -99994, -99994, -99995, -99996, -99997, -99997, -99997, -99997, -99997, -99997, -99998, -99998, -99999, -99999, -100000]",64.10344827586206,30.5
Pe2e4- Pc7c5- Pd2d3- Pg7g6- Pc2c3- Bf8g7- Ng1f3- Nb8c6- Bf1e2- Pd7d6- Bc1e3- Ng8f6- Nb1d2- Ke8g8- Ke1g1- Pa7a6- Ph2h3- Pb7b5- Pd3d4- Pc5d4x Nf3d4x Nc6d4x Be3d4x Pe7e5- Bd4e3- Bc8b7- Nd2b3- Ra8c8- Qd1d2- Qd8c7- Ra1c1- Rf8d8- Be3h6- Bg7h8- Bh6g5- Rd8d7- Bg5f6x Bh8f6x Be2g4- Rd7d8- Bg4c8x Rd8c8x Qd2d6x Qc7d6x Rc1d1- Rc8d8- Rd1d6x Rd8d6x Pf2f3- Bb7c8- Kg1f2- Kg8g7- Kf2e3- Rd6d1- Rf1d1x Bc8e6- Rd1d8- Bf6d8x Nb3c5- Bd8b6- ,61,invalid_move,*,"[29, 30, -7, -4, -4, 17, -15, 26, -14, 29, -25, -25, -27, -18, -19, 10, 5, 78, 72, 73, -4, 24, -14, 8, 4, -5, -133, -34, -189, -84, -237, -29, -212, -4, -94, 24, 24, 20, 22, 194, 201, 199, -537, -546, -567, -427, -451, -437, -450, -439, -480, -441, -477, 409, 411, 415, -417, -432, -489, -498]",95.34482758620689,75.83333333333333
Pd2d4- Pd7d5- Nb1c3- Pc7c6- Pf2f3- Ng8f6- Pe2e4- Pd5e4x Pf3e4x Pe7e6- Bc1g5- Bf8e7- Ng1f3- Ke8g8- Bf1d3- Ph7h6- Bg5h4- Nb8d7- Bh4g3- Pe6e5- Pd4e5x Nd7e5x Nf3e5x Qd8b6- Qd1d2- Qb6b2x Ke1g1- Qb2b6+ Kg1h1- Bc8g4- Ra1b1- Qb6d4- Nc3e2- Qd4e5x Bg3e5x Bg4e2x Bd3e2x Nf6e4x Qd2e3- Ne4g5- Be5f4- Rf8e8- Be2d3- Ra8d8- Bf4g5x Be7g5x Qe3a7x Rd8d7- Qa7b8- Bg5e3- Rb1b7x Rd7b7x Bd3c4- Be3f4- Ph2h3- Rb7e7- Qb8f4x Re7e1- Kh1h2- Re1e7- Rf1f3- Re7e1- Qf4d6- Re1e7- Qd6c6x Re7e1- Qc6c5- Re1e7- Rf3g3- Re7e5- Qc5e5x Re8e5x Rg3f3- Re5g5- Rf3f4- Rg5e5- Pa2a4- Re5g5- Pa4a5- Rg5a5x Bc4d3- Ra5a2- Rf4c4- Ra2a3- Kh2g3- Ra3d3$ Pc2d3x Pf7f5- Rc4c5- Pg7g6- Rc5d5- Kg8f7- Rd5d7+ Kf7f6- Rd7d6+ Kf6e5- Rd6d7- Pf5f4+ Kg3f3- Pg6g5- Rd7e7+ Ke5f6- Re7e4- Kf6f5- Re4f4$ Pg5f4x Kf3f2- Kf5e5- Kf2f3- Ke5f5- Kf3f2- Kf5g5- Kf2f3- Kg5f5- Pg2g4+ Kf5g5- Ph3h4+ Kg5h4x Kf3f4x Kh4h3- Pd3d4- Kh3g2- Pd4d5- Kg2f2- Pd5d6- Kf2e2- Pd6d7- ,128,invalid_move,*,"[31, 32, 0, 25, -14, -24, -26, -33, -34, 126, 41, 81, 82, 95, 69, 152, -10, 73, -10, 11, -1, 361, 364, 374, 297, 346, 226, 357, 362, 462, 459, 512, 443, 583, 593, 612, 582, 599, 611, 637, 565, 575, 557, 592, 547, 570, 572, 623, -97, 99999, 575, 99999, -484, 99987, -489, 611, 625, 99993, 692, 99990, 641, 99993, 643, 708, 654, 99994, 688, 719, 719, 846, 573, 542, 538, 547, 538, 539, 543, 558, 505, 518, 479, 483, 474, 99999, 477, 526, 547, 576, 551, 577, 569, 581, 539, 598, 618, 645, 563, 590, 607, 676, 579, 634, 639, 660, 523, 540, 540, 552, 668, 662, 524, 682, 0, 676, 612, 671, 672, 865, 867, 871, 99979, 99986, 99987, 99987, 99988, 99989, 99990]",73.0,66.67857142857143
Pe2e4- Pe7e6- Pd2d3- Pc7c6- Pd3d4- Pd7d5- Pe4e5- Pc6c5- Pc2c3- Nb8c6- Ng1f3- Pc5d4x Pc3d4x Bf8b4+ Nb1c3- Ng8e7- Bc1e3- Ke8g8- Pa2a3- Bb4a5- Pb2b4- Ba5c7- Bf1d3- Ne7f5- Bd3f5x Pe6f5x Ke1g1- Pf5f4- Be3d2- Pf7f6- Pe5f6x Rf8f6x Nf3e5- Nc6e5x Pd4e5x Rf6f8- Nc3d5x Bc8e6- Nd5f4x Qd8d2x Qd1d2x Ra8d8- Qd2c2- Bc7b6- Ra1d1- Rd8d1x Rf1d1x Rf8f4x Pg2g3- Rf4g4- Ph2h3- Rg4g5- Pg3g4- Be6b3- Qc2c8+ Kg8f7- Rd1d7+ Kf7g6- Qc8e8+ Kg6h6- Rd7b7x Bb6f2$ Kg1f2x Bb3d5- Rb7a7x Bd5b3- Qe8f8- Rg5e5x Qf8f4+ Re5g5- Qf4g5$ Kh6g5x Ra7g7$ Kg5f4- Rg7h7x Kf4e4- Rh7h5- Ke4f4- Rh5f5+ Kf4e4- Rf5c5- Ke4d4- Rc5f5- Kd4c3- Pg4g5- Kc3b2- Pg5g6- Kb2a3x Pg6g7- Ka3b4x Qg7g8- Kb4c3- Qg8g3+ Kc3b4- Rf5f4+ Kb4c5- Qg3g4- Bb3c2- Qg4g5+ Kc5b6- Rf4f6+ Kb6c7- Qg5g7+ Kc7b8- Rf6f8+ ,106,checkmate,1-0,"[29, 34, 5, 51, 41, 44, 30, 31, 37, 36, 41, 39, 48, 103, 85, 102, 61, 67, 66, 69, 63, 67, 71, 80, 57, 66, 74, 82, 13, 9, -79, 23, -98, -92, -83, -18, -425, 57, 47, 520, 520, 627, 525, 725, 440, 552, 362, 379, 364, 554, 339, 444, 432, 99993, 99994, 99994, 99994, 99994, 99993, 99993, 691, 825, 875, 99989, 99984, 99995, 99994, 99999, 99997, 99998, 564, 564, 535, 551, 521, 628, 608, 698, 737, 755, 620, 680, 688, 775, 591, 685, 698, 794, 603, 632, 503, 99993, 99995, 99995, 99995, 99995, 99988, 99994, 99995, 99997, 99998, 99998, 99999, 99999, 100000]",0.18421052631578946,6.184210526315789
Pe2e4- Pg7g6- Pd2d3- Pd7d6- Ph2h3- Bf8g7- Ng1f3- Nb8c6- Bf1e2- Pe7e5- Ke1g1- Bc8e6- Nb1c3- Ng8e7- Pa2a3- Pf7f5- Pe4f5x Pg6f5x Nf3h2- Pf5f4- Nh2g4- Qd8d7- Be2f3- Ke8c8- Bf3c6x Ne7c6x Nc3e4- Rd8f8- Pf2f3- Ph7h5- Ng4h2- Nc6d4- Bc1d2- Pd6d5- Ne4c3- Pc7c6- Nc3e2- Nd4e2$ Qd1e2x Bg7f6- Pc2c3- Bf6h4- Pd3d4- Be6f5- Pd4e5x Bf5h3x Pg2h3x Qd7h3x Pe5e6- Rf8f6- Qe2g2- Qh3g2$ Kg1g2x Rh8g8+ Kg2h1- Rg8g3- Rf1f2- Rf6g6- Rf2g2- Rg3g2x ,61,invalid_move,*,"[29, 56, -3, 28, -17, 6, -25, 33, 0, 0, -1, 28, -35, -32, -38, -31, -23, 26, -141, -59, -207, -155, -276, -278, -314, -294, -299, -288, -301, -306, -342, -342, -356, -299, -378, -296, -294, -226, -219, -201, -254, -225, -307, -73, -161, 78, 63, 26, -214, -172, -203, 145, 149, 224, 146, 255, 224, 454, -496, -508]",83.62068965517241,64.1
Pd2d4- Pd7d5- Pe2e3- Pc7c6- Ph2h4- Pe7e6- Ph4h5- Ph7h6- Pf2f4- Ng8f6- Ng1f3- Nf6e4- Bf1d3- Ne4g3- Rh1g1- Ng3f5- Pg2g4- Nf5e7- Nf3h4- Ne7g8- Nh4f3- Ng8f6- Pg4g5- Nf6d7- Pg5h6x Pg7h6x Nf3e5- Nd7e5x Pf4e5x Nb8d7- Pc2c3- Nd7b6- Qd1f3- Bc8d7- Qf3f7$ Ke8f7x Rg1f1+ Kf7e7- Bc1d2- Ke7e8- Bd2c1- Bf8e7- Nb1d2- Pc6c5- Pb2b3- Pc5d4x Pe3d4x Nb6c8- Nd2f3- Bd7c6- Bc1h6x Rh8h6x Rf1g1- Rh6h5x Rg1g7- Rh5h1+ Ke1d2- Rh1a1x Rg7g8+ Ke8d7- Rg8d8$ Be7d8x Bd3b5- Bc6b5x Nf3g5- Bb5c6- Ng5f7- Bd8e7- Nf7h6- Be7g5+ Kd2d3- Bg5h6x Kd3c2- Ra1a2$ Kc2b1- Ra2d2- Kb1c1- Rd2d4$ Kc1c2- Rd4e4- Kc2d3- Re4e5x Pc3c4- Re5e4- Pc4d5x Pe6d5x Kd3c3- Bh6g7+ Kc3d3- Re4d4+ Kd3e3- Rd4e4+ Ke3d3- Re4e6- Kd3c2- Re6d6- Kc2d3- Rd6e6- Kd3c2- Re6e4- Kc2d2- Bg7d4- Kd2d3- Bd4b6- Kd3c2- Pd5d4- Kc2d3- Re4e3+ Kd3c4- Re3c3+ Kc4b4- Bb6a5+ Kb4a5x Pb7b6+ Ka5a6- Ra8b8- Pb3b4- Rc3a3+ ,119,checkmate,0-1,"[31, 32, 21, 31, -27, 4, -39, -37, -27, -28, -20, 4, 12, 59, -70, 99, 83, 144, 42, 104, 106, 129, 7, 186, 82, 169, 0, 8, 10, 170, -12, 134, 150, 154, -452, -452, -472, -473, -535, 99997, -555, 99999, -455, 99999, -472, 99999, -452, 99999, -459, -453, -576, -557, -601, -491, -596, -629, -680, -683, -694, -697, -690, -667, -795, -799, -99991, -760, -815, -793, -99985, -99991, -99992, -99994, -99994, -99995, -99995, -99996, -99997, -99994, -99996, -1085, -99985, -99991, -99992, -99991, -99993, -99994, -99994, -99995, -99995, -99992, -99994, -99995, -99995, -99995, -99995, -99994, -99994, -99995, -99995, 0, -99995, -99995, -99995, -99994, -99994, -99995, -99995, -99995, -99998, -99997, -99997, -99995, -99995, -99995, -99998, -99999, -99999, -100000]",64.96774193548387,67.71875
Pd2d4- Pf7f5- Pc2c4- Pe7e6- Pd4d5- Pe6e5- Nb1c3- Ng8f6- Ng1f3- Bf8c5- Bc1g5- Ke8g8- Bg5f6x Qd8f6x Pe2e3- Pe5e4- Nf3d4- Pf5f4- Nd4b5- Pf4e3x Pf2e3x Qf6h4+ Pg2g3- Qh4g5- Nb5c7x Bc5e3x Nc7a8x Pd7d6- Qd1e2- Bc8g4- Qe2e3x Qg5e3$ Bf1e2- Qe3f2+ Ke1d2- Qf2e2$ Nc3e2x Bg4e2x Kd2e2x Nb8a6- Ra1f1- Rf8a8x Rf1f2- Na6c5- Rh1f1- Nc5d3- Rf2f5- Nd3b2x Rf5g5- Ph7h6- Rg5h5- Pg7g5- Rh5h6x Kg8g7- Rh6h5- Kg7g6- Rh5g5$ Kg6g5x Rf1f7- Ra8e8- Rf7b7x Re8e5- Ph2h4+ Kg5g4- Rb7a7x Nb2c4x Ra7g7+ Kg4h3- Rg7h7- Re5d5x Pa2a4- Rd5a5- Rh7a7- Nc4e5- Ra7h7- Ra5a4x Rh7h6- Ra4c4- Rh6d6x Rc4c2+ Ke2e3- Rc2c3+ Ke3e4x Ne5c4- Rd6d4- Rc3c2- Rd4d3- Nc4e5- Rd3d5- Rc2e2+ Ke4d4- Ne5f3+ Kd4d3- Nf3h4x Pg3h4x Re2h2- Rd5g5- Kh3h4x Rg5g7- Rh2a2- Rg7h7+ Kh4g5- Rh7g7+ Kg5f6- Rg7g4- Ra2a3+ Kd3c4- Ra3a4+ Kc4c3- Kf6f5- Rg4f4+ Kf5e5- Rf4a4x Ke5d5- Ra4a5+ Kd5c6- Ra5c5+ Kc6b6- Rc5b5+ Kb6a6- Rb5b4- Ka6a5- Rb4a4+ Ka5a4x ,125,insufficient_material,1/2-1/2,"[31, 55, 52, 41, -8, 62, -5, 49, 40, 115, -41, -24, -92, -101, -89, -30, -47, 37, -219, -205, -99999, -86, -60, -33, -81, -118, -99998, 41, -229, 276, -99995, -99996, -99996, -530, -550, 282, 315, 389, 386, 373, 392, 393, 349, 415, 425, 441, 384, 406, 185, 244, 134, 383, 408, 413, 159, 146, -276, -284, -375, -249, -332, 380, 303, 321, -224, -221, -224, -260, -432, -469, -904, -412, -845, 491, -453, -480, -576, -404, -409, -394, -460, 13, -2, 11, 1, -15, -18, 22, -18, -3, -12, -29, 3, 82, 0, 0, -3, 0, -5, -3, 0, 0, 0, -10, -2, 0, -437, -460, -99981, 434, -99988, 435, 417, 99981, 99975, 99984, 0, 99993, 0, 99995, 99995, 99995, 0, 0]",43.611111111111114,38.38181818181818
Pg2g4- Pg7g5- Ph2h3- Pe7e5- Pb2b3- Pd7d5- Bc1b2- Pd5d4- Pe2e3- Pc7c5- Pe3d4x Pc5d4x Pd2d3- Nb8c6- Nb1d2- Ng8f6- Nd2e4- Nf6e4x Pd3e4x Bf8b4+ Ke1e2- Ke8g8- Ke2f3- Pf7f5- Bf1c4+ Kg8g7- Pa2a3- Pf5g4$ ,29,invalid_move,*,"[-127, 52, 37, 71, -101, -103, -101, -75, -73, -26, -119, -119, -126, -129, -161, -99, -256, -248, -238, -205, -194, -137, -155, -33, -93, -54, -277, -237]",59.76923076923077,46.214285714285715
Pe2e4- Ph7h5- Ng1f3- Ph5h4- Ph2h3- Pd7d6- Pd2d4- Pc7c6- Bf1c4- Qd8c7- Pc2c3- Nb8d7- Bc1f4- Pe7e5- Pd4e5x Pd6e5x Bf4h2- Bf8c5- Qd1e2- Ng8f6- Nb1d2- Ke8g8- Ke1c1- Nd7b6- Bc4b3- Bc8e6- Kc1b1- Ra8d8- Rh1e1- Nb6d7- Nd2c4- Bc5e7- Nc4e3- Nd7c5- Pc3c4- Nc5b3x Pa2b3x Pa7a5- Ne3f5- Be6f5x Pe4f5x Pa5a4- Nf3e5x Pa4b3x Ne5f3- Qc7a5- Rd1d8x Rf8d8x Qe2e7x Qa5f5$ Kb1a1- Rd8a8+ ,53,invalid_move,*,"[29, 124, 104, 145, 147, 175, 186, 197, 160, 200, 203, 195, 175, 150, 78, 72, 78, 110, 78, 159, 128, 188, 48, 217, 207, 285, 176, 280, 161, 264, 134, 220, 133, 235, 21, 17, -80, 177, 19, 9, 2, 74, -174, -183, -564, -568, -700, -99989, -99998, -99997, -99997, -99996]",2.869565217391304,0.9565217391304348
Pd2d4- Pd7d5- Pc2c4- Pd5c4x Pe2e4- Pe7e6- Bf1c4x Pc7c6- Ng1f3- Ng8f6- Nb1c3- Bf8e7- Ke1g1- Ke8g8- Bc1e3- Nb8d7- Ph2h3- Nf6d5- Bc4d5x Pe6d5x Pe4e5- Pf7f6- Pe5f6x Nd7f6x Nf3e5- Bc8e6- Qd1d2- Qd8c7- Ra1c1- Ra8c8- Nc3e2- Qc7b6- Ne2f4- Be6f7- Nf4d3- Nf6e4- Qd2e2- Pc6c5- Nd3c5x Ne4c5x Pd4c5x Be7c5x Be3c5x Qb6c5x Ne5f7x Rf8f7x Rc1c5x Rc8c5x Pb2b4- Rc5c4- Rf1d1- Pb7b6- Kg1h2- Pa7a6- Pa2a3- Pb6b5- Rd1d5x Rf7c7- Rd5d4- Rc4d4x Pg2g3- Rd4d2- Qe2d2x Rc7c2- Qd2c2x Kg8f7- Qc2c5- Kf7e6- Qc5c6+ Ke6e7- Qc6a6x Ke7f7- Qa6b5x Kf7e6- Qb5c5- Ke6f7- Pb4b5- Pg7g6- Pb5b6- Ph7h6- Pb6b7- Pg6g5- Qb7b8- Kf7g6- Pa3a4- Kg6h5- Pa4a5- Kh5g6- Pa5a6- Kg6f6- Pa6a7- Kf6e6- Qa7a8- Ke6f6- Pg3g4- Kf6e6- Ph3h4- Ke6f6- Ph4g5$ Ph6g5x Pf2f4- Pg5f4x Qb8f4$ Kf6e6- Qa8a6+ Ke6d7- Qf4f5+ Kd7d8- Qa6a5+ Kd8e8- Qc5c6+ Ke8e7- Qf5e5+ Ke7f7- Qc6e6+ Kf7f8- Qa5a8+ ,118,checkmate,1-0,"[31, 32, 34, 47, 38, 79, 55, 140, 149, 146, 123, 134, 135, 180, 109, 150, 118, 438, 34, 107, 0, 1, 0, 7, 1, 8, -11, 14, -17, 37, 1, 19, 17, 48, 49, 81, 66, 247, 213, 205, 214, 377, 394, 522, 8, 517, 519, 507, 514, 499, 486, 574, 526, 592, 548, 570, 569, 99999, 767, 99999, 6, 99999, 568, 715, 765, 828, 755, 774, 762, 773, 779, 821, 827, 853, 864, 866, 99994, 99994, 99995, 99996, 99997, 99997, 99998, 99998, 99998, 99999, 99998, 99998, 99998, 99998, 99998, 99998, 99998, 99998, 99998, 99998, 99998, 99998, 99998, 99998, 99998, 99998, 99998, 99999, 99999, 99999, 99999, 99999, 99999, 99999, 99999, 99999, 99999, 99999, 99999, 99999, 100000]",3.4166666666666665,9.944444444444445
Pd2d4- Pe7e6- Pe2e3- Pg7g6- Bf1d3- Bf8g7- Ng1f3- Ng8e7- Ke1g1- Ke8g8- Pc2c3- Pd7d5- Nb1d2- Pc7c5- Pe3e4- Pc5c4- Bd3c2- Nb8c6- Rf1e1- Pb7b5- Pe4e5- Pa7a5- Pa2a3- Pb5b4- Pa3b4x Pa5b4x Ra1a8x Pb4c3x Pb2c3x Bc8b7- Ra8d8x Rf8d8x Nd2f1- Bb7a6- Nf1g3- Nc6a5- Bc1d2- Na5b3- Bc2b3x Pc4b3x Qd1b3x Ba6c4- Qb3b4- Ne7f5- Ng3f5x Pe6f5x Ph2h3- Ph7h5- Pe5e6- Pf7e6x Re1e6x Rd8b8- Qb4d6- Rb8f8- Qd6f8$ Bg7f8x Re6g6$ Kg8f7- Rg6g5- Bc4d3- Nf3e5+ Kf7e6- Rg5h5x Bf8e7- Rh5h6+ ,66,invalid_move,*,"[31, 34, 17, 42, 39, 33, 31, 62, 26, 58, 28, 22, 21, 21, -39, 107, 107, 138, 147, 156, 160, 163, 111, 261, 263, 472, 443, 549, 533, 586, 585, 586, 584, 606, 583, 583, 570, 600, 598, 601, 598, 621, 577, 611, 627, 683, 628, 651, 819, 942, 743, 99996, 99992, 99992, 580, 576, 574, 674, 583, 647, 673, 99994, 597, 914, 99985]",23.03448275862069,48.53333333333333
Pd2d4- Pd7d5- Pc2c4- Bc8f5- Pc4d5x Qd8d5x Nb1c3- Qd5a5- Bc1f4- Nb8c6- Pe2e3- Ke8c8- Qd1b3- Qa5b6- Bf1c4- Nc6a5- Qb3c2- Pe7e6- Ng1e2- Bf8b4- Ke1g1- Bb4c3x Ne2c3x Na5c4x Pb2b3- Nc4d6- Ra1c1- Ph7h6- Pe3e4- Bf5h7- Pe4e5- Nd6f5- Qc2d2- Nf5d4x Qd2e3- Nd4f5- Qe3b6x Pa7b6x Rf1d1- Bh7g6- Pg2g4- Nf5h4- Rd1d8$ Kc8d8x Rc1d1+ Kd8e7- Bf4g3- Nh4f3+ Kg1g2- Nf3g5- Ph2h4- Ng5e4- Nc3e4x Bg6e4$ Kg2g1- Be4c2- Rd1d2- Bc2e4- Pf2f3- Be4c6- Pa2a4- Pg7g5- Ph4h5- Ng8f6- Pe5f6$ Ke7f6x Rd2d6- Bc6f3x Rd6b6x Bf3g4x Rb6b7x Bg4h5x Rb7c7x Rh8a8- Pa4a5- Ra8a5x Rc7c6- Ra5d5- Kg1f2- Pg5g4- Rc6c4- Rd5d2+ Kf2e3- Rd2e2+ Ke3f4- Re2h2- Bg3h2x Pg4g3- Bh2g3x Bh5g6- Bg3h4+ Kf6g7- Bh4e7- Ph6h5- Rc4c7- Kg7h7- Rc7a7- Ph5h4- Ra7a6- Ph4h3- Ra6a8- Ph3h2- Be7d6- Qh2h1- Ra8h8+ Kh7h8x Bd6e5+ Kh8h7- Be5g7- Qh1e4+ Kf4g5- Qe4f5+ Kg5h4- Kh7g7x Kh4g3- Qf5g5+ Kg3h3- Qg5f5+ Kh3h4- Pe6e5- Kh4g3- Pe5e4- Kg3h4- Pe4e3- Kh4g3- Pe3e2- Kg3g2- ,128,invalid_move,*,"[31, 29, 41, 78, 85, 222, 236, 240, 85, 125, 33, 56, 44, 73, 39, 246, -603, 62, -572, 112, -557, 135, -488, -164, -505, -242, -502, 0, 0, 78, -453, -271, -419, -393, -475, -408, -418, -414, -494, -339, -466, -314, -318, -285, -342, -312, -314, -323, -316, -331, -317, -308, -449, -437, -462, -385, -425, -436, -462, -438, -446, -448, -456, -27, -19, -26, -568, -383, -631, -252, -239, -221, -259, -249, -429, -453, -491, -469, -483, -376, -382, -376, -388, 415, -99999, 376, 421, 447, 416, 496, 492, 478, 403, 570, 440, 99994, 402, 446, 360, 383, 342, 351, -627, -647, -725, -751, -99979, -99981, -99993, -99994, -99998, -99996, -99996, -99995, -99995, -99993, -99997, -99995, -99997, -99995, -99995, -99996, -99997, -99997, -99997, -99997, -99997]",143.33333333333334,125.6923076923077
Pd2d4- Pd7d5- Pe2e3- Pe7e6- Pe3e4- Pc7c5- Pe4d5x Pe6d5x Pd4c5x Bf8c5x Ng1f3- Ng8f6- Bf1e2- Ke8g8- Ke1g1- Nb8c6- Pc2c3- Bc8g4- Bc1g5- Bg4f3x Be2f3x Qd8c7- Nb1d2- Ra8d8- Bg5f6x Pg7f6x Nd2b3- Bc5d6- Qd1c2- Pd5d4- Pc3d4x Nc6d4x Nb3d4x Bd6h2$ Kg1h1- Bh2e5- Nd4f5- Be5b2x Ra1b1- Bb2e5- Pg2g3- Rf8e8- Rf1e1- Pb7b6- Rb1d1- Rd8d1x Re1d1x Qc7c2x Rd1e1- Qc2f5x Bf3e4- Qf5e4$ Re1e4x Pf6f5- Re4a4- Pa7a5- Ra4c4- Pb6b5- Rc4c5- Pa5a4- Rc5b5x Pa4a3- Rb5a5- Re8a8- Ra5e5x Pf5f4- Re5e1- Pf4g3x Pf2g3x Kg8g7- Kh1g2- Kg7f6- Kg2f3- Kf6g5- Kf3e3- Pf7f5- Ke3d4- Ph7h5- Kd4e5- Ph5h4- Ke5e6- Ph4g3x Ke6f7- Pg3g2- Re1g1- Ra8e8- Rg1g2$ Kg5h4- Rg2g1- Re8e6- Rg1h1+ Kh4g4- Rh1g1+ Kg4f3- Rg1f1+ Kf3e3- Rf1e1+ Ke3f4- Re1e6x Kf4g3- Re6g6+ Kg3h4- Rg6g1- Kh4h3- Kf7g7- Kh3h2- Rg1f1- Kh2h3- Rf1f4- Kh3g3- Rf4f3+ Kg3g4- Rf3f4+ Kg4h3- Rf4g4- Kh3h2- Rg4g3- Kh2h1- Rg3h3+ Kh1g1- Rh3g3+ Kg1h1- Rg3h3+ Kh1g1- Rh3h2- Kg1f1- Rh2h1+ ,128,invalid_move,*,"[31, 32, 16, 12, -109, 17, 12, 10, -39, -34, -51, -28, -53, -46, -53, -52, -48, -43, -60, 3, 2, 184, 49, 131, 121, 108, 108, 181, -67, 78, -9, -7, -3, -1, -3, 460, -450, 727, -464, 516, -463, 477, -520, 507, -542, 485, -551, -561, -752, -625, -99994, -501, -505, -508, -515, -520, -514, -464, -480, -448, -448, -442, -482, 464, 1, 1, -17, -10, -236, -3, -244, -1, -3, -1, -535, -3, -288, -236, -1013, -4, -873, -563, -592, -460, -482, 445, 569, 557, -322, 99984, 544, 674, 607, 679, 0, 557, 544, 797, 576, 577, 576, 823, 555, 99977, 21, 99978, 99985, 99986, 99988, 99988, -877, 99980, -918, 99990, -655, 99987, -809, 99989, 554, 99987, 585, 99990, 543, 99988, -963, 824, 544]",169.12727272727273,140.69642857142858
