Move History,Number of Plies,Outcome,Result,Player Scores,ACPL White,ACPL Black
Pd2d3- Pd7d5- Pf2f3- Pb7b6- Pg2g3- Bc8b7- Bf1g2- Pe7e6- Pe2e4- Pd5e4x Pf3e4x Ng8f6- Nb1c3- Pc7c5- Ng1f3- Nb8d7- Ke1g1- Bf8e7- Bc1e3- Ke8g8- Qd1e2- Ra8c8- Ra1d1- Ph7h6- Be3f4- Nf6h7- Pe4e5- Pf7f6- Pe5f6x Nh7f6x Bf4e5- Nd7e5x Nf3e5x Qd8d4+ Kg1h1- Qd4e5x Qe2e5x Pg7g5- Qe5e6$ Kg8h8- Qe6e7x Rc8e8- Qe7c5x Pb6c5x Rf1f6x Rf8f6x Rd1e1- Re8e1$ ,49,checkmate,0-1,"[-1, -17, -132, -45, -71, -57, -73, -66, -63, 2, -5, 5, -3, -2, -11, 43, 53, 50, -6, -4, -27, 21, 18, 19, 21, 60, 62, 132, 130, 299, -39, 133, 69, 87, 90, 510, 539, 687, 668, 708, 641, 650, 341, 479, -20, 382, -99999, -100000]",70.95454545454545,83.21739130434783
Pc2c4- Pg7g6- Pd2d3- Ng8f6- Nb1c3- Bf8g7- Pg2g3- Pc7c6- Bf1g2- Pd7d5- Pc4d5x Pc6d5x Pe2e3- Nb8c6- Ng1e2- Pe7e5- Ke1g1- Bc8e6- Pd3d4- Pe5e4- Pf2f3- Ke8g8- Pf3e4x Pd5e4x Bc1d2- Pa7a6- Nc3a4- Pb7b5- Na4c5- Ra8c8- Nc5e6x Pf7e6x Pa2a3- Nf6d5- Pb2b4- Pa6a5- Pb4a5x Nc6a5x Ne2c3- Nd5f6- Nc3b5x Na5c4- Bd2b4- Nc4e3x Qd1e2- Ne3f1x Ra1f1x Qd8d4$ Kg1h1- Qd4b4x Pa3b4x Rc8c4- Nb5d6- Rc4b4x Nd6e4x Nf6e4x Bg2e4x Rb4e4x Qe2e4x Bg7d4- Qe4e6$ Kg8g7- Qe6d7+ Kg7h6- Rf1f8x Kh6g5- Rf8g8- Kg5h5- Qd7h7$ Kh5g4- Qh7g6$ Kg4f3- Qg6f5+ Kf3e3- Qf5e4+ Ke3d2- Qe4d4$ Kd2c1- Ph2h4- Kc1b1- Ph4h5- Kb1c1- Ph5h6- Kc1b1- Ph6h7- Kb1c1- Qh7h8- Kc1b1- Qd4c5- Kb1a2- Qc5c4+ Ka2b1- Qh8h4- Kb1b2- Qc4b4+ Kb2c2- Qh4c4+ Kc2d1- Qc4d3+ Kd1c1- Qb4d2+ ,102,checkmate,1-0,"[13, 53, 7, 7, 3, 15, 29, 41, -20, -10, -1, 2, -51, -35, -49, -45, -43, -14, -27, -29, -50, 38, 25, 42, -104, 77, -26, -23, -40, 192, 160, 169, 40, 172, 37, 149, 50, 53, -288, 41, 56, 73, 50, 40, -9, -7, -8, 548, -193, 363, 365, 571, 328, 330, 364, 364, 0, 463, 0, 99993, 99994, 99994, 99993, 99995, 99996, 99997, 99987, 99997, 99996, 99996, 99996, 99996, 99995, 99995, 488, 99996, 99997, 99997, 99997, 99997, 99997, 99997, 99997, 99997, 99997, 99997, 99998, 99999, 99998, 99998, 99999, 99999, 99998, 99998, 99998, 99998, 99999, 99999, 99999, 99999, 100000]",107.27586206896552,117.4
Pe2e3- Pe7e6- Pa2a3- Pc7c5- Pb2b4- Pc5b4x Pa3b4x Bf8b4x Pc2c3- Bb4e7- Bc1a3- Pd7d6- Ba3b2- Ng8f6- Pd2d4- Ke8g8- Ng1f3- Pd6d5- Bf1e2- Nb8d7- Ke1g1- Pb7b6- Nb1d2- Bc8b7- Nf3e5- Pa7a6- Be2f3- Nd7e5x Pd4e5x Nf6d7- Pc3c4- Pd5c4x Nd2c4x Nd7c5- Qd1d8x Rf8d8x Ra1d1- Rd8d1x Rf1d1x Bb7f3x Pg2f3x Nc5d3- Bb2d4- Nd3e5x Nc4e5x Be7d6- Ne5c6- Ra8c8- Nc6e7+ Bd6e7x Rd1c1- Be7b4- Rc1c8$ ,54,invalid_move,*,"[19, 19, 0, 20, -77, -72, -68, -72, -87, -84, -113, -90, -129, -127, -135, -142, -144, -147, -151, -141, -149, -135, -158, -158, -180, -177, -196, -178, -178, -135, -141, 225, -118, -6, -28, -4, -237, -220, -246, -240, -238, 314, -16, 242, 242, 304, 236, 240, -219, -218, -608, 573, 577]",0.5384615384615384,0.38461538461538464
Pd2d4- Pc7c6- Bc1f4- Pd7d5- Bf4b8x Ra8b8x Pe2e3- Ng8f6- Nb1c3- Bc8f5- Ng1f3- Pe7e6- Bf1e2- Bf8d6- Ke1g1- Ke8g8- Ph2h3- Ph7h6- Nf3e5- Nf6e4- Nc3e4x Bf5e4x Be2f3- Be4h7- Pc2c3- Pf7f6- Ne5g4- Pf6f5- Ng4e5- Bd6e5x Pd4e5x Qd8g5- Qd1d4- Pb7b6- Pb2b4- Pc6c5- Pb4c5x Pb6c5x Qd4c5x Rb8c8- Qc5a7x Rc8a8- Qa7d4- Ra8a3- Rf1c1- Rf8a8- Pc3c4- Ra3a4- Pc4d5x Ra4d4x Pe3d4x Pe6d5x Rc1c7- Ra8a4- Ra1c1- Qg5d8- Rc7b7- Kg8f8- Rb7b8- Ra4d4x Rb8d8$ Kf8e7- Rd8d5x Rd4d5x Bf3d5x Bh7g8- Rc1c7+ Ke7f8- Bd5g8x Kf8g8x Rc7c8+ Kg8f7- Rc8c7+ Kf7e6- Rc7c6+ Ke6e5x Rc6c5+ Ke5e4- Pa2a4- Ke4d3- Pa4a5- Kd3e2- Pa5a6- Ke2e1- Pa6a7- Ke1e2- Qa7a8- Ke2e1- Qa8f3- Ke1d2- Qf3f5x Kd2e1- Qf5f3- Ke1d2- Qf3d3+ Kd2e1- Qd3f3- Ke1d2- Qf3d1+ ,100,invalid_move,*,"[31, 44, 28, 42, -36, -33, -33, -30, -74, -50, -48, -43, -53, -64, -63, -63, -73, -62, -92, -67, -71, -32, -86, -69, -148, -148, -280, -55, -54, -55, -49, 5, 0, 18, -52, 105, 100, 111, 110, 148, 155, 294, 177, 276, 135, 363, 372, 396, 106, 94, 55, 477, -183, 195, -160, 533, -201, 276, -462, 615, 618, 639, 641, 649, 650, 713, 594, 719, 794, 928, 700, 789, 780, 812, 708, 810, 714, 805, 831, 864, 951, 99991, 99992, 99996, 99997, 99997, 99998, 99998, 99998, 99998, 99998, 99998, 99998, 99998, 543, 99999, 99998, 99998, 585]",10.536585365853659,6.390243902439025
Pe2e3- Pd7d6- Pd2d3- Pc7c6- Pc2c4- Pe7e6- Ng1f3- Ng8f6- Bf1e2- Bf8e7- Ke1g1- Ke8g8- Nb1c3- Pe6e5- Pb2b3- Ph7h6- Bc1b2- Bc8g4- Ph2h3- Bg4h5- Nf3h2- Bh5g6- Be2f3- Nb8d7- Pd3d4- Pe5d4x Pe3d4x Pd6d5- Pc4d5x Pc6d5x Nc3e2- Pa7a6- Ra1c1- Nd7b6- Ne2f4- Nb6d7- Nf4g6x Pf7g6x Nh2g4- Nf6g4x Bf3g4x Nd7f6- Bg4e6+ Kg8h7- Bb2a3- Be7a3x Rc1c2- Ba3b4- Rc2e2- Bb4d6- Pg2g3- Pa6a5- Ph3h4- Nf6e4- Ph4h5- Pg6g5- Pf2f3- Ne4g3x Re2g2- Ng3f1x Qd1f1x Qd8f6- Pf3f4- Pg5f4x Rg2f2- Qf6g5+ Kg1h1- Pf4f3- Rf2f3x Rf8f3x Qf1f3x Ra8f8- Qf3g2- Qg5c1+ Qg2g1- Qc1g1$ Kh1g1x Rf8f6- Kg1g2- Rf6e6x Kg2f3- Re6f6+ Kf3e2- Rf6f4- Ke2d3- Rf4d4$ Kd3d4x Pb7b6- Kd4d5x Bd6a3- Kd5c6- Ba3b4- Kc6b5- Bb4e1- Kb5b6x Be1h4- Kb6a5x Bh4e1+ Ka5b5- Be1h4- Kb5c4- Bh4e1- Kc4d3- Be1f2- Pa2a4- Bf2b6- Pa4a5- Bb6a5x Kd3c4- Ba5b6- Kc4b5- Bb6e3- Pb3b4- Be3b6- Kb5c4- Bb6a7- Kc4b5- Ba7b6- Kb5c4- Bb6a7- Kc4b5- Ba7b6- Kb5c4- Bb6a7- Kc4b5- Ba7b6- Kb5c4- ,128,invalid_move,*,"[19, 30, 0, 3, 1, 31, 39, 34, 16, 25, 32, 27, 24, 29, 12, 18, -3, 19, 4, 47, 1, 1, -32, -17, -21, 15, 8, 123, 111, 116, -62, -21, -43, 9, -4, 108, 94, 97, 99, 230, 6, 15, -54, -41, -515, -500, -520, -503, -498, -446, -453, -409, -395, -391, -406, -288, -507, -545, -550, -524, -567, -544, -692, -556, -708, -588, -636, -678, -742, -635, -667, -710, -99994, -99995, -99995, -517, -517, -500, -713, -730, -752, -764, -807, -841, -848, -504, -521, -494, -510, -513, -516, -487, -539, -524, -577, -441, -497, -201, -230, -149, -164, -2, -239, -77, -17, 32, -454, -455, -449, -454, -468, -460, -513, 442, -530, -460, -597, 467, -603, -462, -631, 501, -607, 0, -629, 512, -636]",33.22950819672131,22.403225806451612
Pc2c4- Pd7d6- Pd2d4- Bc8f5- Pe2e3- Nb8c6- Ng1f3- Pe7e6- Bf1d3- Bf5d3x Qd1d3x Bf8e7- Ke1g1- Ng8f6- Nb1c3- Ke8g8- Ph2h3- Ph7h6- Pe3e4- Pd6d5- Pe4e5- Nf6d7- Pc4d5x Pe6d5x Pa2a3- Pa7a6- Pb2b4- Pb7b5- Bc1b2- Pf7f6- Pe5f6x Nd7f6x Nf3e5- Nc6e5x Pd4e5x Nf6d7- Ra1c1- Nd7e5x Qd3d5$ Qd8d5x Nc3d5x Be7d6- Nd5e3- Ra8d8- Ne3f5- Rf8f5x Bb2e5x Bd6e5x Rc1d1- Rd8d1x Rf1d1x Be5f6- Rd1d7- Pc7c5- Rd7d6- Pc5b4x Pa3b4x Kg8f7- Rd6a6x Bf6c3- Ra6c6- Rf5d5- Rc6c3x Rd5d4- Pg2g3- Rd4b4x Rc3c7+ Kf7g6- Rc7d7- Rb4a4- Kg1g2- Ra4a5- Rd7c7- Ra5a4- Rc7c6+ Kg6h7- Pf2f4- Pb5b4- Kg2f3- Pb4b3- Kf3e3- Pb3b2- Rc6b6- Ra4a1- Pg3g4- Qb2b1- Rb6b1x Ra1b1x Ke3f3- Rb1f1+ Kf3g3- Rf1g1+ Kg3f3- Rg1f1+ Kf3g3- Rf1e1- Kg3h4- Re1f1- Kh4h5- Rf1f4x Ph3h4- Rf4f1- Pg4g5- Rf1g1- Pg5h6x Rg1h1- Ph6g7x Rh1h4$ Kh5h4x Kh7g7x ,111,insufficient_material,1/2-1/2,"[13, 30, 31, 78, 55, 96, 58, 99, 48, 50, 45, 89, 60, 82, 44, 68, 34, 82, 73, 118, 33, 105, 108, 162, 124, 267, 102, 288, 29, 356, 152, 121, 124, 238, 220, 282, 45, 62, 59, 60, 55, 61, -126, 25, -471, -471, -473, -464, -482, -491, -489, -468, -487, -490, -476, -488, -490, -467, -465, -431, -475, 0, 0, 0, 0, -1, 0, 0, 0, 0, 0, 1, 0, 0, 2, 1, 1, 8, 0, 9, -117, 1, 1, 6, -456, -466, -480, -539, -558, -554, -562, -513, -562, -569, -585, -542, -99979, 0, -667, -850, -99999, -826, -858, 0, -99999, -864, -99991, 0, 0, 0]",72.90384615384616,75.62264150943396
Pd2d3- Ng8f6- Pe2e3- Pc7c6- Pd3d4- Pd7d5- Pc2c3- Pe7e6- Bf1d3- Bf8d6- Ng1e2- Ke8g8- Ke1g1- Nb8d7- Pf2f4- Pc6c5- Ne2g3- Pc5c4- Bd3c2- Pb7b5- Nb1d2- Nd7b6- Pe3e4- Bc8d7- Pe4e5- Bd6e7- Nd2f3- Nf6e8- Bc1e3- Pf7f6- Qd1e2- Pf6e5x Pf4e5x Bd7c6- Nf3g5- Be7g5x Be3g5x Qd8c7- Rf1f8$ Kg8f8x Ra1f1+ Kf8g8- Qe2h5- Ph7h6- Bg5h6x Pg7h6x Qh5h6x Ne8g7- Qh6g6- Ra8f8- Qg6g4- Bc6d7- Ng3h5- Rf8f1$ Kg1f1x Nb6c8- Nh5f6+ Kg8f8- Nf6d7$ Qc7d7x Qg4f3+ Qd7f7- Qf3f7$ Kf8f7x Kf1f2- Ng7f5- Bc2f5x Pe6f5x Kf2e3- Pa7a5- Pg2g4- Pf5g4x Ke3f4- Kf7e6- Ph2h4- Ke6d7- Ph4h5- Kd7e6- Kf4g4x Ke6f7- Kg4g5- Kf7g7- Kg5f4- Kg7f7- Ph5h6- Kf7g8- Pe5e6- Nc8e7- Ph6h7+ Kg8h8- Kf4e5- Kh8h7x Ke5d6- Ne7f5+ Kd6d5x Nf5e7+ Kd5d6- Ne7c8+ Kd6d7- Nc8b6+ Kd7c7- Nb6d5+ Kc7b7- Nd5e7- Pd4d5- Ne7g8- Pd5d6- Ng8f6- Pe6e7- Nf6e8- Pd6d7- Ne8f6- Qd7d8- Nf6e8- Qd8e8x Kh7h6- Qe8g6+ Kh6g6x Qe7e8+ Kg6f5- Qe8b5$ Kf5e4- Qb5a5x Ke4d3- Qa5b4- Kd3c2- Qb4c4x ,128,invalid_move,*,"[-1, 0, -25, 7, -17, -10, -40, -16, -21, -14, -42, -27, -47, -23, -33, -21, -21, -16, -24, -25, -38, -16, -37, 415, 393, 401, 191, 189, 149, 215, 51, 250, 269, 507, 448, 517, 156, 714, 652, 698, 635, 633, 489, 99996, 743, 99990, 99991, 99999, 99998, 99999, 0, 99991, 228, 226, 208, 99999, 475, 480, 29, 37, -62, -60, -62, -61, -93, -47, -78, -66, -77, -45, -300, -330, -354, -28, -536, 120, 171, 117, 157, 205, 155, 214, 148, 192, 45, 311, 202, 285, -60, 120, 111, 97, 101, 92, 92, 322, 337, 512, 597, 607, 503, 549, 104, 107, 114, 667, 718, 750, 638, 793, 1071, 1156, 1012, 99995, 99996, 99996, 99979, 99984, 99987, 99988, 99989, 99989, 99990, 99990, 99991, 99991, 99992]",2.5,15.711538461538462
Pd2d3- Pd7d6- Pb2b3- Pc7c6- Bc1b2- Ng8f6- Nb1d2- Pg7g6- Pg2g3- Bf8g7- Bf1g2- Ke8g8- Pf2f3- Nb8d7- Pe2e4- Pe7e5- Ng1e2- Pd6d5- Ke1g1- Pd5e4x Pd3e4x Nd7c5- Pc2c4- Qd8c7- Qd1c2- Pb7b6- Ra1d1- Bc8e6- Nd2b1- Rf8d8- Nb1c3- Nf6d7- Nc3d5- Be6d5x Pc4d5x Pc6d5x Pe4d5x Ra8c8- Pf3f4- Pe5f4x Pg3f4x Bg7b2x Qc2b2x Nd7f6- Ne2d4- Nf6d5x Bg2d5x Rd8d5x Nd4f3- Qc7c6- Qb2d2- Rc8d8- Qd2f2- Rd5d1x Rf1d1x Rd8d1$ Kg1g2- Qc6f3$ Qf2f3x Rd1d2+ Kg2g3- Rd2a2x Qf3e4- Ra2a3- Qe4e7- Nc5e4+ Kg3f3- Ne4d2+ Kf3e2- Nd2b3x Qe7b4- Nb3c5- Qb4a3x Nc5d7- Qa3a7x Nd7f6- Qa7b6x Nf6d5- Qb6c6- Nd5f4$ Ke2f3- Nf4e6- Qc6c8+ Kg8g7- Qc8d7- Ne6g5+ Kf3g2- Ng5e4- Qd7d5- Ne4f6- Qd5e5- Kg7h6- Qe5f6x Kh6h5- Qf6f7x Kh5g5- Qf7h7x Kg5f6- Qh7g6$ Kf6e5- Qg6f5+ Ke5d4- Qf5g4+ Kd4c3- Qg4g3+ Kc3b2- Ph2h4- Kb2a2- Qg3f2+ Ka2b3- Qf2e3+ Kb3a4- Qe3d3- Ka4a5- Qd3c3+ Ka5a4- Ph4h5- Ka4b5- Ph5h6- Kb5a4- Ph6h7- Ka4b5- Qh7h8- Kb5a6- Qh8a8+ Ka6b6- Qa8c6+ ,128,invalid_move,*,"[-1, 17, 22, 4, 2, 0, -3, 4, 5, 5, 6, 7, -89, -56, -64, -44, -63, -71, -68, -16, -36, 94, -231, -123, -121, -32, -37, 32, -27, -41, -107, 29, 17, 61, 65, 66, 66, 112, 34, 247, 80, 156, 61, 463, -21, 119, -220, -224, -409, -27, -537, -349, -601, -600, -649, -648, -673, -17, -9, -11, -508, -18, -716, -18, -63, 190, 0, 49, 0, 400, -132, 373, 396, 442, 451, 638, 471, 728, 431, 450, 466, 480, 464, 488, 422, 473, 412, 573, 428, 659, 717, 99996, 99997, 99997, 99996, 99996, 99986, 99990, 0, 99992, 0, 99992, 99992, 99992, 99992, 99993, 99994, 99994, 99993, 99993, 99993, 99994, 99994, 99994, 99994, 99994, 99995, 99995, 99996, 99996, 99997, 99997, 99998, 99998, 99999, 99999, 99998]",16.630434782608695,2.8260869565217392
Pd2d4- Ng8f6- Pe2e3- Pd7d5- Bf1d3- Pg7g6- Ng1f3- Bf8g7- Ke1g1- Ke8g8- Nb1d2- Pc7c5- Pc2c3- Pc5d4x Pe3d4x Nb8c6- Nf3e5- Pe7e6- Ne5c6x Pb7c6x Nd2f3- Bc8b7- Nf3e5- Ra8c8- Bc1g5- Rf8e8- Bg5f6x Bg7f6x Qd1g4- Bf6g7- Ph2h4- Pc6c5- Ph4h5- Pc5d4x Ph5g6x Ph7g6x Ne5g6x Pf7g6x Qg4g6x Pd4c3x Pb2c3x Rc8c3x Bd3b5- Rc3c8- Ra1d1- Qd8f6- Qg6g4- Re8f8- Qg4h5- Rc8c5- Bb5d3- Bb7c6- Bd3g6- Qf6g6x Qh5g6x Rf8f6- Qg6g4- Bc6d7- Qg4h5- Rf6h6- Qh5f3- Rh6g6- Pg2g3- Bd7b5- Rf1e1- Rc5c4- Re1e2- Rc4g4- Re2e6x Bb5c6- Qf3c3- Bc6a8- Re6g6x Rg4g6x Qc3c8+ Kg8h7- Qc8f5- Ba8b7- Qf5d3- Bb7a6- Qd3a6x Rg6c6- Qa6a7x Rc6c2- Qa7b7- Rc2a2x Qb7d5x Ra2a7- Qd5f5+ Kh7h6- Pg3g4- Ra7a6- Qf5f4+ Kh6g6- Qf4f5+ Kg6h6- Qf5h5+ ,98,checkmate,1-0,"[31, 34, 17, 17, -21, -21, -18, -7, -19, -10, -10, -7, -2, 50, 37, 51, -112, 91, 5, 0, -6, 42, 17, 58, 29, 105, -23, -23, -12, -50, -78, 62, 54, 75, 42, 19, -214, -214, -323, -320, -315, -201, -339, -175, -297, 173, -330, -290, -424, -435, -427, 99996, -300, 367, 381, 387, 332, 412, 362, 375, 304, 455, 346, 350, 353, 467, 300, 425, 439, 637, -470, 606, 627, 632, 636, 646, 559, 639, 469, 541, -259, 99993, 687, 99986, 848, 99991, 670, 99995, 99996, 99996, 99994, 99999, 99995, 99998, 99999, 99999, 100000]",65.6829268292683,87.29268292682927
Pd2d4- Pd7d5- Pa2a3- Pc7c6- Ph2h3- Ng8f6- Ng1f3- Bc8f5- Pe2e3- Pe7e6- Bf1d3- Bf5g6- Bd3g6x Ph7g6x Nb1d2- Bf8d6- Pc2c3- Nb8d7- Pb2b4- Qd8c7- Bc1b2- Pa7a6- Pa3a4- Pb7b5- Pa4a5- Ra8c8- Qd1e2- Ke8g8- Ke1g1- Nf6e4- Nd2e4x Pd5e4x Nf3d2- Pf7f5- Pf2f3- Pe4f3x Nd2f3x Nd7f6- Nf3e5- Bd6e5x Pd4e5x Nf6d5- Qe2d2- Rf8d8- Qd2d4- Rd8d7- Rf1f2- Kg8h7- Ra1f1- Rc8d8- Qd4c5- Qc7c8- Qc5d4- Nd5e3x Rf1e1- Ne3d5- Pc3c4- Nd5e7- Pc4b5x Rd7d4x Bb2d4x Pc6b5x Re1c1- Ne7c6- Rc1c6x Qc8d7- Rc6a6x Qd7b7- Rf2c2- Qb7d5- Ra6b6- Qd5d4$ Kg1h2- Qd4e5$ Kh2g1- Qe5d4+ Kg1h1- Rd8c8- Rb6b5x Qd4a1+ Kh1h2- Qa1d4- Rb5b7- Qd4f4+ Kh2h1- Qf4f1+ Kh1h2- Qf1f4+ Pg2g3- Qf4f2+ Kh2h1- Qf2f1+ Kh1h2- Qf1f2+ Kh2h1- Qf2e1+ Kh1h2- Qe1f2+ Kh2h1- Qf2e1+ Kh1h2- Qe1f2+ Kh2h1- Qf2f3+ Kh1h2- Qf3f2+ ,107,fivefold_repetition,1/2-1/2,"[31, 27, 6, 18, 5, 6, 7, 9, -34, -26, -27, -9, -21, -17, -16, 8, -26, -21, -52, 13, -40, 17, -69, -71, -146, -113, -125, -83, -166, -10, 1, 0, -89, -109, -105, -107, -137, -159, -174, -182, -181, -42, -181, -142, -232, -204, -207, -1, -164, -48, -65, -8, -144, 297, -496, -123, -288, -110, -463, -516, -523, -455, -714, -414, -591, -150, -557, -27, -480, -334, -99985, -99986, -99990, -99991, -99996, -99992, -99994, -53, -704, -99994, -99994, -26, -99996, -99997, -99997, -99996, -99996, -99997, -99998, 517, -99998, -99999, -99999, 541, -99998, -99998, -99999, 543, -99998, -99998, -99999, 538, -99998, -99997, -99998, 552]",99.07894736842105,103.7948717948718
Pe2e4- Pe7e6- Pc2c3- Pb7b6- Bf1c4- Bc8b7- Pd2d3- Pg7g6- Ng1f3- Bf8g7- Ke1g1- Ng8e7- Bc1g5- Ph7h6- Bg5h4- Pg6g5- Bh4g3- Ne7g6- Ph2h3- Ng6f4- Nb1d2- Nf4h3$ Pg2h3x Qd8e7- Nd2b3- Nb8c6- Nb3d2- Ke8c8- Pd3d4- Pf7f5- Pe4f5x Pe6f5x Qd1e2- Pf5f4- Bg3h2- Rd8e8- Qe2e7x Re8e7x Ra1e1- Re7e1x Rf1e1x Nc6a5- Bc4d3- Bb7f3x Nd2f3x Rh8e8- Re1e8$ Kc8b7- Re8e7- Na5c6- Re7g7x Nc6e7- Rg7e7x Pd7d6- Re7e6- Pb6b5- Re6d6x Pc7d6x Bh2f4x Pa7a6- Bf4d6x Kb7b6- Bd6b4- Kb6c6- Nf3e5+ Kc6d5- Ne5g6- Kd5e6- Ng6f4+ Ke6f7- Pd4d5- Kf7f6- Pd5d6- Kf6f7- Bd3e4- Kf7f6- Be4d5- Kf6f5- Bd5b3- Kf5e4- Pf2f3+ Ke4f4x Pd6d7- Kf4e3- Qd7d8- Ke3f4- Qd8e7- Kf4f3x Qe7e6- Kf3f4- Qe6h6x Kf4f3- Qh6g5x Kf3e4- Qg5g3- Ke4f5- Qg3g4+ Kf5f6- Ph3h4- Kf6e5- Ph4h5- Ke5f6- Ph5h6- Kf6e5- Ph6h7- Ke5f6- Qh7h8+ ,108,checkmate,1-0,"[29, 54, 23, 76, -11, -1, 6, 18, 18, 16, 25, 26, -19, -15, -76, -38, -57, -55, -64, 57, 62, 310, 292, 333, 254, 272, 182, 191, 177, 217, 227, 209, 200, 194, 190, 233, 215, 254, 230, 269, 280, 310, 304, 418, 417, 640, 641, 646, 660, 698, 733, 794, 810, 833, 841, 849, 667, 696, 634, 766, 783, 813, 806, 817, 810, 829, 823, 841, 769, 844, 960, 99994, 99995, 99995, 99993, 99996, 99995, 99995, 99994, 99995, 99993, 99994, 99995, 99996, 99997, 99997, 99997, 99998, 99998, 99998, 99997, 99997, 99998, 99998, 99997, 99997, 99997, 99997, 99997, 99997, 99997, 99998, 99997, 99998, 99999, 99999, 100000]",0.7428571428571429,7.114285714285714
Pd2d4- Pd7d5- Pe2e3- Pf7f6- Bf1b5+ Pc7c6- Bb5a4- Pb7b5- Ba4b3- Pe7e6- Pc2c3- Bf8d6- Pa2a4- Ng8e7- Pa4b5x Pc6b5x Ng1f3- Ke8g8- Ra1a6- Nb8a6x Bb3c2- Na6c7- Ke1g1- Ne7f5- Nb1d2- Bc8d7- Nd2b3- Pa7a6- Nb3c5- Bd6c5x Pd4c5x Nc7e8- Pb2b4- Ne8c7- Bc1b2- Nf5e7- Qd1a1- Ne7c6- Rf1d1- Qd8e7- Pe3e4- Pd5e4x Bc2e4x Pf6f5- Be4c6x Bd7c6x Nf3e5- Bc6d5- Pc3c4- Bd5e4- Pc4b5x Pa6b5x Pc5c6- Nc7d5- Qa1a5- Qe7h4- Pg2g3- Qh4h3- Ne5d7- Rf8d8- Nd7c5- Ra8a7- Nc5e4x Pf5e4x Qa5a7x Rd8a8- Qa7a8$ Kg8f7- Qa8b7+ Kf7g6- Pc6c7- Qh3g4- Qb7b5x Ph7h5- Qb5c6- Nd5e7- Qc6e6$ Kg6h7- Qc7c8- Qg4e6x Qc8e6x Ne7g6- Rd1d7- Ph5h4- Rd7g7$ Kh7h8- Rg7g6$ Kh8h7- Qe6f7+ ,90,checkmate,1-0,"[31, 28, 14, 72, 36, 46, 0, 8, -17, 42, -33, 23, -33, 29, 22, 47, 7, 31, -471, -473, -455, -466, -511, -419, -423, -385, -447, -407, -422, -419, -406, -333, -360, -369, -386, -392, -409, -412, -407, -401, -396, -365, -377, -350, -358, -391, -380, -434, -398, -31, -406, -357, -545, -351, -560, -396, -807, -878, -99999, -662, -99999, 444, -491, 511, 149, 99999, 714, 767, 99991, 99993, 645, 718, 183, 600, 0, 99990, -196, 685, 394, 99995, 99996, 99997, 99997, 99998, 99999, 99999, 99999, 99999, 100000]",40.25,23.52777777777778
Pe2e4- Pe7e5- Ph2h4- Pf7f6- Ph4h5- Pd7d6- Ph5h6- Pg7h6x Rh1h6x Bf8h6x Pd2d3- Bh6c1x Qd1c1x Ng8e7- Qc1h6- Rh8g8- Qh6h7x Rg8f8- Qh7h5+ Ne7g6- Nb1c3- Nb8c6- Ng1f3- Bc8e6- Ke1c1- Qd8e7- Bf1e2- Ke8c8- Qh5h7- Rf8h8- Qh7g6x Rd8g8- Qg6h6- Rg8g2x Nf3h4- Rg2g4- Qh6e3- Rg4h4x Rd1g1- Rh4h2- Rg1g3- Qe7h7- Qe3f3- Rh2h1+ Rg3g1- Rh1g1$ Kc1d2- Rg1g8- Pd3d4- Pe5d4x Nc3d5- Be6d5x Pe4d5x Nc6e5- Qf3e4- Pf6f5- Qe4d4x Pc7c5- Qd4c3- Pb7b6- Be2a6+ Kc8b8- Pf2f4- Ne5f3+ Kd2e3- Nf3g1- Qc3b3- Qh7h6- Ke3f2- Rg8g4- Qb3b5- Rg4f4$ Kf2g3- Rf4g4+ Kg3f2- Rg4f4+ Kf2e1- Rf4e4+ Ke1f1- Re4f4+ Kf1g2- Qh6g5+ ,83,checkmate,0-1,"[29, 33, -46, 81, 49, 125, 4, 160, -372, -358, -440, -431, -441, -420, -413, -344, -447, -331, -429, -102, -267, 66, -348, -137, -379, -164, -386, -273, -689, -451, -455, -463, -604, 418, -527, 401, -527, -542, -571, -503, -526, -518, -565, -536, -667, -679, -680, -680, -732, -736, -769, -783, -1006, -679, -99994, -657, -677, -677, -714, -633, -681, -685, -99991, -597, -99994, -729, -99995, -99993, -99996, -99994, -99997, -99995, -99999, -99997, -99997, -99995, -99995, -99996, -99997, -99995, -99999, -100000]",5.096774193548387,3.5483870967741935
Pd2d4- Pc7c5- Pd4c5x Pe7e6- Pe2e4- Bf8c5x Ng1f3- Nb8c6- Bc1g5- Qd8b6- Qd1c1- Ph7h6- Bg5e3- Bc5e3x Qc1e3x Qb6e3$ Pf2e3x Ng8f6- Nb1c3- Ke8g8- Bf1d3- Pe6e5- Ke1c1- Pd7d6- Nc3d5- Nf6d5x Pe4d5x Nc6e7- Pe3e4- Pf7f5- Pe4f5x Ne7f5x Bd3f5x Bc8f5x Nf3d2- Bf5g4- Rd1f1- Rf8f1$ Rh1f1x Bg4e2- Rf1e1- Be2g4- Re1e4- Bg4d7- Nd2c4- Pb7b5- Nc4e3- Pa7a6- Pc2c4- Pb5c4x Ne3c4x Ra8c8- Kc1d2- Bd7b5- Pb2b3- Bb5c4x Pb3c4x Rc8c4x Re4c4x Kg8f7- Rc4c7+ Kf7f6- Rc7c6- Kf6f5- Rc6a6x Kf5e4- Ra6d6x Ke4f5- Rd6d7- Kf5e4- Rd7g7x Ke4f5- Rg7f7+ Kf5e4- Rf7d7- Ke4f5- Rd7e7- Ph6h5- Re7e5$ Kf5g4- Re5e6- Kg4f5- Pd5d6- Kf5g4- Pd6d7- Ph5h4- Qd7d8- Kg4f5- Re6e4- Kf5e4x Qd8h4$ Ke4f5- Qh4e7- Kf5g4- Qe7e4+ Kg4h5- Pa2a4- Kh5g5- Pa4a5- Kg5f6- Pa5a6- Kf6f7- Pa6a7- Kf7g7- Qa7a8- Kg7f6- Qa8a5- Kf6g7- Qe4e6- Kg7f8- Qa5e5- ,112,stalemate,1/2-1/2,"[31, 62, 27, 16, 16, 18, 0, 10, -92, -75, -275, -116, -110, -94, -151, -89, -91, -89, -93, -4, -42, 31, 33, 27, -63, -66, -61, 1, 0, 6, -32, 27, -111, -105, -114, -19, -26, 16, 15, 48, 27, 65, 36, 83, 89, 297, -3, 12, -32, 70, 44, 49, 51, 232, 16, 27, 5, 559, 560, 582, 569, 586, 565, 581, 564, 582, 612, 897, 625, 755, 591, 837, 99987, 99991, 728, 99990, 99990, 99992, 532, 99994, 99991, 99991, 533, 99994, 99996, 99996, 99997, 99998, 99990, 99991, 99992, 99992, 99993, 99997, 99992, 99993, 99993, 99993, 99995, 99995, 99996, 99996, 99997, 99997, 99998, 99998, 99998, 99998, 99998, 99998, 0]",53.891891891891895,69.97368421052632
Pe2e4- Pe7e5- Pc2c3- Pd7d6- Pf2f3- Nb8c6- Pd2d4- Pe5d4x Pc3d4x Ng8f6- Pd4d5- Nc6e5- Nb1c3- Bf8e7- Bc1f4- Ke8g8- Bf4e5x Pd6e5x Qd1c2- Bc8d7- Bf1d3- Bd7b5- Ng1e2- Bb5d3x Qc2d3x Pa7a6- Ke1g1- Pb7b5- Pa2a3- Pc7c5- Pb2b4- Pc5c4- Qd3c2- Ra8c8- Ra1c1- Nf6h5- Pg2g4- Nh5f4- Ne2f4x Pe5f4x Rf1d1- Be7g5- Rd1d3- Qd8f6- Ph2h4- Bg5h4x Kg1g2- Bh4g5- Rc1h1- Ph7h6- Rh1h5- Rc8e8- Qc2d2- Re8e7- Rd3d4- Rf8e8- Rh5h3- Qf6g6- Rh3h5- Bg5f6- ,61,invalid_move,*,"[29, 31, -30, 34, -48, 11, 10, 33, 30, 83, 16, 12, 4, 14, -62, -70, -126, -124, -141, -111, -139, 359, -41, -27, -19, 24, -37, -23, -43, -50, -231, -89, -115, -67, -107, -69, -92, 121, 113, 103, -42, 142, -454, -1, -480, -172, -508, -107, -622, -78, -694, -104, -482, -165, -178, -57, -195, -125, -182, -174]",152.79310344827587,141.63333333333333
Pc2c4- Pe7e6- Pd2d3- Pf7f5- Nb1c3- Ng8f6- Pg2g3- Bf8e7- Bf1g2- Ke8g8- Ng1f3- Pd7d6- Ke1g1- Nb8d7- Pa2a3- Pa7a6- Bc1g5- Pc7c6- Bg5f6x Nd7f6x Pb2b4- Pe6e5- Pb4b5- Pa6b5x Pc4b5x Pc6b5x Nc3b5x Bc8d7- Qd1b3+ Bd7e6- Qb3b2- Qd8a5- Pa3a4- Qa5b6- Nf3g5- Ph7h6- Ng5e6x ,38,invalid_move,*,"[13, 29, 2, 37, 39, 46, 40, 48, 48, 51, 42, 50, 38, 82, 41, 70, 41, 41, -19, -10, -14, -7, -63, -92, -122, 5, 19, 24, 24, 487, 5, 90, 18, 216, 197, 500, 507]",1.6111111111111112,1.2777777777777777
Pd2d4- Pe7e6- Pd4d5- Bf8b4+ Pc2c3- Bb4c5- Pd5e6x Pd7e6x Bc1e3- Bc5e3x Pf2e3x Qd8d1$ Ke1d1x Pf7f6- Ng1f3- Nb8c6- Nb1d2- Bc8d7- Pe3e4- Ke8c8- Pe2e3- Ng8e7- Pe4e5- Pf6e5x Nf3e5x Nc6e5x Kd1c2- Ne7c6- Nd2e4- Ne5g6- Ra1d1- Nc6a5- Bf1e2- Na5c6- Be2f3- Ng6e7- Ne4c5- Ne7d5- Bf3d5x Pe6d5x Nc5d7x Rd8d7x Rh1f1- Nc6e5- Rf1e1- Ne5g6- Re1e2- Rh8e8- Rd1e1- Rd7e7- Pe3e4- Pd5e4x Re2e4x Re7e4x Re1e4x Re8e4x Kc2d3- Re4e7- Kd3d4- Re7d7+ Kd4c4- Rd7d2- Kc4b5- Rd2b2$ Kb5a4- Rb2a2$ Ka4b5- Ra2g2x Pc3c4- Rg2h2x Pc4c5- Pb7b6- Kb5a6- Pb6c5x Ka6b5- Pc5c4- Kb5c4x Rh2h3- Kc4b5- Rh3h4- Kb5c5- Rh4a4- Kc5b5- Ra4a3- Kb5c5- Ra3h3- Kc5b5- Rh3f3- Kb5c5- Rf3f5+ Kc5c4- Rf5a5- Kc4d3- Ra5f5- Kd3e4- Rf5f7- Ke4d3- Rf7f6- Kd3e4- Rf6f5- Ke4d3- Rf5f6- Kd3e4- Rf6b6- Ke4d4- Rb6a6- Kd4e4- Ra6b6- Ke4d4- Rb6a6- Kd4d5- Ra6b6- Kd5c4- Rb6b4+ Kc4d3- Rb4b6- Kd3e3- Rb6c6- Ke3f3- Rc6b6- Kf3g4- Rb6b4+ Kg4g5- Rb4g4+ Kg5h5- Rg4g3- ,127,stalemate,1/2-1/2,"[31, 39, -69, 16, 0, 16, 19, 20, -183, -119, -168, -177, -180, -135, -150, -118, -119, -103, -110, -59, -75, -45, -63, 8, -538, -537, -560, -511, -551, -466, -455, -416, -428, -421, -466, -433, -454, -389, -452, -456, -496, -492, -482, -486, -484, -462, -496, -498, -504, -493, -525, -514, -632, -633, -656, -667, -672, -665, -672, -669, -679, -687, -721, -748, -785, -790, -798, -853, -1092, -99981, -99996, -783, -99997, -848, -99983, -99986, -99989, -99989, -99992, -99993, -99994, -99992, -99993, -99989, -99992, -99990, -99993, -99990, -99992, -99990, -99990, -99989, -99989, -99990, -99990, -99991, -99991, -99991, -99991, -652, -99990, -99991, -99991, -99991, -99991, -99990, -99990, -99991, -99991, -99990, -99991, 0, -99991, -873, -99990, 0, -99991, -99990, -99991, -99991, -99991, -99990, -99994, -99985, -99993, 0]",49.83783783783784,33.18421052631579
Pd2d3- Pd7d5- Pc2c4- Pd5c4x Pd3c4x Qd8d1$ Ke1d1x Ng8f6- Nb1c3- Pe7e6- Bc1g5- Bf8e7- Bg5f6x Be7f6x Ng1f3- Ke8g8- Pe2e3- Nb8c6- Bf1e2- Bc8d7- Kd1c2- Ra8d8- Ra1d1- Pe6e5- Nc3d5- Nc6e7- Nd5f6$ Pg7f6x Pa2a3- Bd7f5+ Be2d3- Bf5g6- Bd3g6x Ne7g6x Rd1d8x Rf8d8x Rh1d1- Rd8d1x Kc2d1x Kg8g7- Kd1e2- Kg7h6- Ke2d3- Ng6e7- Pb2b4- Pc7c6- Pa3a4- Pb7b6- Pb4b5- Pc6b5x Pa4b5x Ne7c8- Kd3e4- Nc8d6+ Ke4d5- Nd6b7- Nf3d2- Nb7c5- Nd2e4- Nc5e4x Kd5e4x Kh6g5- Ke4d5- Kg5g4- Pe3e4- Pf6f5- Pe4f5x Kg4f5x Kd5c6- Kf5f4- Kc6b7- Kf4g4- Kb7a7x Kg4f4- Ka7b6x Kf4f5- Pc4c5- Kf5e6- Pc5c6- Ke6d6- Pc6c7- Kd6d7- Qc7c8+ Kd7c8x Kb6c6- Kc8d8- Kc6d6- Kd8c8- Pb5b6- Kc8b7- Pf2f4- Kb7c8- Pf4e5x Kc8b7- Pe5e6- Pf7e6x Kd6e6x Kb7b6x Pg2g4- Kb6b5- Ph2h4- Kb5c4- Pg4g5- Kc4d4- Ph4h5- Kd4e4- Pg5g6- Ke4f4- Pg6h7x Kf4g5- Qh7h8- Kg5f4- Qh8e5+ Kf4f3- Ke6f5- Kf3g2- Qe5e3- Kg2f1- Qe3d2- Kf1g1- Qd2d1+ Kg1g2- Qd1f3+ Kg2g1- Qf3f2+ Kg1h1- Qf2g2+ ,128,invalid_move,*,"[-1, 5, -50, -42, -100, -107, -117, -64, -69, -21, -60, -42, -109, -109, -126, -50, -106, -65, -62, -86, -98, -11, -32, 50, 52, 56, 32, 31, 14, 46, -376, 17, 11, 66, 44, 39, 10, 6, 5, 10, 4, 83, 28, 167, 148, 169, 96, 231, 186, 183, 192, 262, 278, 277, 293, 295, 299, 320, 331, 395, 385, 424, 440, 497, 217, 437, 292, 318, 357, 462, 543, 615, 637, 722, 746, 776, 777, 813, 817, 836, 848, 931, 722, 734, 487, 514, 503, 541, 504, 547, -431, 715, 740, 761, 678, 653, 654, 665, 631, 682, 587, 574, 560, 550, 539, 536, 538, 99992, 99993, 99993, 99994, 99995, 99995, 99995, 99996, 99996, 99996, 99996, 99997, 99997, 99996, 99996, 531, 99996, 531, 99996, 99979]",1.9074074074074074,5.333333333333333
Pe2e3- Pe7e5- Pg2g3- Pc7c5- Bf1g2- Pd7d5- Pb2b3- Pf7f5- Bc1b2- Ng8f6- Ng1e2- Bf8d6- Pd2d3- Ke8g8- Nb1d2- Nb8c6- Ke1g1- Bc8e6- Pa2a3- Qd8d7- Pc2c4- Pd5d4- Pe3d4x Pe5d4x Nd2f3- Nf6g4- Ph2h3- Ng4e5- Nf3e5x Bd6e5x Pf2f4- Be5d6- Ne2c1- Ra8e8- Nc1e2- Nc6e7- Qd1d2- Ne7g6- Ra1e1- Be6f7- Bb2c1- Re8e3- Ne2d4x Re3e1x Qd2e1x Pc5d4x Qe1d2- Rf8e8- Bc1b2- Pb7b6- Rf1e1- Re8e1$ Qd2e1x Ng6e7- Qe1d2- Ne7c6- Bb2d4x Nc6d4x ,59,invalid_move,*,"[19, 26, -47, 31, 21, 23, -65, 6, -52, 193, -56, -29, -68, -62, -84, -86, -96, -90, -88, -83, -107, -114, -106, -68, -131, 39, 16, 72, 29, 26, -50, -30, -120, -94, -97, -58, -74, -35, -35, -22, -29, -5, -330, -312, -330, -328, -339, -333, -341, -326, -322, -332, -330, -284, -311, -300, -505, -502]",53.142857142857146,33.55172413793103
Pe2e4- Pe7e6- Pd2d4- Pa7a6- Ng1f3- Pc7c5- Pc2c3- Pc5d4x Pc3d4x Nb8c6- Nb1c3- Bf8b4- Bc1d2- Bb4c3x Bd2c3x Ng8e7- Bf1d3- Pd7d5- Pe4e5- Pg7g6- Ke1g1- Ke8g8- Pa2a3- Pb7b5- Pb2b4- Pa6a5- Bc3d2- Pa5b4x Bd2b4x Ne7f5- Bd3f5x Pe6f5x Ra1c1- Bc8e6- Nf3d2- Nc6b4x Pa3b4x Ra8a2- Nd2b3- Qd8b6- Rc1a1- Rf8a8- Ra1a2x Ra8a2x Nb3c5- Be6c8- Qd1c1- Bc8b7- Nc5b7x Qb6b7x Qc1d2- Qb7c7- Rf1c1- Qc7d7- Pg2g3- Qd7e6- Qd2c3- Ra2e2- Rc1e1- Qe6d7- Qc3d2- Re2d2x Re1f1- Rd2d4x Rf1d1- Rd4e4- Kg1g2- Qd7c6- Rd1c1- Re4e5x Rc1c6x Re5e6- Rc6e6x Pf7e6x Kg2f3- Kg8f7- Kf3f4- Kf7f6- Kf4e3- Kf6e5- Ke3d3- Ph7h5- Ph2h4- Pg6g5- Ph4g5x Ke5d6- Kd3d4- Kd6c6- Kd4e5- Pd5d4- Ke5f6- Pe6e5- Kf6g6- Pe5e4- Kg6h5x Pe4e3- Kh5h4- Pe3e2- Pg3g4- Qe2e1- Pg5g6- Qe1f2$ Kh4g5- Qf2g3- Kg5f5x Qg3g4$ Kf5f6- Qg4g6$ Kf6e5- Pd4d3- Ke5d4- Pd3d2- Kd4c3- Qd2d1- Kc3b2- Qg6e4- Kb2c3- Qd1d3+ Kc3b2- Qe4e2+ Kb2c1- Qd3d2+ Kc1b1- Qd2b2+ ,125,checkmate,0-1,"[29, 48, 35, 55, 58, 75, 56, 100, 100, 167, 101, 160, 101, 106, 110, 300, 121, 146, 141, 216, 230, 220, 198, 287, 207, 265, 243, 272, 183, 341, 285, 297, 128, 524, 34, 43, 28, 59, 12, 101, 106, 107, 121, 109, 121, 200, 135, 298, 61, 35, -582, 485, -652, 479, -558, 468, 22, 66, 9, 467, -571, -609, -657, -655, -99993, -670, -682, -696, -99994, -270, -275, -20, -464, -485, -494, -505, -529, -509, -527, -416, -530, -437, -517, -396, -449, -101, -402, 615, 25, 509, -62, 372, -427, -17, -543, -581, -821, -1006, -99988, -99989, -99989, -99990, -99990, -99987, -99991, 520, -99994, -1144, -99995, -99996, -99996, -99997, -99997, -99998, -99998, -99998, -99999, -99998, -99998, -99999, -99999, -99999, -99999, -100000]",204.5,185.3469387755102
