Move History,Number of Plies,Outcome,Result,Player Scores,ACPL White,ACPL Black
Pe2e4- Pc7c5- Pa2a3- Pg7g6- Pb2b4- Bf8g7- Pc2c3- Pd7d5- Bc1b2- Pd5e4x Pd2d4- Pc5d4x Pc3d4x Ng8f6- Nb1c3- Nb8c6- Bf1c4- Qd8d4x Qd1b3- Nc6e5- Bc4b5+ Ke8f8- Ng1e2- Qd4b6- Ke1g1- Bc8e6- Qb3c2- Pa7a6- Bb5a4- Ne5d3- Bb2c1- Ra8c8- Qc2d2- Ph7h5- Qd2e3- Qb6c7- Ne2f4- Nd3f4x Qe3f4x Qc7c3x Ba4b3- Qc3b3x Ra1b1- Qb3b1x Bc1e3- Qb1d3- Qf4c7- Rc8c7x Rf1d1- Qd3d1$ ,51,checkmate,0-1,"[29, 32, -6, -18, -22, -17, -67, -63, -200, -185, -191, -226, -222, -214, -212, -217, -238, -230, -264, -262, -271, -267, -269, -274, -307, -308, -297, -316, -323, -330, -321, -361, -390, -420, -448, -455, -557, -545, -544, -561, -692, -688, -779, -795, -798, -823, -1036, -1081, -99999, -100000]",40.78260869565217,2.7083333333333335
Pa2a3- Pc7c5- Pe2e3- Pd7d5- Pc2c3- Nb8c6- Pd2d4- Pe7e5- Bf1b5- Bc8d7- Pd4e5x Nc6e5x Bb5d7$ Qd8d7x Ng1f3- Ne5f3$ Qd1f3x Ke8c8- Ke1g1- Ng8f6- Rf1d1- Bf8d6- Nb1d2- Qd7e6- Pb2b4- Pc5c4- Pa3a4- Pg7g5- Pb4b5- Pg5g4- Qf3e2- Bd6e5- Pa4a5- Ph7h5- Pa5a6- Pb7b6- Nd2f1- Nf6e4- Rd1d4- Ne4c3x Qe2c2- Be5d4x Pe3d4x Nc3e2+ Kg1h1- Ne2d4x Qc2a4- Nd4b3- Ra1b1- Nb3c5- Qa4c2- Qe6e4- Bc1e3- Qe4c2x Rb1c1- Qc2b2- Rc1d1- Pd5d4- Be3d2- Qb2b5x Bd2f4- Nc5e6- Bf4d2- Pc4c3- Bd2e1- Qb5f1$ ,67,checkmate,0-1,"[-11, 16, 7, -2, -60, -53, -62, -59, -59, -58, -73, -67, -80, -86, -86, -81, -84, -83, -123, -115, -147, -140, -167, -169, -195, -188, -204, -193, -217, -212, -197, -209, -225, -213, -218, -229, -304, -342, -384, -353, -419, -416, -426, -423, -419, -433, -435, -437, -448, -457, -480, -491, -718, -728, -739, -749, -766, -778, -795, -810, -837, -844, -864, -871, -99999, -100000]",27.129032258064516,4.28125
Pe2e4- Pe7e6- Pf2f3- Pd7d5- Pd2d3- Nb8c6- Bc1e3- Ng8f6- Pd3d4- Pd5e4x Pf3e4x Nf6e4x Bf1d3- Pe6e5- Pd4d5- Qd8d5x Pc2c4- Bf8b4+ Nb1d2- Qd5d3x Qd1e2- Qd3e2$ Ng1e2x Bc8e6- Pa2a3- Bb4d2$ Be3d2x Ke8c8- Pb2b4- Rd8d2x Ke1g1- Rd2e2x Rf1f7x Be6f7x Ra1d1- Bf7c4x Rd1e1- Re2e1$ ,39,checkmate,0-1,"[29, 39, -70, -38, -54, -61, -101, -107, -110, -108, -114, -115, -204, -203, -291, -300, -387, -401, -633, -617, -611, -624, -625, -622, -625, -621, -626, -625, -723, -716, -787, -803, -907, -923, -950, -964, -99999, -100000]",57.588235294117645,4.222222222222222
Pd2d4- Ng8f6- Bc1f4- Pc7c5- Pe2e3- Pe7e6- Pc2c3- Pd7d5- Ng1f3- Bf8d6- Nf3e5- Qd8c7- Bf1b5+ Nb8c6- Pa2a4- Pc5c4- Ke1g1- Ke8g8- Bb5c6x Pb7c6x Pf2f3- Nf6h5- Bf4g3- Pf7f6- Ne5g4- Nh5g3x Ph2g3x Pe6e5- Pd4e5x Bd6c5- Pe5f6x Bc8g4x Pf6g7x Bc5e3$ Kg1h1- Rf8f6- Qd1d4- Rf6h6+ ,39,checkmate,0-1,"[31, 35, 16, 25, 26, 15, 22, 24, 21, 16, 7, -17, -18, -23, -41, -66, -73, -78, -76, -86, -226, -246, -296, -276, -279, -257, -246, -262, -311, -323, -371, -407, -677, -788, -99994, -99995, -99999, -100000]",38.5625,3.3529411764705883
Pe2e3- Pc7c5- Ng1e2- Pd7d5- Pf2f3- Pe7e6- Pd2d4- Nb8c6- Pc2c3- Ng8f6- Pg2g3- Bf8e7- Bf1g2- Ke8g8- Ke1g1- Pb7b5- Nb1d2- Qd8b6- Pa2a3- Pa7a5- Rf1e1- Pe6e5- Pd4e5x Nc6e5x Ne2f4- Pc5c4- Nd2f1- Be7c5- Qd1c2- Pg7g5- Nf4e2- Ne5d3- Re1d1- Bc8f5- Qc2d2- Ph7h5- Ne2d4- Bf5g6- Qd2e2- Rf8e8- Pf3f4- Pg5f4x Pg3f4x Bc5d4x Pc3d4x Nd3f4x Qe2f2- Nf4g2x Qf2g2x Re8e4- Qg2f2- Re4g4+ Kg1h1- Bg6e4+ Qf2g2- Rg4g2x ,57,invalid_move,*,"[19, 22, -32, -35, -112, -102, -105, -105, -116, -118, -122, -124, -115, -117, -116, -125, -142, -135, -155, -156, -189, -192, -241, -242, -256, -265, -263, -250, -303, -298, -293, -289, -294, -289, -333, -316, -314, -328, -361, -351, -400, -385, -411, -404, -424, -410, -421, -414, -435, -456, -582, -589, -99995, -99996, -99996, -99997]",26.8,4.5
Pe2e4- Pc7c5- Pf2f4- Pe7e6- Pe4e5- Ng8h6- Ng1f3- Nb8c6- Pd2d3- Nh6f5- Bf1e2- Pd7d5- Ke1g1- Ph7h5- Ph2h3- Pb7b5- Pa2a3- Bf8e7- Nb1c3- Qd8b6- Pd3d4- Pc5d4x Nf3d4x Nc6d4x Qd1d4x Nf5d4x Be2b5$ Nd4b5$ ,29,invalid_move,*,"[29, 20, -8, -8, -37, -47, -37, -37, -44, -43, -46, -58, -70, -75, -114, -112, -112, -129, -139, -145, -389, -368, -527, -542, -627, -601, -715, -708]",56.15384615384615,4.071428571428571
Pe2e4- Pe7e5- Pd2d3- Nb8c6- Pf2f3- Pd7d5- Pc2c3- Bf8c5- Pd3d4- Pe5d4x Pc3d4x Nc6d4x Ng1e2- Qd8h4+ Pg2g3- Nd4f3$ ,17,checkmate,0-1,"[29, 28, -16, -7, -131, -116, -146, -164, -211, -217, -254, -253, -375, -396, -99999, -100000]",67.33333333333333,3.5714285714285716
Pe2e4- Pe7e6- Bf1d3- Pd7d5- Qd1e2- Ng8f6- Pe4e5- Nf6d7- Pf2f4- Nd7c5- Bd3b5+ Pc7c6- Bb5a4- Nc5a4x Pb2b3- Na4c5- Pd2d4- Nc5e4- Ng1f3- Pc6c5- Pd4c5x Bf8c5x Nb1d2- Qd8a5- Bc1b2- Nb8c6- Pc2c3- Ne4c3x Bb2c3x Qa5c3x Ra1c1- Qc3c1$ Qe2d1- Qc1c3- Pa2a4- Qc3e3+ Qd1e2- Qe3f4x Pg2g4- Bc8d7- Ph2h4- Bc5e3- Nd2f1- Be3d4- Nf3d4x Nc6d4x Qe2d3- Ra8c8- Rh1h2- Rc8c1+ ,51,invalid_move,*,"[29, 54, -8, -6, -20, -24, -4, 7, -72, -97, -108, -105, -430, -424, -409, -413, -434, -423, -444, -448, -466, -440, -434, -450, -469, -448, -521, -530, -522, -534, -679, -661, -668, -674, -713, -706, -703, -707, -754, -757, -750, -746, -775, -767, -840, -846, -845, -922, -99991, -99992]",42.73913043478261,5.916666666666667
Pe2e4- Pe7e6- Pd2d4- Pd7d5- Bf1b5+ Pc7c6- Bb5a4- Pd5e4x Pf2f3- Pb7b5- Pf3e4x Qd8h4+ Pg2g3- Qh4e4$ Qd1e2- Qe4e2$ Ng1e2x Pb5a4x Pb2b3- Nb8d7- Pb3a4x Bc8a6- Bc1a3- Bf8a3x Nb1a3x Ng8e7- Na3c4- Ba6c4x Ne2f4- Ke8g8- Ph2h4- Ra8b8- Ph4h5- Ph7h6- Ra1b1- Rb8b1$ Ke1d2- Rb1h1x Nf4e2- Ne7d5- Pc2c3- Rf8b8- Pg3g4- Rb8b2+ ,45,checkmate,0-1,"[29, 36, 39, 43, -10, -17, -94, -75, -132, -152, -420, -412, -566, -508, -524, -510, -500, -510, -525, -533, -579, -557, -599, -571, -556, -552, -619, -619, -623, -626, -636, -629, -638, -637, -814, -834, -854, -881, -99993, -99995, -99995, -99996, -99999, -100000]",56.388888888888886,9.052631578947368
Pe2e4- Pe7e5- Pa2a4- Ng8f6- Ph2h3- Nf6e4x Bf1b5- Pa7a6- Bb5c4- Pd7d5- Bc4d3- Nb8c6- Ng1f3- Bf8c5- Ke1g1- Ne4f2x Qd1e2- Nf2d3$ ,19,invalid_move,*,"[29, 22, -20, -11, -128, -137, -242, -264, -356, -372, -357, -365, -411, -392, -402, -389, -614, -616]",79.625,4.555555555555555
Pd2d4- Ng8f6- Ph2h3- Pd7d5- Pg2g3- Pc7c5- Bf1g2- Pc5d4x Ng1f3- Qd8a5+ Bc1d2- Qa5b6- Nf3d4x Qb6d4x Bd2c3- Qd4d1$ Ke1d1x Nf6e4- Bc3d4- Nb8c6- Bd4e3- Pf7f5- Pf2f3- Ne4g3x Rh1g1- Pg7g6- Nb1c3- Pd5d4- Be3f4- Pd4c3x Pb2c3x Ng3h5- Pe2e4- Nh5f4x Pe4f5x Bc8f5x Ph3h4- Ra8d8+ Kd1c1- Bf8h6- Kc1b2- Rd8d2- Ra1c1- Nf4g2x Rg1g2x Rd2g2x Rc1d1- Rg2c2$ Kb2b3- Rc2h2- Pa2a4- Bf5c2+ Kb3a3- Bc2d1x Pc3c4- Bh6c1+ ,57,checkmate,0-1,"[31, 33, 2, 0, -48, -48, -64, -66, -62, -65, -98, -80, -344, -350, -501, -494, -515, -491, -527, -515, -517, -509, -555, -569, -560, -572, -542, -542, -596, -590, -646, -657, -782, -794, -825, -815, -846, -821, -856, -862, -868, -895, -902, -917, -934, -938, -952, -1004, -1033, -1147, -99993, -99994, -99997, -99998, -99999, -100000]",43.875,4.48
Pe2e4- Pc7c5- Pd2d3- Pg7g6- Pc2c3- Pd7d5- Ph2h3- Nb8c6- Qd1f3- Ng8f6- Bc1g5- Bf8g7- Bg5f6x Pe7f6x Pe4d5x Nc6e5- Qf3e4- Ke8g8- Ng1f3- Bc8f5- Qe4e2- Ne5d3$ Ke1d1- Qd8d5x Nb1d2- Rf8e8- Pb2b3- Re8e2x Bf1e2x Nd3f2$ Kd1e1- Nf2h1x Ke1f1- Nh1g3+ Kf1f2- Ng3e2x Kf2e2x Qd5d3+ Ke2f2- Bg7h6- Ra1e1- Bh6d2x Re1e2- Bd2c3x Re2e3- Bc3d4- Nf3d4x Qd3d4x Kf2f3- Bf5c2- Re3e2- Bc2d1- Kf3g3- Bd1e2x Kg3h2- Qd4f2- Kh2h1- Be2f1- Kh1h2- Qf2g2$ ,61,checkmate,0-1,"[29, 32, -8, 3, -2, -7, -37, -39, -94, -93, -139, -143, -143, -124, -159, -170, -333, -354, -403, -403, -532, -524, -596, -610, -658, -677, -703, -702, -717, -718, -729, -730, -734, -745, -752, -763, -760, -764, -765, -763, -812, -846, -860, -888, -908, -989, -99984, -99991, -99991, -99993, -99994, -99995, -99995, -99996, -99997, -99998, -99998, -99999, -99999, -100000]",37.22727272727273,1.9565217391304348
Pd2d4- Ng8f6- Bc1f4- Pd7d5- Pe2e3- Pc7c5- Pc2c3- Nb8c6- Ng1f3- Qd8b6- Qd1c2- Nf6h5- Bf4g3- Nh5g3x Ph2g3x Pg7g6- Bf1d3- Bf8g7- Nb1d2- Pc5c4- Bd3e2- Bc8f5- Qc2a4- Qb6b2x Ke1g1- Bf5c2- Qa4c2x Qb2c2x Nf3e1- Qc2d2x Ne1f3- Qd2e2x Nf3e1- Ke8g8- Pf2f4- Qe2e3$ Kg1h1- Qe3c3x Ne1f3- Nc6d4x Nf3d4x Qc3d4x Ra1d1- Qd4c5- Rd1c1- Pd5d4- Rf1d1- Qc5h5+ Kh1g1- Pd4d3- Kg1f2- Bg7d4+ Kf2f1- Qh5e2+ ,55,checkmate,0-1,"[31, 41, 29, 21, 17, 13, -1, 2, 7, -1, 0, -10, -33, -39, -32, -32, -47, -47, -35, -31, -32, -30, -301, -305, -326, -334, -487, -500, -633, -652, -668, -666, -696, -685, -826, -833, -839, -853, -855, -856, -870, -872, -900, -909, -932, -981, -99991, -99992, -99992, -99993, -99998, -99999, -99999, -100000]",41.22727272727273,1.391304347826087
Pd2d4- Pd7d5- Pe2e3- Pe7e6- Pf2f3- Bf8d6- Bf1d3- Qd8h4+ Pg2g3- Bd6g3$ Ph2g3x Qh4h1x Ke1f2- Ph7h5- Nb1c3- Ph5h4- Pg3h4x Nb8c6- Ng1e2- Qh1h4$ Kf2f1- Pe6e5- Pd4e5x Bc8h3+ Kf1g1- Nc6e5x Qd1e1- Qh4e1$ Kg1h2- Ne5f3$ ,31,checkmate,0-1,"[31, 35, 18, 12, -38, -48, -76, -78, -183, -186, -321, -304, -366, -357, -382, -397, -408, -400, -547, -544, -543, -530, -99989, -99991, -99991, -99995, -99998, -99999, -99999, -100000]",58.0,4.909090909090909
Ng1f3- Pd7d5- Pe2e3- Ng8f6- Pb2b4- Pe7e5- Bc1b2- Pe5e4- Nf3d4- Bf8b4x Pa2a3- Bb4e7- Pg2g3- Pc7c5- Nd4b5- Nb8c6- Bf1g2- Bc8g4- Ph2h3- Bg4d1x Ke1d1x Pa7a6- Nb5c3- Qd8c7- Nc3e2- Pd5d4- Pe3d4x Pc5d4x Ne2d4x Nc6d4x Bb2d4x Ra8d8- Bd4f6x Be7f6x Pc2c3- Ke8g8- Kd1c2- Bf6d4- Rh1d1- Rf8e8- Bg2e4x Re8e4x Pd2d3- Re4e8- Pc3c4- Qc7a5- Nb1d2- Qa5c3+ Kc2b1- Qc3b2+ ,51,checkmate,0-1,"[32, 25, 14, 17, -19, -7, -115, -125, -115, -111, -176, -166, -240, -231, -349, -346, -347, -351, -610, -618, -615, -627, -613, -617, -626, -615, -637, -647, -629, -651, -635, -634, -709, -687, -667, -670, -680, -685, -697, -676, -741, -749, -744, -739, -965, -99994, -99998, -99999, -99999, -100000]",4.2272727272727275,3.909090909090909
Ng1f3- Pd7d5- Pd2d4- Ng8f6- Ph2h3- Pc7c5- Pd4c5x Pe7e6- Bc1f4- Bf8c5x Pe2e3- Qd8e7- Nb1c3- Ke8g8- Bf1d3- Nb8c6- Pa2a3- Pe6e5- Bf4g3- Pe5e4- Bd3e2- Pe4f3x Be2f3x Pd5d4- Nc3e4- Nf6e4x Bf3e4x Qe7e4x Ke1g1- Pd4e3x Pf2e3x Bc8f5- Rf1f5x Qe4f5x Qd1f3- Qf5f3x Pg2f3x Bc5e3$ Kg1h2- Rf8d8- Ra1f1- Rd8d2+ Kh2h1- Nc6d4- Rf1e1- Nd4e2- Re1e2x Rd2e2x Bg3f4- Be3f4x Pc2c4- Ra8d8- Kh1g1- Rd8d1+ ,55,checkmate,0-1,"[32, 21, 37, 37, 1, 7, -16, 1, -36, -33, -36, -36, -47, -48, -45, -49, -119, -129, -362, -346, -411, -433, -411, -418, -608, -608, -603, -592, -593, -587, -593, -599, -632, -636, -651, -641, -647, -646, -664, -667, -667, -670, -694, -698, -700, -716, -719, -742, -99995, -99996, -99998, -99999, -99999, -100000]",33.73913043478261,2.9166666666666665
Pd2d4- Ng8f6- Pc2c4- Pe7e6- Pa2a3- Pd7d5- Nb1c3- Pd5c4x Pe2e3- Pc7c5- Bf1c4x Pa7a6- Ng1f3- Pb7b5- Bc4a2- Nb8d7- Ke1g1- Bc8b7- Nc3e2- Qd8b8- Pb2b3- Bf8e7- Bc1b2- Ke8g8- Ra1c1- Rf8d8- Pd4c5x Nd7c5x Bb2f6x Rd8d1x Rf1d1x Pg7f6x Ne2g3- Bb7f3x Pg2f3x Pb5b4- Pa3a4- Kg8h8- Rc1c4- Pf6f5- Rd1c1- Nc5d3- Rc1c2- Nd3e5- Rc4c7- Be7d6- Rc7c6- Ne5f3$ Kg1g2- Nf3e1+ Kg2f1- Ne1c2x Ng3h5- Bd6e5- Pf2f4- Qb8d8- Nh5f6- Qd8d3+ Kf1g2- Qd3e2+ Kg2g1- Nc2e3x Nf6d7- Qe2f1+ ,65,checkmate,0-1,"[31, 35, 29, 28, 1, 0, -13, 6, -22, -13, -11, -9, -19, 5, -3, -13, -13, -12, -49, -32, -50, -45, -50, -51, -64, -52, -160, -159, -336, -347, -339, -363, -424, -430, -430, -429, -465, -482, -481, -484, -556, -556, -555, -555, -564, -581, -610, -612, -617, -625, -618, -639, -718, -740, -867, -99991, -99994, -99995, -99995, -99996, -99997, -99998, -99999, -100000]",5.333333333333333,0.7037037037037037
Pd2d4- Pd7d5- Pe2e3- Pe7e6- Qd1e2- Pc7c5- Pc2c3- Ng8f6- Ng1f3- Nb8c6- Pg2g3- Bf8d6- Bf1g2- Ke8g8- Ke1g1- Pb7b6- Ph2h3- Pa7a5- Pa2a4- Bc8a6- Qe2d2- Nf6e4- Qd2c2- Ba6f1x Bg2f1x Ra8c8- Nb1d2- Pf7f5- Nd2e4x Pf5e4x Nf3d2- Qd8f6- Nd2b3- Bd6g3x Nb3d2- Qf6f2$ Kg1h1- Qf2h2+ ,39,checkmate,0-1,"[31, 34, 17, 11, -43, -41, -59, -54, -49, -51, -35, -43, -28, -29, -30, -26, -68, -73, -244, -239, -258, -259, -276, -265, -256, -256, -315, -303, -419, -410, -457, -451, -535, -564, -99998, -99999, -99999, -100000]",40.3125,3.3529411764705883
Pd2d4- Pd7d5- Pe2e4- Pd5e4x Nb1c3- Ng8f6- Qd1e2- Nb8c6- Pf2f3- Nc6d4x Qe2e4x Nf6e4x Pf3e4x Nd4c2$ Ke1f2- Pe7e5- Bf1b5+ Pc7c6- Bb5c4- Qd8d4+ Kf2f3- Qd4c4x Ng1e2- Qc4d3+ Kf3f2- Bf8c5+ Bc1e3- Qd3e3$ Kf2f1- Qe3f2+ ,31,checkmate,0-1,"[31, 36, -54, -50, -54, -47, -183, -171, -209, -232, -646, -644, -672, -663, -653, -641, -689, -683, -742, -734, -813, -830, -99995, -99996, -99996, -99997, -99998, -99999, -99999, -100000]",89.6,5.909090909090909
Ng1f3- Pe7e6- Pd2d4- Pd7d5- Qd1d3- Ng8f6- Pg2g3- Pc7c5- Pc2c3- Pb7b6- Bf1g2- Bf8d6- Ke1g1- Bc8a6- Pc3c4- Ba6c4x Qd3c2- Ke8g8- Pb2b3- Bc4a6- Bc1b2- Nb8c6- Pd4c5x Pb6c5x Pa2a3- Ra8c8- Pb3b4- Pc5b4x Pa3b4x Nc6d4- Bb2d4x Rc8c2x Bd4a7x Ba6e2x Rf1e1- Be2f3x Bg2f3x Bd6b4x Re1d1- Qd8e7- Ba7d4- Bb4c5- Bd4c5x Qe7c5x Nb1d2- Pg7g6- Nd2b3- Qc5f2$ Kg1h1- Qf2h2$ ,51,checkmate,0-1,"[32, 30, 25, 33, -35, -32, -35, -34, -38, -35, -39, -32, -40, -38, -175, -176, -191, -172, -226, -223, -239, -214, -214, -241, -258, -252, -276, -288, -282, -284, -362, -376, -516, -545, -542, -559, -547, -550, -566, -577, -582, -579, -584, -590, -591, -593, -99998, -99999, -99999, -100000]",27.272727272727273,3.4782608695652173
Pe2e4- Pc7c5- Pd2d3- Nb8c6- Pc2c4- Pe7e6- Pf2f4- Pd7d5- Pe4d5x Pe6d5x Pc4d5x Qd8d5x Nb1c3- Qd5d6- Ng1f3- Bf8e7- Bc1e3- Ng8h6- Pg2g3- Nh6g4- Bf1g2- Ng4e3x Qd1e2- Ne3g2$ Qe2g2x Bc8g4- Ke1g1- Bg4f3x Qg2f3x Ke8g8- Ra1e1- Ra8e8- Nc3e4- Qd6d8- Ne4c5x Be7c5$ Kg1g2- Qd8a5- Re1e8x Rf8e8x Rf1e1- Qa5e1x Qf3e4- Re8e4x Pd3e4x Ph7h5- Pe4e5- Qe1e2+ Kg2h3- Bc5e7- Pg3g4- Qe2g4$ ,53,checkmate,0-1,"[29, 33, -19, 0, -5, -25, -28, -49, -109, -98, -121, -134, -121, -134, -129, -107, -143, -148, -182, -176, -550, -543, -556, -532, -538, -537, -563, -545, -523, -515, -487, -489, -508, -485, -599, -598, -590, -582, -614, -622, -850, -1214, -99995, -99996, -99996, -99997, -99997, -99998, -99998, -99999, -99999, -100000]",51.25,7.238095238095238
Pf2f4- Ng8f6- Pc2c4- Pe7e6- Pe2e4- Nf6e4x Pd2d3- Qd8h4+ Pg2g3- Ne4g3x Ng1f3- Qh4h5- Ph2g3x Qh5h1x Nb1c3- Pb7b6- Bc1e3- Bc8b7- Qd1e2- Qh1f3x Qe2f3x Bb7f3x Ke1f2- Bf3b7- Ra1e1- Nb8a6- Bf1g2- Ke8c8- Bg2b7$ Kc8b7x Nc3b5- Pc7c6- Nb5d4- Na6b4- Pa2a3- Nb4d3$ Kf2e2- Nd3b2x Nd4f3- Nb2c4x Be3d4- Pf7f6- Re1c1- Nc4a3x Rc1a1- Na3b5- Ra1a7$ Nb5a7x Bd4b6x Kb7b6x Nf3d4- Na7b5- Nd4b5x Pc6b5x Ke2d3- Bf8a3- Kd3c2- Pb5b4- Kc2b3- Rd8c8- Kb3a2- Rc8c3- Ka2b1- Pb4b3- Kb1a1- Rc3c1+ ,67,checkmate,0-1,"[-26, -28, -33, -22, -146, -148, -273, -278, -286, -280, -282, -289, -288, -275, -281, -291, -321, -297, -513, -525, -523, -521, -525, -517, -549, -545, -563, -557, -589, -592, -614, -614, -614, -608, -669, -670, -669, -666, -677, -676, -708, -699, -739, -729, -735, -736, -787, -801, -841, -848, -876, -882, -1017, -1094, -1142, -99990, -99991, -99992, -99995, -99996, -99996, -99997, -99998, -99999, -99999, -100000]",5.444444444444445,0.14814814814814814
Pc2c3- Pe7e5- Qd1b3- Nb8c6- Pg2g3- Ng8f6- Bf1g2- Bf8c5- Qb3c4- Bc5b6- Pd2d3- Pd7d5- Qc4b3- Ke8g8- Bc1g5- Bb6f2$ Ke1f2x Nf6g4+ Kf2f3- Qd8g5x Ph2h3- Qg5e3+ ,23,checkmate,0-1,"[11, 21, -50, -51, -70, -101, -87, -92, -112, -122, -157, -157, -184, -187, -312, -339, -304, -328, -99997, -99998, -99999, -100000]",37.125,1.1111111111111112
Pe2e3- Pe7e5- Qd1f3- Pd7d5- Qf3d5x Qd8d5x Pf2f3- Qd5a5- Pc2c3- Pc7c6- Pb2b4- Qa5c7- Pa2a4- Pa7a5- Pb4a5x Ng8f6- Pa5a6- Nb8a6x Bf1a6x Ra8a6x Ng1e2- Ph7h5- Ke1g1- Bc8e6- Pd2d4- Be6c4- Rf1f2- Ra6a8- Bc1a3- Nf6d5- Ba3f8x Ke8f8x Pe3e4- Nd5e7- Pd4e5x Bc4e2x Rf2e2x Qc7e5x Pf3f4- Qe5c5+ Kg1f1- Ne7g6- Pe4e5- Ng6f4x Re2e1- Qc5d5- Re1d1- Qd5g2$ Kf1e1- Qg2e2+ ,51,checkmate,0-1,"[19, 22, -80, -87, -577, -571, -628, -612, -620, -616, -621, -623, -645, -627, -625, -626, -642, -637, -648, -639, -632, -636, -634, -626, -643, -615, -624, -625, -630, -612, -601, -607, -608, -586, -595, -592, -595, -601, -609, -629, -627, -644, -659, -664, -99990, -99992, -99998, -99999, -99999, -100000]",37.04761904761905,6.363636363636363
Pe2e4- Pe7e5- Pa2a4- Ng8f6- Pa4a5- Nf6e4x Pa5a6- Bf8c5- Pa6b7x Bc5f2$ Ke1e2- Bc8b7x Ke2f3- Qd8h4- Pg2g3- Ne4g3$ Kf3f2x Ng3h1$ Kf2e2- Qh4e4+ ,21,checkmate,0-1,"[29, 36, -24, -7, -131, -139, -250, -256, -357, -321, -312, -321, -990, -99991, -99997, -99998, -99998, -99999, -99999, -100000]",3.8333333333333335,1.5
Pc2c4- Pe7e5- Pa2a3- Ng8f6- Pb2b4- Pc7c5- Pb4b5- Bf8e7- Bc1b2- Pa7a6- Pe2e3- Pa6b5x Pc4b5x Pe5e4- Bb2f6x Be7f6x Nb1c3- Pd7d5- Ng1e2- Bf6e5- Ra1b1- Ra8a3x Pg2g3- Bc8e6- Bf1g2- Nb8d7- Ke1g1- Ke8g8- Pf2f4- Be5c3x Ne2c3x Pf7f5- Pd2d3- Ra3c3x Pd3e4x Pf5e4x Qd1d4- Pc5d4x Pe3d4x Qd8f6- Rf1e1- Qf6d4$ Kg1h1- Be6f7- Rb1c1- Rc3c1x Re1c1x Qd4d2- Rc1f1- Pe4e3- Bg2d5x Bf7d5$ Kh1g1- Qd2g2+ ,55,checkmate,0-1,"[13, 19, 1, 5, -20, -13, -26, -30, -30, -40, -89, -76, -76, -82, -151, -182, -193, -189, -208, -197, -232, -229, -233, -241, -224, -222, -214, -236, -243, -242, -232, -232, -487, -492, -510, -498, -710, -726, -742, -746, -788, -807, -804, -819, -873, -905, -906, -931, -961, -988, -99997, -99998, -99999, -100000]",36.583333333333336,2.52
Pe2e3- Pe7e5- Pc2c3- Pd7d5- Pa2a4- Ng8f6- Ph2h3- Bf8d6- Pa4a5- Pa7a6- Pb2b4- Qd8e7- Ng1f3- Nb8c6- Pb4b5- Pa6b5x Bf1b5x Ke8g8- Nb1a3- Ra8a5x Bb5c6x Pb7c6x Pd2d4- Pe5d4x Nf3d4x Bc8d7- Ke1g1- Ra5a3x Bc1a3x Bd6a3x Nd4f5- Bd7f5x Ra1a3x Qe7a3x Pc3c4- Pd5c4x Qd1c1- Qa3b4- Qc1c4x Qb4c4x Rf1c1- Qc4c1$ Kg1h2- Nf6h5- Pg2g4- Qc1f1- Pg4f5x Qf1f2$ Kh2h1- Nh5g3+ ,51,checkmate,0-1,"[19, 21, -35, -30, -75, -83, -100, -113, -116, -114, -151, -146, -145, -152, -215, -194, -194, -188, -355, -370, -387, -373, -427, -431, -410, -419, -446, -451, -454, -457, -591, -590, -596, -604, -621, -636, -660, -653, -770, -865, -99994, -99995, -99996, -99997, -99997, -99998, -99998, -99999, -99999, -100000]",41.421052631578945,3.15
Pe2e3- Pg7g6- Pd2d3- Bf8g7- Pc2c3- Pd7d5- Pb2b3- Pe7e5- Bc1b2- Nb8c6- Pg2g3- Ng8f6- Bf1g2- Bc8f5- Ng1f3- Pe5e4- Pd3e4x Pd5e4x Nf3d4- Nc6e5- Nd4f5x Ne5d3+ Ke1f1- Pg6f5x Qd1c2- Nd3b2x Qc2b2x Qd8d1+ ,29,checkmate,0-1,"[19, 10, -33, -21, -40, -47, -71, -72, -67, -68, -110, -118, -142, -149, -165, -157, -186, -178, -171, -174, -248, -241, -377, -384, -505, -508, -99999, -100000]",44.0,2.6923076923076925
Pe2e4- Pc7c5- Pd2d3- Nb8c6- Bf1e2- Pg7g6- Ng1f3- Bf8g7- Ke1g1- Ng8f6- Nb1c3- Pd7d5- Pe4d5x Nf6d5x Nc3d5x Qd8d5x Nf3d2- Bc8e6- Nd2f3- Ra8d8- Pc2c4- Qd5d7- Bc1f4- Bg7b2x Ra1b1- Bb2g7- Pd3d4- Pc5d4x Nf3d4x Nc6d4x Qd1d4x Bg7d4x Rb1b7x Qd7b7x Be2f3- Qb7b6- Bf3e4- Be6c4x Rf1e1- Bd4f2$ Kg1h1- Bf2e1x Bf4e3- Qb6e3x Be4c6+ Ke8f8- Bc6f3- Be1h4- Pg2g3- Qe3f3$ Kh1g1- Qf3f1+ ,53,checkmate,0-1,"[30, 35, -15, 3, -6, -5, -22, -22, -14, -21, -29, -33, -40, -48, -48, -43, -58, -53, -72, -55, -135, -147, -227, -200, -180, -188, -275, -270, -525, -514, -577, -578, -749, -760, -760, -750, -785, -824, -1116, -99989, -99992, -99993, -99995, -99996, -99996, -99997, -99997, -99998, -99998, -99999, -99999, -100000]",4.7368421052631575,1.4736842105263157
Pe2e4- Pe7e6- Pd2d3- Pc7c5- Nb1c3- Pd7d5- Pe4d5x Pe6d5x Bc1f4- Nb8c6- Nc3b5- Qd8a5+ Nb5c3- Pd5d4- Bf4d2- Pd4c3x Bd2c3x Qa5c7- Ng1f3- Ng8f6- Bc3f6x Pg7f6x Bf1e2- Bc8e6- Ke1g1- Ke8c8- Pc2c3- Kc8b8- Qd1b3- Be6b3x Pa2b3x Bf8d6- Pc3c4- Pa7a5- Ra1a5x Qc7a5x Rf1a1- Qa5a1$ Be2f1- Bd6c7- Pg2g3- Rd8d3x Ph2h4- Rd3f3x Kg1g2- Qa1e1- Pb3b4- Qe1f2$ Kg2h3- Rf3g3$ ,51,checkmate,0-1,"[29, 39, -5, 7, -10, -7, -3, 2, -49, -54, -398, -370, -378, -380, -376, -378, -369, -369, -403, -404, -450, -426, -481, -458, -457, -454, -448, -448, -583, -575, -577, -570, -641, -645, -734, -747, -939, -975, -1003, -1017, -1077, -1116, -99994, -99995, -99995, -99996, -99997, -99998, -99999, -100000]",58.8,5.857142857142857
Pd2d4- Ng8f6- Bc1f4- Pd7d5- Pa2a3- Pc7c5- Pc2c3- Qd8b6- Qd1c2- Pc5d4x Pc3d4x Nb8c6- Pe2e3- Bc8f5- Qc2b3- Qb6b3x Nb1d2- Qb3b2x Ng1f3- Qb2a1$ Ke1e2- Bf5c2- Nf3e5- Qa1d1+ ,25,checkmate,0-1,"[31, 35, 17, 21, -2, -3, -41, -39, -122, -119, -96, -81, -96, -83, -624, -673, -672, -696, -99994, -99995, -99996, -99997, -99999, -100000]",89.75,4.555555555555555
Pd2d4- Pd7d5- Ph2h3- Pc7c5- Pd4c5x Ng8f6- Ng1f3- Pe7e6- Nb1c3- Bf8c5x Bc1g5- Qd8b6- Pe2e3- Qb6b2x Bf1b5+ Ke8f8- Bg5f6x Pg7f6x Ke1g1- Qb2c3x Nf3d4- Pa7a6- Bb5d3- Ph7h5- Nd4f3- Bc5e7- Ra1c1- Bc8d7- Nf3d4- Nb8c6- Nd4c6x Bd7c6x Rc1b1- Pf6f5- Bd3e2- Ph5h4- Pe3e4- Pd5e4x Qd1d4- Qc3d4x Rb1d1- Qd4g7- Be2h5- Rh8g8- Bh5e2- Qg7g2$ ,47,checkmate,0-1,"[31, 35, -5, 3, -17, -15, -16, -8, -49, -52, -134, -128, -141, -141, -329, -342, -352, -353, -357, -367, -417, -408, -429, -431, -495, -487, -494, -485, -537, -514, -562, -548, -539, -550, -542, -539, -596, -603, -844, -876, -900, -944, -1032, -1214, -99999, -100000]",50.04761904761905,4.2727272727272725
Ng1f3- Pd7d5- Pe2e3- Pe7e6- Pa2a4- Ng8f6- Pa4a5- Pc7c5- Nb1c3- Pa7a6- Pd2d4- Nb8c6- Bf1d3- Pc5c4- Bd3e2- Nc6a5x Ke1g1- Pb7b5- Pb2b3- Bc8b7- Pb3c4x Na5c4x Be2c4x Pd5c4x Bc1a3- Bf8a3x Ra1a3x Pb5b4- Ra3a4- Pb4c3x Ra4c4x Ra8c8- Rc4c3x Rc8c3x Qd1d2- Nf6e4- Qd2d1- Ke8g8- Nf3e5- Ne4d6- Ne5f3- Rc3c8- Pc2c4- Nd6c4x Qd1a4- Bb7f3x Pg2f3x Qd8g5+ Kg1h1- Nc4d2- Rf1g1- Qg5h5- Pf3f4- Qh5f3+ Rg1g2- Rc8c1+ Qa4d1- Rc1d1$ ,59,checkmate,0-1,"[29, 35, 16, 12, -17, -20, -45, -51, -78, -66, -71, -78, -138, -119, -118, -123, -115, -123, -192, -185, -267, -248, -285, -267, -408, -419, -412, -422, -422, -423, -423, -428, -543, -556, -584, -581, -587, -591, -591, -590, -626, -613, -634, -647, -672, -698, -690, -696, -699, -709, -737, -824, -99997, -99998, -99998, -99999, -99999, -100000]",30.24,3.769230769230769
Pe2e4- Pc7c5- Pc2c3- Pd7d5- Ng1f3- Pd5e4x Nf3e5- Nb8d7- Qd1a4- Ng8f6- Ne5d7x Bc8d7x Qa4c4- Ra8c8- Pd2d3- Pb7b5- Qc4b3- Pe4d3x Bf1d3x Pc5c4- Bd3c2- Pc4b3x Pa2b3x Qd8c7- Bc1e3- Nf6g4- Pf2f3- Ng4e3x Ke1e2- Ne3c2x Ke2d1- Nc2a1x Kd1d2- Na1b3$ Kd2d3- Qc7c4+ Kd3e3- Pe7e5- Nb1d2- Bf8c5+ ,41,checkmate,0-1,"[29, 33, 38, 33, -47, -30, -85, -95, -111, -124, -239, -210, -240, -256, -286, -296, -302, -307, -534, -535, -626, -603, -602, -620, -614, -629, -808, -818, -866, -888, -965, -1006, -1057, -1098, -99992, -99994, -99994, -99995, -99999, -100000]",62.8125,4.294117647058823
Pf2f4- Ng8f6- Pg2g4- Nf6g4x Ph2h4- Pe7e5- Pe2e4- Pd7d5- Pd2d3- Bf8e7- Pf4e5x Be7h4$ Ke1d2- Pd5e4x Kd2e2- Qd8d4- Qd1d2- Qd4f2+ Ke2d1- Qf2f1$ Qd2e1- Qf1e1$ ,23,checkmate,0-1,"[-26, -30, -191, -187, -294, -274, -332, -325, -350, -341, -472, -448, -492, -528, -765, -763, -99997, -99998, -99998, -99999, -99999, -100000]",109.0,8.25
Pe2e4- Pc7c5- Nb1c3- Pe7e6- Pd2d3- Pd7d5- Pe4d5x Pe6d5x Ng1f3- Ng8f6- Bc1g5- Bc8e6- Bf1e2- Ph7h6- Bg5h4- Nb8c6- Ke1g1- Pd5d4- Nc3e4- Pg7g5- Ne4f6$ Qd8f6x Bh4g3- Pg5g4- Nf3d2- Ph6h5- Nd2e4- Qf6g6- Pc2c3- Ph5h4- Bg3f4- Ke8c8- Ne4c5x Bf8c5x Pc3d4x Bc5d6- Bf4d6x Rd8d6x Be2g4x Be6g4x Qd1g4$ Qg6g4x Pf2f3- Qg4d4$ Kg1h1- Rh8g8- Ra1d1- Qd4b2x Rd1b1- Qb2g2$ ,51,checkmate,0-1,"[29, 33, 28, 38, -1, -7, -3, -10, -26, -17, -28, -37, -41, -33, -30, -42, -44, -48, -37, -40, -70, -71, -61, -56, -97, -11, -116, -119, -123, -121, -174, -170, -430, -415, -452, -466, -485, -475, -577, -603, -736, -754, -779, -782, -802, -850, -99991, -99992, -99999, -100000]",41.18181818181818,6.6521739130434785
Pc2c4- Pe7e5- Pa2a3- Ng8f6- Pe2e3- Pc7c5- Ph2h3- Nb8c6- Pb2b3- Pd7d5- Bc1b2- Pd5d4- Pe3e4- Nf6e4x Qd1f3- Pf7f5- Bf1d3- Ne4g5- Qf3e2- Pe5e4- Bd3c2- Pd4d3- Bc2d3x Qd8d3x Qe2d3x Pe4d3x Ph3h4- Ng5e4- Ng1f3- Bf8d6- Nf3g5- Ke8g8- Ng5e4x Pf5e4x Ke1g1- Nc6d4- Bb2d4x Pc5d4x Pb3b4- Bc8g4- Nb1c3- Pd4c3x Pd2c3x Pd3d2- Ra1d1- Bd6f4- Pg2g3- Bf4h6- Rd1d2x Bh6d2x Rf1d1- Bg4d1x Pc4c5- Pe4e3- Pf2e3x Bd2e3$ Kg1g2- Bd1g4- Pc3c4- Rf8f2+ Kg2g1- Rf2e2+ Kg1f1- Ra8f8+ ,65,checkmate,0-1,"[13, 18, -5, -4, -9, -5, -47, -43, -45, -39, -129, -141, -246, -257, -350, -325, -445, -430, -482, -509, -502, -480, -482, -489, -481, -481, -488, -475, -487, -457, -528, -529, -553, -541, -562, -566, -572, -567, -572, -571, -676, -685, -702, -715, -717, -733, -730, -741, -769, -784, -852, -99992, -99994, -99995, -99995, -99996, -99996, -99997, -99997, -99998, -99998, -99999, -99999, -100000]",5.04,0.72
Pe2e4- Pe7e5- Pb2b4- Bf8b4x Pc2c3- Bb4a5- Pa2a4- Ng8f6- Ph2h3- Nb8c6- Ng1f3- Nf6e4x Qd1e2- Pd7d5- Pd2d3- Ne4c3x Nb1c3x Ba5c3$ Bc1d2- Bc3a1x Bd2c3- Ba1c3$ Qe2d2- Bc3d2$ Ke1d2x Pe5e4- Pd3e4x Pd5e4$ Kd2e3- Pe4f3x Pg2f3x Bc8f5- Bf1b5- Qd8e7+ Ke3f4- Qe7e5+ Kf4g5- Pf7f6+ Kg5h4- Qe5f4+ Kh4h5- Bf5g6+ ,43,checkmate,0-1,"[29, 28, -149, -138, -130, -148, -199, -196, -266, -276, -278, -265, -380, -379, -582, -587, -602, -616, -624, -622, -803, -808, -885, -907, -936, -950, -992, -1018, -1042, -1088, -99993, -99995, -99995, -99996, -99996, -99997, -99997, -99998, -99998, -99999, -99999, -100000]",71.0,2.0
Pe2e4- Pe7e6- Pf2f4- Pd7d5- Pe4e5- Pc7c5- Ng1f3- Bc8d7- Pd2d4- Nb8c6- Pc2c3- Ng8h6- Bf1b5- Qd8b6- Pa2a4- Pa7a6- Bb5c6x Pb7c6x Pa4a5- Qb6a7- Pb2b4- Pc5b4x Pc3b4x Bf8b4$ Bc1d2- Ra8b8- Qd1c2- Nh6f5- Ke1g1- Nf5d4x Nf3d4x Qa7d4$ Kg1h1- Qd4a1x Qc2c6x Bd7c6x Nb1c3- Qa1f1$ ,39,checkmate,0-1,"[30, 48, -17, -13, -33, -11, -13, -11, -22, -15, -19, -12, -72, -101, -117, -106, -108, -112, -109, -101, -214, -219, -245, -251, -245, -244, -261, -267, -401, -411, -445, -486, -508, -504, -784, -812, -99999, -100000]",47.411764705882355,4.666666666666667
Pc2c4- Pe7e5- Pe2e4- Nb8c6- Pf2f3- Bf8c5- Pa2a3- Pd7d6- Pb2b4- Bc5g1x Rh1g1x Qd8h4+ Pg2g3- Qh4h2x Pb4b5- Qh2g1x Pb5c6x Bc8h3- Pc6b7x Qg1f1$ ,21,checkmate,0-1,"[13, 15, -38, -40, -174, -180, -180, -179, -179, -171, -160, -171, -179, -178, -483, -486, -490, -478, -99999, -100000]",63.0,2.6666666666666665
Pd2d4- Ng8f6- Pa2a3- Pd7d5- Ng1f3- Pe7e6- Nb1c3- Pc7c5- Pd4c5x Bf8c5x Pe2e3- Nb8c6- Bf1b5- Pa7a6- Bb5c6$ Pb7c6x Ke1g1- Ke8g8- Pb2b4- Bc5d6- Nc3a4- Pa6a5- Na4c5- Pa5b4x Pa3b4x Ra8a1x Pc2c3- Pe6e5- Nc5d3- Pe5e4- Nf3d4- Pe4d3x Qd1d3x Nf6g4- Pg2g3- Qd8e8- Nd4f5- Ng4e5- Qd3d4- Bc8f5x Pg3g4- Ne5f3+ Kg1g2- Bf5e4- Ph2h3- Nf3d4$ ,47,invalid_move,*,"[31, 37, 5, 4, 2, 8, -25, -30, -35, -35, -36, -35, -82, -81, -71, -69, -88, -91, -118, -106, -166, -166, -273, -315, -511, -500, -510, -511, -597, -600, -601, -612, -600, -571, -595, -609, -626, -615, -745, -761, -992, -1113, -99990, -99991, -99995, -99996]",51.4,3.761904761904762
Pe2e3- Pe7e5- Ng1f3- Pe5e4- Nf3g1- Pd7d5- Pc2c4- Pd5c4x Bf1c4x Qd8g5- Pg2g3- Nb8c6- Pf2f4- Qg5g6- Pf4f5- Bc8f5x Bc4b5- Ke8c8- Bb5c6x Qg6c6x Nb1c3- Ph7h5- Pb2b3- Ng8f6- Bc1b2- Nf6g4- Qd1e2- Bf8b4- Ke1c1- Ng4e5- Pd2d4- Pe4d3x Qe2d2- Rh8e8- Pe3e4- Bf5e4x ,37,invalid_move,*,"[19, 17, -46, -64, -69, -55, -76, -53, -66, -66, -119, -116, -147, -175, -307, -296, -354, -369, -371, -362, -367, -369, -369, -378, -387, -393, -393, -379, -392, -416, -662, -668, -675, -710, -710, -738]",38.705882352941174,4.111111111111111
