Move History,Number of Plies,Outcome,Result,Player Scores,ACPL White,ACPL Black
Pe2e4- Pe7e6- Pd2d4- Pd7d6- Nb1c3- Ph7h6- Bf1d3- Pa7a6- Pf2f4- Pb7b6- Ng1f3- Bc8b7- Ke1g1- Nb8d7- Qd1e2- Qd8e7- Bc1e3- Ke8c8- Bd3a6x Pg7g6- Pa2a4- Bf8g7- Pa4a5- Pb6b5- Qe2b5x Pc7c6- Qb5b7$ ,28,checkmate,1-0,"[34, 43, 32, 73, 79, 98, 100, 98, 101, 150, 166, 163, 167, 175, 179, 214, 234, 408, 404, 533, 516, 580, 571, 783, 836, 99999, 100000]",0.4166666666666667,9.0
Pe2e4- Pe7e5- Ng1f3- Pf7f6- Nf3e5x Pf6e5x Qd1h5+ Pg7g6- Qh5e5$ Qd8e7- Qe5h8x Ng8f6- Nb1c3- Nb8c6- Pd2d4- Nc6d4x Bc1g5- Nd4c2$ Ke1d1- Nc2a1x Bg5f6x Qe7f7- Bf1d3- Pd7d6- Kd1e2- Bc8g4+ Pf2f3- Bg4e6- Rh1a1x ,30,invalid_move,*,"[34, 28, 22, 161, 152, 272, 250, 271, 280, 297, 288, 337, 314, 350, 356, 387, 370, 391, 380, 396, 403, 383, 377, 394, 392, 395, 400, 420, 426]",1.8571428571428572,2.357142857142857
Pe2e4- Pe7e6- Pd2d4- Pc7c6- Nb1c3- Pd7d5- Ng1f3- Pd5e4x Nc3e4x Ng8f6- Ne4f6$ Qd8f6x Bc1g5- Qf6g6- Bf1d3- Qg6g5x Nf3g5x Ph7h6- Ng5f3- Bf8e7- Ke1g1- Ke8g8- Pc2c3- Nb8d7- Rf1e1- Pb7b6- Pa2a4- Bc8b7- Pb2b4- Pc6c5- Pb4c5x Pb6c5x Ra1b1- Bb7f3x Qd1f3x Ra8b8- Kg1h1- Rb8b1x Re1b1x Rf8b8- Rb1b8$ Nd7b8x Qf3a8- ,44,invalid_move,*,"[36, 42, 39, 85, 75, 70, 78, 109, 112, 162, 174, 175, 203, 190, 189, 588, 582, 591, 591, 597, 594, 587, 578, 571, 582, 578, 582, 539, 555, 566, 555, 544, 523, 510, 503, 507, 510, 509, 522, 591, 602, 603, 641]",4.9523809523809526,7.0
Pe2e4- Pe7e6- Pd2d4- Pg7g6- Nb1c3- Bf8g7- Ph2h4- Ng8e7- Ph4h5- Pb7b6- Ph5h6- Bg7f8- Bc1g5- Pf7f6- Bg5f6x Rh8g8- Ng1f3- Bc8b7- Nf3g5- Nb8c6- Ng5h7x Bf8h6x Rh1h6x Nc6d4x Qd1d4x Pd7d6- Bf6g5- Qd8d7- Nh7f6+ Ke8f7- Rh6h7+ Kf7f8- Bg5h6+ Rg8g7- Bh6g7$ ,36,invalid_move,*,"[28, 42, 44, 117, 113, 118, 130, 195, 186, 328, 364, 345, 375, 518, 529, 564, 558, 585, 572, 605, 598, 686, 696, 755, 745, 772, 771, 959, 988, 99993, 99994, 99997, 99998, 99998, 99999]",1.3571428571428572,9.285714285714286
Pe2e4- Pe7e6- Nb1c3- Pc7c6- Pa2a3- Pd7d5- Pd2d4- Pd5e4x Nc3e4x Ng8f6- Ne4f6$ Qd8f6x Ng1f3- Bf8d6- Bc1g5- Qf6g6- Bf1d3- Qg6h5- Bg5d2- Ke8g8- Pg2g4- Qh5d5- Pc2c4- ,24,invalid_move,*,"[33, 37, 30, 86, 68, 71, 70, 74, 77, 100, 102, 99, 95, 156, 175, 186, 186, 172, 171, 296, 300, 506, 514]",1.5454545454545454,3.272727272727273
Pe2e4- Pe7e6- Pd2d4- Pc7c6- Ng1f3- Pd7d5- Nb1d2- Pd5e4x Nd2e4x Ng8f6- Ne4f6$ Qd8f6x Bc1g5- Qf6g6- Qd1d2- Bf8e7- Bg5e7x Ke8e7x Nf3e5- Qg6f6- Ph2h4- Nb8d7- Pf2f4- Nd7e5x Pd4e5x Qf6f5- Ke1c1- Pb7b5- Qd2d6+ Ke7e8- Qd6d8+ ,32,checkmate,1-0,"[36, 26, 33, 80, 82, 80, 83, 102, 90, 165, 168, 177, 175, 197, 163, 217, 212, 211, 220, 211, 214, 205, 204, 585, 643, 678, 708, 99998, 99999, 99999, 100000]",2.3846153846153846,8.846153846153847
Pe2e4- Pe7e6- Nb1c3- Pc7c6- Pd2d4- Pd7d5- Bf1d3- Pd5e4x Nc3e4x Ng8f6- Ne4f6$ Qd8f6x Qd1g4- Pg7g6- Ng1f3- Bf8g7- Bc1g5- Qf6f5- Bd3f5x Pe6f5x Qg4g3- Ke8g8- Ke1g1- Nb8d7- Rf1e1- Nd7f6- Bg5f6x Bg7f6x Kg1h1- Bc8d7- Qg3d6- Ra8d8- Qd6f6x Bd7e6- Ph2h3- Rd8d5- Pc2c4- Rd5d6- Qf6e7- Rf8e8- Qe7e8$ Kg8g7- Qe8b8- Pb7b6- Qb8d6x Pc6c5- Pd4d5- Be6d7- Qd6d7x Pa7a5- Re1e7- Pa5a4- Re7f7$ Kg7h6- Rf7h7$ ,56,checkmate,1-0,"[35, 38, 28, 76, 71, 78, 94, 91, 92, 135, 127, 133, 139, 188, 194, 526, 504, 532, 502, 525, 526, 531, 511, 534, 524, 524, 522, 537, 513, 538, 520, 623, 633, 636, 623, 674, 682, 659, 665, 829, 857, 856, 858, 907, 951, 99993, 99995, 99995, 99996, 99996, 99997, 99998, 99999, 99999, 100000]",1.2272727272727273,5.818181818181818
Pe2e4- Pe7e6- Nb1c3- Pa7a6- Pd2d4- Pb7b5- Ng1f3- Bc8b7- Bf1d3- Pb5b4- Nc3a4- Pa6a5- Ke1g1- Bb7a6- Pc2c4- Ba6b7- Pd4d5- Pe6d5x Pe4d5x Bf8e7- Rf1e1- Ng8f6- Nf3d4- Ke8g8- Nd4f5- Pd7d6- Nf5e7$ Qd8e7x Re1e7x Nb8d7- Bc1g5- Rf8e8- Bg5f6x Nd7f6x Re7c7x Bb7c8- Ph2h3- Bc8f5- Bd3f5x Re8e1+ Qd1e1x Ra8e8- Rc7c8- Re8c8x Bf5c8x Nf6e4- Qe1e4x Pg7g6- Qe4d4- Pf7f5- Qd4f6- Ph7h5- Ra1e1- Pg6g5- Re1e8+ Kg8h7- Bc8f5$ ,58,checkmate,1-0,"[31, 28, 26, 47, 49, 72, 59, 62, 58, 110, 110, 155, 147, 174, 178, 264, 265, 267, 257, 255, 261, 392, 423, 445, 471, 577, 538, 599, 615, 618, 610, 625, 629, 616, 625, 642, 645, 692, 702, 839, 893, 912, 926, 943, 971, 1060, 99988, 99993, 99996, 99996, 99997, 99997, 99998, 99998, 99999, 99999, 100000]",0.782608695652174,9.454545454545455
Pe2e4- Pe7e5- Ng1f3- Pf7f6- Pd2d4- Pd7d6- Bf1c4- Pc7c6- Nb1c3- Pb7b5- Bc4b3- Pa7a5- Pa2a3- Pa5a4- Bb3a2- Pg7g5- Bc1e3- Ph7h5- Pd4e5x Pd6e5x Ba2f7+ Ke8e7- Be3c5+ Ke7f7x Qd1d8x Bf8c5x Qd8c8x Nb8d7- Qc8a8x Nd7b6- Qa8c6x Nb6c4- Qc6d5+ Kf7g6- Qd5c5x Nc4b2x Nc3d5- Nb2d3+ Pc2d3x Ng8e7- Qc5e7x Rh8c8- Qe7f6$ Kg6h7- Nf3g5$ Kh7g8- Nd5e7+ ,48,checkmate,1-0,"[28, 31, 26, 156, 125, 164, 180, 189, 196, 182, 195, 206, 212, 209, 212, 228, 276, 368, 392, 527, 517, 531, 540, 537, 543, 583, 585, 673, 702, 807, 820, 825, 850, 869, 877, 898, 923, 970, 1015, 99994, 99995, 99997, 99998, 99998, 99999, 99999, 100000]",1.0526315789473684,14.68421052631579
Pe2e4- Pe7e6- Pd2d4- Pb7b6- Ng1f3- Bc8b7- Bf1d3- Pd7d5- Pe4e5- Pc7c5- Pc2c3- Pc5d4x Pc3d4x Nb8c6- Nb1c3- Bf8b4- Ke1g1- Ng8e7- Nc3e2- Ke8g8- Pa2a3- Bb4a5- Ne2f4- Ne7f5- Bd3f5x Pe6f5x Pb2b4- ,28,invalid_move,*,"[35, 46, 51, 96, 89, 83, 89, 82, 84, 98, 94, 129, 121, 157, 154, 191, 179, 186, 185, 389, 388, 374, 380, 414, 421, 418, 405]",2.3076923076923075,2.0
Pe2e4- Pe7e6- Pd2d4- Pa7a6- Bf1d3- Pb7b5- Ng1f3- Bc8b7- Ke1g1- Ph7h6- Pa2a4- Pb5b4- Nb1d2- Pa6a5- Rf1e1- Pg7g5- Pc2c3- Pg5g4- Nf3e5- Ph6h5- Nd2b3- Pd7d6- Ne5c4- Ph5h4- Nc4a5x Bb7a6- Pc3b4x Ba6d3x Qd1d3x Pg4g3- Pf2g3x Ph4g3x Qd3g3x Qd8f6- Bc1d2- Qf6d4$ Nb3d4x Bf8h6- Bd2h6x Ng8h6x Nd4e6x Pf7e6x Qg3g6+ Ke8d7- Qg6g7+ ,46,invalid_move,*,"[30, 43, 28, 69, 58, 92, 90, 99, 92, 130, 119, 157, 143, 168, 166, 212, 203, 245, 257, 258, 266, 254, 262, 363, 359, 369, 344, 357, 351, 362, 361, 329, 348, 391, 386, 683, 693, 716, 723, 739, 771, 815, 861, 889, 1003]",2.0,11.636363636363637
Pe2e4- Pe7e6- Pd2d4- Pd7d5- Nb1c3- Pd5e4x Nc3e4x Ng8f6- Ne4f6$ Qd8f6x Ng1f3- Bf8b4+ Pc2c3- Bb4a5- Qd1a4+ Bc8d7- Qa4a5x Nb8c6- Qa5c7x Ke8g8- Bf1d3- Ra8c8- Qc7d7x Nc6d4x Qd7d4x Qf6d4x Pc3d4x Rc8d8- Bc1e3- Rd8d4x Be3d4x Rf8d8- Ke1d2- Rd8d4x Nf3d4x Pe6e5- Ra1e1- Pe5d4x Re1e8+ ,40,checkmate,1-0,"[34, 35, 40, 37, 36, 60, 49, 109, 85, 58, 78, 129, 139, 268, 311, 512, 509, 504, 514, 539, 558, 592, 612, 708, 717, 747, 746, 752, 754, 823, 840, 837, 846, 866, 874, 876, 880, 99999, 100000]",2.111111111111111,9.777777777777779
Pe2e4- Pe7e5- Ng1f3- Pf7f6- Bf1c4- Pd7d6- Pd2d4- Pe5d4x Nf3d4x Pc7c5- Nd4f5- Bc8f5x Pe4f5x Ng8e7- Qd1h5+ Pg7g6- Pf5g6x Ne7g6x Ke1g1- Nb8c6- Rf1e1+ Bf8e7- Nb1c3- Nc6e5- Bc4e6- Qd8c7- Pf2f4- Ne5c6- Pf4f5- ,30,invalid_move,*,"[32, 33, 30, 141, 169, 174, 185, 230, 221, 278, 268, 328, 322, 339, 346, 337, 343, 357, 344, 386, 390, 371, 380, 496, 512, 532, 566, 643, 682]",2.0,11.0
Pe2e4- Pe7e5- Ng1f3- Pd7d6- Pd2d4- Pe5d4x Nf3d4x Nb8c6- Nb1c3- Nc6d4x Qd1d4x Ng8f6- Bc1f4- Bf8e7- Ke1c1- Ke8g8- Pf2f3- Pc7c5- Qd4e3- Pb7b6- Ph2h4- Bc8b7- Bf1c4- Pa7a6- Pe4e5- Pd6e5x Rd1d8x Ra8d8x Qe3e5x Rd8e8- Qe5c7- Bb7a8- Qc7b6x Re8c8- Rh1e1- Rc8b8- Bf4b8x Rf8b8x Qb6b8$ Nf6e8- Qb8e8$ Be7f8- Qe8f7$ Kg8h8- Qf7f8$ ,46,checkmate,1-0,"[33, 29, 29, 61, 64, 63, 65, 73, 73, 111, 121, 126, 123, 133, 121, 128, 123, 183, 211, 248, 259, 256, 267, 274, 262, 399, 402, 424, 439, 465, 487, 492, 532, 554, 556, 701, 708, 99991, 99993, 99997, 99998, 99998, 99999, 99999, 100000]",0.4444444444444444,8.555555555555555
Pe2e4- Pe7e5- Ng1f3- Pf7f6- Nf3e5x Pf6e5x Qd1h5+ Pg7g6- Qh5e5$ Qd8e7- Qe5h8x Qe7e4$ Ke1d1- Qe4g4+ Pf2f3- Qg4e6- Qh8h7x Qe6e1+ Kd1e1x Nb8c6- Qh7g6$ Ke8e7- Pd2d4- Nc6d4x Bc1g5+ Ng8f6- Qg6f6$ Ke7e8- Qf6g6+ ,30,checkmate,1-0,"[33, 32, 26, 151, 177, 251, 321, 299, 274, 294, 305, 312, 350, 420, 435, 428, 432, 741, 748, 886, 917, 917, 951, 99997, 99998, 99998, 99999, 99999, 100000]",2.727272727272727,21.454545454545453
Pe2e4- Pe7e5- Ng1f3- Pf7f6- Bf1c4- Pc7c6- Nb1c3- Pd7d5- Pe4d5x Pc6d5x Nc3d5x Bc8e6- Nd5c7+ Qd8c7x Bc4e6x Qc7d6- Be6c8- Qd6d8- Bc8b7x Nb8d7- Bb7a8x Qd8a8x Pd2d3- Bf8c5- Ra1b1- Ng8e7- Pb2b4- Bc5b6- Ke1g1- Ke8g8- Pa2a4- Pa7a5- Pb4a5x Bb6a5x Pc2c4- Nd7c5- Bc1a3- Nc5d3x Ba3e7x Qa8e8- Qd1d3x Qe8e7x Qd3d5+ Kg8h8- Qd5a5x Rf8d8- Rb1b7- Qe7d6- Pc4c5- Qd6c6- Qa5d8$ Qc6e8- Qd8e8$ ,54,checkmate,1-0,"[28, 28, 26, 146, 172, 168, 162, 153, 150, 197, 210, 243, 224, 221, 232, 214, 219, 458, 430, 431, 426, 417, 433, 450, 435, 426, 420, 440, 419, 419, 405, 429, 415, 395, 429, 475, 491, 539, 544, 631, 637, 637, 642, 643, 662, 656, 661, 680, 703, 99998, 99999, 99999, 100000]",3.25,7.666666666666667
Pe2e4- Pe7e6- Pd2d4- Pc7c6- Ng1f3- Pd7d5- Nb1d2- Pd5e4x Nd2e4x Ng8f6- Ne4f6$ Qd8f6x Bc1g5- Qf6g6- Bf1d3- Qg6h5- Qd1e2- Bf8e7- Pg2g4- ,20,invalid_move,*,"[35, 46, 28, 77, 75, 71, 83, 99, 106, 168, 167, 172, 165, 181, 189, 187, 168, 227, 219]",0.6666666666666666,3.0
Pe2e4- Pe7e6- Pd2d4- Pc7c6- Bf1d3- Pd7d5- Nb1c3- Pd5e4x Nc3e4x Ng8f6- Ne4f6$ Qd8f6x Ng1f3- Bf8d6- Bc1g5- Qf6g6- Bd3g6x Ph7g6x Qd1d3- Nb8d7- Ke1g1- Nd7f6- Rf1e1- Nf6d5- Pc2c4- Nd5f4- Qd3e3- Nf4h5- Ph2h4- Pf7f6- Qe3e4- Pf6g5x Qe4g6$ Ke8d7- Re1e6x Kd7c7- Re6d6x Bc8d7- Rd6d7$ Kc7d7x Qg6f7+ Kd7d6- Pc4c5+ ,44,checkmate,1-0,"[33, 39, 35, 93, 98, 82, 101, 98, 96, 131, 123, 130, 140, 571, 556, 552, 551, 558, 556, 533, 535, 547, 552, 567, 561, 585, 578, 554, 544, 531, 528, 547, 554, 653, 676, 672, 681, 722, 798, 785, 817, 99999, 100000]",5.0,9.4
Pe2e4- Pe7e5- Ng1f3- Pf7f6- Nf3e5x Pf6e5x Qd1h5+ Pg7g6- Qh5e5$ Qd8e7- Qe5h8x Qe7e4$ Ke1d1- Qe4g4+ Pf2f3- Qg4e6- Nb1c3- Nb8c6- Qh8h7x Nc6d4- Bf1d3- Nd4f5- Bd3f5x Qe6f5x Qh7g8x Qf5c2$ Kd1c2x Pd7d6- Rh1e1+ Ke8d7- Qg8e6+ Kd7d8- Qe6e8+ ,34,checkmate,1-0,"[31, 41, 31, 150, 164, 285, 279, 293, 283, 292, 296, 310, 353, 433, 433, 406, 424, 434, 429, 506, 495, 575, 600, 621, 608, 1006, 99992, 99995, 99996, 99996, 99997, 99999, 100000]",2.076923076923077,8.666666666666666
Pe2e4- Pe7e5- Ng1f3- Pf7f6- Nf3e5x Pf6e5x Qd1h5+ Pg7g6- Qh5e5$ Qd8e7- Qe5h8x Qe7e4$ Ke1d1- Qe4g4+ Pf2f3- Qg4e6- Qh8h7x Qe6e1+ Kd1e1x Nb8c6- Qh7g6$ Ke8e7- Pd2d4- Nc6d4x Bc1g5+ Ng8f6- Qg6f6$ Ke7e8- Qf6g6+ ,30,checkmate,1-0,"[28, 30, 26, 181, 173, 281, 279, 280, 305, 307, 312, 334, 346, 420, 449, 437, 426, 733, 745, 857, 929, 935, 952, 99997, 99998, 99998, 99999, 99999, 100000]",1.0909090909090908,15.636363636363637
Pe2e4- Pe7e5- Ng1f3- Pf7f6- Nf3e5x Pf6e5x Qd1h5+ Pg7g6- Qh5e5$ Qd8e7- Qe5h8x Qe7e4$ Ke1d1- Qe4g4+ Pf2f3- Qg4e6- Qh8h7x Qe6e1+ Kd1e1x Nb8c6- Qh7g6$ Ke8e7- Pd2d4- Nc6d4x Bc1g5+ Ng8f6- Qg6f6$ Ke7e8- Qf6g6+ ,30,checkmate,1-0,"[34, 35, 26, 163, 161, 256, 292, 296, 316, 317, 295, 341, 346, 441, 434, 446, 437, 747, 762, 840, 891, 908, 961, 99997, 99998, 99998, 99999, 99999, 100000]",0.0,16.363636363636363
Pe2e4- Pe7e5- Ng1f3- Pf7f6- Nf3e5x Pf6e5x Qd1h5+ Pg7g6- Qh5e5$ Qd8e7- Qe5h8x Ng8f6- Nb1c3- Nb8c6- Pd2d4- Nc6d4x Bc1g5- Nd4c2$ Ke1d1- Nc2a1x Bg5f6x Qe7f6x Qh8f6x Bf8e7- Qf6h8+ Be7f8- Qh8e5+ Bf8e7- Nc3d5- Pc7c6- Qe5e7$ ,32,checkmate,1-0,"[34, 33, 20, 154, 139, 284, 310, 311, 305, 316, 299, 294, 343, 394, 390, 390, 371, 418, 380, 408, 405, 675, 675, 99988, 99989, 99992, 99993, 99996, 99997, 99999, 100000]",0.5454545454545454,6.818181818181818
Pe2e4- Pe7e6- Pd2d4- Pa7a6- Ng1f3- Pb7b5- Nb1d2- Bc8b7- Pa2a4- Pb5b4- Bf1d3- Pa6a5- Ke1g1- Ph7h6- Rf1e1- Pg7g5- Pd4d5- Pg5g4- Nf3d4- Ph6h5- Nd2c4- Ph5h4- Qd1g4x Ph4h3- Pg2g3- Ng8f6- Qg4f3- Bf8g7- Bc1g5- Nf6h5- Bg5d8x Ke8d8x Nd4b3- Pf7f5- Nb3c5- Bb7c8- Pe4f5x Pe6f5x Bd3f5x Rh8f8- Nc5e6+ Pd7e6x Pd5e6x Bc8e6x Ra1d1+ Kd8c8- Bf5e6$ ,48,invalid_move,*,"[28, 32, 29, 61, 61, 112, 110, 123, 126, 114, 96, 148, 148, 165, 178, 210, 220, 275, 275, 320, 331, 367, 372, 394, 400, 397, 405, 460, 448, 599, 584, 596, 603, 676, 679, 718, 758, 800, 819, 839, 942, 984, 1137, 99992, 99995, 99998, 99999]",0.7142857142857143,18.142857142857142
Pe2e4- Pe7e5- Ng1f3- Pf7f6- Nf3e5x Pf6e5x Qd1h5+ Pg7g6- Qh5e5$ Qd8e7- Qe5h8x Ng8f6- Nb1c3- Nb8c6- Pd2d4- Nc6d4x Bf1d3- Pd7d6- Bc1g5- Bc8g4- Bg5f6x Qe7f6x Qh8f6x Nd4c2$ Bd3c2x Bf8e7- Qf6h8+ Ke8d7- Qh8a8x Be7h4- Bc2a4+ Pc7c6- Qa8b7$ Kd7e6- Ba4c6x Bg4f5- Pe4f5$ Ke6f5x Qb7f7+ Kf5g5- Pg2g3- ,42,invalid_move,*,"[34, 26, 25, 140, 155, 263, 286, 307, 323, 311, 308, 307, 361, 383, 394, 387, 384, 467, 477, 609, 609, 740, 747, 817, 812, 855, 848, 944, 955, 1052, 1092, 1116, 1159, 1180, 1282, 99993, 99994, 99995, 99996, 99996, 99997]",1.6470588235294117,19.529411764705884
Pe2e4- Pe7e5- Ng1f3- Ph7h6- Nf3e5x Pd7d6- Ne5g4- Bc8g4x Qd1g4x Ng8f6- Qg4e2- Nb8c6- Pc2c3- Bf8e7- Pd2d4- Ke8g8- Pg2g3- Pd6d5- Pe4e5- Nf6e4- Nb1d2- Ne4d2x Bc1d2x Pf7f6- Bf1g2- Pf6e5x Pd4e5x Nc6e5x Qe2e5x Be7f6- Qe5d5$ Qd8d5x Bg2d5$ Kg8h8- Ke1c1- Pc7c6- Bd5e4- Ra8e8- Rh1e1- Re8e4x Re1e4x Pb7b5- Bd2e3- Pa7a5- Be3c5- Rf8e8- Re4e8$ Kh8h7- Kc1c2- Pb5b4- Pc3b4x Pa5b4x Kc2b3- ,54,invalid_move,*,"[33, 32, 25, 126, 141, 189, 182, 184, 179, 187, 193, 189, 178, 239, 246, 241, 241, 302, 305, 292, 297, 301, 283, 297, 315, 295, 322, 466, 469, 523, 534, 550, 547, 550, 547, 529, 526, 563, 545, 571, 566, 590, 580, 587, 586, 729, 766, 769, 784, 794, 797, 801, 796]",2.3461538461538463,5.769230769230769
Pe2e4- Pe7e6- Pd2d4- Pd7d5- Pe4e5- Pc7c5- Pc2c3- Nb8c6- Ng1f3- Pc5d4x Pc3d4x Bf8b4+ Nb1c3- Ng8e7- Bf1d3- Ke8g8- Bd3h7$ Kg8h7x Nf3g5+ Kh7g8- Qd1h5- Ne7g6- Qh5h7+ ,24,checkmate,1-0,"[31, 35, 33, 33, 43, 31, 32, 28, 27, 45, 55, 82, 101, 103, 114, 295, 342, 331, 322, 356, 405, 99999, 100000]",2.7,14.7
Pe2e4- Pe7e5- Pd2d4- Pd7d6- Nb1c3- Nb8c6- Pd4d5- Nc6d4- Bc1e3- Pc7c5- Pd5c6x Pb7c6x Be3d4x Pe5d4x Qd1d4x Ng8f6- Ke1c1- Bf8e7- Pe4e5- Pd6e5x Qd4e5x Ke8g8- Rd1d8x Rf8d8x Qe5e7x Bc8g4- Bf1c4- Rd8e8- Bc4f7$ Kg8h8- Bf7e8x Ra8e8x Qe7a7x Re8e1+ Kc1d2- Re1f1- Qa7a8+ Nf6g8- Pf2f3- Bg4f5- Nc3d1- Rf1d1$ Kd2d1x Bf5c2$ Kd1c2x ,46,invalid_move,*,"[31, 30, 0, 55, 58, 66, 60, 82, 85, 79, 80, 117, 110, 118, 135, 135, 136, 195, 207, 203, 219, 390, 412, 535, 538, 556, 568, 648, 667, 669, 683, 682, 686, 692, 701, 722, 728, 741, 750, 750, 771, 771, 824, 873, 975]",0.5454545454545454,14.863636363636363
Pe2e4- Pe7e6- Pd2d4- Ph7h6- Bf1d3- Pa7a6- Nb1c3- Pb7b5- Ng1f3- Bc8b7- Bc1e3- Pg7g5- Ph2h4- Pg5g4- Nf3d2- Ph6h5- Nd2b3- Pd7d6- Qd1d2- Bf8h6- Be3h6x Ng8h6x Nb3a5- Bb7c8- Pe4e5- Pd6d5- Na5b3- Nh6f5- Bd3f5x Pe6f5x Nc3e2- Pc7c5- Nb3c5x Nb8c6- Pg2g3- Pb5b4- Ke1g1- Pa6a5- Ne2f4- Pa5a4- Pa2a3- Pb4a3x Ra1a3x Nc6d4x Qd2d4x Bc8a6- Qd4a4$ Ke8f8- Rf1e1- Ra8c8- Qa4d4- Rc8c5x Pe5e6- Pf7e6x Qd4h8$ Kf8f7- Qh8h7+ Kf7f6- Re1e6$ ,60,checkmate,1-0,"[31, 34, 37, 64, 76, 96, 89, 98, 89, 90, 91, 195, 192, 189, 196, 188, 189, 192, 200, 228, 205, 225, 227, 254, 269, 253, 254, 296, 281, 288, 292, 384, 386, 399, 404, 418, 426, 459, 481, 483, 497, 489, 487, 611, 612, 678, 664, 656, 675, 713, 738, 670, 725, 99995, 99996, 99996, 99997, 99999, 100000]",4.269230769230769,7.884615384615385
Pe2e4- Pe7e6- Pd2d4- Ph7h6- Bf1d3- Pa7a6- Ng1f3- Pb7b5- Pa2a4- Bc8b7- Ke1g1- Pb5b4- Rf1e1- Pa6a5- Nb1d2- Bf8e7- Pc2c4- Pb4c3x Pb2c3x Pd7d6- Pe4e5- Pd6d5- Bd3c2- Pc7c5- Ra1b1- Pc5d4x Rb1b7x Nb8c6- Nf3d4x Nc6d4x Pc3d4x Ra8c8- Bc2d3- Rc8c4- Nd2c4x Pd5c4x Bd3c4x Qd8c8- Bc4b5+ Ke8f8- Qd1f3- Qc8c1x Rb7b8+ Be7d8- Rb8d8$ Kf8e7- Rd8e8+ ,48,checkmate,1-0,"[33, 53, 26, 60, 68, 96, 86, 128, 157, 137, 130, 157, 169, 178, 155, 170, 171, 179, 174, 206, 208, 220, 222, 272, 271, 409, 377, 500, 485, 480, 491, 512, 523, 681, 680, 700, 696, 699, 686, 687, 702, 99996, 99997, 99998, 99999, 99999, 100000]",1.25,4.55
Pe2e4- Pe7e5- Ng1f3- Pd7d6- Pd2d4- Pe5d4x Nf3d4x Nb8c6- Bc1f4- Ng8f6- Nb1c3- Bf8e7- Qd1d2- Ke8g8- Ke1c1- Nc6d4x Qd2d4x Pc7c5- Qd4e3- Bc8e6- Ph2h4- Pb7b5- Bf1b5x Qd8a5- Bf4d6x Be7d6x Rd1d6x Ra8b8- Rd6a6- Qa5b4- Ra6a4- Qb4b5x Nc3b5x Rb8b5x Qe3e2- Rf8b8- Pb2b3- Pc5c4- Ra4c4x Rb5a5- Pa2a4- Ra5e5- Rh1d1- Rb8d8- Rd1d8$ Nf6e8- Rd8e8$ ,48,checkmate,1-0,"[33, 28, 23, 58, 51, 58, 61, 64, 63, 74, 67, 64, 57, 66, 71, 59, 62, 147, 155, 155, 159, 148, 159, 271, 312, 265, 291, 318, 334, 383, 373, 396, 428, 435, 428, 447, 450, 445, 441, 473, 475, 470, 481, 99998, 99999, 99999, 100000]",4.190476190476191,7.857142857142857
Pe2e4- Pe7e5- Ng1f3- Pf7f6- Pd2d4- Pd7d6- Bf1c4- Pc7c6- Nb1c3- Pb7b5- Bc4b3- Pa7a5- Pa2a4- Pb5b4- Nc3e2- Pc6c5- Pd4c5x Pd6c5x Bb3f7+ Ke8f7x Qd1d8x Bf8e7- Qd8c8x Nb8c6- Qc8a8x Nc6d4- Nf3d4x Pc5d4x Qa8a5x Ng8h6- Qa5d5+ Kf7g6- Ph2h4- Pf6f5- Pe4f5$ Nh6f5x Qd5e6+ Kg6h5- Qe6f5$ Pg7g5- Ph4g5$ ,42,checkmate,1-0,"[33, 35, 25, 152, 121, 168, 160, 194, 184, 203, 204, 191, 191, 193, 203, 227, 217, 225, 230, 480, 494, 687, 705, 771, 808, 833, 841, 834, 849, 887, 932, 99995, 99996, 99996, 99997, 99997, 99998, 99998, 99999, 99999, 100000]",1.3333333333333333,10.2
Pe2e4- Pe7e6- Nb1c3- Pg7g6- Ph2h4- Bf8g7- Pd2d4- Ng8e7- Ph4h5- Pd7d5- Ph5h6- Bg7f8- Bc1g5- Pd5e4x Nc3e4x Nb8c6- Ne4f6+ ,18,checkmate,1-0,"[29, 22, 38, 116, 99, 115, 115, 177, 176, 239, 260, 254, 264, 363, 375, 99999, 100000]",1.8571428571428572,8.428571428571429
Pe2e4- Pe7e6- Pd2d4- Pg7g6- Nb1c3- Bf8g7- Ph2h4- Ng8e7- Ph4h5- Pd7d5- Ph5h6- Bg7f8- Bc1g5- Pf7f6- Bg5f6x Rh8g8- Ng1f3- Pd5e4x Nf3g5- Ne7f5- Bf6d8x Ke8d8x Nc3e4x Nb8c6- Ng5h7x Nc6d4x Nh7f8x Rg8f8x Ph6h7- Rf8h8- Pc2c3- ,32,invalid_move,*,"[34, 38, 34, 126, 121, 122, 120, 179, 179, 246, 257, 256, 261, 472, 469, 458, 473, 520, 531, 645, 653, 667, 666, 677, 677, 701, 704, 715, 735, 718, 735]",1.9333333333333333,6.0
Pe2e4- Pe7e6- Pd2d4- Ph7h6- Nb1c3- Pa7a6- Bf1d3- Pb7b5- Bc1e3- Bc8b7- Ng1f3- Pb5b4- Nc3e2- Pa6a5- Pc2c4- Pb4c3x Pb2c3x Bf8e7- Ra1b1- Bb7a6- Pe4e5- Ba6d3x Qd1d3x Pd7d6- Ne2f4- Pd6e5x Nf3e5x Nb8d7- Ne5f7x Ke8f7x Qd3g6+ Kf7f8- Nf4e6$ ,34,checkmate,1-0,"[33, 47, 40, 84, 68, 94, 82, 96, 105, 98, 121, 110, 120, 165, 155, 154, 157, 199, 189, 193, 189, 187, 178, 241, 243, 445, 473, 646, 634, 99998, 99999, 99999, 100000]",1.5,5.357142857142857
Pe2e4- Pe7e6- Pd2d4- Pd7d5- Pe4e5- Pc7c5- Pc2c3- Nb8c6- Ng1f3- Pc5d4x Pc3d4x Bf8b4+ Nb1c3- Ng8e7- Bf1d3- Ke8g8- Bd3h7$ Kg8h7x Nf3g5+ Kh7g8- Qd1h5- Ne7g6- Qh5h7+ ,24,checkmate,1-0,"[38, 34, 39, 35, 29, 33, 25, 21, 29, 38, 33, 107, 92, 93, 106, 285, 279, 319, 325, 396, 421, 99999, 100000]",1.2,5.7
Pe2e4- Pe7e6- Pd2d4- Ph7h6- Ng1f3- Pa7a6- Bf1d3- Pb7b5- Ke1g1- Bc8b7- Pa2a4- Pb5b4- Rf1e1- Pa6a5- Nb1d2- Ng8f6- Pc2c4- Pb4c3x Pb2c3x Bf8e7- Ra1b1- Ke8g8- Rb1b7x Nb8c6- Rb7b1- Ra8b8- Ph2h3- Nc6a7- Pe4e5- Nf6h7- Ph3h4- Pc7c5- Rb1b8x Qd8b8x Bc1a3- Pc5d4x Ba3e7x Rf8e8- Be7d6- Na7c6- Bd3h7$ Kg8h7x Bd6b8x Re8b8x Pc3d4x Nc6b4- Nd2e4- Nb4d5- Qd1c2- Nd5f4- Ne4f6+ Kh7h8- Qc2h7+ ,54,checkmate,1-0,"[35, 32, 36, 69, 62, 110, 105, 140, 131, 155, 143, 156, 172, 171, 178, 184, 175, 180, 186, 194, 192, 573, 521, 604, 592, 580, 573, 609, 577, 621, 599, 588, 586, 573, 573, 588, 598, 669, 670, 700, 707, 707, 713, 712, 708, 715, 715, 720, 727, 99998, 99999, 99999, 100000]",1.7083333333333333,2.6666666666666665
Pe2e4- Pe7e6- Pd2d4- Pb7b6- Ng1f3- Bc8b7- Bf1d3- Ng8f6- Pe4e5- Nf6d5- Pc2c4- Nd5b4- Bd3e2- Nb4c6- Pd4d5- Pe6d5x Pc4d5x Nc6e7- Nb1c3- Ne7d5x Nc3d5x Bb7d5x Qd1d5x Nb8c6- Ke1g1- Bf8e7- Pa2a3- Ke8g8- Rf1d1- Pd7d6- Qd5c6x Pd6e5x Rd1d8x Ra8d8x Bc1e3- Pe5e4- Qc6e4x Be7f6- Kg1h1- Rf8e8- Qe4c6- Re8e7- Pg2g4- Rd8e8- Be2c4- Ph7h6- Ra1g1- Pg7g5- Qc6f6x Re7e6- Bc4e6x Re8e6x Qf6d8+ Kg8g7- Be3d4+ Pf7f6- Qd8d7+ Re6e7- Qd7e7$ Kg7g6- Qe7f6$ Kg6h7- Qf6g7+ ,64,checkmate,1-0,"[28, 39, 29, 88, 96, 88, 78, 111, 108, 151, 143, 149, 126, 205, 218, 306, 298, 315, 286, 481, 480, 526, 525, 525, 525, 533, 529, 534, 541, 594, 601, 634, 656, 650, 649, 653, 665, 670, 678, 681, 683, 693, 692, 711, 712, 710, 720, 99991, 99992, 99992, 99993, 99993, 99994, 99994, 99995, 99995, 99996, 99997, 99998, 99998, 99999, 99999, 100000]",0.6956521739130435,3.9130434782608696
Pe2e4- Pe7e5- Ng1f3- Pf7f6- Nf3e5x Pf6e5x Qd1h5+ Pg7g6- Qh5e5$ Qd8e7- Qe5h8x Qe7e4$ Ke1d1- Qe4g4+ Pf2f3- Qg4e6- Qh8h7x Qe6e1+ Kd1e1x Nb8c6- Qh7g6$ Ke8e7- Pd2d4- Nc6d4x Bc1g5+ Ng8f6- Qg6f6$ Ke7e8- Qf6g6+ ,30,checkmate,1-0,"[31, 25, 32, 158, 186, 282, 286, 283, 305, 295, 309, 325, 340, 422, 427, 433, 434, 674, 742, 872, 913, 953, 974, 99997, 99998, 99998, 99999, 99999, 100000]",1.7272727272727273,20.545454545454547
Pe2e4- Pe7e5- Ng1f3- Pf7f6- Nf3e5x Pf6e5x Qd1h5+ Pg7g6- Qh5e5$ Qd8e7- Qe5h8x Qe7e4$ Ke1d1- Qe4g4+ Pf2f3- Qg4e6- Qh8h7x Qe6e1+ Kd1e1x Nb8c6- Qh7g6$ Ke8e7- Pd2d4- Nc6d4x Bc1g5+ Ng8f6- Qg6f6$ Ke7e8- Qf6g6+ ,30,checkmate,1-0,"[31, 12, 21, 160, 171, 275, 274, 295, 307, 312, 323, 343, 336, 451, 431, 430, 430, 769, 764, 890, 915, 954, 982, 99997, 99998, 99998, 99999, 99999, 100000]",1.8181818181818181,8.727272727272727
Pe2e4- Pe7e6- Pd2d4- Pd7d5- Nb1c3- Pd5e4x Nc3e4x Ng8f6- Ne4f6$ Qd8f6x Ng1f3- Bf8d6- Bc1g5- Qf6g6- Bf1d3- Qg6h5- Ph2h3- Pf7f6- Bg5d2- Ke8g8- Pc2c4- Pe6e5- Pc4c5- Bd6e7- Ke1g1- Pe5d4x Pb2b4- Pb7b6- Rf1e1- Pb6c5x Re1e7x Pc5b4x Bd3e4- Pc7c6- Qd1b3+ Kg8h8- Nf3d4x Pf6f5- Be4f3- Qh5g6- Qb3b4x Nb8a6- Qb4a3- Na6c7- Re7c7x Bc8a6- Rc7c6x Ba6b7- Rc6g6x Ph7g6x Bf3b7x Ra8b8- Qa3e7- Rb8b7x Qe7f8$ Kh8h7- Nd4f3- Rb7b2- Nf3g5+ Kh7h6- Qf8h8+ ,62,checkmate,1-0,"[31, 44, 33, 35, 44, 43, 55, 73, 94, 85, 78, 96, 132, 133, 121, 120, 123, 117, 121, 130, 123, 110, 155, 137, 121, 173, 178, 348, 373, 437, 504, 499, 518, 522, 526, 528, 526, 585, 581, 605, 601, 596, 610, 702, 698, 717, 728, 792, 837, 859, 923, 99985, 99988, 99993, 99994, 99994, 99995, 99998, 99999, 99999, 100000]",2.32,15.36
Pe2e4- Pe7e6- Nb1c3- Pc7c5- Ng1f3- Nb8c6- Pd2d4- Pc5d4x Nf3d4x Ng8f6- Nd4c6x Pb7c6x Pe4e5- Nf6d5- Nc3e4- Bf8b4+ Pc2c3- Bb4a5- Ne4d6+ Ke8e7- Qd1g4- Pf7f5- Qg4g7$ ,24,checkmate,1-0,"[31, 30, 25, 29, 41, 56, 51, 51, 56, 57, 44, 48, 59, 63, 67, 128, 148, 267, 298, 275, 307, 99999, 100000]",2.4,11.5
Pe2e4- Pe7e6- Pd2d4- Pg7g6- Nb1c3- Bf8g7- Ph2h4- Ng8e7- Ph4h5- Pg6h5x Qd1h5x Pd7d6- Ng1f3- Nb8d7- Pe4e5- Pd6e5x Pd4e5x Nd7e5x Nf3e5x Bg7e5x Qh5e5x Ne7c6- Qe5h8$ Ke8d7- Qh8h7x Qd8f6- Bc1e3- Pb7b6- Rh1h6- Bc8b7- Ra1d1+ Kd7e7- Rh6f6x Ke7f6x Nc3e4+ Kf6e7- Be3g5+ Ke7f8- Qh7h8+ ,40,checkmate,1-0,"[38, 70, 35, 109, 108, 120, 128, 175, 183, 214, 238, 224, 230, 241, 250, 266, 267, 475, 445, 535, 550, 772, 803, 814, 826, 869, 929, 1037, 1140, 99992, 99994, 99994, 99995, 99997, 99998, 99998, 99999, 99999, 100000]",1.0,19.785714285714285
Pe2e4- Pe7e5- Ng1f3- Pf7f6- Bf1c4- Pc7c6- Nb1c3- Pd7d5- Pe4d5x Pc6d5x Bc4d5x Ng8e7- Bd5b3- Ne7c6- Pd2d4- Pe5d4x Qd1e2+ Bf8e7- Nc3d5- Ke8g8- Nd5e7$ ,22,invalid_move,*,"[31, 30, 21, 149, 165, 158, 135, 160, 155, 211, 176, 166, 179, 224, 212, 204, 217, 265, 263, 436, 438]",2.6,4.4
Pe2e4- Pe7e5- Ng1f3- Pf7f6- Nf3e5x Pf6e5x Qd1h5+ Pg7g6- Qh5e5$ Qd8e7- Qe5h8x Qe7e4$ Ke1d1- Qe4g4+ Pf2f3- Qg4e6- Qh8h7x Qe6e1+ Kd1e1x Nb8c6- Qh7g6$ Ke8e7- Pd2d4- Nc6d4x Bc1g5+ Ng8f6- Qg6f6$ Ke7e8- Qf6g6+ ,30,checkmate,1-0,"[34, 31, 30, 168, 197, 281, 258, 302, 294, 284, 295, 316, 344, 442, 437, 424, 433, 705, 742, 867, 929, 935, 940, 99997, 99998, 99998, 99999, 99999, 100000]",2.3636363636363638,16.454545454545453
Pe2e4- Pe7e6- Pd2d4- Pc7c6- Ng1f3- Pd7d5- Nb1d2- Pd5e4x Nd2e4x Ng8f6- Ne4f6$ Qd8f6x Bc1g5- Qf6g6- Bf1d3- Qg6h5- Qd1e2- Bf8e7- Bg5e7x Ke8e7x Ke1c1- Nb8d7- Kc1b1- Nd7f6- Rh1g1- Pb7b5- Pg2g4- Qh5d5- Nf3e5- Qd5a2$ Kb1a2x Pa7a5- Ne5c6$ Ke7d6- Bd3b5x Bc8b7- Qe2e5+ ,38,invalid_move,*,"[34, 38, 33, 73, 77, 70, 77, 108, 107, 184, 157, 169, 196, 194, 190, 176, 184, 219, 233, 235, 234, 242, 248, 240, 252, 307, 297, 298, 312, 649, 657, 715, 774, 810, 817, 99994, 99995]",1.8235294117647058,9.764705882352942
Pe2e4- Pe7e6- Pd2d4- Pb7b6- Ng1f3- Bc8b7- Bf1d3- Pd7d6- Nb1c3- Nb8d7- Qd1e2- Pg7g6- Ph2h4- Bf8g7- Ph4h5- Ng8e7- Bc1g5- Ph7h6- Ph5g6x Pf7g6x Bg5h4- Pg6g5- Bh4g5x Ph6g5x Rh1h8$ Bg7h8x Nf3g5x Bh8f6- Qe2h5+ Ke8f8- Qh5f7+ ,32,checkmate,1-0,"[33, 41, 32, 90, 87, 91, 94, 99, 93, 94, 101, 118, 132, 182, 175, 168, 169, 217, 226, 216, 198, 210, 187, 197, 188, 198, 217, 99997, 99998, 99999, 100000]",1.3076923076923077,4.076923076923077
Pe2e4- Pe7e6- Pd2d4- Pc7c6- Bf1d3- Pd7d5- Nb1c3- Pd5e4x Nc3e4x Ng8f6- Ne4f6$ Qd8f6x Ng1f3- Bf8d6- Bc1g5- Qf6g6- Bd3g6x Ph7g6x Ph2h4- Nb8d7- Ke1g1- Nd7f6- Rf1e1- Nf6d5- Pc2c4- Nd5f4- Pd4d5- Pc6d5x Pc4c5- Bd6c5x Bg5f4x Bc5e7- Re1e3- Pb7b6- Ra1c1- Bc8b7- Qd1a4+ Ke8f8- Qa4d7- Ra8d8- Qd7b7x Pg6g5- Bf4g5x Be7g5x Nf3g5x Rh8h4x Qb7f7$ ,48,checkmate,1-0,"[32, 44, 48, 85, 85, 87, 93, 93, 86, 148, 124, 117, 112, 572, 564, 560, 538, 538, 532, 555, 546, 574, 561, 603, 605, 614, 609, 612, 627, 652, 637, 625, 620, 646, 634, 695, 705, 731, 728, 759, 782, 891, 1356, 99997, 99998, 99999, 100000]",1.0952380952380953,25.0
Pe2e4- Pe7e5- Ng1f3- Pf7f6- Nf3e5x Pf6e5x Qd1h5+ Pg7g6- Qh5e5$ Qd8e7- Qe5h8x Qe7e4$ Ke1d1- Qe4g4+ Pf2f3- Qg4e6- Qh8h7x Qe6e1+ Kd1e1x Nb8c6- Qh7g6$ Ke8e7- Pd2d4- Nc6d4x Bc1g5+ Ng8f6- Qg6f6$ Ke7e8- Qf6g6+ ,30,checkmate,1-0,"[35, 32, 23, 152, 169, 268, 294, 290, 304, 316, 312, 352, 342, 463, 441, 420, 453, 705, 764, 902, 919, 934, 983, 99997, 99998, 99998, 99999, 99999, 100000]",2.5454545454545454,19.545454545454547
Pe2e4- Pe7e5- Ng1f3- Pf7f6- Nf3e5x Pf6e5x Qd1h5+ Pg7g6- Qh5e5$ Qd8e7- Qe5h8x Ng8f6- Nb1c3- Nb8c6- Pd2d4- Nc6d4x Bc1g5- Nd4c2$ Ke1d1- Nc2a1x Bg5f6x Qe7f7- Bf1e2- Pd7d6- Kd1d2- Bc8e6- Rh1a1x ,28,invalid_move,*,"[32, 38, 28, 176, 149, 292, 301, 307, 307, 320, 305, 287, 342, 337, 341, 404, 386, 386, 409, 411, 395, 400, 392, 393, 396, 441, 434]",1.7692307692307692,7.230769230769231
Pe2e4- Pe7e6- Nb1c3- Pc7c6- Pd2d4- Pd7d5- Bf1d3- Pd5e4x Nc3e4x Ng8f6- Ne4f6$ Qd8f6x Ng1f3- Bf8d6- Bc1g5- Qf6g6- Bd3g6x Ph7g6x Qd1d3- Nb8d7- Ke1g1- Nd7f6- Ph2h3- Nf6d5- Rf1e1- Ke8g8- Bg5d2- Pb7b6- Pc2c4- Nd5f6- Bd2g5- Bc8b7- Pc4c5- Pb6c5x Qd3a3- Pc5d4x Qa3d6x Pc6c5- Kg1h1- Bb7f3x Pg2f3x Ra8d8- Qd6h2- Pd4d3- Bg5d2- Pc5c4- Re1e5- Pc4c3- Pb2c3x ,50,invalid_move,*,"[34, 36, 33, 85, 82, 91, 94, 88, 89, 133, 128, 124, 123, 569, 564, 548, 549, 548, 548, 558, 558, 546, 540, 564, 560, 566, 554, 566, 557, 569, 564, 553, 531, 529, 520, 542, 553, 535, 534, 528, 519, 525, 527, 521, 520, 515, 516, 545, 536]",3.625,0.7916666666666666
Pe2e4- Pe7e5- Ng1f3- Pf7f6- Nf3e5x Pf6e5x Qd1h5+ Pg7g6- Qh5e5$ Qd8e7- Qe5h8x Ng8f6- Nb1c3- Nb8c6- Pd2d4- Nc6d4x Bf1d3- Pd7d6- Bc1g5- Bc8g4- Bg5f6x Qe7f6x Qh8f6x Nd4c2$ Bd3c2x Bf8e7- Qf6h8+ Ke8d7- Qh8a8x Be7h4- Bc2a4+ Pc7c6- Qa8b7$ Kd7e6- Ba4c6x Bg4f5- Pe4f5$ Ke6f5x Qb7f7+ Kf5g5- Pg2g3- ,42,invalid_move,*,"[29, 34, 25, 160, 164, 273, 256, 312, 323, 293, 324, 298, 326, 398, 381, 377, 373, 501, 498, 607, 613, 733, 751, 793, 831, 855, 850, 941, 975, 1043, 1073, 1095, 1133, 1167, 1241, 99993, 99994, 99995, 99996, 99996, 99997]",3.5294117647058822,18.352941176470587
