Move History,Number of Plies,Outcome,Result,Player Scores,ACPL White,ACPL Black
Pd2d4- Pd7d6- Pc2c4- Pc7c6- Nb1c3- Ng8f6- Pe2e4- Pg7g6- Pf2f4- Bf8g7- Ng1f3- Ke8g8- Bf1d3- Pe7e5- Pf4e5x Pd6e5x Pd4d5- Pc6d5x Pc4d5x Nb8d7- Ke1g1- Nd7c5- Bd3c2- Nc5d7- Bc1g5- Ph7h6- Bg5h4- Pg6g5- Bh4g3- Nf6h5- Bg3f2- Nh5f4- Pg2g3- Nf4h3+ Kg1g2- Nh3f2x Rf1f2x Pf7f5- Pe4f5x Rf8f5x Bc2f5x Nd7f6- Bf5c8x Qd8c8x Qd1e2- Qc8d7- Ra1f1- Ra8f8- Nf3e5x Qd7d5$ Nc3d5x Nf6d5x Qe2c4- Kg8h7- Ne5f7- Rf8f7x Rf2f7x Nd5e3+ Kg2g1- Ne3c4x Rf7b7x Nc4d2- Rf1d1- Nd2f3+ Kg1g2- Nf3e5- Rd1d7- Ne5d7x Rb7d7x Kh7g6- Rd7a7x Kg6f5- Ra7g7x Kf5e4- Rg7g5x Ph6g5x Ph2h4- Pg5h4x Pg3h4x Ke4f5- Ph4h5- Kf5g5- Ph5h6- Kg5h6x Pb2b4- Kh6g5- Pb4b5- Kg5f5- Pb5b6- Kf5e5- Pb6b7- Ke5d6- Qb7b8+ Kd6c6- Qb8c8+ Kc6d5- Qc8d7+ Kd5c5- Qd7c7+ Kc5b5- Qc7b7+ Kb5a5- Qb7a7+ Ka5b5- Qa7b7+ Kb5c5- Qb7c6+ Kc5d4- Qc6d6+ Kd4c3- Qd6c5+ Kc3b2- Qc5b4+ Kb2c1- Qb4a3+ Kc1d1- Qa3b2- Kd1e1- Qb2d2+ ,120,invalid_move,*,"[31, 57, 41, 56, 73, 82, 79, 89, 65, 90, 90, 92, 46, 30, 23, 34, 28, 54, 57, 73, 62, 58, 40, 93, 48, 52, 57, 102, 101, 100, 98, 82, 47, 46, 61, 61, 63, 221, 221, 468, 489, 469, 457, 514, 472, 554, 519, 574, 583, 1074, 99989, 99991, 905, 99993, 483, 99993, 542, 541, 526, 529, 533, 544, 557, 560, 555, 534, 515, 520, 529, 529, 531, 547, 576, 622, 552, 569, 555, 628, 633, 666, 688, 673, 678, 696, 703, 798, 597, 582, 99989, 99990, 99991, 99991, 99992, 99992, 99991, 99992, 99992, 99992, 99991, 99992, 99992, 99998, 99991, 99991, 99992, 99992, 0, 99992, 99993, 99993, 99994, 99994, 99995, 99996, 99995, 99996, 99997, 99997, 474]",12.372093023255815,5.404761904761905
Pe2e4- Pc7c5- Pc2c4- Pg7g6- Nb1c3- Bf8g7- Pd2d3- Nb8c6- Ng1f3- Pd7d6- Bf1e2- Ng8f6- Ke1g1- Ke8g8- Bc1e3- Pa7a6- Pa2a3- Pb7b5- Pc4b5x Pa6b5x Nc3b5x Bc8a6- Nb5c3- Nc6d4- Nf3d4x Pc5d4x Be3d4x Nf6d7- Bd4g7x Kg8g7x Be2f3- Nd7e5- Bf3e2- Qd8b6- Pb2b4- Ra8c8- Qd1d2- Rc8c3x Qd2c3x Rf8c8- Qc3d2- Rc8c3- Ra1c1- Rc3a3x Rc1c7- Ra3a2- Qd2c3- Ra2e2x ,49,invalid_move,*,"[29, 30, 6, 45, -3, 0, -16, -16, -36, -47, -29, -21, -33, -25, -37, 0, -35, -1, -22, -26, -28, -9, -5, 254, 251, 247, 260, 284, 298, 293, 195, 201, 222, 214, 220, 286, 239, 384, 398, 400, 382, 573, 344, 361, -388, 453, -172, -152]",1.3333333333333333,3.9130434782608696
Pe2e4- Pe7e5- Pf2f4- Pf7f5- Pf4e5x Pf5e4x Ng1e2- Ng8e7- Ne2g3- Ne7g6- Bf1e2- Bf8e7- Ke1g1- ,14,invalid_move,*,"[29, 31, -31, 107, -231, 62, -44, 75, 70, 95, -11, 170, 187]",0.0,2.8333333333333335
Pe2e4- Pd7d6- Pd2d4- Pc7c6- Pc2c4- Nb8d7- Nb1c3- Pg7g6- Bc1e3- Bf8g7- Bf1d3- Ng8f6- Ng1e2- Ke8g8- Ke1g1- Pe7e5- Pf2f4- Pe5d4x Ne2d4x Nd7c5- Bd3c2- Nc5e6- Nd4e6x Bc8e6x Pf4f5- Be6d7- Pf5g6x Pf7g6x Qd1e2- Qd8e7- Ra1d1- Ra8e8- Be3d4- Pc6c5- Bd4f6x Bg7f6x Nc3d5- Qe7e5- Nd5f6$ Rf8f6x Rf1f6x Qe5f6x Rd1d6x Bd7c6- Rd6f6x Re8e4x Qe2e4x Bc6e4x Bc2e4x Pb7b6- Rf6e6- Kg8f7- Re6d6- Kf7e7- Rd6d5- Ke7e6- Rd5c5x Pb6c5x Be4b7- Pa7a5- Bb7a6- Pa5a4- Ba6b5- Pa4a3- Pb2a3x Ke6d6- Pa3a4- Kd6e5- Pa4a5- Ke5d4- Pa5a6- Kd4c3- Pa6a7- Kc3b2- Qa7a8- Kb2c3- Qa8c6- Kc3b2- Qc6c5x Kb2a2x Qc5b4- Ka2a1- Qb4b2+ Ka1b2x Pc4c5- Kb2c3- Pc5c6- Kc3d4- Pc6c7- Kd4e3- Qc7c8- Ke3f4- Qc8c4+ Kf4e3- Qc4e4+ Ke3d2- Qe4d4+ ,98,invalid_move,*,"[29, 54, 58, 67, 73, 78, 76, 99, 101, 94, 57, 54, 32, 55, 55, 52, -190, 41, -21, -1, -125, 96, 56, 57, -108, 158, -15, -11, -139, -66, -341, -1, -351, -118, -118, -44, -30, -40, -41, -41, -47, -44, -491, 610, 643, 99992, 657, 686, 691, 692, 698, 717, 680, 690, 690, 696, 510, 545, 500, 540, 490, 535, 541, 546, 579, 585, 608, 618, 677, 823, 848, 876, 916, 99979, 99988, 99991, 99990, 99993, 99994, 99995, 99996, 99996, 732, 761, 781, 811, 833, 845, 856, 99988, 99989, 99994, 99990, 99997, 423, 99995, 99995]",19.35,12.615384615384615
Pe2e4- Pe7e6- Pd2d3- Pc7c5- Ng1f3- Nb8c6- Bf1e2- Pd7d5- Pe4d5x Pe6d5x Ke1g1- Ng8f6- Rf1e1- Bf8e7- Bc1g5- Ke8g8- Bg5f6x Be7f6x Nb1c3- Pd5d4- Nc3e4- Bf6e7- Ne4g3- Be7d6- Ng3e4- Bd6c7- Ne4c5x Bc7b6- Nc5b3- Bc8e6- Nb3d4x Nc6d4x Nf3d4x Bb6d4x Pc2c3- Bd4b6- Be2f3- Qd8c7- Qd1c2- Ra8d8- Re1e2- Be6d5- Bf3d5x Rd8d5x Ra1e1- Rf8d8- Pd3d4- Rd5d6- Re2e8+ Rd8e8x Re1e8$ ,52,checkmate,1-0,"[29, 48, 1, 22, 10, 18, -13, -13, -17, -19, -14, -11, -30, -28, -59, -54, -115, -120, -121, -37, -46, -44, -78, -50, -50, 39, 40, 81, 75, 66, -351, -350, -473, -364, -367, -312, -319, -285, -307, -311, -337, -319, -322, -326, -330, 99998, -281, 99998, 99999, 99999, 100000]",1.0434782608695652,0.2727272727272727
Pd2d4- Pd7d5- Pc2c4- Pc7c6- Nb1c3- Ng8f6- Pe2e3- Pe7e6- Ng1f3- Bf8b4- Bf1d3- Bb4c3$ Pb2c3x Ke8g8- Ke1g1- Nb8d7- Pc4d5x Pe6d5x Pc3c4- Pd5c4x Bd3c4x Nd7b6- Bc4b3- Bc8g4- Ph2h3- Bg4h5- Pg2g4- Bh5g6- Nf3e5- Qd8d5- Pf2f4- Nf6e4- Pf4f5- Bg6f5x Pg4f5x Qd5d6- Pf5f6- Pg7g6- Qd1g4- Ne4f6x Qg4g5- Nb6d5- Qg5h6- Nd5e3x Bc1e3x Qd6e5x Pd4e5x Nf6e4- Be3d4- Ra8d8- Bd4e3- Rd8d3- Bb3c2- Rd3e3x Rf1f7x Re3g3+ Kg1h2- Rg3h3$ Kh2g2- Rh3g3+ Kg2h2- Rg3f3- Ra1g1- Rf3f7x Bc2e4x Rf7f2+ Rg1g2- Rf2f4- Be4g6x Rf4h4+ Kh2g3- Rh4h6x Bg6h7$ Kg8h7x Rg2h2- Rf8g8+ Kg3f4- Rh6h2x Kf4e4- Rh2a2x Ke4d4- Ra2a4+ Kd4c5- Rg8g5- Kc5d6- Ra4h4- Kd6c7- Rg5e5x Kc7b7x Re5d5- Kb7c6x Rh4c4+ Kc6d5x Pa7a5- Kd5c4x Pa5a4- Kc4b4- Pa4a3- Kb4a3x ,100,insufficient_material,1/2-1/2,"[31, 36, 35, 41, 34, 38, 37, 35, 41, 49, 52, 59, 53, 50, 64, 71, 67, 67, 71, 79, 83, 84, 51, 82, 95, 130, 137, 124, 119, 504, 385, 464, 447, 500, 500, 494, 396, 488, 413, 424, 354, 366, 316, 496, 508, 774, 826, 99993, 888, 99996, 706, 783, 696, 760, 596, 656, 706, 737, 1, 602, 632, 99999, 537, 522, 541, 617, 547, 99996, 99994, 99994, -435, -437, -522, -550, -690, -682, -692, -703, -764, -99983, -99992, -99996, -99998, -99995, -99995, -99990, -99990, -99991, -99995, -99994, -99995, -99984, -99985, 0, 0, 0, 0, 0, 0]",5.897435897435898,6.948717948717949
Pe2e4- Pe7e6- Pf2f4- Pc7c5- Ng1f3- Nb8c6- Pd2d4- Pc5d4x Nf3d4x Ng8f6- Nb1c3- Bf8c5- Bc1e3- Bc5d4x Be3d4x Ke8g8- Bf1d3- Pd7d5- Pe4e5- Nf6d7- Ke1g1- Pf7f6- Pe5f6x Nd7f6x Pf4f5- Pe6e5- Bd4e3- Pd5d4- Be3g5- Pd4c3x Pb2c3x Qd8b6+ Kg1h1- Bc8d7- Ph2h3- Ra8d8- Bg5f6x Rf8f6x Qd1g4- Rd8f8- Ra1e1- Rf6h6- Re1e5x Nc6e5x Qg4e4- Ne5d3x Pc2d3x Bd7c6- Qe4g4- Rh6g6- Qg4h4- Qb6e3- Rf1e1- Qe3d3x Re1e7- Qd3f1+ Kh1h2- Qf1g2$ ,59,checkmate,0-1,"[29, 48, -16, -5, -5, 0, -35, -11, -9, 0, -7, 83, -43, 158, 151, 141, -283, 60, -124, 105, -317, 117, -167, 106, -410, -28, -306, -327, -350, -350, -350, -364, -346, -346, -423, -391, -388, -387, -398, -346, -379, -345, -555, -567, -566, -568, -582, -584, -604, -636, -99994, -580, -99993, -611, -99998, -99999, -99999, -100000]",4.769230769230769,3.2
Pd2d4- Pd7d6- Pc2c4- Pc7c6- Nb1c3- Ng8f6- Pe2e4- Pg7g6- Pf2f4- Bf8g7- Ng1f3- Ke8g8- Bf1d3- Nb8d7- Ke1g1- Pe7e5- Pf4e5x Pd6e5x Pd4d5- Pc6d5x Pc4d5x Nd7c5- Bd3c2- Bc8g4- Qd1e2- Qd8b6- Kg1h1- Ra8c8- Ph2h3- Bg4f3x Rf1f3x Nc5d7- Bc1e3- Qb6c7- Ra1f1- Pa7a6- Pa2a3- Pb7b5- Pb2b4- Nd7b6- Be3b6x Qc7b6x Rf3f6x Bg7f6x Rf1f6x Qb6d4- Rf6b6- Rc8c3x Qe2g4- ,50,invalid_move,*,"[31, 54, 40, 64, 77, 80, 71, 82, 56, 106, 99, 94, 47, 121, 73, 62, 48, 48, 55, 56, 61, 65, 67, 55, 20, 61, 55, 63, -15, 57, 70, 95, -389, 183, 113, 110, 81, 99, -329, 260, -42, -43, -325, -302, -454, 197, -475, -429, -573]",1.3333333333333333,1.6666666666666667
