Move History,Number of Plies,Outcome,Result,Player Scores,ACPL White,ACPL Black
Pe2e3- Pc7c5- Pd2d3- Pd7d6- Pf2f3- Nb8c6- Pg2g3- Pg7g6- Bf1g2- Bf8g7- Ng1e2- Ng8f6- Ke1g1- Ke8g8- Pc2c3- Pe7e5- Pb2b3- Pd6d5- Bc1b2- Pd5d4- Pe3d4x Pc5d4x Pc3d4x Pe5d4x Nb1d2- Rf8e8- Nd2c4- Bc8e6- Nc4d2- Be6d5- Nd2e4- Nf6e4x Pf3e4x Bd5e6- Ne2f4- Be6d7- Nf4d5- Nc6e5- Nd5f4- Pf7f5- Pe4f5x Bd7f5x Bg2b7x Ra8b8- Bb7d5+ Kg8h8- Bd5e4- Bf5e4x Pd3e4x Qd8b6- Kg1g2- Rb8d8- Qd1e2- Ne5g4- Ph2h3- Ng4e3+ Kg2h2- Ne3f1$ Ra1f1x Re8e4x Qe2e4x Qb6d6- Qe4d5- Qd6d5x Nf4d5x Rd8d5x Rf1f8+ Bg7f8x Bb2d4$ Kh8g8- Bd4a7x Rd5d2+ Kh2g1- Rd2a2x Ba7c5- Ra2c2- Bc5f8x Kg8f8x Kg1f1- Kf8f7- Kf1e1- Kf7f6- Ke1d1- Kf6e5- Kd1e1- Ke5d4- Ke1d1- Kd4c3- Kd1e1- Kc3b3x Ke1f1- Kb3c4- Kf1e1- Kc4d3- Ke1d1- Kd3e3- Kd1e1- Ke3f3- Ke1f1- Kf3g3x Kf1g1- Kg3h3x Kg1h1- Kh3g3- Kh1g1- Kg3f3- Kg1h1- Kf3g3- Kh1g1- Kg3f3- Kg1h1- Kf3g3- Kh1g1- Kg3h3- Kg1h1- Kh3g3- Kh1g1- Kg3h3- Kg1h1- Rc2c1+ ,121,checkmate,0-1,"[19, 10, -29, 6, -62, -59, -81, -59, -65, -57, -58, -59, -65, -66, -94, -72, -92, -104, -158, -123, -191, -146, -233, -230, -290, -243, -285, -172, -327, -113, -119, -43, -84, -80, -87, -49, -44, -19, -100, 21, 21, 28, 35, 33, 23, 32, 32, 81, 76, 208, 6, 112, -24, 392, -233, -240, -221, -221, -216, 446, 439, 454, 2, 0, 0, 1, -545, -544, -620, -489, -479, -479, -496, -516, -655, -498, -540, -561, -566, -580, -583, -594, -599, 389, -600, -626, -641, -653, -663, -99987, -99987, -99988, -99988, -99989, -99991, -668, -99999, -667, -99999, -854, -99999, -99988, -99999, -99999, -99999, -99998, -99998, -99999, -99999, -99997, -99997, 0, -99999, -99994, -99999, 0, -99999, 0, -99999, -100000]",7.0212765957446805,19.170212765957448
Pe2e4- Pc7c5- Pd2d3- Pg7g6- Ng1f3- Bf8g7- Bf1e2- Nb8c6- Ke1g1- Pd7d6- Pc2c3- Ng8f6- Bc1g5- Ke8g8- Nb1d2- Ph7h6- Bg5h4- Pg6g5- Bh4g3- Nf6h5- Bg3d6x Pe7d6x Pd3d4- Pc5d4x Pc3d4x Nh5f4- Be2c4- Nc6d4x Nf3d4x Bg7d4x Nd2f3- Bd4b2x Ra1b1- Bb2g7- Qd1b3- Bc8e6- Bc4e6x Pf7e6x Qb3e6$ Kg8h8- Nf3g5x Qd8g5x Qe6d6x Ra8d8- Qd6c7- Rd8d2- Pg2g3- Nf4h3+ Kg1g2- Nh3f2x Rf1f2x Rd2f2$ ,53,invalid_move,*,"[29, 38, 2, -1, -14, -8, -18, -16, -27, -10, -12, 27, -42, -21, -27, -34, -25, -36, -33, -32, -369, -348, -430, -414, -464, -453, -485, -412, -405, -400, -461, -431, -437, -427, -526, -484, -482, -449, -676, -443, -767, -758, -99999, -682, -99999, -896, -99987, -99992, -99992, -99993, -99995, -99995]",10.681818181818182,4.619047619047619
Pe2e4- Pe7e5- Pd2d3- Pf7f5- Nb1c3- Ng8f6- Pe4f5x Pd7d5- Ng1f3- Bc8f5x Bf1e2- Bf8d6- Ke1g1- Ke8g8- Bc1g5- Pc7c6- Bg5f6x Qd8f6x Nc3d5x Pc6d5x Pc2c4- Pd5d4- Pb2b4- Nb8c6- Pb4b5- Nc6e7- Pa2a4- Pa7a6- Pb5a6x Ra8a6x Pa4a5- Rf8a8- Qd1b3- Ra6a5x Ra1a5x Ra8a5x Qb3b7x Ra5a2- Qb7b8+ ,40,invalid_move,*,"[29, 33, 0, 83, 44, 119, 117, 123, -37, 68, -56, -25, -40, -28, -121, -95, -198, -179, -445, -419, -414, -388, -435, -394, -440, -397, -408, -368, -375, -333, -357, -327, -310, -53, -43, -47, -292, -233, -623]",0.21052631578947367,1.6842105263157894
Pe2e4- Pe7e6- Pd2d4- Pc7c6- Nb1c3- Pd7d5- Pe4e5- Pf7f6- Pf2f4- Pf6e5x Pf4e5x Ng8e7- Ng1f3- Ne7g6- Bf1d3- Bf8e7- Ke1g1- Ke8g8- Bc1e3- Nb8d7- Qd1d2- Pc6c5- Pd4c5x Nd7c5x Be3c5x Be7c5$ Kg1h1- Ng6e5x Nf3e5x Bc5d6- Ne5f3- Pe6e5- Nc3d5x Bc8g4- Nd5e3- Bg4f3x Rf1f3x Qd8h4- Ra1f1- Ra8e8- Ne3f5- Qh4h5- Nf5d6x Re8d8- Nd6f5- Rd8d7- Nf5g3- Qh5f7- Ng3e4- Rf8d8- Qd2e3- Rd7d4- Ne4g5- Qf7a2x Ng5e6- Rd4h4- Ne6d8x Rh4h2$ Kh1g1- ,60,invalid_move,*,"[29, 54, 43, 80, 86, 89, 41, 146, 77, 148, 159, 178, 157, 236, 224, 229, 173, 173, 138, 199, 131, 117, 22, 89, -14, -17, -21, 391, 431, 455, 353, 505, 512, 523, 523, 489, 501, 528, 512, 598, 548, 662, 690, 99994, 624, 99998, 710, 759, 652, 825, 668, 99994, 869, 99996, 478, 99998, 99996, 99996, 99995]",4.68,7.6
Pe2e3- Pe7e6- Pd2d4- Pd7d6- Pc2c4- Ng8f6- Nb1c3- Bf8e7- Ng1f3- Ke8g8- Bf1d3- Pc7c5- Ke1g1- Pc5d4x Pe3d4x Nb8c6- Bc1e3- Pd6d5- Pc4d5x Pe6d5x Rf1e1- Bc8g4- Ph2h3- Bg4h5- Bd3e2- Bh5g6- Be2d3- Bg6d3x Qd1d3x Nf6e4- Nc3e4x Pd5e4x Qd3e4x Be7f6- Ra1d1- Rf8e8- Qe4d3- Qd8b6- Pb2b3- Ra8d8- Pd4d5- Nc6e5- Nf3e5x Bf6e5x Be3b6x Pa7b6x Re1e5x Re8e5x Qd3d4- Re5d5x Qd4d5x Rd8d5x Rd1d5x Kg8f8- Rd5d7- Kf8e8- Rd7b7x Ke8d8- Rb7b6x Kd8c7- Rb6b4- Kc7c6- Rb4c4+ Kc6b5- Rc4b4+ Kb5a5- Rb4c4- Pf7f5- Rc4a4+ Ka5b5- Ra4b4+ Kb5c5- Rb4c4+ Kc5d5- Rc4d4+ Kd5c5- Rd4c4+ Kc5b5- Rc4b4+ Kb5a5- Rb4a4+ Ka5b5- Ra4b4+ Kb5c5- Rb4c4+ Kc5d5- Rc4d4+ Kd5c5- Rd4c4+ Kc5b5- Rc4b4+ Kb5a5- Rb4a4+ Ka5b5- Ra4b4+ ,96,fivefold_repetition,1/2-1/2,"[18, 15, 14, 48, 39, 43, 40, 52, 44, 49, 44, 69, 37, 79, 94, 103, 39, 34, 34, 50, 28, 27, 38, 31, 13, 49, 18, 25, 16, 118, 98, 128, 123, 181, 95, 98, 66, 443, 105, 228, 250, 535, 530, 587, 590, 578, 557, 578, 557, 575, 577, 580, 581, 578, 585, 588, 596, 641, 591, 592, 599, 597, 603, 610, 439, 611, 609, 617, 617, 616, 441, 617, 619, 696, 478, 619, 621, 627, 486, 627, 628, 628, 489, 613, 629, 762, 492, 617, 0, 627, 0, 619, 0, 615, 0]",0.723404255319149,2.1914893617021276
Pe2e4- Pe7e5- Pc2c4- Pc7c6- Nb1c3- Pd7d6- Pd2d3- Ng8f6- Pf2f4- Bf8e7- Ng1f3- Ke8g8- Pf4e5x Pd6e5x Bf1e2- Nb8d7- Ke1g1- Nd7c5- Bc1e3- Nc5e6- Qd1d2- Ne6d4- Nf3d4x Pe5d4x Be3d4x Bc8e6- Pb2b3- Pc6c5- Bd4e3- Pb7b6- Ra1d1- Qd8c7- Nc3d5- Nf6d5x Pe4d5x Be6d7- Be3f4- Qc7c8- Be2f3- Be7f6- Bf4g3- Bf6d4+ Kg1h1- Bd7f5- Bf3e4- Bf5e4x Pd3e4x Qc8g4- Qd2f4- Qg4f4x Bg3f4x Pf7f6- Bf4g3- Ra8e8- Rf1e1- Re8e7- Re1e2- Rf8e8- Rd1e1- Re7e4x Re2e4x Re8e4x Re1e4x Kg8f7- Re4e7+ Kf7g6- Re7a7x Ph7h5- Ra7b7- Ph5h4- Bg3f2- Ph4h3- Pg2h3x Kg6h5- Rb7b6x Kh5g6- Rb6c6- Kg6h5- Rc6c5x Kh5g6- Rc5c6- Kg6h5- Rc6c5- Kh5g6- Rc5c6- Kg6h5- Rc6c5- Kh5g6- Rc5c6- Kg6h5- Rc6c5- Kh5g6- Rc5c6- Kg6h5- Rc6c5- ,96,fivefold_repetition,1/2-1/2,"[29, 28, -50, 46, 27, 57, 31, 24, 12, 36, 23, 58, 51, 47, -65, -46, -58, -3, -60, 51, -135, 107, -288, -296, -452, 132, -487, 188, 185, 185, 184, 219, 157, 191, 180, 197, 180, 250, 207, 205, 219, 235, 214, 257, 150, 145, 155, 255, 169, 156, 148, 194, 77, 60, 34, 349, 44, 49, 52, 523, 549, 557, 561, 607, 61, 633, 571, 596, 560, 587, 549, 551, 555, 641, 562, 723, 554, 753, 580, 769, 571, 877, 582, 1009, 564, 99978, 0, 99983, 0, 99983, 0, 99985, 0, 99987, 0]",13.8,1.3863636363636365
Pe2e4- Pe7e6- Pd2d3- Pc7c5- Ng1f3- Nb8c6- Bf1e2- Pd7d5- Pe4d5x Pe6d5x Ke1g1- Ng8f6- Rf1e1- Bf8e7- Bc1g5- Ke8g8- Bg5f6x Be7f6x Nb1c3- Pd5d4- Nc3e4- Bf6e7- Ne4g3- Bc8e6- Nf3d2- Qd8c7- Nd2e4- Ra8d8- Be2f3- Pf7f5- Ne4d2- Be7d6- Nd2c4- Bd6g3x Ph2g3x Qc7f7- Nc4d2- Pf5f4- Pg3g4- Ph7h5- Pg4h5x Qf7h5x Bf3h5x Rf8f6- Bh5f3- Rd8f8- Nd2e4- Rf6h6- Ne4c5x Rf8f6- Nc5e6x Rf6e6x Bf3c6x Pb7c6x Qd1f3- Re6f6- Qf3e4- Rf6g6- Qe4e8+ Kg8h7- Qe8e4- ,62,invalid_move,*,"[29, 48, 1, 5, 5, 7, -16, -17, -14, -18, -20, -28, -31, -28, -50, -51, -114, -126, -107, -35, -49, -53, -75, -58, -59, -8, -118, -100, -106, 58, -41, 467, -49, 53, 36, 101, 22, 78, 38, 103, 100, 535, 550, 552, 527, 646, 555, 580, 561, 682, 711, 760, 628, 636, 618, 717, 541, 704, 609, 620, 590]",1.0,2.2
Pe2e4- Pe7e6- Pd2d4- Pf7f5- Pe4f5x Pe6f5x Ng1f3- Ng8f6- Bf1d3- Pd7d5- Ke1g1- Bf8d6- Rf1e1+ Ke8f7- Nf3e5+ Kf7g8- Ne5f3- Nf6e4- Nf3e5- Bd6e5x Pd4e5x Pc7c6- Pf2f3- Ne4c5- Bd3f5x Bc8f5x Qd1d5$ Nc5e6- Qd5d8$ Ne6d8x Pf3f4- Nb8d7- Nb1c3- Nd8e6- Bc1e3- Ra8d8- Ra1d1- Nd7b6- Rd1d8$ Ne6d8x Re1d1- Nd8e6- Pg2g4- Bf5c2x Rd1d7- Bc2e4- Nc3e4x Nb6d7x Ne4d6- Nd7b6- Pf4f5- Ne6c5- Be3c5x Nb6d7- ,55,invalid_move,*,"[29, 25, 47, 112, 130, 166, 167, 175, 164, 174, 184, 218, 210, 235, 208, 260, 133, 301, 84, 110, 113, 205, 168, 162, -245, -258, -664, -180, -204, -208, -273, -221, -226, -219, -298, -213, -201, -193, -181, -193, -252, -180, -372, -45, -487, 446, -260, -265, -381, -263, -278, 231, 210, 414]",1.6296296296296295,3.0
Pe2e3- Pe7e5- Pd2d3- Pf7f5- Pf2f3- Ng8f6- Pg2g3- Pd7d5- Bf1g2- Bf8d6- Ng1e2- Ke8g8- Ke1g1- Pc7c6- Pc2c3- Bc8e6- Pb2b3- Nb8d7- Bc1b2- Qd8e7- Nb1d2- Ra8e8- Pe3e4- Pf5e4x Pd3e4x Pd5e4x Pf3e4x Nf6g4- Nd2f3- Nd7c5- Qd1c2- Be6f7- Ra1d1- Bf7h5- Ph2h3- Ng4e3- Qc2d2- Ne3d1x Rf1d1x Bh5f3x Bg2f3x Nc5e6- Qd2d6x Qe7d6x Rd1d6x Ne6g5- Bf3g4- Re8d8- Rd6d8x Rf8d8x Bg4f5- Ph7h6- Ph3h4- Ng5f7- Bf5e6- Kg8f8- Be6f7x Kf8f7x Kg1f2- Kf7e6- Kf2e3- Ke6d6- Ke3d3- Rd8f8- Kd3c4- Rf8f2- Ne2c1- Rf2b2x Nc1d3- Rb2a2x Nd3e5x Ra2c2- Ne5d3- Rc2c3$ Kc4b4- Rc3d3x Pe4e5+ Kd6e6- Kb4c5- Rd3d5+ Kc5c4- Rd5e5x Kc4d4- Re5d5+ Kd4e4- Rd5d4+ Ke4e3- Rd4h4x Ke3f3- Rh4b4- Kf3e3- Rb4b3$ Ke3d2- Rb3b4- Kd2c3- Rb4a4- Kc3b3- Ra4a5- Kb3c3- Ra5a4- Kc3b3- Ra4a5- Kb3c3- Ra5a4- Kc3b3- Ra4a5- Kb3c3- Ra5a4- Kc3b3- Ra4a5- Kb3c3- Ra5a4- ,113,fivefold_repetition,1/2-1/2,"[19, 27, -37, 12, -62, -36, -105, -112, -119, -108, -108, -83, -85, -93, -116, -115, -108, -105, -173, -157, -163, -177, -271, -311, -315, -311, -389, -397, -384, -345, -472, -302, -411, -82, -427, -445, -446, -453, -556, -503, -527, -380, -459, -454, -463, 199, 36, 125, 124, 132, 12, 179, 0, 192, -282, 178, -55, 128, -24, 161, 158, 323, 131, 151, 53, 86, -445, -470, -524, -510, -578, -449, -442, 353, -607, -633, -638, -650, -683, -650, -657, -623, -637, -661, -671, -491, -678, -548, -676, -705, -948, -978, -99986, -99984, -99985, -99985, -99985, -99984, -99986, -99986, -99986, -99986, -99987, 0, -99987, 0, -99987, 0, -99987, 0, -99987, 0]",5.166666666666667,20.9375
Pe2e4- Pc7c5- Pd2d4- Pd7d6- Pd4d5- Pe7e6- Pc2c4- Pe6d5x Pc4d5x Ng8f6- Nb1c3- Bf8e7- Bf1c4- Ke8g8- Ng1f3- Pa7a6- Ke1g1- Pb7b5- Bc4b3- Pc5c4- Bb3c2- Bc8g4- Ph2h3- Bg4h5- Pg2g4- Bh5g6- Nf3h4- Bg6e4x Nc3e4x Nf6e4x Bc2e4x Be7h4x Qd1f3- Qd8f6- Qf3f6x Bh4f6x Bc1e3- Nb8d7- Ra1c1- Nd7e5- Pf2f4- Ne5d3- Rc1c2- Nd3c5- Be3c5x Pd6c5x Rf1c1- Ra8d8- Pb2b3- Pc4b3x Pa2b3x Rd8d5x Be4d5x Rf8d8- Bd5c6- Rd8d2- Rc2d2x Bf6d4+ Kg1g2- Bd4e3- Rd2d8+ ,62,checkmate,1-0,"[29, 38, 0, 153, 73, 69, 94, 76, 72, 61, 66, 103, 90, 94, 66, 78, 55, 49, -41, 72, 74, 86, 82, 163, 145, 143, 81, 140, 148, 121, -109, -141, -191, -153, -180, -176, -333, -208, -341, -117, -222, -70, -498, -161, -159, -166, -201, -173, -237, -135, -125, 377, 416, 434, 345, 619, 624, 626, 631, 99999, 100000]",3.689655172413793,3.4827586206896552
Pe2e4- Pe7e6- Pd2d4- Pf7f5- Pe4f5x Pe6f5x Ng1f3- Ng8f6- Bf1d3- Pd7d5- Ke1g1- Bf8d6- Rf1e1+ Ke8f7- Nf3e5+ Kf7g8- Ne5f3- Nf6e4- Bd3e4x Pf5e4x Nf3e5- Bd6e5x ,23,invalid_move,*,"[29, 43, 42, 154, 184, 164, 158, 169, 175, 185, 180, 205, 206, 228, 182, 293, 128, 312, -17, 65, 67, 75]",1.8181818181818181,3.9
Pd2d4- Pd7d5- Pc2c4- Pc7c6- Nb1c3- Pe7e6- Pe2e4- Pd5e4x Nc3e4x Ng8f6- Ne4f6$ Qd8f6x Ng1f3- Bf8b4+ Bc1d2- Bb4d2$ Qd1d2x Ke8g8- Bf1d3- Nb8d7- Ke1g1- Pe6e5- Pd4e5x Nd7e5x Nf3e5x Qf6e5x Rf1e1- Qe5f6- Re1e3- Bc8e6- Ra1e1- Ra8d8- Re3e6x Pf7e6x Re1e6x Qf6f7- Re6e2- Rd8d3x Qd2d3x Qf7c4x Qd3c4$ Kg8h8- Qc4c3- Ph7h6- Qc3e3- Rf8f7- Qe3e8+ Kh8h7- Qe8f7x Kh7h8- Qf7g7$ Kh8g7x Re2e7+ Kg7f6- Re7b7x Kf6e5- Rb7a7x Ke5d4- Ra7g7- Kd4c4- Rg7g6- Kc4b4- Rg6h6x Kb4c4- Rh6c6$ Kc4b4- Rc6b6+ Kb4c4- Pa2a4- Kc4d4- Pa4a5- Kd4c4- Pa5a6- Kc4d4- Pa6a7- Kd4c4- Qa7a8- Kc4d4- Qa8a4+ Kd4e5- Rb6b5+ Ke5f6- Qa4a6+ Kf6f7- Rb5b7+ Kf7f8- Qa6a8+ ,88,checkmate,1-0,"[31, 27, 29, 33, 38, 38, 48, 57, 57, 45, 56, 57, 52, 57, 61, 64, 73, 91, 86, 85, 32, 31, -10, -8, -7, 0, -7, -4, -5, 4, -23, -27, -265, -258, -554, -216, -248, 167, 150, 99994, 99995, 99995, 738, 99987, 657, 99995, 99996, 99997, 99998, 99998, 585, 600, 601, 601, 613, 621, 635, 844, 848, 970, 661, 99988, 714, 974, 99982, 99989, 99987, 99988, 99990, 99990, 99991, 99992, 99993, 99993, 99994, 99995, 99996, 99996, 99997, 99997, 99997, 99997, 99998, 99998, 99999, 99999, 100000]",14.925925925925926,17.26923076923077
Pd2d4- Pd7d5- Pc2c4- Pc7c6- Nb1c3- Ng8f6- Pe2e3- Pe7e6- Ng1f3- Bf8e7- Bf1e2- Ke8g8- Ke1g1- Nb8d7- Pb2b3- Pa7a6- Bc1b2- Pb7b5- Pc4d5x Pc6d5x Ra1c1- Bc8b7- Nf3e5- Ra8c8- Ne5d7x Qd8d7x Pa2a3- Rf8d8- Pb3b4- Nf6e4- Nc3e4x Pd5e4x Qd1d2- Pf7f5- Pf2f3- Be7f6- Pf3e4x Pf5e4x Rf1f6x Pg7f6x Rc1f1- Kg8h8- Be2g4- Pf6f5- Bg4h3- Rd8g8- Rf1f2- Rg8g6- Pg2g3- Rc8g8- Kg1h1- Pf5f4- Pe3f4x Rg6g3x Ph2g3x Rg8g3x Bh3g2- Qd7g7- Rf2f1- ,60,invalid_move,*,"[31, 27, 29, 33, 38, 38, 32, 39, 39, 44, 32, 27, 27, 26, 23, 31, 25, 73, -1, 20, 10, 7, -14, -7, -26, -25, -21, -15, -25, -22, -58, -73, -85, -34, -111, -59, -92, -48, -251, -160, -199, -73, -153, 398, -320, 399, -328, 133, -321, 400, -312, 462, -332, 367, 431, 557, 75, 509, -276]",0.9655172413793104,2.586206896551724
Pe2e4- Pe7e6- Pd2d4- Pa7a6- Nb1c3- Pb7b5- Bc1e3- Bc8b7- Ng1f3- Pb5b4- Nc3e2- Pa6a5- Pc2c3- Pb4c3x Pb2c3x Pc7c5- Pd4c5x Bf8c5x Be3c5x Bb7e4x Bc5d4- Be4f3x Pg2f3x Ng8f6- Bf1g2- Ke8g8- Ke1g1- Nb8c6- Bd4f6x Qd8f6x Ne2g3- Nc6e5- Ng3e4- Qf6g6- Ne4g3- Pd7d5- Qd1d4- Ne5f3$ Bg2f3x Qg6f6- Qd4f6x Pg7f6x Bf3g2- Kg8h8- Ra1b1- Rf8g8- Rb1b7- Ra8f8- Rf1b1- Rg8g7- Rb7b8- Rf8b8x Rb1b8$ Rg7g8- Rb8g8$ Kh8g8x Ng3e2- Kg8g7- Ne2d4- Kg7g6- Nd4c6- Pe6e5- Nc6a5x Pd5d4- Pc3d4x Pe5d4x Na5c6- Pd4d3- Nc6d4- Kg6g5- Nd4f3+ Kg5f4- Nf3d2- Kf4e5- Nd2c4+ Ke5d4- Nc4d2- Kd4c3- Nd2e4+ Kc3c2- Ne4f6x Kc2c1- Nf6h7x Kc1c2- Nh7g5- Kc2c1- Ng5f7x Kc1c2- Nf7e5- Kc2c1- Ne5d3$ Kc1c2- Nd3b4+ Kc2c1- Nb4d3+ Kc1c2- Nd3b4+ Kc2c1- Nb4d3+ Kc1c2- Nd3b4+ Kc2c1- Nb4d3+ Kc1c2- Nd3b4+ Kc2c1- Nb4d3+ ,108,fivefold_repetition,1/2-1/2,"[29, 48, 36, 56, 48, 83, 44, 47, -51, -61, -56, 70, -60, 89, -26, 186, 36, 448, 471, 458, 377, 427, 365, 368, 359, 362, 346, 359, 363, 357, 249, 329, 232, 351, 335, 343, 294, 501, 475, 532, 527, 541, 496, 525, 484, 509, 472, 473, 507, 541, 497, 519, 540, 557, 560, 564, 532, 537, 517, 519, 525, 565, 549, 569, 582, 617, 583, 602, 564, 624, 570, 595, 600, 621, 548, 550, 519, 535, 518, 613, 474, 621, 496, 559, 599, 578, 645, 782, 657, 99974, 99983, 99987, 99984, 99988, 99987, 99988, 99987, 99989, 0, 99988, 0, 99989, 0, 99988, 0, 99989, 0]",15.042553191489361,4.804347826086956
Pd2d4- Pd7d5- Pc2c4- Pc7c6- Nb1c3- Ng8f6- Pe2e3- Bc8f5- Ng1f3- Pe7e6- Bf1e2- Bf8d6- Ke1g1- Ke8g8- Pb2b3- Nb8d7- Bc1b2- Pa7a6- Ra1c1- Ra8c8- Pa2a3- Pb7b5- Pc4c5- Bd6b8- Pb3b4- Nf6e4- Nc3e4x Bf5e4x Nf3d2- Be4g6- Be2f3- Pf7f5- Ph2h3- Qd8h4- Bf3e2- Qh4g5- Nd2f3- Qg5h6- Nf3e5- Nd7e5x Pd4e5x Bb8e5x Bb2e5x Qh6g5- Be5g3- Pe6e5- Be2f3- Pe5e4- Bf3e2- Rc8d8- Qd1d4- Rd8d7- Rc1d1- Rf8d8- Pf2f4- Pe4f3x Be2f3x ,58,invalid_move,*,"[31, 32, 37, 35, 26, 37, 40, 23, 19, 24, -7, 21, 4, 9, -25, -25, -42, -25, -23, -9, -35, -21, -39, -53, -67, -88, -107, -12, -29, 18, -28, 4, -61, -46, -60, -31, -16, -2, 0, 24, 29, 457, 460, 519, 469, 499, 351, 426, 368, 389, 368, 418, 374, 459, -102, 380, -67]",1.9285714285714286,1.25
Pd2d4- Pe7e6- Pe2e3- Pf7f5- Pc2c4- Ng8f6- Nb1c3- Pd7d5- Pc4d5x Pe6d5x Ng1f3- Pc7c6- Bf1d3- Bf8d6- Ke1g1- Ke8g8- Ph2h3- Nb8d7- Rf1e1- Nf6e4- Nc3e4x Pf5e4x Bd3e2- Nd7f6- Nf3e5- Bd6e5x Pd4e5x Nf6d7- Pf2f4- Pe4f3x Be2f3x Nd7e5x Bf3e2- Ne5g6- Be2f3- Bc8f5- Bf3e2- Qd8b6- Bc1d2- Ra8e8- Bd2c3- Re8e3x Qd1d2- Re3e2$ ,45,invalid_move,*,"[31, 38, 16, 48, 43, 41, 45, 37, 42, 44, 19, 17, 8, 6, 8, 8, -19, 115, -137, -139, -413, -453, -438, -205, -200, -196, -208, -194, -217, -209, -209, -212, -555, -185, -355, -156, -411, -279, -342, -228, -386, 167, -99990, -550]",2.8095238095238093,1.4761904761904763
Pe2e4- Pe7e6- Pd2d3- Pd7d6- Ng1f3- Ph7h6- Bf1e2- Pg7g6- Ke1g1- Bf8g7- Pc2c3- Ng8e7- Pd3d4- Ke8g8- Bc1e3- Pf7f5- Pe4f5x Pe6f5x Nb1d2- Pg6g5- Nf3e1- Pf5f4- Be3f4x Pg5f4x Be2f3- Ne7g6- Ne1d3- Nb8c6- Nd2e4- Bc8f5- Ne4d2- Qd8g5- Nd2e4- Bf5e4x Bf3e4x Ng6h4- Pg2g3- Pf4g3x Pf2g3x Nh4g6- Be4g6x Qg5g6x Qd1f3- Rf8f3x Rf1f3x Ra8f8- Ra1f1- Rf8f3x Rf1f3x ,50,invalid_move,*,"[29, 43, 5, 37, 20, 77, 35, 68, 43, 63, 25, 30, 38, 43, 7, 26, 25, 26, -274, 2, -260, -266, -263, -266, -292, -216, -297, -305, -347, -325, -492, -341, -329, -280, -307, -255, -274, -244, -280, -124, -258, -104, -515, -564, -524, -500, -554, -558, -555]",2.9166666666666665,2.75
Pe2e4- Pe7e5- Pd2d3- Pf7f5- Nb1c3- Ng8f6- Pe4f5x Pd7d5- Ng1f3- Bc8f5x Bf1e2- Pc7c6- Ke1g1- Bf8d6- Bc1g5- Ke8g8- Ph2h3- Ph7h6- Bg5h4- Nb8d7- Bh4g3- Qd8c7- Nf3h4- Bf5h7- Nh4f3- Ra8e8- Nf3h4- Pe5e4- Pd3e4x Pd5e4x Qd1d6x Qc7d6x Bg3d6x Re8d8- Bd6f8x Rd8f8x Ra1d1- Nd7e5- Rd1d6- Ne5c4- Rd6d4- Nc4b2x Rf1b1- Nb2a4- Nc3a4x Pb7b5- Na4c5- Pa7a5- Nc5e6- Rf8e8- Ne6c7- Re8c8- Nc7e6- Pa5a4- Ne6c5- Rc8a8- Nc5b7- Pb5b4- Nb7d6- Pb4b3- Pa2b3x Pa4b3x Rb1b3x Ra8a1+ Kg1h2- Nf6d5- Rb3b8+ ,68,checkmate,1-0,"[29, 33, -6, 82, 42, 104, 104, 119, -5, 56, -70, -23, -25, -12, -96, -94, -115, -98, -100, -40, -124, -122, -161, -154, -187, -150, -215, -160, -232, 363, 362, 363, 348, 487, 480, 488, 431, 495, 473, 568, 460, 473, 473, 557, 527, 544, 534, 567, 571, 584, 500, 507, 491, 535, 499, 569, 482, 563, 562, 590, 573, 613, 576, 661, 683, 99999, 100000]",0.0,0.8125
Pd2d4- Pd7d6- Pc2c4- Pc7c6- Nb1c3- Ng8f6- Pe2e4- Pg7g6- Pf2f4- Bf8g7- Ng1f3- Ke8g8- Bf1d3- Nb8d7- Ke1g1- Pe7e5- Pf4e5x Pd6e5x Pd4d5- Pc6d5x Pc4d5x Nd7c5- Bd3c2- Bc8g4- Qd1e2- Qd8b6- Kg1h1- Ra8c8- Ph2h3- Bg4f3x Rf1f3x Nc5d7- Bc1e3- Qb6c7- Ra1f1- Nd7c5- Be3c5x Qc7c5x Rf3f6x Bg7f6x Rf1f6x Qc5d4- Qe2f3- Qd4d2- Qf3g3- Qd2c2x Rf6f3- Qc2b2x Rf3f2- Qb2c3x Rf2f3- Qc3d4- Rf3f2- Rc8c1+ Kh1h2- Qd4e4x Rf2f3- Qe4e1- Rf3f2- Rc1c2- Rf2c2x Qe1g3$ Kh2g3x Rf8d8- Rc2c7- Pe5e4- Rc7b7x Pe4e3- Rb7a7x Pe3e2- Ra7e7- Qe2e1+ Kg3h2- Qe1e7x Pd5d6- Qe7d6$ Pg2g3- Qd6d2+ Kh2g1- ,80,invalid_move,*,"[31, 58, 28, 63, 73, 77, 82, 78, 94, 98, 98, 105, 48, 129, 50, 53, 51, 52, 53, 58, 62, 65, 81, 60, 21, 66, 58, 56, -6, 55, 58, 99, -404, 157, 103, 438, 317, 321, 320, 318, 321, 341, 340, 352, -113, -129, -186, -232, -504, -511, -516, -514, -558, -513, -521, -535, -578, -568, -99999, -395, -379, -362, -345, -377, -391, -166, -129, -22, -478, 1, -2, 12, -99994, -99995, -99996, -99997, -99997, -99998, -99998]",16.714285714285715,30.65714285714286
Pe2e4- Pe7e6- Pd2d4- Pf7f5- Pe4f5x Pe6f5x Ng1f3- Ng8f6- Bf1d3- Pd7d5- Ke1g1- Bf8d6- Rf1e1+ Ke8f7- Nf3e5+ Kf7g8- Ne5f3- Nb8c6- Pc2c3- Bc8d7- Bc1g5- Qd8e8- Nb1d2- Qe8g6- Nf3e5- Nc6e5x Pd4e5x Bd6e5x Bg5f6x Be5f6x Nd2f3- Ra8e8- Re1e8$ ,34,invalid_move,*,"[29, 34, 43, 164, 174, 175, 167, 169, 170, 173, 174, 219, 210, 214, 195, 273, 142, 175, 94, 194, 132, 502, 126, 249, -118, 166, 164, 210, 93, 120, 90, 85, 22]",0.3125,1.3125
Pe2e4- Pe7e6- Pd2d4- Pg7g6- Pc2c4- Bf8g7- Nb1c3- Ng8e7- Ng1f3- Ke8g8- Bf1e2- Pd7d5- Pc4d5x Pe6d5x Pe4e5- Pc7c5- Ke1g1- Pc5d4x Nf3d4x Nb8c6- Nd4c6x Ne7c6x Bc1e3- Bc8e6- Pf2f4- Qd8b6- Be3b6x Pa7b6x Be2f3- Ra8d8- Qd1e2- Nc6d4- Qe2f2- Nd4f3$ Qf2f3x Pd5d4- Nc3e4- Be6d5- Ne4f6+ Bg7f6x Pe5f6x Bd5f3x Rf1f3x Rd8d5- Ra1e1- Rf8d8- Rf3d3- Rd5c5- Rd3d4x Rc5c2- Rd4d8$ ,52,checkmate,1-0,"[29, 34, 33, 117, 69, 98, 90, 70, 65, 94, 41, 37, 39, 42, 35, 40, -48, -41, -55, -33, -46, -27, -437, -32, -408, 499, 480, 491, 477, 481, 443, 469, 472, 481, 477, 467, 484, 490, 286, 285, 0, 0, 0, 11, -10, 16, 14, 201, 183, 99999, 100000]",1.4583333333333333,0.9166666666666666
Pd2d4- Pd7d6- Pc2c4- Pg7g6- Nb1c3- Bf8g7- Pe2e4- Ng8f6- Pf2f4- Ke8g8- Ng1f3- Pc7c5- Pd4d5- Pa7a6- Bf1d3- Pb7b5- Pc4b5x Pa6b5x Ke1g1- Pb5b4- Nc3e2- Bc8a6- Bd3a6x Nb8a6x Qd1d3- Na6c7- Pe4e5- Pd6e5x Pf4e5x Nf6d5x Ne2f4- Nd5f4x Bc1f4x Nc7e6- Bf4g3- Qd8d3x Rf1d1- Qd3f5- Rd1d7- Ra8d8- Ra1d1- Rd8d7x Rd1d7x ,44,invalid_move,*,"[31, 54, 28, 53, 52, 54, 48, 53, 26, 30, 30, 21, 27, 69, 52, 50, -51, -32, -150, -131, -138, -105, -115, -112, -204, -125, -254, -206, -212, -211, -305, -300, -594, -250, -653, -651, -669, -663, -680, -637, -701, -713, -721]",1.0952380952380953,0.2857142857142857
Pe2e4- Pe7e6- Pd2d4- Pf7f6- Pe4e5- Pd7d6- Pe5f6x Ng8f6x Ng1f3- Bf8e7- Bf1d3- Ke8g8- Ke1g1- Pe6e5- Pd4e5x Pd6e5x Nf3e5x Be7d6- Ne5f3- Bd6e7- Rf1e1- Be7d6- Nb1c3- Bd6e7- Bc1g5- Be7d6- Bg5f6x Qd8f6x Nc3e4- Qf6e7- Ne4d6x Pc7d6x Bd3c4+ Kg8h8- Qd1d4- Nb8c6- Qd4c3- Nc6e5- Nf3e5x Pd6e5x Re1e5x Qe7f6- Re5e8- Qf6c3x Pb2c3x Rf8e8x Bc4f7- Re8f8- Bf7b3- Bc8e6- Ra1d1- Be6b3x Pa2b3x Ra8e8- Rd1d7- Re8e1+ ,57,checkmate,0-1,"[29, 48, 36, 135, 72, 128, 55, 48, 54, 60, 55, 62, 56, 199, 196, 271, 156, 212, 112, 273, 205, 246, 237, 369, 295, 348, 305, 317, 317, 471, 437, 701, 647, 658, 332, 568, 263, 348, 335, 339, 350, 343, -471, 99999, -480, -479, -482, -480, -491, -221, -497, -515, -502, -490, -99999, -100000]",12.038461538461538,11.615384615384615
Pd2d4- Pd7d5- Pc2c4- Pc7c6- Nb1c3- Ng8f6- Pe2e3- Bc8f5- Ng1f3- Pe7e6- Bf1e2- Bf8d6- Ke1g1- Ke8g8- Pc4d5x Pe6d5x Pa2a3- Nb8d7- Pb2b4- Rf8e8- Bc1b2- Nf6e4- Nc3e4x Bf5e4x Nf3d2- Be4g6- Be2f3- Nd7f6- Ra1c1- Qd8d7- Ph2h3- Ra8c8- Rf1e1- Ph7h6- Pe3e4- Pd5e4x Nd2e4x Nf6e4x Bf3e4x Bg6e4x Re1e4x Re8e4x Qd1f3- Re4e1+ Rc1e1x Rc8e8- Re1e8$ Qd7e8x Pd4d5- Pc6d5x Bb2d4- Qe8e1+ ,53,checkmate,0-1,"[31, 30, 37, 35, 41, 44, 26, 33, 20, 23, 0, 17, 1, 14, -23, -22, -38, -40, -85, -82, -78, -84, -112, -80, -96, -79, -107, -118, -106, -68, -143, -104, -147, -91, -291, -308, -432, -439, -511, -537, -549, -548, -567, -41, -31, -37, -47, -39, -99999, -113, -99999, -100000]",3.25,1.625
Pd2d4- Pd7d5- Pc2c3- Pc7c5- Ng1f3- Nb8c6- Bc1f4- Ng8f6- Pe2e3- Pe7e6- Bf1d3- Bf8d6- Bf4g3- Ke8g8- Ke1g1- Pa7a6- Nb1d2- Pb7b5- Pa2a3- Bc8b7- Rf1e1- Ra8c8- Qd1e2- Pc5c4- Bd3c2- Nc6a5- Pe3e4- Na5b3- Ra1d1- Nb3d2x Rd1d2x Pd5e4x Bc2e4x Nf6e4x Qe2e4x Bb7e4x Re1e4x Qd8c7- Nf3e5- Pf7f6- Ne5f3- Pe6e5- Pd4e5x Pf6e5x Re4e5x Bd6e5x Nf3e5x Qc7e5x Bg3e5x Rc8e8- Be5d4- Rf8f7- Pg2g3- Rf7e7- Kg1g2- Re7e2- Rd2e2x Re8e2x Kg2f3- Re2b2x Ph2h4- Rb2b3- Kf3g4- Rb3a3x Pf2f4- Ra3c3x Pf4f5- Rc3d3- Pf5f6- Pg7f6x Bd4f6x Rd3g3$ Kg4f5- Rg3f3+ Kf5e6- Rf3f6$ Ke6f6x Pc4c3- Kf6e5- Pc3c2- Ke5d4- Qc2c1- Kd4e5- Qc1c5+ Ke5f4- Pb5b4- Kf4e4- Pb4b3- Ke4f4- Pb3b2- Kf4e4- Qb2b1+ Ke4f4- Qb1b4+ Kf4f3- Qc5c3+ Kf3e2- Qb4b2+ Ke2d1- Qc3c1+ ,101,checkmate,0-1,"[31, 33, 19, 14, 11, 58, 7, 19, 9, 27, -13, 10, 5, 33, 5, 40, 38, 52, 29, 27, 31, 30, 27, 30, 42, 68, 50, 271, 21, 27, -77, 1, -498, -500, -567, -507, -507, -451, -504, -508, -515, -436, -419, -426, -499, -500, -514, -238, -232, -235, -99999, -149, -135, -41, -328, -300, -403, -409, -401, -410, -487, -490, -507, -519, -520, 342, -588, -571, -817, -595, -637, -84, -631, -649, -726, -879, -922, -99983, -99988, -99990, -99991, -99993, -99993, -99992, -99993, -99994, -99994, -99995, -99995, -99996, -99996, -99997, -99998, -99997, -99997, -99998, -99998, -99999, -99999, -100000]",63.026315789473685,51.37837837837838
Pd2d4- Pd7d5- Pc2c4- Pc7c5- Pc4d5x Qd8d5x Nb1c3- Qd5d8- Pe2e4- Pc5d4x Nc3d5- Pe7e6- Nd5f4- Ng8f6- Bf1b5+ Bc8d7- Bb5d7$ Nb8d7x Ng1f3- Bf8c5- Ke1g1- Ke8g8- Pe4e5- Nf6d5- Nf4d5x Pe6d5x Bc1g5- Pf7f6- Pe5f6x Nd7f6x Bg5f6x Qd8f6x Nf3d4x Bc5d4x Qd1d4x Qf6d4x Ra1d1- Qd4b2x Rd1d5x Ra8d8- Rd5d8x Rf8d8x Pg2g3- Rd8d2- Ph2h4- Qb2a2x Kg1g2- Qa2d5+ Kg2h3- Qd5f5+ Kh3g2- Qf5e4+ Kg2h3- Qe4f5+ Pg3g4- Qf5f3+ Kh3h2- Qf3f2$ Kh2h3- Qf2g3+ Kh3g3x Rd2d3+ Kg3f4- Rd3a3- Rf1c1- Ra3a4+ Kf4e5- Ra4a5+ Ke5d6- Ra5a6+ Kd6c7- Ra6c6+ Kc7b7x Rc6c1x Kb7a7x Rc1b1- Ka7a6- Rb1a1+ Ka6b5- Ra1b1+ Kb5c4- Rb1c1+ Kc4d4- Rc1d1+ Kd4e3- Rd1e1+ Ke3f4- Re1f1+ Kf4g3- Rf1g1+ Kg3f2- Rg1g4x Kf2f3- Rg4h4x Kf3g3- Rh4h5- Kg3f3- Rh5g5- Kf3f4- Rg5f5+ Kf4e4- Rf5f6- Ke4e5- Rf6e6+ Ke5e6x Pg7g5- Ke6f5- Pg5g4- Kf5g4x Ph7h5+ Kg4h5x ,112,insufficient_material,1/2-1/2,"[31, 33, 32, 72, 49, 70, 10, 114, -141, -120, -192, -210, -177, -189, -228, -187, -185, -189, -189, -26, -115, -25, -19, -27, -24, -18, -64, -5, 9, 14, -10, -1, -498, -504, -585, -601, -605, -609, -605, -656, -671, -706, -728, -738, -784, -798, -99980, -99984, -99984, -99986, -99986, -99988, -99990, -99989, -99995, -99996, -99996, -595, -99999, -333, -337, -345, -341, -237, -306, -319, -396, -344, -341, -334, -451, -490, -578, -618, -851, -685, -882, -766, -884, -655, -664, -665, -697, -716, -738, -601, -779, -576, -836, -882, -907, -918, -99980, -99983, -99986, -99986, -99986, -99987, -99987, -658, -99988, -99989, -99989, -655, -652, -524, -517, 0, 0, 0, 0]",8.068181818181818,12.318181818181818
Pe2e4- Pe7e6- Pd2d3- Pd7d6- Pf2f4- Ph7h6- Ng1f3- Pa7a6- Bf1e2- Pb7b6- Ke1g1- Bc8b7- Nb1c3- Nb8d7- Bc1e3- Qd8e7- Qd1d2- Pg7g6- Pf4f5- Pg6f5x Pe4f5x Pe6f5x Be3h6x Ng8h6x Qd2h6x Bf8h6x Nf3d4- Bh6e3+ Kg1h1- Be3d4x Be2h5- Bd4c3x Pb2c3x Ke8c8- Ra1e1- Qe7h4- Bh5f3- Qh4h2$ ,39,checkmate,0-1,"[29, 34, 2, 42, 17, 34, 33, 52, 46, 81, 89, 72, 64, 84, 47, 110, 64, 90, 0, -10, -5, 151, -540, -353, -589, -589, -99994, -99995, -99998, -1207, -99992, -804, -946, -883, -1052, -1490, -99999, -100000]",29.0625,0.8666666666666667
Pe2e4- Pd7d6- Pd2d4- Pc7c6- Pc2c4- Nb8d7- Nb1c3- Qd8c7- Ng1f3- Pe7e5- Bf1e2- Ng8f6- Ke1g1- Bf8e7- Ph2h3- Ke8g8- Bc1e3- Rf8e8- Qd1d2- Nd7f8- Ra1d1- Nf8g6- Pd4d5- Pc6c5- Pa2a3- Pa7a6- Pb2b4- Pb7b6- Pb4c5x Pb6c5x Nc3a4- Bc8d7- Na4b6- Ra8b8- Nb6d7x Qc7d7x Rd1b1- Rb8b1x Rf1b1x Re8b8- Rb1b8$ Qd7c8- Rb8c8$ Be7f8- Rc8f8$ Ng6f8x Be3g5- Nf8g6- Qd2a5- Nf6e4x Qa5d8+ Ng6f8- Qd8d6x Ne4d6x Bg5e7- Nd6c4x Be7f8x Kg8f8x Be2c4x Pf7f6- Nf3d2- Kf8e7- Nd2e4- Ke7d7- Ne4c5$ Kd7d6- Nc5a6x ,68,invalid_move,*,"[30, 55, 53, 66, 68, 80, 85, 103, 104, 105, 107, 112, 101, 96, 87, 90, 101, 107, 94, 97, 76, 80, 82, 78, 81, 110, 115, 110, 53, 60, -156, 17, -428, 83, 73, 61, -5, 30, 29, 509, 519, 735, 733, 740, 653, 669, 605, 670, 688, 99993, 99994, 99994, 480, 479, 505, 615, 542, 551, 559, 577, 584, 571, 584, 583, 588, 647, 582]",11.625,8.225806451612904
Pd2d4- Pd7d6- Pc2c4- Pc7c6- Nb1c3- Ng8f6- Pe2e4- Pg7g6- Pf2f4- Bf8g7- Ng1f3- Ke8g8- Bf1d3- Nb8d7- Ke1g1- Pe7e5- Pf4e5x Pd6e5x Pd4d5- Pc6d5x Pc4d5x Nd7c5- Bd3c2- Bc8g4- Qd1e2- Qd8b6- Kg1h1- Ra8c8- Ph2h3- Bg4f3x Rf1f3x Nc5d7- Bc1e3- Qb6c7- Ra1f1- Pa7a6- Pa2a3- Pb7b5- Pb2b4- Nd7b6- Be3b6x Qc7b6x Rf3f6x Bg7f6x Rf1f6x Rc8c3x Rf6b6x Rc3c2x Qe2c2x Rf8c8- Qc2c8$ Kg8g7- Qc8c6- Pf7f5- Pd5d6- Pf5e4x Pd6d7- Pe4e3- Qd7d8- Pe5e4- Qd8e7+ Kg7h6- Qc6e4x Pe3e2- Qe4e2x Pa6a5- Qe2e3+ ,68,invalid_move,*,"[31, 58, 30, 63, 67, 70, 80, 91, 63, 86, 95, 97, 43, 132, 58, 58, 53, 63, 56, 54, 58, 66, 67, 58, 28, 70, 56, 51, -16, 59, 67, 96, -397, 162, 101, 96, 69, 87, -330, 282, -44, -37, -332, -330, -491, 480, 527, 664, 718, 99993, 99994, 99995, 99996, 99997, 99995, 99996, 99997, 99997, 99998, 99998, 99998, 99998, 99999, 99999, 99998, 99998, 99999]",0.875,5.708333333333333
