Move History,Number of Plies,Outcome,Result,Player Scores,ACPL White,ACPL Black
Pe2e3- Pe7e6- Pf2f3- Pc7c6- Pg2g3- Pd7d5- Ke1e2- Bf8d6- Ke2f2- Nb8d7- Kf2g2- Nd7e5- Ph2h3- Ne5g6- Pd2d3- Ph7h5- Pe3e4- Ph5h4- Pg3g4- Bd6e7- Pf3f4- Pd5e4x Pd3e4x Bc8d7- Pf4f5- Pe6f5x Pe4f5x Ng6e5- Pc2c3- Bd7f5x Bc1f4- Bf5e4+ Kg2h2- Be7d6- Nb1d2- Qd8c7- Nd2e4x Ke8c8- Ne4d6$ Qc7d6x Qd1d6x Rd8d6x Bf4e5x Rd6d2+ Ng1e2- Rd2e2$ Bf1e2x Ng8e7- Ra1f1- Ne7d5- Be5g7x Rh8g8- Bg7h6- Nd5f6- Bh6g5- Nf6d5- Bg5h4x Nd5f4- Bh4g3- Nf4e2x Rf1f2- Ne2g3x Rh1g1- Ng3f5- Rf2f5x Rg8d8- Rf5f7x Rd8d2+ Rg1g2- Rd2b2x Rf7f8+ Kc8d7- Rf8f7+ Kd7d6- Rg2e2- Kd6c5- Re2b2x Kc5c4- Rf7b7x Kc4c3x Rb7a7x Kc3b2x Ra7c7- Kb2c3- Rc7c6$ Kc3d4- Pg4g5- Kd4d5- Pg5g6- Kd5d4- Pg6g7- Kd4d5- Qg7g8+ Kd5c6x Qg8f8- Kc6d7- Kh2g3- Kd7e6- Qf8e8+ Ke6f6- Kg3f4- Kf6g7- Qe8f7+ Kg7h8- Kf4g5- ,106,stalemate,1/2-1/2,"[19, 23, -51, -15, -44, -35, -146, -139, -157, -139, -162, -78, -128, -121, -183, -140, -221, -214, -188, -162, -217, -212, -587, -33, -175, -126, -125, 55, -338, 109, -732, -776, -816, -544, -557, 161, 167, 224, 239, 472, 508, 509, 510, 500, 472, 584, 599, 635, 566, 617, 607, 614, 634, 716, 597, 674, 684, 778, 622, 641, 619, 632, 531, 616, 622, 623, 629, 636, 641, 99995, 749, 783, 663, 783, 286, 794, 842, 1024, 1110, 99992, 99987, 99989, 99985, 99989, 99988, 99988, 99990, 99990, 99989, 99992, 99993, 99993, 99992, 99992, 99991, 99991, 99990, 99990, 99990, 99996, 99997, 99997, 661, 99996, 0]",33.3,25.41025641025641
Pe2e4- Pe7e5- Ph2h4- Qd8f6- Pc2c4- Bf8c5- Pa2a4- Qf6f2$ ,9,checkmate,0-1,"[29, 30, -59, 74, -40, -41, -99999, -100000]",0.3333333333333333,0.0
Pc2c4- Pe7e6- Qd1a4- Pa7a5- Pb2b3- Pb7b6- Pa2a3- Ra8a6- Pd2d3- Pb6b5- Pc4b5x Ra6b6- Pg2g3- Rb6b5x Qa4g4- Pe6e5- Qg4f3- Bf8e7- Qf3d5- Pc7c6- Qd5e5x Rb5e5x Ph2h4- Bc8b7- Pf2f3- Bb7a6- Pa3a4- Qd8b6- Ra1a3- Qb6b4+ Bc1d2- Qb4b3x Pg3g4- Qb3b1$ Ke1f2- Qb1f1$ Kf2g3- Qf1g1$ Kg3f4- Qg1h1x Bd2a5x Qh1f3$ Kf4e5x Qf3g4x Ba5d2- Qg4h4x Pa4a5- Qh4f6+ Ke5e4- Qf6g6+ Ke4d4- Ng8f6- Ra3a1- Qg6g4+ Kd4e3- Nf6d5+ Ke3f2- Nd5f4- Bd2e3- Nf4d3$ Kf2f1- Nd3e5- Be3a7- Qg4h3+ Kf1e1- Qh3h1+ Ke1d2- Qh1a1x Ba7b8x Ne5c4+ Kd2c2- Qa1b2+ Kc2d1- Qb2d2+ ,75,checkmate,0-1,"[13, 29, -14, 9, -175, -123, -207, -87, -241, 128, 122, 186, 100, 400, -137, 39, -150, -111, -615, -194, -603, -599, -638, -593, -673, -614, -690, -657, -726, -669, -663, 265, -851, -869, -874, -664, -1030, -701, -99996, -1258, -99999, -881, -99998, -99998, -99999, -99996, -99998, -99997, -99997, -1086, -99996, -971, -99996, -99993, -99998, -99997, -99997, -99990, -99998, -99995, -99996, -99997, -99997, -99996, -99996, -99994, -99994, -99995, -99996, -99996, -99996, -99997, -99999, -100000]",0.8571428571428571,0.3
Pe2e3- Pb7b6- Nb1c3- Pc7c5- Bf1b5- Ng8f6- Qd1f3- Pe7e6- Ph2h4- Nb8c6- Pa2a4- Bc8b7- Nc3e4- Nf6e4x Qf3e4x Pd7d5- Qe4f3- Bf8e7- Ph4h5- Ke8g8- Ph5h6- Pg7g6- Qf3g3- Nc6e5- Qg3e5x Be7d6- Qe5g7+ ,28,checkmate,1-0,"[19, 30, -26, 45, -62, 49, 51, 354, 42, 32, -79, -76, -160, -153, -145, -62, -138, -117, -128, -122, -124, -121, -344, 159, 121, 99999, 100000]",0.8333333333333334,0.8333333333333334
Pg2g4- Pe7e5- Pe2e4- Pd7d6- Pd2d3- Bc8g4x Pf2f3- Bg4h5- Bf1h3- Qd8h4+ Ke1f1- Bh5f3x Ng1f3x Qh4h3$ Kf1f2- Qh3g4- Rh1g1- Qg4f4- Bc1f4x Pe5f4x Nb1c3- Ng8f6- Nc3b5- Nb8a6- Nb5d4- Pc7c5- Nd4f5- Pg7g6- Nf5d6$ Bf8d6x Nf3g5- Ke8g8- Ng5h7x Nf6h7x Qd1g4- Nh7f6- Qg4g5- Na6b4- Qg5f6x Nb4c2x Rg1g5- Nc2a1x Qf6g6$ Pf7g6x Rg5g6$ Kg8f7- Rg6d6x Na1c2- Rd6d7+ Kf7f6- Rd7b7x Ra8b8- Rb7a7x Rb8b2x Ra7a6+ Kf6g5- Ra6a5- Rf8b8- Ra5c5$ Kg5g6- Rc5c6+ Kg6f7- Rc6c7+ Kf7e6- Rc7c6+ Ke6d7- Rc6g6- Rb2a2x Rg6g7+ Kd7e6- Rg7g6+ Ke6e5- Pd3d4+ Ke5d4x Rg6g4- Kd4c5- Rg4f4x Rb8b2- Rf4f5+ Kc5b6- Kf2f3- Rb2b3+ Kf3f4- Nc2e3- Rf5f6+ Kb6c7- Ph2h4- Rb3b4- Ph4h5- Ne3c4- Kf4g5- Ra2a5+ Kg5g6- Nc4e5+ Kg6g7- Rb4b7- Ph5h6- Ra5a7- Ph6h7- Ne5d7- Rf6f5- Nd7c5- Rf5c5$ Kc7b6+ Kg7f6- Rb7h7x Rc5c6+ Kb6b5- Rc6c5+ Kb5b6- Rc5c6+ Kb6b7- Rc6c5- Rh7h6+ Kf6e7- Rh6h8- Rc5b5+ Kb7c7- Rb5c5+ Kc7b7- Rc5b5+ Kb7a6+ Ke7d6- Rh8d8+ ,125,invalid_move,*,"[-121, -110, -150, -58, -89, 356, -236, -212, -206, -193, -190, 318, -279, -277, -289, -247, -269, 485, 489, 464, 466, 471, 464, 437, 416, 458, 419, 389, 385, 370, 215, 199, -250, -143, -256, -75, -136, 472, 473, 99995, 362, 432, -585, -602, -605, -604, -606, -546, -560, -546, -559, -573, -614, -634, -738, -676, -991, -672, -691, -554, -643, -580, -605, -600, -599, -613, -99993, -511, -585, -609, -741, -685, -99998, -630, -99997, -652, -765, -496, -700, -434, -677, -453, -463, -417, -438, -430, -570, -322, -688, -419, -432, -401, -442, -461, -479, -414, -641, -424, -440, 15, 10, 48, -310, -281, -287, -292, -99988, -296, -99992, -283, -99989, -264, -306, -273, -99997, -278, -99986, -312, -99989, -290, -99989, -99989, -99990, -99988]",36.054545454545455,15.814814814814815
Pg2g3- Pd7d5- Bf1h3- Pe7e6- Pe2e3- Ng8f6- Qd1f3- Bf8d6- Qf3f6x Qd8f6x Bh3e6x Bc8e6x Ng1f3- Nb8c6- Nf3d4- Nc6d4x Pe3d4x Qf6d4x Ke1g1- Qd4e4- Pd2d3- Qe4g2+ Kg1g2x Ke8g8- Bc1g5- Ra8e8- Pf2f4- Be6h3+ Kg2h3x Pf7f6- Rf1e1- Pf6g5x Re1e8x Rf8e8x Kh3g4- Pg5f4x Pd3d4- Pf4g3x Kg4f5- Pg3h2x Kf5g5- Qh2h1- Kg5f5- Qh1f1+ Kf5g4- Qf1f3+ Kg4h4- Re8e4+ Kh4g5- Ph7h6+ Kg5g6- Qf3f5+ Kg6f5x Re4f4+ Kf5g6- Rf4g4+ Kg6h5- Rg4g5+ Kh5h4- Rg5g2- Nb1c3- Pg7g5+ Kh4h5- Bd6f4- Nc3d5x Pg5g4- Nd5f4x Rg2c2x Ra1g1- Pg4g3- Nf4h3- Rc2h2- Rg1g3$ Kg8h7- Rg3g4- Rh2h1- Rg4h4- Rh1g1- Rh4f4- Rg1h1- Rf4h4- Rh1h3x Rh4h3x Pb7b5- Rh3g3- Pc7c5- Pd4c5x Pb5b4- Rg3g1- Kh7h8- Rg1g5- Pa7a5- Pb2b3- Pa5a4- Pb3a4x Pb4b3- Pa2b3x Kh8h7- Pc5c6- Kh7h8- Pc6c7- Kh8h7- Qc7c8- ,104,invalid_move,*,"[5, 13, -135, -14, -48, -46, -129, -102, -558, -571, -669, -650, -856, -680, -739, -764, -769, -692, -707, -621, -619, -73, -75, -35, -78, -51, -255, 203, 214, 216, -518, -138, -154, -155, -288, -284, -463, -482, -607, -588, -99997, -99997, -99999, -99998, -99998, -529, -99999, -99999, -99999, -99999, -99999, -99998, -99998, -473, -562, -562, -572, -558, -567, -468, -490, -436, -426, -240, -259, 237, 258, 257, 169, 289, 14, 182, 162, 275, -409, 274, 249, 638, 282, 299, 277, 514, 517, 567, 99990, 99995, 99996, 99996, 99994, 99996, 711, 99996, 747, 99996, 1085, 99988, 99989, 99995, 99992, 99996, 99997, 99997, 99997]",1.5945945945945945,15.891891891891891
Pf2f4- Pe7e6- Ng1f3- Nb8c6- Pc2c3- Pd7d5- Pd2d4- Bf8d6- Nb1d2- Ng8f6- Pe2e3- Ke8g8- Bf1b5- Bc8d7- Bb5c6x Bd7c6x Pb2b3- Pa7a6- Bc1b2- Rf8e8- Ke1g1- Ph7h6- Nf3e5- Bd6e5x Pf4e5x Nf6e4- Nd2e4x Pd5e4x Pc3c4- Pb7b5- Qd1e2- Pb5c4x Pb3c4x Ra8b8- Bb2a3- Rb8b7- Rf1c1- Rb7b6- Ba3c5- Rb6b5- Rc1c3- Rb5b7- Rc3a3- Qd8b8- Ra1f1- Re8c8- Qe2h5- Rb7b5- Rf1f7x Rb5c5x Rf7g7$ Kg8f8- Qh5f7+ ,54,checkmate,1-0,"[-26, -19, -26, 23, 15, 0, 3, 0, -80, -2, 0, 7, -26, -5, -80, -64, -65, -48, -49, -3, -42, 8, -2, 53, 47, 188, 181, 184, 143, 145, 122, 119, 119, 217, 229, 244, 115, 144, 138, 452, 97, 119, 80, 153, 142, 182, 136, 514, 0, 99995, -65, 99999, 100000]",3.44,0.7083333333333334
Pg2g3- Pb7b6- Pg3g4- Bc8b7- Pf2f3- Pd7d6- Bf1h3- Pe7e5- Pe2e4- Pg7g6- Pd2d4- Pe5d4x Qd1d4x Ng8f6- Bc1g5- Bf8g7- Bg5f6x Qd8f6x Nb1c3- Ke8g8- Qd4d3- Qf6h4+ Ke1d1- Nb8c6- Pb2b3- Nc6e5- Qd3d2- Ra8d8- Nc3d5- Bb7d5x Pe4d5x Qh4f2- Ng1e2- Ne5f3x Rh1f1- Qf2h2x Ne2f4- Nf3d2x Kd1e1- Nd2f1x Ke1f1x Qh2h3$ Kf1e2- Bg7a1x Ke2e1- Rf8e8+ Ke1d1- Qh3g3- Nf4e2- Qg3g4x Kd1d2- Qg4e2$ Kd2c1- Qe2c2$ Kc1c2x Re8e2+ Kc2d1- Re2a2x Kd1e1- Ra2b2- Ke1d1- Rb2b3x Kd1d2- Rb3a3- Kd2c2- Ra3a2+ Kc2b3- Ra2b2+ Kb3c4- Rb2c2+ Kc4b5- Rc2c5+ Kb5a6- Rc5d5x Ka6a7x Rd5c5- Ka7a6- Rd8a8+ Ka6b7- Ra8a5- Kb7b8- Pb6b5- Kb8b7- Pc7c6- Kb7b8- Pb5b4- Kb8b7- Pb4b3- Kb7b8- Rc5b5+ Kb8c8- Pb3b2- Kc8d8- Rb5b6- Kd8e8- Qb2b1- Ke8e7- Ra5a7+ Ke7d8- Rb6b8+ ,101,checkmate,0-1,"[5, 51, -94, -87, -207, -111, -203, -197, -217, -121, -142, -28, -43, 175, -79, -85, -342, -169, -584, -83, -407, -438, -427, -359, -565, -468, -498, -475, -557, -476, -528, 487, -627, -578, -593, -550, -99999, -903, -1032, -1163, -99994, -700, -99994, -721, -99996, -99997, -99997, -99997, -99998, -99997, -99998, -99999, -99999, -99994, -99994, -99995, -99996, -99997, -99997, -99997, -99997, -99994, -99995, -99995, -99995, -99994, -99994, -99995, -99995, -99991, -99994, -99994, -99994, -99993, -99993, -99994, -99994, -99993, -99993, -99993, -99993, -99993, -99995, -99993, -99993, -99994, -99994, -99995, -99995, -99996, -99998, -99996, -99997, -99997, -99998, -99998, -99998, -99999, -99999, -100000]",8.3,0.55
Pe2e4- Pe7e5- Pc2c4- Pd7d6- Ph2h3- Bf8e7- Nb1c3- Ng8f6- Pd2d3- Ke8g8- Ng1f3- Pc7c6- Bc1e3- Qd8c7- Bf1e2- Nb8a6- Ke1g1- Na6c5- Pb2b4- Nc5e6- Be3d2- Ne6d4- Nf3d4x Pe5d4x Nc3a4- Pb7b5- Na4b2- Pb5c4x Nb2c4x Pd6d5- Nc4b2- Pd5e4x Pd3e4x Nf6e4x Be2d3- Ne4d2x Qd1d2x Bc8f5- Bd3f5x Ra8d8- Qd2c2- Be7f6- Nb2d3- Bf6g5- Qc2c4- Pg7g6- Bf5g4- Qc7e7- Ph3h4- Bg5f6- Pf2f3- Rd8e8- Pa2a4- Qe7e3+ Kg1h2- Bf6h4x Pg2g3- Bh4g3$ Kh2g2- Qe3f4- Qc4c6x Bg3h4- Qc6d7- Re8e5- Qd7d4x Re5g5- Kg2h3- Rg5h5- Qd4d7- Qf4g3+ ,71,checkmate,0-1,"[29, 32, -47, 10, 1, 13, 21, 28, 18, 23, 4, 15, -11, 81, 28, 63, 71, 81, 94, 104, 33, 51, -5, -4, -7, 8, -1, -9, -18, -12, -100, -123, -111, -103, -120, -115, -130, 371, 371, 426, 361, 487, 489, 490, 478, 483, 486, 504, 444, 497, 242, 333, 258, 275, 241, 241, 264, 273, -46, 469, -442, 562, -498, 541, -552, 553, -99999, 604, -99999, -100000]",0.9393939393939394,3.6363636363636362
Ng1f3- Pf7f5- Pd2d4- Pc7c6- Pd4d5- Pc6d5x Qd1d5x Nb8c6- Pe2e4- Pf5e4x Nf3g5- Ng8f6- Bf1c4- Pe7e6- Ng5e4x Nf6d5x Bc4d5x Pe6d5x Ne4c3- Bf8b4- Ke1g1- Qd8e7- Rf1e1- Ke8g8- Nc3d5x Qe7e1$ ,27,checkmate,0-1,"[29, 51, 58, 65, -24, -13, -20, 34, -81, -3, -77, 99999, -342, -350, -581, -573, -582, -594, -614, -599, -596, -513, -99999, -473, -99999, -100000]",47.72727272727273,11.3
Pe2e4- Ph7h5- Pd2d3- Pa7a5- Ng1f3- Pe7e6- Nb1c3- Pc7c6- Bc1f4- Nb8a6- Bf1e2- Bf8b4- Bf4d2- Qd8b6- Nc3a4- Qb6d4- Bd2c3- Bb4c3$ Pb2c3x Qd4f6- Pd3d4- Pb7b5- Na4b6- Ra8b8- Qd1d3- Rb8b6x Pe4e5- Qf6e7- Qd3e3- Pf7f6- Be2d3- Pf6e5x Nf3e5x Rh8h6- Pc3c4- Pb5c4x Bd3c4x Na6b4- Pa2a3- Nb4c2$ Ke1e2- Nc2e3x Ke2e3x Ng8f6- Pa3a4- Nf6d5+ Bc4d5x Pc6d5x Ke3d3- Ph5h4- Ph2h3- Bc8a6+ Kd3c3- Qe7a3+ Kc3c2- Qa3d3+ Kc2c1- Rb6b3- Rh1d1- Rb3c3+ Kc1b2- Rc3c2+ Kb2b1- Rc2c3+ Kb1b2- Rc3b3+ Kb2a2- Qd3c2+ ,69,checkmate,0-1,"[29, 129, 26, 118, 110, 123, 121, 146, 113, 157, 131, 171, 118, 180, 126, 643, 148, 150, -217, 178, 174, 180, 194, 209, -252, -259, -302, -294, -360, -247, -255, -201, -194, -199, -245, -178, -279, -272, -588, -595, -647, -631, -629, -632, -704, -663, -705, -665, -99992, -701, -99993, -779, -99994, -273, -99998, -367, -99996, -553, -99999, -99999, -99999, -99999, -99999, -516, -99999, -99999, -99999, -100000]",7.185185185185185,20.346153846153847
Pa2a4- Pe7e5- Pb2b3- Pf7f6- Pc2c4- Pd7d5- Pe2e3- Pd5c4x Pb3c4x Pb7b6- Pd2d4- Pe5d4x Pe3d4x Qd8e7+ Ke1d2- Qe7b4+ Kd2c2- Qb4c4$ Bf1c4x Pg7g5- Ng1f3- Pg5g4- Nf3h4- Nb8c6- Nh4f5- Bc8f5$ Bc4d3- Bf5d7- Qd1g4x Ke8c8- Qg4g7- Bf8g7x Pf2f3- Nc6d4$ Kc2c3- Nd4f3x Rh1f1- Nf3h2x Rf1f6x Nh2g4- Bd3f5- Bg7f6$ Kc3b4- Rd8e8- Nb1d2- Re8e6- Nd2f3- Re6e2- Ra1b1- Ng4f2- Nf3d4- Bf6d4x Bf5d3- Re2e8- Bc1h6- Re8e1- Bd3f5- Re1b1$ Kb4a3- Rb1a1+ Ka3b3- Bd4c5- Bf5d7$ Kc8d7x Bh6c1- Ra1c1x Pg2g4- Rc1c3+ Kb3b2- Nf2d3+ Kb2a2- Rc3c2+ Ka2b1- Rc2c1+ Kb1a2- Rc1c2+ Ka2b3- Rc2c3+ Kb3a2- Rc3a3+ Ka2b1- Ra3b3+ Kb1c2- Rb3a3- Pg4g5- Ra3a4x Pg5g6- Ph7g6x Kc2d3x Ra4f4- Kd3c3- Rh8h2- Kc3b3- Rh2h3+ Kb3b2- Rf4f2+ Kb2c1- Rh3h1+ ,99,checkmate,0-1,"[-16, -10, -75, -24, -78, -79, -131, 37, -58, 32, -50, -43, -189, 158, -69, 62, -246, 604, 617, 671, 632, 635, 640, 631, 385, 389, 213, 464, -428, 360, -488, -484, -538, -517, -587, -496, -611, -551, -704, -653, -847, -838, -883, -710, -838, -661, -723, -682, -841, -673, -775, -781, -1052, -713, -878, -680, -894, -909, -99995, -99993, -99993, -851, -863, -874, -99981, -99994, -99994, -998, -99994, -985, -99997, -99994, -99996, -99995, -99995, -99994, -99994, -1036, -99997, -99990, -99996, -99995, -99995, -99996, -99996, -99989, -99995, -99996, -99996, -99997, -99997, -99998, -99998, -99998, -99998, -99999, -99999, -100000]",6.8125,2.870967741935484
Pg2g4- Pg7g6- Pd2d4- Bf8g7- Pd4d5- Pd7d6- Nb1c3- Ng8f6- Pg4g5- Nf6d7- Pe2e4- Ke8g8- Bf1d3- Nd7e5- Bd3c4- Nb8d7- Ng1f3- Ne5c4x Bc1f4- Nc4b2x Qd1b1- Nb2c4- Qb1b3- Nc4b6- Ph2h4- Pe7e5- Pd5e6x Pf7e6x Bf4g3- Pd6d5- Pe4d5x Pe6d5x Ke1c1- Nd7c5- Qb3b4- Nc5a6- Qb4b3- Bc8g4- Rd1d5x Qd8e7- Rh1e1- Rf8f3x Re1e7x Bg4h3- Nc3b5- Rf3f2x Nb5c7x Ra8f8- Re7g7$ Kg8h8- Rg7h7$ Kh8g8- Rd5d8+ ,54,invalid_move,*,"[-121, -61, -59, -42, -81, -78, -187, -37, -19, 19, 1, 39, -109, -5, -444, -62, -451, -475, -580, -580, -608, -608, -596, -530, -601, -407, -566, -516, -606, -501, -539, -440, -526, -577, -576, -488, -613, -399, -538, -384, -485, 99999, 378, 99999, -512, 99999, 588, 99987, 582, 99994, 539, 99994, 1207]",5.130434782608695,30.47826086956522
Pc2c3- Pe7e5- Pb2b3- Pb7b5- Pe2e4- Pb5b4- Pc3b4x Bf8b4x Pa2a3- Bb4a5- Pb3b4- Ba5b6- Pa3a4- Pa7a6- Nb1c3- Pc7c6- Pb4b5- Pa6b5x Pa4b5x Ra8a1x Pb5c6x Ra1c1x Qd1c1x Nb8c6x Qc1b2- Ng8f6- Pf2f3- Ke8g8- Pg2g4- Pd7d6- Pg4g5- Nf6d7- Ng1e2- Pf7f5- Pe4f5x Nd7c5- Rh1g1- Pe5e4- Pf3e4x Nc5e4x Nc3e4x Pd6d5- Ne4c3- Bb6g1x Ne2g1x Pd5d4- Nc3b5- Pd4d3- Nb5c3- Qd8e7+ Ng1e2- Qe7g5x Ne2g3- Nc6e5- Bf1d3x Ne5d3$ Ke1d1- Qg5d2$ Kd1d2x Rf8d8- Kd2d1- Nd3b2$ Kd1c1- Ph7h5- Ng3h5x Rd8d3- Nc3e2- Nb2c4- Kc1b1- Nc4a3+ Kb1a1- Na3c2+ Ka1b2- Nc2e3- Ne2f4- Rd3d2+ Kb2c3- Ne3f5x Nf4e2- Nf5d6- Ne2g3- Nd6b5+ Kc3c4- Nb5d6+ Kc4c5- Nd6b7+ Kc5c6- Nb7a5+ Kc6c5- Na5b3+ Kc5c4- Bc8e6+ Kc4c3- Rd2g2- Ng3f5- Be6f5x Nh5f4- Rg2h2x Nf4d5- Rh2h1- Nd5f4- Rh1h3+ Nf4h3x Pg7g5- Nh3g5x Kg8g7- Ng5f3- Kg7g6- Nf3e5+ Kg6g5- Ne5f7+ Kg5f6- Nf7h6- Kf6g6- Nh6f5x Kg6f5x ,117,insufficient_material,1/2-1/2,"[11, 11, -78, 32, 27, 122, 22, 16, 5, 0, -25, -20, -80, -33, -38, 69, -122, -120, -438, -437, -441, -409, -431, -417, -475, -465, -530, -521, -546, -541, -550, -521, -544, -485, -467, -466, -720, -443, -671, -347, -384, -285, -438, -421, -471, -402, -435, -361, -491, -476, -530, -440, -431, -389, -793, -831, -858, 345, -447, 427, -471, -463, -490, -405, -470, -302, -434, -452, -523, -429, -441, -412, -420, -428, -430, -386, -412, 19, -538, 2, -438, 17, -425, -419, -432, -414, -425, -414, -409, -411, -426, -428, -424, -366, -498, -504, -550, -554, -583, -476, -574, -658, -723, -6, 7, 7, -10, 9, 0, 4, 12, 3, -2, 14, 0, 53]",3.1379310344827585,1.0
Pd2d4- Ng8f6- Pe2e4- Pg7g6- Pa2a4- Pd7d5- Pf2f3- Pd5e4x Pf3e4x Bf8g7- Pc2c3- Ke8g8- Bf1c4- Pc7c6- Ng1f3- Bc8g4- Bc1f4- Qd8d7- Ph2h3- Bg4f3x Pg2f3x Qd7e6- Bc4e6x Pf7e6x Pd4d5- Pe6d5x Pe4e5- Nf6h5- Qd1d2- Nh5f4x Qd2f4x Nb8d7- Nb1d2- Nd7e5x Qf4e5x Bg7e5x Ke1c1- Be5d6- Rh1e1- Rf8f3x Nd2f3x Pe7e5- Nf3g5- Bd6e7- Ng5e6- Ra8e8- Ne6c7- Re8f8- Nc7e6- Rf8f3- Re1e5x Be7f6- Re5e4- Bf6g5+ Kc1c2- Rf3h3x Rd1d4- Rh3h2+ Kc2b3- Pa7a5- Ne6g5x Rh2b2$ Kb3a3- Rb2a2+ Ka3b3- Ra2a1- Re4e8+ Kg8g7- Re8e7+ Kg7h6- Re7e6- Ra1b1+ Kb3a3- Rb1a1+ Ka3b3- Pb7b5- Rd4h4+ Kh6g7- Rh4h7$ Kg7g8- Re6e8+ ,82,checkmate,1-0,"[31, 31, -85, 116, -107, 118, -90, -82, -115, -11, -141, -52, -179, 32, -78, 96, -94, 126, 148, 160, -62, 500, 478, 469, 371, 395, 301, 319, -71, -46, -627, 304, -610, 344, -408, -408, -418, -435, -426, 366, 351, 440, 351, 371, 358, 434, 244, 364, 273, 408, 432, 422, -348, 510, 217, 469, 21, 7, 0, 359, 190, 525, 422, 514, 420, 491, 531, 496, 403, 489, 261, 421, 237, 429, 267, 442, 347, 99997, 99998, 99999, 100000]",2.236842105263158,2.5
Pe2e4- Nb8c6- Ng1h3- Pe7e5- Pf2f4- Pd7d6- Pf4e5x Bc8g4- Pd2d4- Bg4d1x Ke1d1x Nc6d4x Bc1d2- Pd6e5x Pc2c3- Bf8c5- Pc3d4x Bc5d4x Nb1c3- Ng8f6- Nc3d5- Nf6d5x Pe4d5x Qd8d5x Rh1g1- Ke8c8- Nh3g5- Pf7f6- Ng5f7- Rh8f8- Nf7d8x Rf8d8x Kd1c1- Bd4b2$ Kc1b2x Qd5d2$ Kb2b1- Qd2c3- Bf1a6- Qc3b2+ Kb1b2x Pb7a6x Ra1c1- Rd8d2+ Kb2a3- Rd2a2$ Ka3b4- Ra2g2x Rc1c6- Pf6f5- Rg1c1- Pg7g5- Rc6c7$ Kc8d8- Rc1c6- Pg5g4- Rc6a6x Rg2h2x Ra6a7x Pg4g3- Rc7b7- Pg3g2- Rb7b8+ ,64,checkmate,1-0,"[29, 37, -77, -56, -129, -58, -453, 430, -488, -484, -518, -546, -578, -588, -584, -533, -541, -487, -545, -485, -615, -623, -619, -639, -759, -733, -820, -738, -99994, -694, -721, -730, -99993, -99994, -99994, -99995, -99997, -99996, -99997, 428, 450, 439, 447, 455, 382, 573, 358, 547, -519, 504, 226, 403, 418, 463, 375, 515, -431, 421, 326, 99996, 0, 99999, 100000]",16.53846153846154,3.88
Pe2e4- Pd7d6- Bf1b5+ Nb8d7- Pd2d3- Pg7g6- Ng1f3- Bf8g7- Nb1c3- Pc7c6- Bb5a4- Ng8f6- Bc1f4- Pb7b5- Ba4b3- Ke8g8- Ph2h4- Pa7a5- Ph4h5- Pa5a4- Bb3f7$ Rf8f7x Ph5g6x Ph7g6x Qd1d2- Pa4a3- Pb2b3- Nd7f8- Ke1c1- Qd8a5- Rh1h2- Qa5c3x Qd2c3x Nf8e6- Bf4e3- Ne6f4- Rd1h1- Nf6g4- Rh2h8+ Bg7h8x Rh1h8$ ,42,checkmate,1-0,"[29, 54, 1, 14, -4, 8, -6, 21, -21, -33, -30, -28, -67, -46, -44, -44, -110, -120, -288, -236, -228, -228, -232, -239, -287, -283, -294, -211, -311, -207, -456, -30, -21, 287, 72, 397, -382, 99998, 99999, 99999, 100000]",1.6111111111111112,1.2222222222222223
Pe2e4- Pf7f6- Pa2a3- Pa7a5- Ph2h3- Pb7b5- Nb1c3- Pc7c5- Nc3b5x Pa5a4- Pb2b3- Bc8a6- Pb3a4x Ba6b5x Pa4b5x Qd8a5- Pa3a4- Pc5c4- Bc1b2- Pc4c3- Pd2c3x Pd7d5- Pe4d5x Qa5c3$ Bb2c3x Pe7e5- Bc3b4- Nb8d7- Pc2c3- Ra8a4x Ra1a4x Pe5e4- Ra4a8+ Ke8f7- Ng1e2- Pe4e3- Pf2e3x Pf6f5- Pg2g3- Pf5f4- Pg3f4x Pg7g5- Pf4g5x Ph7h5- Bf1g2- Nd7e5- Pd5d6- Ne5d3+ Qd1d3x Bf8g7- Ra8a7+ Kf7f8- Ra7g7x Ph5h4- Pd6d7+ Ng8e7- Qd7d8+ Kf8g7x Qd8e7$ Kg7g8- Qd3g6+ ,62,checkmate,1-0,"[29, 136, 123, 194, 146, 256, 206, 265, 240, 276, 216, 314, 255, 448, 431, 460, 462, 501, 485, 606, 513, 516, 523, 787, 811, 932, 560, 728, 721, 838, 863, 1068, 965, 958, 883, 1010, 947, 993, 923, 1046, 961, 1035, 1013, 1141, 1073, 99993, 1263, 99994, 99995, 99999, 99997, 99998, 99995, 99998, 99996, 99998, 99998, 99998, 99999, 99999, 100000]",0.30434782608695654,2.6363636363636362
Pa2a4- Pd7d5- Ph2h3- Pe7e5- Pc2c3- Nb8c6- Pe2e3- Bc8f5- Pg2g4- Bf5e4- Pf2f3- Be4g6- Ph3h4- Qd8f6- Ph4h5- Bg6b1x Ra1b1x Ph7h6- Ng1e2- Bf8c5- Bf1g2- Ng8e7- Pd2d4- Pe5d4x Pc3d4x Bc5b4+ Bc1d2- Bb4d2$ Qd1d2x Nc6b4- Ke1g1- Ke8g8- Pf3f4- Nb4c6- Bg2d5x Ra8d8- Qd2c3- Ne7d5x Qc3c2- Nd5e3x Qc2c6x Pb7c6x Rf1f3- Qf6h4- Rf3h3- Ne3g4x Rh3h4x Ng4f6- Rb1e1- Rf8e8- Ne2g3- Re8e1$ Kg1f2- Rd8d4x Pf4f5- Rd4d2+ Kf2f3- Re1e3+ Kf3f4- Rd2d4+ Kf4e3x Rd4d5- Ke3f4- Pc6c5- Kf4e3- Pc5c4- Rh4d4- Pc4c3- Pb2c3x Rd5c5- Rd4d8+ Kg8h7- Ke3d4- Rc5f5x Ng3f5x Nf6d5- Rd8d5x Pc7c6- Rd5d7- Pg7g6- Ph5g6$ Kh7g6x Rd7a7x Pc6c5+ Kd4c5x Ph6h5- Ra7a6+ Kg6g5- Nf5e3- Kg5f4- Ne3d5+ Kf4g3- Ra6h6- Pf7f5- Pc3c4- Pf5f4- Nd5f4x Kg3f2- Nf4h5x Kf2e1- Rh6f6- Ke1d2- Rf6d6+ Kd2e1- Pa4a5- Ke1f2- Pa5a6- Kf2e1- Pa6a7- Ke1f2- Qa7a8- Kf2e1- Qa8a1+ Ke1f2- Rd6d2+ Kf2e3- Qa1e1+ Ke3f3- Qe1f1+ Kf3e3- Rd2e2+ Ke3d3- Qf1f3+ ,124,checkmate,1-0,"[-16, -13, -62, -50, -100, -94, -99, -72, -187, -144, -254, -173, -179, 15, 7, 16, 6, -3, -189, 22, 32, 45, 72, 70, -21, -15, -30, -10, -27, 449, -23, 425, -43, 56, -319, 196, -486, -466, -595, -630, -730, -698, -732, -662, -99993, -268, -279, -269, -330, -327, -616, -621, -607, -445, -611, -338, -604, -316, -99997, -598, -599, -195, -547, -332, -323, -116, -233, -180, -198, -55, -66, -55, -50, 379, 380, 597, 598, 673, 99990, 99995, 619, 617, 648, 1002, 710, 946, 667, 781, 663, 835, 671, 977, 1294, 99986, 961, 99989, 875, 99990, 99989, 99993, 99993, 99993, 99992, 99992, 99993, 99993, 99994, 99994, 99995, 99995, 99996, 99998, 99997, 99997, 99997, 99998, 99999, 99999, 99998, 99999, 99999, 99999, 100000]",32.355555555555554,34.022222222222226
Pe2e4- Pg7g5- Nb1c3- Ph7h6- Bf1c4- Bf8g7- Ng1f3- Pe7e6- Pd2d4- Pf7f6- Bc1e3- Pd7d6- Ke1g1- Pc7c6- Pe4e5- Nb8d7- Pe5d6x Pb7b6- Bc4e6x Bc8b7- Nf3d2- Ng8e7- Pd4d5- Ne7g6- Pd5c6x Bb7c6x Be6d7$ Bc6d7x Nd2e4- Qd8e7- Ne4f6$ Bg7f6x Qd1d5- Ke8c8- Nc3b5- Ng6e5- Nb5a7$ Kc8b8- Na7b5- Ne5c6- Nb5c7- Rd8f8- Nc7b5- Rf8c8- Pc2c4- Nc6b4- Qd5b7+ Kb8b7x Ra1d1- Bd7b5x Pc4b5x Rh8d8- Be3b6x Kb7b6x Pa2a4- Rc8c2- Pa4a5+ Kb6b5x Rd1b1- Rd8c8- Rb1a1- Kb5c6- Pb2b3- Rc2c3- Pf2f3- Rc8b8- Pg2g3- Kc6d5- Ra1d1+ Kd5e6- Rf1e1+ Ke6f5- Ph2h3- Qe7e6- Pg3g4+ Kf5f4- Re1e6x Kf4g3- Rd1d3- Rc3c1+ Rd3d1- Rc1d1$ Re6e1- Rb8d8- Pa5a6- Rd8a8- Pa6a7- Kg3h3x Re1d1x Ra8a7x Rd1d5- Ra7f7- Kg1f1- Kh3h4- Kf1e1- Kh4g3- Ke1f1- Rf7c7- Kf1e1- Rc7c1+ Ke1d2- Rc1b1- Pf3f4- Pg5f4x Kd2e2- Pf4f3+ Ke2e3- Rb1b3$ Ke3e4- Pf3f2- Rd5d2- Qf2f1- Rd2d5- Qf1e2+ Ke4f5- Rb3f3+ Kf5g6- Qe2e6- Rd5b5- Qe6g4$ Kg6h6x Qg4h3+ Rb5h5- Qh3h5$ ,125,invalid_move,*,"[29, 176, 194, 183, 146, 169, 67, 113, 90, 259, 242, 226, 157, 180, 191, 285, 262, 569, 484, 619, 587, 99997, 541, 587, 492, 485, 151, 316, 213, 758, -24, 644, 386, 99999, 227, 99999, 778, 773, -65, 690, 213, 725, 64, 723, 113, 211, -163, -163, -533, -420, -560, -157, -470, -400, -742, -402, -443, -431, -848, -472, -830, -450, -797, -424, -841, -414, -99989, -417, -428, -408, -386, -362, -99983, -358, -361, -278, -304, -234, -99997, -99998, -99998, -99999, -99999, -454, -99999, -519, -99999, -418, -460, -419, -99994, -478, -732, -440, -718, -510, -756, 425, -588, -505, -611, -555, -670, -763, -99994, -99995, -99995, -99991, -99992, -630, -99997, -99998, -99999, -99996, -99996, -99996, -99996, -99996, -99997, -99997, -99998, -99996, -99996, -99995]",209.0,177.11111111111111
Pe2e4- Pe7e6- Bf1c4- Ng8h6- Pa2a3- Pg7g6- Nb1c3- Bf8g7- Pd2d3- Pb7b6- Bc1e3- Bc8b7- Pf2f3- Pf7f5- Ng1h3- Pf5e4x Pd3e4x Pd7d5- Pe4d5x Pe6d5x Nc3d5x Bb7d5x Bc4d5x Qd8d5x Qd1d5x Nb8c6- Be3h6x Bg7h6x Ke1g1- Nc6e7- Qd5b7- Ra8c8- Ra1d1- Rh8f8- Qb7a7x Rc8d8- Rd1d8$ Ke8d8x Rf1d1+ Kd8e8- Qa7c7x Bh6e3+ Kg1f1- Ne7f5- Pg2g4- Nf5d4- Qc7b8+ Ke8f7- Qb8c7+ Kf7f6- Qc7e5+ Kf6f7- Qe5f6+ Kf7f6x Rd1d4x Rf8d8- Pc2c3- Rd8d4x Pc3d4x Be3d4x Nh3f4- Bd4b2x Pa3a4- Pg6g5- Nf4d5+ Kf6e5- Nd5b6x Ph7h6- Pa4a5- Ke5d4- Pa5a6- Kd4e3- Pa6a7- Ph6h5- Qa7a8- Ph5g4x Pf3g4x Ke3f4- Qa8d5- Kf4g4x Qd5g5$ Kg4f3- Qg5h5+ Kf3f4- Nb6d5+ Kf4e4- Ph2h4- Bb2e5- Nd5f6+ Ke4f4- Nf6d5+ Kf4e4- Qh5e5$ Ke4f3- Nd5f6- ,96,stalemate,1/2-1/2,"[29, 48, -27, 72, -12, 105, 93, 124, 69, 81, 27, 44, -154, 66, 0, 5, -15, 141, -362, 278, -344, 324, 361, 699, 740, 1160, 681, 720, 747, 860, 537, 658, 573, 625, 562, 640, 676, 682, 669, 665, 672, 743, 769, 99999, 824, 99987, 695, 757, 745, 761, -314, 99991, -127, -123, -489, 619, -201, 214, 220, 235, 48, 29, 25, 335, 352, 358, 378, 521, 406, 547, 587, 730, 773, 99978, 99979, 99983, 799, 99983, 99994, 99994, 5, 99993, 678, 693, 707, 716, 722, 850, 562, 99991, 957, 1040, 807, 99999, 0]",61.53658536585366,79.53658536585365
Pd2d4- Pc7c6- Pe2e4- Pa7a5- Pa2a3- Pb7b5- Ng1f3- Pa5a4- Pe4e5- Qd8b6- Bc1e3- Pe7e6- Bf1e2- Pd7d5- Pe5d6x Bf8d6x Pb2b3- Bd6c7- Nb1c3- Bc7d6- Nc3e4- Qb6b7- Pb3a4x Pb5a4x Ne4d6$ Ke8e7- Nd6b7x Bc8b7x Pc2c3- Ng8f6- Ke1g1- Rh8d8- Nf3e5- Bb7c8- Be2f3- Nb8d7- Ne5c6$ Ke7e8- Nc6d8x Ke8d8x Qd1a4x Ra8b8- Pc3c4- Kd8e8- Pc4c5- Rb8a8- Qa4a8x Pg7g6- Qa8c8$ Ke8e7- Pa3a4- Nd7b8- Qc8b8x Nf6d7- Qb8d6+ Ke7e8- Pa4a5- Nd7b8- Pa5a6- Nb8c6- Pa6a7- Nc6e7- Qa7a8+ Ne7c8- Qa8c8$ ,66,checkmate,1-0,"[31, 42, 34, 88, 78, 105, 98, 148, 137, 178, 144, 184, 101, 103, 107, 107, -10, 142, 91, 287, 170, 685, 233, 734, 718, 726, 728, 722, 686, 690, 646, 678, 657, 691, 726, 779, 786, 782, 787, 857, 504, 772, 762, 791, 805, 974, 987, 1125, 1202, 1287, 1042, 1130, 1340, 99995, 99996, 99996, 99996, 99996, 99996, 99999, 99997, 99998, 99999, 99999, 100000]",0.38461538461538464,14.115384615384615
Pd2d3- Pd7d5- Pc2c3- Ng8f6- Ph2h3- Pe7e5- Ng1f3- Nb8c6- Pg2g4- Bf8d6- Nb1d2- Ke8g8- Nd2b3- Ph7h6- Bc1d2- Pe5e4- Nf3d4- Pe4d3x Pe2d3x Nc6d4x Nb3d4x Bd6e5- Bf1g2- Pc7c5- Nd4f3- Bc8e6- Nf3e5x Qd8d6- Ne5f3- Qd6c7- Pd3d4- Ra8d8- Pd4c5x Qc7c5x Bd2e3- Qc5d6- Qd1e2- Qd6e7- Ra1d1- Pb7b6- Rd1d4- Be6c8- Ke1g1- Nf6e4- Rf1d1- Bc8b7- Rd4e4x Pd5e4x Rd1d2- Pe4f3x Qe2f3x Bb7f3x Bg2f3x Rd8d2x Be3d2x Qe7f6- Bf3d1- Qf6h4- Kg1g2- Qh4f2$ Kg2h1- Qf2d2x Bd1b3- Qd2b2x Bb3d5- Qb2c3x Bd5e4- Rf8e8- Be4g2- Re8e2- Kh1h2- Qc3d2- Ph3h4- Re2g2$ Kh2h3- Qd2f2- Pg4g5- Qf2g3+ ,79,checkmate,0-1,"[-1, 18, -23, -24, -70, -67, -73, -74, -128, -117, -112, -75, -148, -78, -184, -178, -195, -203, -191, -161, -160, -52, -47, -33, -37, 401, 400, 478, 362, 421, 366, 426, 358, 493, 386, 458, 450, 491, 472, 523, 466, 478, 452, 450, 401, 460, 386, 382, -275, -290, -549, -540, -587, -543, -541, -532, -665, -547, -641, 317, -99996, -99995, -99997, -99993, -99995, -1071, -99995, -99996, -99997, -99997, -99998, -99997, -99997, -99998, -99998, -99999, -99999, -100000]",1.0333333333333334,0.8333333333333334
Pe2e3- Pd7d6- Bf1c4- Ng8f6- Pb2b3- Pg7g6- Bc1b2- Bf8g7- Ph2h3- Ke8g8- Pg2g4- Nf6e4- Ph3h4- Bg7b2x Pg4g5- Ne4f2x Ke1f2x Bb2a1x Nb1c3- Pe7e6- Ng1f3- Ba1c3x Pd2c3x Qd8e7- Ph4h5- Pe6e5- Ph5g6x Ph7g6x Qd1g1- Bc8f5- Nf3h4- Nb8c6- Nh4f5x Pg6f5x Qg1g3- Ra8e8- Rh1h6- Kg8g7- Rh6h5- Pf5f4- Pe3f4x Pe5f4x Qg3h4- Pf7f6- Pg5f6$ Rf8f6x Rh5g5+ Kg7f8- Qh4h8+ ,50,checkmate,1-0,"[19, 30, -3, -6, -50, -14, -30, -12, -42, -18, -135, -28, -534, -530, -589, -507, -506, -503, -492, -280, -493, -477, -481, -442, -439, -49, 5, 343, 131, 99997, -74, 722, 99996, 99998, 167, 99998, 111, 117, -464, 0, -494, -491, -673, 99996, 99997, 99997, 0, 99999, 100000]",38.15,45.526315789473685
Pf2f3- Pc7c5- Pb2b3- Pd7d6- Pe2e3- Nb8c6- Bf1b5- Ng8f6- Pd2d3- Pg7g6- Pe3e4- Bf8g7- Pg2g4- Ke8g8- Bc1b2- Pa7a6- Bb5c6x Pb7c6x Pc2c4- Pa6a5- Nb1c3- Bc8a6- Pa2a4- Nf6d7- Ng1h3- Nd7b6- Pf3f4- Bg7c3$ Bb2c3x Pf7f6- Pe4e5- Pd6e5x Pf4e5x Pf6e5x Bc3e5x Nb6d7- Be5c3- Rf8f1+ Rh1f1x Qd8f8- Rf1f8$ Ra8f8x Qd1e2- Rf8d8- Bc3a5x Nd7e5- Ba5d8x Kg8f8- Bd8e7$ Kf8e7x Qe2e5$ Ke7d8- Qe5h8+ Kd8c7- Qh8h7$ Kc7b6- Qh7g6x Kb6a5- Qg6c6x Ba6c8- Qc6b5+ ,62,checkmate,1-0,"[-66, -63, -79, -32, -45, -25, -27, -22, -380, -24, -357, -24, -501, -116, -335, -21, -29, -21, -66, -52, -67, 35, -121, -87, -134, -48, -81, 197, 194, 215, 107, 135, 128, 133, 87, 167, 117, 482, 516, 646, 682, 685, 691, 99995, 848, 1059, 99991, 99994, 99992, 99993, 99994, 99994, 99993, 99993, 99993, 99999, 1246, 99996, 99997, 99999, 100000]",0.0,13.045454545454545
